id,listing,title,link,abstract,creation_date,organization,grant_number,grant_org,grant_start,grant_end,grant_money,investigators,total_participants,male_participants,female_participants,source,creation_date_parsed,grant_start_parsed,grant_end_parsed,pct_male,pct_female,year,month,day,column,row
0,193,Phenomenology and Classification of Schizophrenia (Iowa Longitudinal Study),https://nda.nih.gov/edit_collection.html?id=2125,"This study is currently following first-episode patients, some of whom have been followed for as long as 15 years. The study emphasizes understanding the phenomenology of schizophrenia by examining the lifetime trajectory of the illness and its long-term outcome. Since the disorder is characterized by a prolonged lifetime course, longitudinal study of a large group of informative patients is one of the most powerful strategies for examining measures that will illuminate its mechanisms or refine the ... more",10/24/14,University of Iowa,R01MH031593,University Of Iowa,7/1/95,6/30/04,5617677,Nancy Andreasen,282,177,105,lab,10/24/14,7/1/95,6/30/04,0.627659574,0.372340426,1995,7,1,1,1
1,848,Couples: Interpersonal Functioning and Emotion in Borderline Personality Disorder,https://nda.nih.gov/edit_collection.html?id=2935,"This collection contains data from several personality studies conducted 1990-2017. The studies included are: Studies: 1. Validity in the Diagnosis of Personality Disorders (""Validity"") 2. Screening for Personality Disorders (""Screening"") 3. Interpersonal Functioning in Borderline Personality (""Interpersonal Functioning"") 4. Interpersonal Functioning and Emotion in Borderline Personality (""Emotion and Interpersonal Functioning"") 5. Interpersonal Functioning and Emotion in Borderline Personality ... more",6/1/18,University of Pittsburgh,R01MH056888,University Of Pittsburgh At Pittsburgh,4/10/98,8/31/02,1380450,Paul Pilkonis,1170,318,852,lab,6/1/18,4/10/98,8/31/02,0.271794872,0.728205128,1998,4,10,1,2
2,163,"Genotypes of Swedish subjects used in ""Most genetic risk for autism resides with common variation"" study",https://nda.nih.gov/edit_collection.html?id=2092,"Genotypes of Swedish subjects used in ""Most genetic risk for autism resides with common variation"" study",6/29/14,Icahn School of Medicine at Mount Sinai,R01MH057881,University Of Pittsburgh At Pittsburgh,7/1/98,6/30/03,1117457,"Joseph D. Buxbaum, Trent Gaugler, Lambertus Klei, Stephan J. Sanders, Corneliu A. Bodea, Arthur P. Goldberg, Ann B. Lee, Yudi Pawitan, Stephan Ripke, Sven Sandin, Pamela Sklar, Oscar Svantesson, Abraham Reichenberg, Christina M. Hultman, Bernie Devlin, Kathryn Roeder",636,430,206,lab,6/29/14,7/1/98,6/30/03,0.676100629,0.323899371,1998,7,1,1,3
3,37,Collaborative Programs of Excellence in Autism (CPEA),https://nda.nih.gov/edit_collection.html?id=1853,"The CPEAs link 129 scientists from 23 universities in the United States, Canada, Britain, and five other countries, and more than 2,000 families of people with autism. The clinical data associated with the CPEAs are contained here.",10/4/10,Boston University,U19HD035466,University Of Rochester,8/1/98,5/31/03,4520600,"Dawson, Geraldine; Loveland, Katherine; McMahon, William; Minshew, Nancy; Rodier, Patricia; Rogers, Sally; Sigman,Marian; Tager-Flusberg, Helen; Volkmar, Fred",5372,3843,1529,lab,10/4/10,8/1/98,5/31/03,0.715376024,0.284623976,1998,8,1,1,4
4,210,Coordinated Anxiety Learning and Management (CALM),https://nda.nih.gov/edit_collection.html?id=2146,"The goal of this research project entitled CALM: Coordinated Anxiety Learning and Management is to test an approach to assist PCPs deliver more effective treatment to persons with anxiety disorders. We have developed a unified approach to detecting and treating a range of commonly occurring anxiety disorders (specifically panic disorder, generalized anxiety disorder, social phobia, and posttraumatic stress disorder) that is likely to be feasible and effective in primary care settings. The project ... more",9/27/15,,U01MH057858,University Of Washington,7/1/99,6/30/04,1269672,Peter Roy-Byrne,1004,290,714,lab,9/27/15,7/1/99,6/30/04,0.288844622,0.711155378,1999,7,1,1,5
5,156,DCTRS Neurocognitive Enhancement Therapy with Vocational Services in Schizophrenia: Work Outcomes at Two Year Follow-Up,https://nda.nih.gov/edit_collection.html?id=2083,"Neurocognitive enhancement therapy (NET) is a remediation program for the persistent and function-limiting cognitive impairments of schizophrenia. In a previous study in veterans, NET improved work therapy outcomes as well as executive function and working memory. The present study aimed to determine whether NET could enhance functional outcomes among schizophrenia and schizoaffective patients in a community mental health center receiving community-based vocational services. Method: Patients (N = ... more",5/20/14,No Affiliation Provided,R01MH061493,Yale University,5/15/00,2/10/06,2069758,Morris D. Bell,77,44,33,lab,5/20/14,5/15/00,2/10/06,0.571428571,0.428571429,2000,5,15,1,6
6,214,Treatment of SSRI-Resistant Depression in Adolescents (TORDIA),https://nda.nih.gov/edit_collection.html?id=2150,"In this seven-year, multisite study, we propose to compare four strategies for the treatment of SSRI-resistant adolescent major depressive disorder (MDD) and/or Dysthymic Disorder. Up to four hundred adolescents, aged 12-18, who continue to be depressed despite an adequate trial with any of the commonly used SSRIs for which there is some evidence of efficacy (i.e., citalopram, escitalopram, fluoxetine, fluvoxamine, or sertraline) will be randomly assigned to one of four conditions to be delivered ... more",3/31/15,,U01MH061835,University Of Pittsburgh At Pittsburgh,9/22/00,8/31/05,2328823,David A. Brent,429,130,299,lab,3/31/15,9/22/00,8/31/05,0.303030303,0.696969697,2000,9,22,1,7
7,499,Treatment of Attention Deficit Hyperactivity Disorder in Preschool-Age Children (PATS),https://nda.nih.gov/edit_collection.html?id=2551,"This research focuses on the treatment of Attention Deficit Hyperactivity Disorder ADHD in very young children. The medication being used is methylphenidate Ritalin it is being studied to determine its safety and how well it works to treat ADHD in preschool-age children 3-5.5 year olds. The study includes treatment with different doses of methylphenidate and placebo all children will receive active medication during the study. Prior to treatment, each child will receive a thorough psychiatric evaluation ... more",11/9/16,,U01MH060642,Johns Hopkins University,9/22/00,9/13/04,946775,"Laurence Greenhill, James Swanson, Timothy Wigal, C. Keith Conners, Howard Abikoff, James McCracken, Mark Riddle",604,456,148,lab,11/9/16,9/22/00,9/13/04,0.754966887,0.245033113,2000,9,22,1,8
8,207,Treatment of Early Onset Schizophrenia Spectrum Disorders (TEOSS),https://nda.nih.gov/edit_collection.html?id=2143,"This is a multisite research project conducted in collaboration with NIMH undera U01 grant. It is being conducted jointly at the University of Washington (UW), Seattle,WA, University of North Carolina (UNC), Chapel Hill, NC, Harvard Medical School (HU),Boston, MA and Case Western Reserve University (CWRU), Cleveland, Ohio. UNC serves as the coordinating center and is primarily responsible for preparation of blinded medication supplies, randomization and data management. The study will rigorously ... more",9/27/15,,U01MH061464,Seattle Childrens Hospital,9/19/01,8/31/07,1314268,Linmarie Sikich,119,78,41,lab,9/27/15,9/19/01,8/31/07,0.655462185,0.344537815,2001,9,19,1,9
9,112,Longitudinal measurements of sleep EEG in adolescence,https://nda.nih.gov/edit_collection.html?id=2018,Adolescence is now recognized as a period of major brain reorganization as well as rapid endocrine and physical development. Among the most prominent brain changes is a huge decline in the delta (<4 Hz) EEG of NREM sleep. Our ongoing study uses spectral and period-amplitude analyses to examine sleep and EEG longitudinally in semiannual 4-night recordings in two cohorts: C9 (N=30) ages 9-13 and C12 (N=38) ages 12-16. Data from the first two years yielded answers to important questions but raised new ... more,11/6/12,"University of California, Davis",R01MH062521,University Of California At Davis,4/17/02,3/31/07,2219837,Irwin Feinberg,99,52,47,lab,11/6/12,4/17/02,3/31/07,0.525252525,0.474747475,2002,4,17,1,10
10,497,Treatment of Adolescent Suicide Attempters (TASA),https://nda.nih.gov/edit_collection.html?id=2549,Suicide is the third leading cause of death in adolescents and is a major public health problem. Depression is the most common diagnosis for adolescent suicide attempts. Little is known about what treatment is best for these adolescents since they are usually excluded from participation in research studies. The purpose of this study is to compare the effects of three types of treatments for depressed teenagers who have attempted suicide. Participants in this study will be randomly assigned to receive ... more,11/9/16,,U10MH066778,Ut Southwestern Medical Center,8/12/02,7/31/08,2180872,"Laurence Greenhill, Karen Wells, Oscar Bukstein, Graham Emslie, John Walkup",124,28,96,lab,11/9/16,8/12/02,7/31/08,0.225806452,0.774193548,2002,8,12,1,11
11,224,Child/Adolescent Anxiety Multimodal Treatment Study (CAMS),https://nda.nih.gov/edit_collection.html?id=2160,"Anxiety disorders are among the most common conditions affecting children and adolescents. These disorders impair school, social, and family functioning. When left untreated, they also put children at risk for major depression and substance abuse in late adolescence and adulthood. Effective treatments that alleviate symptoms and prevent long-term morbidity and mortality associated with childhood-onset anxiety disorders are needed.During Phase I of this two-phase study, participants are randomly assigned ... more",3/31/15,,U01MH064088,University Of California Los Angeles,9/1/02,5/31/06,1515786,John T. Walkup,488,246,242,lab,3/31/15,9/1/02,5/31/06,0.504098361,0.495901639,2002,9,1,1,12
12,277,Study of Pharmacotherapy of Psychotic Depression (STOP-PD),https://nda.nih.gov/edit_collection.html?id=2278,"Psychotic depression (PD) is a severe disorder that is present in 20% of mixed-age inpatients and in more than 40% of elderly inpatients hospitalized for the treatment of major depression. Acutely, PD is associated with a greater level of depression severity, functional impairment, and resistance to antidepressant treatment than nonpsychotic depression. Longitudinally, PD is associated with a greater likelihood of recurrence, a shorter symptom-free interval, greater disability, and an increased long-term ... more",12/9/14,,U01MH062565,University Of Pittsburgh At Pittsburgh,9/6/02,5/31/08,1479188,Barnett Meyers,259,93,166,lab,12/9/14,9/6/02,5/31/08,0.359073359,0.640926641,2002,9,6,1,13
13,329,RUPP PI PDD: Drug and Behavioral Therapy for Children With Pervasive Developmental Disorders,https://nda.nih.gov/edit_collection.html?id=2349,This 24-week study will compare the safety and effectiveness of medication treatment alone (risperidone or aripiprazole) to medication treatment in combination with a parent management training program.,2/25/16,,U10MH066766,Indiana Univ-Purdue Univ At Indianapolis,9/15/02,7/31/08,2724660,Michael Aman,124,105,19,lab,2/25/16,9/15/02,7/31/08,0.846774194,0.153225806,2002,9,15,1,14
14,208,Treatment of Early Age Mania (TEAM),https://nda.nih.gov/edit_collection.html?id=2144,"Treatment of Early Age Mania (TEAM) was a six year comparative effectiveness study of risperidone, lithium and valproate conducted from 2003-2008 in children aged 6.0-15.11. Subjects were entered into a controlled, randomized, no patient choice, three-strata adaptive strategy trial if they were 6.0-15.11 years old, fit full DSM-IV bipolar I disorder (mixed or manic phase) and had a Children's Global Assessment Scale (CGAS) score less than or equal to 60 (definite clinical impairment). Assignment ... more",9/27/15,,U01MH064869,Johns Hopkins University,9/21/02,6/23/05,988960,Barbara Geller,379,204,175,lab,9/27/15,9/21/02,6/23/05,0.538258575,0.461741425,2002,9,21,1,15
15,217,Research Evaluating the Value of Augmenting Medication with Psychotherapy (REVAMP),https://nda.nih.gov/edit_collection.html?id=2153,Chronic depression affects approximately 5% of adults in the United States and is associated with significant functional impairment and high health care utilization. The combination of drug treatment and psychotherapy may be most effective in treating depression. This study will determine the effects of adjunctive psychotherapy in depressed patients who have failed to respond or have responded only partially to an initial trial medication.Participants receive an initial trial of antidepressant medication ... more,3/31/15,,U01MH062475,Weill Medical Coll Of Cornell Univ,9/24/02,6/30/06,1602564,James P. McCullough,1131,496,635,lab,3/31/15,9/24/02,6/30/06,0.438549956,0.561450044,2002,9,24,1,16
16,159,DCTRS Attention shaping: a reward-based learning method to enhance skills training outcomes in schizophrenia,https://nda.nih.gov/edit_collection.html?id=2086,"Disturbances in sustained attention commonly interfere with the ability of persons with schizophrenia to benefit from evidence-based psychosocial treatments. Cognitive remediation interventions have thus far demonstrated minimal effects on attention, as have medications. There is thus a gap between the existence of effective psychosocial treatments and patients' ability to effectively engage in and benefit from them. We report on the results of a multisite study of attention shaping (AS), a behavioral ... more",5/20/14,University of Rochester Medical Center,R21MH063967,University Of Illinois At Chicago,2/14/03,1/31/07,530436,Steven M. Silverstein,83,50,33,lab,5/20/14,2/14/03,1/31/07,0.602409639,0.397590361,2003,2,14,1,17
17,38,Studies to Advance Autism Research and Treatment (STAART).,https://nda.nih.gov/edit_collection.html?id=1854,"The STAART Network is comprised of eight centers across the country. Most of these centers are evaluating and treating patients, as well as enrolling them into clinical trials.",10/4/10,Icahn School of Medicine at Mount Sinai,U54MH066673,Icahn School Of Medicine At Mount Sinai,5/13/03,4/30/09,7729134,"Aylward, Elizabeth; Buxbaum, Joseph; Dawson, Geraldine; Hollander, Eric; Landa, Rebecca; Rodier, Patricia; Sigman, Marian; Tager-Flusberg, Helen",2007,1531,476,lab,10/4/10,5/13/03,4/30/09,0.762830095,0.237169905,2003,5,13,1,18
18,209,Treatment for Adolescents with Depression Study (TADS)/Substance Use and Other Outcomes Following Treatment for Adolescent Depression (SOFTAD ),https://nda.nih.gov/edit_collection.html?id=2145,"TADS is designed to compare the effectiveness of established treatments for teenagers suffering from major depressive disorder (MDD). The treatments are: psychotherapy (""talking therapy""); medication; and the combination of psychotherapy and medication. Altogether, 432 teenagers (both males and females) ages 12 to 17, will take part in this study at 12 sites in the United States.The TADS design will provide answers to the following questions: What is the long-term effectiveness of medication treatment ... more",9/27/15,,R01MH070494,Duke University,9/1/03,11/30/10,2764421,John F. Curry and John March,439,200,239,lab,9/27/15,9/1/03,11/30/10,0.455580866,0.544419134,2003,9,1,1,19
19,58,Restricted Interests and Repetitive Behaviors in Autism,https://nda.nih.gov/edit_collection.html?id=1887,Collection of a broad array of phenotyping measures in adolescents with high and low functioning autism spectrum disorders that exhibit repetitive behaviors and restricted interest sets,10/17/11,University of North Carolina at Chapel Hill,R01MH073402,Nc State Dept/Hlth & Human Services,7/13/04,4/30/09,849529,Gabriel Dichter,196,152,44,lab,10/17/11,7/13/04,4/30/09,0.775510204,0.224489796,2004,7,13,1,20
20,498,Treatment of Bipolar Mania in Older Adults (GERI-BD),https://nda.nih.gov/edit_collection.html?id=2550,"This is the first controlled acute treatment study of bipolar disorder in adults 60 years or older with current DSM-IV manic, mixed, or hypomanic episodes. The number of older adults with severe and disabling bipolar disorder is increasing, and information to guide the management of the treatment of the disease is lacking in this population. Guidelines for treatment of younger people with bipolar disorder cannot be used for older people, and there are no safety and efficacy data upon which to base ... more",11/9/16,,U01MH068847,Weill Medical Coll Of Cornell Univ,8/1/05,7/31/12,650051,"Robert Young, John Beyer, Laszlo Gyulai, Benoit Mulsant, Martha Sajatovic, Lauren Marangell",224,115,109,lab,11/9/16,8/1/05,7/31/12,0.513392857,0.486607143,2005,8,1,1,21
21,218,Preventing Relapse in Schizophrenia: Oral Antipsychotics Compared To Injectables: Evaluating Efficacy (PROACTIVE),https://nda.nih.gov/edit_collection.html?id=2154,"As is the case with many chronic illnesses, it can be challenging for people with schizophrenia to take multiple pills every day on a long-term basis. At the same time, missing or discontinuing the anti-psychotic medications that treat schizophrenia substantially increases the risk of relapse and re-hospitalization. This study will determine how effective long-acting injectable risperidone is compared to oral antipsychotic medications to help patients who have schizophrenia. Patients who enroll in ... more",3/31/15,,U01MH070008,University Of New Mexico,2/1/06,12/31/11,1015280,Nina R. Schooler,309,89,220,lab,3/31/15,2/1/06,12/31/11,0.28802589,0.71197411,2006,2,1,2,1
22,40,Early Language Development within the Autism Spectrum,https://nda.nih.gov/edit_collection.html?id=1856,This project obtained behavioral data focused on early language and communication development in autism spectrum disorders (ASD). These data were obtained from a sample of young children residing in the state of Wisconsin. All children were between 2-3 years when enrolled in the research project and were continued to be seen annually for re-assessment.A multidisciplinary team of psychologists and speech-language pathologists conducted the evaluations at the Waisman Center on the University of Wisconsin-Madison ... more,12/5/10,University of Wisconsin-Madison,R01DC007223,University Of Wisconsin-Madison,7/1/06,6/30/12,2631949,Susan Ellis-Weismer,97,84,13,lab,12/5/10,7/1/06,6/30/12,0.865979381,0.134020619,2006,7,1,2,2
23,309,Development and validation of software for Internet and PC SCID administration,https://nda.nih.gov/edit_collection.html?id=2323,"""The overall aim of this project is to develop and validate software for computer-assisted administration of the Structured Clinical Interview for DSM-IV Axis I Disorders (SCID) Research Version. The SCID is consistently recognized as the gold standard instrument for generating accurate psychiatric diagnoses, but is cumbersome and expensive to administer. The proposed project will develop Internet-based software to automate the",10/9/15,TeleSage Health Outcomes Inc,R44MH080463,"Telesage, Inc.",5/26/07,11/25/07,99534,Benjamin Brodey,1255,433,822,lab,10/9/15,5/26/07,11/25/07,0.34501992,0.65498008,2007,5,26,2,3
24,11,Longitudinal MRI Study of Infants at Risk for Autism,https://nda.nih.gov/edit_collection.html?id=19,"Research data for the IBIS Autism project. Autism Centers of Excellence (ACE) Network is a collaborative effort by investigators at four clinical sites: University of North Carolina (UNC), University of Washington (UW), Washington University (WU), and Yale University; and one data coordinating center (DCC) at the Montreal Neurological Institute (MNI) to conduct a longitudinal MRI/DTI and behavioral study of infants at high risk for autism (i.e., siblings of autistic individuals) at 6, 12 and 24 months ... more",4/1/08,University of North Carolina at Chapel Hill,R01HD055741,Univ Of North Carolina Chapel Hill,7/1/07,6/30/13,16026783,Joe Piven,1024,710,314,lab,4/1/08,7/1/07,6/30/13,0.693359375,0.306640625,2007,7,1,2,4
25,43,Electrophysiologic Studies of Language Impairment in ASD (Years 1-5),https://nda.nih.gov/edit_collection.html?id=1862,6-15 year old children recruited for MEG studies of auditory processing,1/7/11,Children's Hospital of Philadelphia,R01DC008871,Childrens Hosp Of Philadelphia,7/1/07,6/30/13,1960285,Timothy Roberts,227,175,52,lab,1/7/11,7/1/07,6/30/13,0.77092511,0.22907489,2007,7,1,2,5
26,0,UIC ACE: Translational Studies of Insistence on Sameness in Autism,https://nda.nih.gov/edit_collection.html?id=1,"The UIC ACE was focused on the genetics, neurobiology, cognitive and affective processes, and pharmacology of insistence on sameness (IS) in autism spectrum disorders (ASD). A large sample of children with self-reported autism spectrum disorder will be screened by the Assessment Core for further screening by administration of the ADI-R to the parents. Probands meeting ADI-R criteria for autistic disorder will be recruited for further study if they are also classified by the ADI-R IS items as high ... more",4/1/08,University of Illinois at Chicago,P50HD055751,University Of Illinois At Chicago,8/6/07,7/31/14,9528855,Ed Cook,755,458,297,lab,4/1/08,8/6/07,7/31/14,0.606622517,0.393377483,2007,8,6,2,6
27,1,Biological and Information Processing Mechanisms Underlying Autism,https://nda.nih.gov/edit_collection.html?id=6,"This center focuses on elucidating fundamental information processing and neurobiological mechanisms causing autism with studies of infant siblings, first-diagnosed toddlers, and groups of children, adolescents, and adults with and without autism. Project I: Development of Categorization Knowledge in Low Functioning Autism focuses on the earliest manifestations of autism and information processing mechanisms underlying social and cognitive symptoms. Project II: Disturbances of Affective Contact: ... more",4/1/08,University of Pittsburgh Medical Center,P50HD055748,University Of Pittsburgh At Pittsburgh,8/6/07,7/31/14,9700596,"Nancy Minshew, M.D., Mark Strauss, Ph.D., Kevin Pelphrey, Ph.D., Marcel Just, Ph.D., Thomas Mitchell, Ph.D., and Diane Williams, Ph.D.",991,659,332,lab,4/1/08,8/6/07,7/31/14,0.664984864,0.335015136,2007,8,6,2,7
28,4,Biomarkers of Autism at 12 Months: From Brain Overgrowth to Genes,https://nda.nih.gov/edit_collection.html?id=9,"Behavioral data from the UCSD Autism Center of Excellence. This first data deposit will include Mullen Scales of Early Learning Scores from infants ages 12-36 months who are part of the ACE. Infants represent those at risk for an ASD, language delay (LD) and developmental delay (DD). Normal control data will be deposited as well. **NOTE: Headers from imaging data submitted to this collection contained Personally Identifiable Information (PII) and have been cleaned by NDA Staff**",4/1/08,University of California San Diego,P50MH081755,"University Of California, San Diego",8/6/07,6/30/14,10322836,"Eric Courchesne, Karen Pierce and others.",464,362,102,lab,4/1/08,8/6/07,6/30/14,0.780172414,0.219827586,2007,8,6,2,8
29,5,UCLA Sigman/Bookheimer ACE and ARRA,https://nda.nih.gov/edit_collection.html?id=10,ACE Projects: 1) PI Sigman - Infant Sibs. 2) PI Geschwind - Genetics. 3) PI Dapretto - Mirror neuron and imaging. 4) PI Kasari - Optimizing outcomes for toddlers. 5) PI McCracken - Understanding repetitive behaviors. ARRA: PI Bookheimer - Neural and Phenotypic Correlates of Autism Risk Genes,4/1/08,"University of California, Los Angeles",P50HD055784,University Of California Los Angeles,8/6/07,7/31/12,11465042,"Sigman M, Geschwind D, Bookheimer S",455,385,70,lab,4/1/08,8/6/07,7/31/12,0.846153846,0.153846154,2007,8,6,2,9
30,32,UW ACE Extended Family Study,https://nda.nih.gov/edit_collection.html?id=1654,University of Washington ACE projects,7/15/10,University of Washington,P50HD055782,University Of Washington,8/6/07,7/31/13,10998234,Bryan King,786,468,318,lab,7/15/10,8/6/07,7/31/13,0.595419847,0.404580153,2007,8,6,2,10
31,9,Intensive Intervention for Toddlers With Autism (EARLY STEPS),https://nda.nih.gov/edit_collection.html?id=16,A Multi-Site Randomized Study of Intensive Treatment for Toddlers with Autism,1/22/10,UC Davis MIND Institute,R01MH081757,University Of California At Davis,9/20/07,7/31/13,14775720,Sally J. Rogers,98,76,22,lab,1/22/10,9/20/07,7/31/13,0.775510204,0.224489796,2007,9,20,2,11
32,123,Autism genetics: homozygosity mapping and functional validation (Years 1-5),https://nda.nih.gov/edit_collection.html?id=2029,"Although high throughput sequencing (HTS) methods allow systematic analysis of genetic variation across the entire exome, or even the entire genome, the interpretation of this data faces analytical challenges that have by no means been solved. The use of consanguineous pedigrees, in which parents share ancestry, allows the identification of candidate genes that can then be analyzed more broadly in nonconsanguineous families. Consanguineous families 1] reduce the heterogeneity of ASD, 2] simplify ... more",1/11/13,Children's Hospital Boston,R01MH083565,Boston Childrens Hospital,9/28/07,4/30/12,2849882,Christopher A. Walsh,369,234,135,lab,1/11/13,9/28/07,4/30/12,0.634146341,0.365853659,2007,9,28,2,12
33,274,Bipolar & Schizophrenia Consortium for Parsing Intermediate Phenotypes (B-SNIP 1),https://nda.nih.gov/edit_collection.html?id=2274,"The overall goal of the proposed research is to examine a broad panel of putative endophenotypes in affected individuals with schizophrenia and bipolar and their unaffected relatives in order to: 1) characterize the degree of familial phenotypic overlap between SZ and psychotic BP; 2) identify patterns of endophenotypes unique t the two disorders, and 3) contrast the heritability of endophenotypes across the disorders. To achieve these goals, we will recruit 500 SZ and 500 BP I (with psychosis) probands, ... more",12/9/14,UT Southwestern Medical School,R01MH077945,Yale University,9/29/07,5/31/13,3518485,Carol Tamminga,2431,1026,1405,lab,12/9/14,9/29/07,5/31/13,0.42204854,0.57795146,2007,9,29,2,13
34,460,Consortium for Neuropsychiatric Phenomics,https://nda.nih.gov/edit_collection.html?id=2499,"The Consortium for Neuropsychiatric Phenomics advances the NIH Roadmap Initiative by assembling a transdisciplinary research team of the future to address major unsolved challenges in research on neuropsychiatric disorders. The CNP leverages the new discipline of phenomics the systematic study of phenotypes on a genome-wide scale by integrating basic, clinical and information sciences. Neuropsychiatric disorders have enormous public health significance, and there is currently a broad chasm between ... more",9/19/16,"University of California, Los Angeles",PL1MH083271,University Of California Los Angeles,9/29/07,6/30/13,5804557,Robert M Bilder,1662,862,800,lab,9/19/16,9/29/07,6/30/13,0.518652226,0.481347774,2007,9,29,2,14
35,7,Early Pharmacotherapy Guided by Biomarkers in Autism,https://nda.nih.gov/edit_collection.html?id=14,Clinical trial of buspirone in young children with autism testing a PET scan of serotonin synthesis as a biomarker of drug response,1/15/10,Wayne State University,U01NS061264,Wayne State University,2/1/08,1/31/16,6054366,Diane C Chugani,159,132,27,lab,1/15/10,2/1/08,1/31/16,0.830188679,0.169811321,2008,2,1,2,15
36,2,A Comprehensive Approach to Identification of Autism Susceptibility Genes with the AGRE Center for Genomic and Phenomic Studies in Autism,https://nda.nih.gov/edit_collection.html?id=7,"AGRE is a DNA repository and family registry, housing a database of genotypic and phenotypic information that is available to autism researchers worldwide.",4/1/08,"University of California, Los Angeles",R01MH081754,University Of California Los Angeles,4/1/08,3/24/13,14584906,Clara Lajonchere and Dan Geschwind,2,1,1,lab,4/1/08,4/1/08,3/24/13,0.5,0.5,2008,4,1,2,16
37,3,Yale Autism Center of Excellence: Mechanisms of Social Engagement in the Autism Spectrum Disorders,https://nda.nih.gov/edit_collection.html?id=8,"The Yale ACE consists of 5 project areas and 3 core resources. Projects I, II, and III focus on the same cohort of 12- to 24-month old infants with ASD followed up longitudinally. Project IV involves structural and functional neuroimaging protocols on a group of 10-year-olds with ASD who were extensively characterized at the age of 2 and 4 years. Project V includes cytogenetic studies of the infants evaluated in Projects I, II, and III, and the ASD children evaluated in Project IV. The Administrative ... more",4/1/08,Yale University,P50MH081756,Yale University,4/1/08,3/31/14,12080414,Fred Volkmar,245,194,51,lab,4/1/08,4/1/08,3/31/14,0.791836735,0.208163265,2008,4,1,2,17
38,29,Early Autism Risk Longitudinal Investigation (EARLI) Network,https://nda.nih.gov/edit_collection.html?id=1600,"Descriptive data for EARLI (probands and sibling) ADOS, Vineland, SRS, SCQ",4/1/08,Drexel University,R01ES016443,Drexel University,4/1/08,3/31/15,15566054,Craig Newschaffer,729,361,368,lab,4/1/08,4/1/08,3/31/15,0.495198903,0.504801097,2008,4,1,2,18
39,81,Synaptic A-to-I RNA editing in autistic and neurotypical cerebella,https://nda.nih.gov/edit_collection.html?id=1951,Ultradeep 454 and Illumina sequencing of cDNA from postmortem cerebella of individuals with ASD and matched neurotypical controls,6/11/12,Boston Children's Hospital,R01MH085143,Boston Childrens Hospital,7/22/08,12/31/13,3595969,Louis Kunkel,25,15,10,lab,6/11/12,7/22/08,12/31/13,0.6,0.4,2008,7,22,2,19
40,86,Longitudinal Studies of Autism Spectrum Disorders: From 2 to 23,https://nda.nih.gov/edit_collection.html?id=1965,Longitudinal Studies of Autism Spectrum Disorders (ASD): From 2 to 23 - Increasing Understanding of Nonverbal School-Aged Children and Children with Limited Language Skills,7/12/12,University of Michigan,R01MH081873,Weill Medical Coll Of Cornell Univ,9/1/08,5/31/15,2692305,"Cathy Lord, Ph. D",63,49,14,lab,7/12/12,9/1/08,5/31/15,0.777777778,0.222222222,2008,9,1,2,20
41,56,Predicting Useful Speech in Children With Autism,https://nda.nih.gov/edit_collection.html?id=1885,"Predicting Useful Speech in Children with ASD: Analyzing speech processing, word processing, and pre-speech vocalizations",8/19/11,Vanderbilt University,R01DC006893,Vanderbilt University,2/1/09,1/31/14,2940391,Paul Yoder,150,86,64,lab,8/19/11,2/1/09,1/31/14,0.573333333,0.426666667,2009,2,1,2,21
42,69,Atypical Late Neurodevelopment in Autism,https://nda.nih.gov/edit_collection.html?id=1906,Longitudinal neuroimaging and neuropsychological study to understand how brain mechanisms and clinical phenotypes in autism are related.,2/13/12,University of Wisconsin-Madison,R01MH084795,University Of Utah,4/1/09,1/31/14,1577534,"Janet E Lainhart, MD",174,168,6,lab,2/13/12,4/1/09,1/31/14,0.965517241,0.034482759,2009,4,1,3,1
43,67,Neurobehavioral Research on Infants at Risk for SLI and Autism,https://nda.nih.gov/edit_collection.html?id=1900,The specific aims of the research are (1) to identify markers that distinguish between infants at risk for SLI or ASD and low risk controls; (2) to identify the predictors of later SLI and ASD diagnoses (at 36 months of age) from measures collected between 6 and 12 months of age; and (3) to compare developmental trajectories of key language and related social/cognitive measures between 6 and 36 months in infants with and without clinical outcomes. These aims will be pursued in a longitudinal ... more,1/27/12,Boston University,R01DC010290,Boston University (Charles River Campus),7/1/09,6/30/15,3953029,Helen Tager-flusberg,33,25,8,lab,1/27/12,7/1/09,6/30/15,0.757575758,0.242424242,2009,7,1,3,2
44,257,A Comparison of Long-acting Injectable Medications for Schizophrenia (ACLAIMS),https://nda.nih.gov/edit_collection.html?id=2247,"The purpose of this research study is to compare the ""real-world"" effectiveness of two FDA-approved and widely used long-acting injectable antipsychotic medications (paliperidone palmitate and haloperidol decanoate) in patients with schizophrenia or schizoaffective disorder who are expected to benefit from the improved medication compliance associated with injectable medications. The goal is to evaluate the effects of the medications on outcomes of importance to patients (relapse, symptoms, adverse ... more",12/9/14,,R01MH081234,Duke University,7/1/09,3/31/16,1651336,Joseph McEvoy and Scott Stroup,315,234,81,lab,12/9/14,7/1/09,3/31/16,0.742857143,0.257142857,2009,7,1,3,3
45,82,School-Age Children with Autism with Limited Expressive Language Intervention,https://nda.nih.gov/edit_collection.html?id=1952,School-Age Children with Autism with Limited Expressive Language Skills: An Intervention Study,1/27/12,Kennedy Krieger Institute,R01MH085048,Hugo W. Moser Res Inst Kennedy Krieger,7/16/09,2/28/15,3725900,Rebecca Landa,14,9,5,lab,1/27/12,7/16/09,2/28/15,0.642857143,0.357142857,2009,7,16,3,4
46,44,Child-Initiated Interactions and Autism Intervention,https://nda.nih.gov/edit_collection.html?id=1863,Data for a project to examine specific intervention components during language intervention and social communication.,1/7/11,University of California at Santa Barbara,R34DC010924,University Of California Santa Barbara,9/11/09,8/31/12,739435,Robert Koegel,4,3,1,lab,1/7/11,9/11/09,8/31/12,0.75,0.25,2009,9,11,3,5
47,62,Early Detection of Autism through Acoustic Analysis of Cry,https://nda.nih.gov/edit_collection.html?id=1891,"This team will work collaboratively to develop a new acoustic analysis system for infant cry based on state of the art acoustical engineering and computer technology. In particular, we will utilize advances in digital signal processing to yield more accurate and robust detection and modeling of infant cry acoustics. We will then validate this new system against our current system by using a large data bank of cries already collected, including cries of infants who were later diagnosed with autism ... more",1/27/12,Women & Infants Hospital,R21DC010925,Women And Infants Hospital-Rhode Island,9/11/09,8/31/12,517219,Stephen J. Sheinkopf,769,411,358,lab,1/27/12,9/11/09,8/31/12,0.534460338,0.465539662,2009,9,11,3,6
48,27,Sensory Integration Treatment in ASD,https://nda.nih.gov/edit_collection.html?id=1550,"Sensory integration deficit is a controversial but widely used diagnostic classification in ASD and sensory integration (SI) based treatment is commonly provided to children with autism spectrum disorder, but has an extremely limited evidence base. The purpose of this proposal will be to complete developmental analyses in preparation for a relatively large randomized comparison trial examining the effects of commonly implemented sensory integration treatment techniques on communication development ... more",7/14/10,Vanderbilt University School of Medicine,R34DC010927,Vanderbilt University,9/17/09,8/31/12,681605,Stephen Camarata & Mark Wallace,50,44,6,lab,7/14/10,9/17/09,8/31/12,0.88,0.12,2009,9,17,3,7
49,12,CBT for Anxiety in Adolescents with Autism,https://nda.nih.gov/edit_collection.html?id=20,"The purpose of the research study is to see how well a cognitive-behavioral psychotherapy program works to reduce anxiety in adolescents with autism spectrum disorders. This collection will contain data associated with this project. Including but not limited to the: ADIS, PARS, SACA, ADI-R, ADOS, WISC, and various self report measures completed by the parents and adolescents.",9/1/09,University of South Florida,R34HD065274,University Of South Florida,9/21/09,8/31/11,423402,"Eric A. Storch, Ph.D.",28,21,7,lab,9/1/09,9/21/09,8/31/11,0.75,0.25,2009,9,21,3,8
50,53,AGRE Federated Collection,https://nda.nih.gov/edit_collection.html?id=1879,"AGRE is a DNA repository and family registry, housing a database of genotypic and phenotypic information that is available to autism researchers worldwide.",6/27/11,Autism Speaks,RC1MH089707,"Autism Speaks, Inc.",9/23/09,8/31/12,960080,Clara Lajonchere,7371,4642,2729,lab,6/27/11,9/23/09,8/31/12,0.629765296,0.370234704,2009,9,23,3,9
51,16,Distance to Freeway and Major Road Data,https://nda.nih.gov/edit_collection.html?id=1203,"This collection contains birth address based measures on distance to interstate highway, state highway, major road, and local road for study subjects enrolled in the CHARGE study. **** NOTICE **** Please note that the subjects for this project were pregnant mothers. The phenotype of the child are associated with the mother's data for some of the mothers. The children's clinical data are not available. Contact the PI of this project should you need that information. **** END OF NOTICE ****",9/1/09,University of Southern California,R21ES019002,University Of Southern California,9/28/09,7/31/12,577195,Rob McConnell,1049,846,203,lab,9/1/09,9/28/09,7/31/12,0.806482364,0.193517636,2009,9,28,3,10
52,47,1/2 Development of a Screening Interview for Research Studies of ASD,https://nda.nih.gov/edit_collection.html?id=1866,This collection contains phenotypic data on subjects diagnosed with ASD and subjects with non-ASD diagnoses.,1/11/11,University of Michigan,R01HD065277,Cincinnati Childrens Hosp Med Ctr,9/29/09,8/31/12,736530,"Christoper Monk, Somer Bishop and Cathy Lord",411,302,109,lab,1/11/11,9/29/09,8/31/12,0.734793187,0.265206813,2009,9,29,3,11
53,8,Measuring QALYs in Children with ASDs,https://nda.nih.gov/edit_collection.html?id=15,"Autism spectrum disorders (ASDs) are characterized by impairments in social skills, communication, and cognitive and behavioral functioning. Successful interventions for children with ASDs thus have the potential to not only affect outcomes of the child, but may include substantial health benefits for the family. Guidelines for evaluating the cost-effectiveness of services recommend using the cost per quality adjusted life year (QALY) gained. To date, no studies have attempted to evaluate whether ... more",9/1/09,UAMS - University of Arkansas for Medical Sciences,R01MH089466,Univ Of Arkansas For Med Scis,9/30/09,8/31/12,975561,John Tilford; Karen Kuhlthau,221,189,32,lab,9/1/09,9/30/09,8/31/12,0.85520362,0.14479638,2009,9,30,3,12
55,15,Treatment as usual and peer engagement in Adolescents with High Functioning Autism,https://nda.nih.gov/edit_collection.html?id=1202,"Multi-site RCT contrasting peer-mediated intervention and typical social skills intervention in teens with HFA.********NOTICE********NOTICE********NOTICE*********Subject ages in these datasets are provided in the unit of months, but are not accurate. They are, instead, approximate ages in months.***************************************************",9/1/09,Seattle Children's Hospital,R01HD065291,Seattle Childrens Hospital,9/30/09,8/31/12,772496,"Felice Orlich, PhD",81,67,14,lab,9/1/09,9/30/09,8/31/12,0.827160494,0.172839506,2009,9,30,3,13
56,18,Behavioral Treatment for Autism in Community Settings Using a Telehealth Network,https://nda.nih.gov/edit_collection.html?id=1300,The purpose of this study is to evaluate assessment and treatment procedures for children with autism or a related disorder,9/1/09,University of Iowa,R01MH089607,University Of Iowa,9/30/09,8/31/12,748412,Scott Lindgren,40,36,4,lab,9/1/09,9/30/09,8/31/12,0.9,0.1,2009,9,30,3,14
57,19,Identifying Brain-Based Biomarkers for ASD and their Biological Subtypes,https://nda.nih.gov/edit_collection.html?id=1356,This is a multi-modal brain imaging study of Autism Spectrum Disorders to define biomarkers and subtypes of the disorder.--------------------------------------------------------------------No gradient tables provided for DTI data files. fMRI files headers were cleaned - DOB removed; Spectroscopy files were cleaned - DOB and Physician names removed.,9/1/09,Children's Hospital Los Angeles,R01MH089582,New York State Psychiatric Institute,9/30/09,8/31/12,2431811,Bradley S. Peterson,186,143,43,lab,9/1/09,9/30/09,8/31/12,0.768817204,0.231182796,2009,9,30,3,15
60,22,Pupillary Light Reflex as a Biomarker for Autism,https://nda.nih.gov/edit_collection.html?id=1400,"Pupillary light reflex, Heart rate variability, medical history.",9/1/09,University of Missouri,R21NS070299,University Of Missouri-Columbia,9/30/09,8/31/12,409050,"Gang Yao, Judith H. Miles, Shawn Christ",125,109,16,lab,9/1/09,9/30/09,8/31/12,0.872,0.128,2009,9,30,3,16
61,23,Systems biology of ASD,https://nda.nih.gov/edit_collection.html?id=1401,Sequencing and building protein-protein interaction network of brain-expressed alternatively spliced isoforms of autism candidate genes,9/1/09,University of California San Diego,R01HD065288,"University Of California, San Diego",9/30/09,8/31/12,1319038,Lilia Iakoucheva,2,2,0,lab,9/1/09,9/30/09,8/31/12,1,0,2009,9,30,3,17
65,28,Neural Dissection of Hyperactivity/Inattention in Autism,https://nda.nih.gov/edit_collection.html?id=1551,"This data collection is intended to contain neuroimaging and phenotypic and diagnostic data from approximately 100 children with Autism Spectrum Disorder, 50 children with Attention Deficit/Hyperactivity Disorder and 50 typically developing children.",9/1/09,NYU School of Medicine,R01HD065282,New York University School Of Medicine,9/30/09,8/31/12,2262855,Francisco Xavier Castellanos,214,173,41,lab,9/1/09,9/30/09,8/31/12,0.808411215,0.191588785,2009,9,30,3,18
66,30,Imaging Brain and Movement in ASD,https://nda.nih.gov/edit_collection.html?id=1601,"This dataset contains diagnostic information, standardized neuropsychological test measures, EEG, structural MRI, and movement-related measures from adolescents with ASD and control adolescents.",9/1/09,University of California San Diego,R21NS070296,"University Of California, San Diego",9/30/09,8/31/12,540654,Jeanne Townsend,66,57,9,lab,9/1/09,9/30/09,8/31/12,0.863636364,0.136363636,2009,9,30,3,19
67,31,SFARI - DNA Methylation Analysis Cohort,https://nda.nih.gov/edit_collection.html?id=1650,DNA methylation analysis of peripheral blood cells from siblings discordant for ASD,9/1/09,Emory University,R01MH089606,Emory University,9/30/09,8/31/12,3148467,Stephen T Warren,870,864,6,lab,9/1/09,9/30/09,8/31/12,0.993103448,0.006896552,2009,9,30,3,20
69,34,Genes disrupted by balanced genomic rearrangements in autism spectrum disorders,https://nda.nih.gov/edit_collection.html?id=1700,Sequencing rearrangements in ASD,9/1/09,Massachusetts General Hospital,R21HD065286,Massachusetts General Hospital,9/30/09,8/31/12,617446,James Gusella,65,38,27,lab,9/1/09,9/30/09,8/31/12,0.584615385,0.415384615,2009,9,30,3,21
71,36,CBT for anxiety in adolescents with autism,https://nda.nih.gov/edit_collection.html?id=1850,Collection consists of youth with autism and coexisting anxiety undergoing cognitive-behavioral treatment,9/1/09,"University of California, Los Angeles",R34HD065270,University Of California Los Angeles,9/30/09,8/31/12,506742,Jeffrey Wood,27,21,6,lab,9/1/09,9/30/09,8/31/12,0.777777778,0.222222222,2009,9,30,4,1
54,14,Induced pluripotent cells in ASD with macrocephaly,https://nda.nih.gov/edit_collection.html?id=1201,"R01MH89176 - This project will develop lines of pluripotent cells (iPSC) from a longitudinally acquired cohort of patients with autism spectrum disorders (ASD) and macrocephaly and their family members, as well as typically developing children, using cells obtained by a skin biopsy. We will produce several iPSC lines per individual and characterize them with respect to their biology and their structural genetic variation. The aim is create a resource and analytical tool, which will allow us to examine ... more",6/23/10,Yale University,R01MH089176,Yale University,9/30/09,8/31/12,1987576,Flora Vaccarino,29,20,9,lab,6/23/10,9/30/09,8/31/12,0.689655172,0.310344828,2009,9,30,4,2
58,20,Biological Signatures of Autism,https://nda.nih.gov/edit_collection.html?id=1358,Collection of data associated with the Autism Phenome Project and ARRA grant,7/8/10,"University of California, Davis",R01MH089626,University Of California At Davis,9/30/09,8/31/12,2828090,David G. Amaral,141,109,32,lab,7/8/10,9/30/09,8/31/12,0.773049645,0.226950355,2009,9,30,4,3
59,21,RNA-Seq data from cerebral cortex in control subjects,https://nda.nih.gov/edit_collection.html?id=1360,"RNA-Seq studies of Gene Expression in Cells and Networks in FI (fronto-insular) and AC (anterior cingulate) cortex in Autism. We seek to understand the cellular bases of autism by using a new technology, RNA-Seq, to determine differences in gene expression in autopsy brains of subjects with well described autism versus age and sex matched neurotypical individuals. We have investigated two specific cortical areas involved in self-awareness and social reciprocity which are abnormal in autism and have ... more",7/8/10,California Institute of Technology,R01MH089406,California Institute Of Technology,9/30/09,8/31/12,1115419,John Allman,35,22,13,lab,7/8/10,9/30/09,8/31/12,0.628571429,0.371428571,2009,9,30,4,4
62,24,"The Met Signaling System, Autism and Gastrointestinal Dysfunction.",https://nda.nih.gov/edit_collection.html?id=1450,This dataset contains three types of individuals: with ASD and with gastrointestinal dysfunction; with ASD but without gastrointestinal dysfunction; and without ASD but with gastrointestinal dysfunction.,7/11/10,University of Southern California,R21HD065289,University Of Southern California,9/30/09,8/31/12,570222,Pat R. Levitt,168,127,41,lab,7/11/10,9/30/09,8/31/12,0.755952381,0.244047619,2009,9,30,4,5
63,25,Autism in the second half of the lifespan,https://nda.nih.gov/edit_collection.html?id=1500,"Behavior, daily living, service needs. As a first step toward identifying and understanding the effects of aging in ASD, we propose to examine individuals in middle and later-age (30-70 years) in order to: (1) Characterize current living situations, support needs and available support systems for adults with ASD and the influence of demographic factors on these variables; (2) Determine the effect of age on cognitive and motor abilities in adults with ASD in comparison to normal control adults; (3) ... more",7/12/10,University of California San Diego,R21MH089645,"University Of California, San Diego",9/30/09,8/31/12,534149,Ruth Carper,59,47,12,lab,7/12/10,9/30/09,8/31/12,0.796610169,0.203389831,2009,9,30,4,6
64,26,Neural and Behavioral Outcomes of Social Skills Groups in Children with ASD,https://nda.nih.gov/edit_collection.html?id=1501,Neuroimaging and phenotypic measures of school-age children undergoing social skills group interventions. The purpose of this investigation is to examine the acute and sustained effects of a CBT-based social skills treatment on social cognition and the neural architecture that supports it. High-functioning children with ASD (8-11 years old) will be randomly assigned to a 12-week cognitive behavioral social skills group or a social play comparison group to control for non-specific therapeutic effects. ... more,7/13/10,Mount Sinai School of Medicine,R21MH089236,Icahn School Of Medicine At Mount Sinai,9/30/09,8/31/12,578049,"A. Ting Wang, Latha V. Soorya",38,33,5,lab,7/13/10,9/30/09,8/31/12,0.868421053,0.131578947,2009,9,30,4,7
68,33,Gross morphological correlates to the minicolumnopathy of autism (ATP postmortem MRI),https://nda.nih.gov/edit_collection.html?id=1655,"Proton density weighted scans of fixed, postmortem brain tissue",7/16/10,University of Louisville,R01HD065279,University Of Louisville,9/30/09,11/30/11,546554,Manuel Casanova,18,13,5,lab,7/16/10,9/30/09,11/30/11,0.722222222,0.277777778,2009,9,30,4,8
70,35,Initial Investigation of Prevention of ASD in Infants at Risk,https://nda.nih.gov/edit_collection.html?id=1800,"The project's overall goal is to develop and pilot test a manualized, parent-delivered intervention for symptomatic infants ages 6-11 months of age at high risk for autism that will reduce atypical behaviors and developmental delays and increase developmental rates, thus lessening or preventing the full expression of autism. The intervention will target five behaviors occurring in infants who show abnormal behaviors in the first year of life and later develop autism, as documented by prospective ... more",8/25/10,UC Davis MIND Institute,R21HD065275,University Of California At Davis,9/30/09,8/31/12,527101,Sally J. Rogers,4,3,1,lab,8/25/10,9/30/09,8/31/12,0.75,0.25,2009,9,30,4,9
72,45,Gene Expression and Immune Cell Function in Mothers of Children with Autism- Demographics,https://nda.nih.gov/edit_collection.html?id=1864,"This proposal is submitted in response to the following Title: Recovery Act Limited Competition: Research to Address the Heterogeneity in Autism Spectrum Disorders (R21). Request for Applications (RFA) Number: RFA-MH-09-172 Abstract: Though most studies have examined immune abnormalities in children with autism, it is also possible that an aberrant immune response in mothers during vulnerable, critical periods of neurodevelopment could produce neuronal injury in the fetal or neonatal brain, and produce ... more",1/10/11,MIND Institute,R21HD065269,University Of California At Davis,9/30/09,8/31/11,535645,Frank Sharp,151,0,151,lab,1/10/11,9/30/09,8/31/11,0,1,2009,9,30,4,10
73,46,Development of a Brief Screener for Research in Autism Spectrum Disorders,https://nda.nih.gov/edit_collection.html?id=1865,This collection contains phenotypic data from subjects diagnosed with ASD as well as subjects with non-ASD diagnoses.,1/11/11,University of Michigan,RC1MH089721,University Of Michigan At Ann Arbor,9/30/09,8/31/12,996692,"Cathy Lord, Ph. D. and Christopher Monk",768,591,177,lab,1/11/11,9/30/09,8/31/12,0.76953125,0.23046875,2009,9,30,4,11
74,48,The Effects of Oxytocin on Complex Social Cognition in Autism Spectrum Disorders,https://nda.nih.gov/edit_collection.html?id=1868,The Effects of Oxytocin on Complex Social Cognition,1/14/11,Mount Sinai School of Medicine,R21HD065276,Icahn School Of Medicine At Mount Sinai,9/30/09,8/31/12,564741,"Jennifer Bartz, PhD",24,17,7,lab,1/14/11,9/30/09,8/31/12,0.708333333,0.291666667,2009,9,30,4,12
75,50,Elucidating the Genetic Architecture of Autism by Deep Genomic Sequencing,https://nda.nih.gov/edit_collection.html?id=1872,ARRA Autism Sequencing Collaboration,2/16/11,Broad Institute,R01MH089175,Baylor College Of Medicine,9/30/09,8/31/11,2998515,"Mark Daly, Richard Gibbs, Joseph Buxbaum, Gerard Schellenberg and James Sutcliffe",2103,1387,716,lab,2/16/11,9/30/09,8/31/11,0.659533999,0.340466001,2009,9,30,4,13
76,52,Genomic Identification of Autism Loci,https://nda.nih.gov/edit_collection.html?id=1878,"The goal of this grant is to use a targeted approach to identify the genes responsible for autism. Three different approaches were put forward to focus on genomic regions associated with autism, each was a dedicated specific aim.",5/26/11,University of Washington,R01HD065285,University Of Washington,9/30/09,12/20/11,2623078,Evan E Eichler,6736,4337,2399,lab,5/26/11,9/30/09,12/20/11,0.643853919,0.356146081,2009,9,30,4,14
77,54,Computer Adaptive Testing of Adaptive Behavior of Children and Youth with Autism,https://nda.nih.gov/edit_collection.html?id=1880,"The PEDI-CAT (ASD) will facilitate significant advances in ASD research and clinical services by providing a brief but precise, psychometrically sound assessment of daily function in home and community. The instrument will greatly improve the quality of information obtained on the adaptive behavior of children and youth with ASD and make possible more sensitive tracking of changes in this critical outcome across childhood and adolescence.",6/29/11,Boston University,R21HD065281,Boston University (Charles River Campus),9/30/09,8/31/13,568750,"Wendy Coster, PhD",403,339,64,lab,6/29/11,9/30/09,8/31/13,0.841191067,0.158808933,2009,9,30,4,15
78,55,Sex specific dissection of autism genetics,https://nda.nih.gov/edit_collection.html?id=1883,SRS and SCQ data for females and males with ASDs,7/19/11,"University of California, San Francisco",R21HD065273,"University Of California, San Francisco",9/30/09,8/31/12,540750,Lauren A. Weiss,340,187,153,lab,7/19/11,9/30/09,8/31/12,0.55,0.45,2009,9,30,4,16
79,63,Genomic Profiling and Functional Mutation Analysis in Autism Spectrum Disorders,https://nda.nih.gov/edit_collection.html?id=1895,"This proposal is in response to a request for applications to address ""Genomic Profiling of Mental Disorders"", and proposes intensive genomic profiling and functional analysis of Contactin Associated Protein 2 (CNTNAP2) as well as the presynaptic cytomatrix protein Piccolo (PCLO), in an effort to clarify their roles in Autism Spectrum Disorders (ASD). In addition, the application proposes to deeply sequence genes in the Contactin and Contactin Associated pathways, as well as genes coding for proteins ... more",1/27/12,"University of California, San Francisco",RC2MH089956,Yale University,9/30/09,8/31/12,2245837,Matthew State,4731,2858,1873,lab,1/27/12,9/30/09,8/31/12,0.604100613,0.395899387,2009,9,30,4,17
80,74,Behavioral and Genetic Biomarker Development for Autism and Related Disorders,https://nda.nih.gov/edit_collection.html?id=1932,"This collection represents a family-based study of Autism Spectrum Disorder (ASD) that consists of (1) behavioral and diagnostic assessments of ASD (including social behavior, language, reading, and cognition measures) used to create behavioral biomarkers and (2) the genetic data used for linkage, association, whole genome sequencing studies, and the creation iPSCS into neurons.",4/10/12,Rutgers University,RC1MH088288,"Rutgers, The State Univ Of N.J.",9/30/09,8/31/12,993675,"Linda Brzustowicz, M.D.",735,433,302,lab,4/10/12,9/30/09,8/31/12,0.589115646,0.410884354,2009,9,30,4,18
81,75,Deep sequencing of autism candidate genes in 2000 families from the Simons Simplex Collection (SSC),https://nda.nih.gov/edit_collection.html?id=1936,"343 families from the Simons Simplex Collection. Each family includes father, mother, a proband and an unaffected sibling.",4/18/12,Cold Spring Harbor Laboratory,RC2MH090028,Cold Spring Harbor Laboratory,9/30/09,8/31/12,2779842,Michael Wigler,4559,2724,1835,lab,4/18/12,9/30/09,8/31/12,0.597499452,0.402500548,2009,9,30,4,19
82,85,Performance Indices of Social Disability in Toddlers with Autism,https://nda.nih.gov/edit_collection.html?id=1959,"This project - 'Performance Indices of Social Disability in Toddlers with Autism' - addresses Challenge Area '(04) Clinical Research' and Specific Challenge Topic 'Autism: Addressing the Challenge (04-MH-101*)'; and Challenge Area '(01) Behavior, Behavioral Change, and Prevention' and Specific Challenge Topic 'Individual- Based Model of Social Behavior (01-GM-101*)'. The overarching goal of this project is to develop performance indices of social engagement which can be used at the earliest point ... more",6/22/12,Emory University,RC1MH088676,Emory University,9/30/09,7/31/12,1424264,Ami Klin,74,58,16,lab,6/22/12,9/30/09,7/31/12,0.783783784,0.216216216,2009,9,30,4,20
83,238,Emergency Department Safety Assessment and Follow-Up Evaluation (EDSAFE) Trial,https://nda.nih.gov/edit_collection.html?id=2191,"The NIMH's RFA-Suicide Prevention in Emergency Medicine Departments recognizes the emergency department (ED) as an important setting to increase suicide detection and prevention efforts but observes that evidence-based practice guidelines do not exist. In response, we have designed the ED Safety Assessment and Follow-up Evaluation (EDSAFE) trial. Two inter-related studies will be conducted using a quasi-experimental design appropriate for studying systems-based change. The studies will share three ... more",4/30/15,University of Massachusetts Medical School,U01MH088278,Univ Of Massachusetts Med Sch Worcester,9/30/09,5/31/16,11709446,Edwin Boudreaux,243581,110639,132942,lab,4/30/15,9/30/09,5/31/16,0.454218515,0.545781485,2009,9,30,4,21
84,550,"Pediatric Imaging, Neurocognition, and Genetics (PING)",https://nda.nih.gov/edit_collection.html?id=2607,The PING Data Resource is the product of a multi-site project involving developmental researchers across the United States including UC San Diego the University of Hawaii UC Los Angeles Children's Hospital of Los Angeles of the University of Southern California UC Davis Kennedy Krieger Institute of Johns Hopkins University Sackler Institute of Cornell University University of Massachusetts Massachusetts General Hospital at Harvard University and Yale University. The Data Resource includes neurodevelopmental ... more,3/24/17,University of California San Diego,RC2DA029475,"University Of California, San Diego",9/30/09,8/31/13,9107610,Terry Jernigan,1494,780,714,lab,3/24/17,9/30/09,8/31/13,0.522088353,0.477911647,2009,9,30,5,1
85,638,A Study of the neural and psychological correlates of emotion and motivation processing deficits in individuals with schizophrenia vs. controls,https://nda.nih.gov/edit_collection.html?id=2703,The goal of the current study is to use state-of-the art functional neuroimaging and behavioral paradigms derived from the affective science literature to examine the integrity of the components of the neural systems linking rewards and actions. We feel it is critical to examine the function of the different components of the system in the same study in the same individuals so that we can address issues related to heterogeneity in symptom expression that may be leading to conflicting results across ... more,7/13/17,Washington University in St. Louis,R01MH066031,Washington University,12/17/09,11/30/15,2762920,Deanna Barch,152,83,69,lab,7/13/17,12/17/09,11/30/15,0.546052632,0.453947368,2009,12,17,5,2
676,10,Aberrant Behavior Checklist in Fragile X Syndrome,https://nda.nih.gov/edit_collection.html?id=18,"This project will combine data from the Aberrant Behavior Checklist for individuals with fragile X syndrome from multiple centers throughout the U.S. in order to examine its factor structure, reliability, and clinical utility, and to examine its potential as an outcome measure for clinical trials. We will also create norms specific to FXS.",2/2/10,"University of California, Davis",,,2/2/10,,,"David Hessl, Ph.D.",678,491,187,lab,2/2/10,2/2/10,,0.724188791,0.275811209,2010,2,2,5,3
86,91,Early Brain Development in Twins,https://nda.nih.gov/edit_collection.html?id=1974,"Twin studies have been critical in determining the contributions of genetic and environmental factors to normal brain structure and for understanding abnormalities of brain development that underlie neurodevelopmental and neuropsychiatric disorders. In adults and older children, twin studies indicate that genes play a significant role in the variability of global brain volumes, including total brain, total gray and total white matter volumes. Other than this current study, there have been no studies ... more",8/9/12,University of North Carolina at Chapel Hill,R01MH070890,Univ Of North Carolina Chapel Hill,5/1/10,6/30/15,3252912,John Gilmore,248,119,129,lab,8/9/12,5/1/10,6/30/15,0.47983871,0.52016129,2010,5,1,5,4
87,64,Novel computational methods for higher order diffusion MRI in autism,https://nda.nih.gov/edit_collection.html?id=1896,"We aim at developing computational methods for processing and analysis of high angular resolution diffusion imaging data that has been fitted with higher order diffusion models (HOMs). Compared to the tensor model in diffusion tensor imaging (DTI), HOMs provide a much richer understanding of pathology-based connectivity changes in complex WM regions, as well as a quantification of the degree of abnormality of WM. These imaging measures when correlated with clinical measures of symptom severity ... more",1/27/12,University of Pennsylvania,R01MH092862,University Of Pennsylvania,9/28/10,6/30/17,3323309,Ragini Verma,9,6,3,lab,1/27/12,9/28/10,6/30/17,0.666666667,0.333333333,2010,9,28,5,5
88,87,Dissecting Epistasis and Pleiotropy in Autism towards Personalized Medicine (Autism Traits in the RASopathies),https://nda.nih.gov/edit_collection.html?id=1966,"SRS & SCQ data for individuals with RASopathies (NF1, Noonan, CFC, & Costello syndromes) as well as healthy family members.",7/12/12,"University of California, San Francisco",DP2OD007449,"University Of California, San Francisco",9/30/10,6/30/15,2400834,"Lauren A. Weiss, PhD",133,64,69,lab,7/12/12,9/30/10,6/30/15,0.481203008,0.518796992,2010,9,30,5,6
89,243,Establishing Moderators/Biosignatures of Antidepressant Response - Clinical Care (EMBARC) MDD Treatment and Controls,https://nda.nih.gov/edit_collection.html?id=2199,"EMBARC is a comparative effectiveness trial of three mechanistically distinct treatments for Major Depressive Disorder (MDD) (citalopram, bupropion, and cognitive behavioral therapy) in which we will assess a comprehensive array of carefully selected clinical (i.e. anxious depression, early life trauma, ) and biological (i.e. genetic, neuroimaging, serum, epigenetic ) moderators and mediators of outcome. This Collection provides data on the treatment group and the normal controls evaluated as part ... more",4/30/15,NYS Psychiatric Institute,U01MH092250,Columbia University Health Sciences,9/30/10,6/30/16,8942332,"Madhukar H. Trivedi, Myrna M. Weissman, Patrick J. McGrath and Ramin V. Parsey",336,117,219,lab,4/30/15,9/30/10,6/30/16,0.348214286,0.651785714,2010,9,30,5,7
677,39,Autism Tissue Program (ATP) Brain Donor Listing,https://nda.nih.gov/edit_collection.html?id=1855,"This is a listing of brain donors, with GUIDs, that are within the Autism Tissue Program (ATP) database. The information in this collection is limited to just a few fields. Additional information is available to authorized researchers with ATP accounts through NDAR or ATPportal.org",11/23/10,Autism Tissue Program,,,11/23/10,,,"Jane Pickett Ph.D, ATP Director of Brain Resources and Data",419,316,103,lab,11/23/10,11/23/10,,0.754176611,0.245823389,2010,11,23,5,8
90,61,Fetal Programming of the Newborn and Infant Human Brain,https://nda.nih.gov/edit_collection.html?id=1890,"We propose to conduct a prospective, longitudinal, follow-up study in a population-based cohort of children born to mothers who will participate in an NIH-funded study of biological and behavioral processes in pregnancy. We will have extensive characterization in this child cohort over the course of their intrauterine life and birth with all the prenatal measures required to address the above questions, including serial measures of the maternal-placental fetal endocrine and immune/inflammatory milieu, ... more",1/13/12,University of California Irvine,R01MH091351,University Of California-Irvine,12/1/10,11/30/16,3133876,Claudia Buss and Pathik D. Wadhwa,392,81,311,lab,1/13/12,12/1/10,11/30/16,0.206632653,0.793367347,2010,12,1,5,9
91,76,Cultural Equivalence of Autism Assessment for Latino Children,https://nda.nih.gov/edit_collection.html?id=1939,The proposed study will examine the cultural equivalence of the Autism Diagnostic Interview Revised (ADI-R) for a US Latino population. The proposed study builds on an existing study of Latino children on the autism spectrum and their families and will recruit 25 additional children who have intellectual disabilities. We propose 3 aims: (1) to assess the reliability of the ADI-R Spanish version among Spanish speaking parents of children with autism and intellectual disabilities; (2) To investigate ... more,5/14/12,University of Wisconsin-Madison,R03HD064828,University Of Illinois At Chicago,12/20/10,11/30/14,175750,Sandra Magana,100,80,20,lab,5/14/12,12/20/10,11/30/14,0.8,0.2,2010,12,20,5,10
678,49,NICHD Brain and Tissue Bank for Developmental Disorders,https://nda.nih.gov/edit_collection.html?id=1870,"The objective of this human tissue repository is to systematically collect, store, and distribute brain and other tissues for research dedicated to the improved understanding, care and treatment of individuals with developmental disorders.",1/23/11,University of Maryland,,,1/23/11,,,H. Ron Zielke,3392,1993,1399,lab,1/23/11,1/23/11,,0.587558962,0.412441038,2011,1,23,5,11
92,72,Visual attention and fine motor coordination in infants at risk for autism,https://nda.nih.gov/edit_collection.html?id=1920,"The broad objectives of this research are to develop novel tools for early identification of motor, social, and cognitive deficits of Autism Spectrum Disorders (ASD) within the first six months of life. In this proposal, reaching, object exploration, and associative learning tasks are used as powerful contexts to identify impairments related to ASD and the broader autism phenotype (BAP) within the first six months of life. We will longitudinally compare two groups: 1) infant siblings of children ... more",3/1/12,University of Connecticut,R03HD060809,University Of Delaware,1/23/11,12/31/14,149203,Anjana Narayan Bhat,43,31,12,lab,3/1/12,1/23/11,12/31/14,0.720930233,0.279069767,2011,1,23,5,12
93,65,Measuring Social Networks among Parents and Autism Heath Care Providers,https://nda.nih.gov/edit_collection.html?id=1897,"This study will generate hypotheses, yield a field-tested survey instrument, and provide preliminary evidence about the effects of social networks on parents capacity to manage their child's autism treatment, laying the groundwork for larger-scale research and intervention.",1/27/12,University of Chicago,R21HD067865,University Of Chicago,2/1/11,1/31/14,429000,Stephen Raudenbush,80,9,71,lab,1/27/12,2/1/11,1/31/14,0.1125,0.8875,2011,2,1,5,13
94,71,Next Generation Gene Discovery in Familial Autism,https://nda.nih.gov/edit_collection.html?id=1919,"The goal of this proposal is to identify novel genes that are responsible for autism. To achieve that, we will apply novel analytic approach to identify families from existing UW-ACE and NIH collections where inheritance is most parsimonious with single gene transmission. We will analyze such families with newly available comparative genomic hybridization, target capture and massively parallel sequencing of all protein coding regions of human genome (exome). Our novel approach will likely identify ... more",2/29/12,University of Washington,R01MH092367,University Of Washington,2/3/11,12/31/16,3330602,Zoran Brkanac,202,140,62,lab,2/29/12,2/3/11,12/31/16,0.693069307,0.306930693,2011,2,3,5,14
95,78,Decoding what and who in the auditory system of children with autism spectrum,https://nda.nih.gov/edit_collection.html?id=1943,"To further our understanding of basic auditory function underlying decoding of phonological content (""what"" is being said) and speaker identity (who is saying it) in children with ASD, compared to typically developing (TD) children matched on age and language ability. Novel multivariate pattern recognition techniques will be used to increase the sensitivity for detecting fine-grained neural representations of information processing in the auditory system of children with ASD. 1) fMRI will be used ... more",5/14/12,Stanford Universtity,R21DC011095,Stanford University,2/4/11,1/31/15,434500,Vinod Menon,21,20,1,lab,5/14/12,2/4/11,1/31/15,0.952380952,0.047619048,2011,2,4,5,15
96,73,Components of Limited Activity Monitoring in Toddlers with ASD,https://nda.nih.gov/edit_collection.html?id=1923,"This proposal seeks to understand why toddlers with ASD monitor the activities of others less frequently by examining the social, perceptual, and developmental factors which may influence this ability in 20-month old toddlers with ASD and 14- and 20-month old TD toddlers. In regards to typical development, this proposal aims to chart the normative developmental changes in activity monitoring and to understand the bases for these changes, thus providing a context by which to understand limited activity ... more",3/1/12,Seattle Children's Research Institute,R03MH092618,Yale University,2/7/11,6/30/13,165646,Frederick Shic,269,207,62,lab,3/1/12,2/7/11,6/30/13,0.769516729,0.230483271,2011,2,7,5,16
765,0,Predictors of self-injurious behaviour exhibited by individuals with autism spectrum disorder,https://nda.nih.gov/study.html?id=258,"Presence of an autism spectrum disorder is a risk factor for development of self-injurious behaviour (SIB) exhibited by individuals with developmental disorders. The most salient SIB risk factors historically studied within developmental disorders are level of intellectual disability, communication deficits and presence of specific genetic disorders. Recent SIB research has expanded the search for risk factors to include less commonly studied variables for people with developmental disorders: negative ... more",2/23/11,Burkhart Center for Autism Education and Research,,,2/23/11,,,"Richman DM; Barnard-Brak L, Bosch A, Thompson S, Grubb L, Abby L",369,302,67,paper,2/23/11,2/23/11,,0.818428184,0.181571816,2011,2,23,5,17
97,77,Developing a novel treatment for restricted inflexible behavior,https://nda.nih.gov/edit_collection.html?id=1940,"The overall goal of the proposed project is to initiate a program of research to develop a novel treatment approach to restricted, inflexible behavior, a clinically important and highly understudied problem in neurodevelopmental disorders in general and autism in specific. Rather than target a particular compulsive, restricted, or repetitive behavior for modification, our proposed strategy is to promote the development of flexibility and variability using age appropriate, functional activities. As ... more",5/14/12,University of Florida,R21MH091554,University Of Florida,4/7/11,3/31/14,393407,Mark Lewis,12,10,2,lab,5/14/12,4/7/11,3/31/14,0.833333333,0.166666667,2011,4,7,5,18
679,51,IAN Interactive Autism Network,https://nda.nih.gov/edit_collection.html?id=1877,"IAN Research participants complete a series of baseline self-report questionnaires that collect information on ASD diagnosis, phenotypic characteristics and treatments, developmental history and educational setting, family demographics and parent past medical history, as well as many other topics. Both standardized instruments and study-specific instruments are used. The resulting dataset consists of approximately 1,500 data elements that are derived from the questionnaires that make up the IAN protocol ... more",4/13/11,Kennedy Krieger Institute,,,4/13/11,,,Paul A. Law,16301,7647,8654,lab,4/13/11,4/13/11,,0.469112324,0.530887676,2011,4,13,5,19
98,88,Sensor-based technology in the study of motor skills in infants at risk for ASD (Infant motor planning),https://nda.nih.gov/edit_collection.html?id=1968,"Longitudinal and cross-sectional data on motor planning in infants at HR for ASD and comparison infants. This research is designed to examine fine motor and object manipulation skills in HR and comparison infants with no such risk (Low Risk infants; LR) between the ages of 12 and 36 months. The approach taken is innovative because it involves the application of newly-developed, technologically sophisticated sensor technology designed for use in unstructured settings in combination with longitudinal ... more",7/14/12,University of Pittsburgh,R21HD068584,University Of Pittsburgh At Pittsburgh,4/15/11,3/31/14,433676,Jana M. Iverson,66,33,33,lab,7/14/12,4/15/11,3/31/14,0.5,0.5,2011,4,15,5,20
99,59,Emergence and Stability of Autism in Fragile X Syndrome,https://nda.nih.gov/edit_collection.html?id=1888,"FXS Demographics, General Demographics, and Mullen Scores",1/10/12,University of South Carolina,R01MH090194,University Of South Carolina At Columbia,5/27/11,2/29/16,803314,Jane Roberts,44,34,10,lab,1/10/12,5/27/11,2/29/16,0.772727273,0.227272727,2011,5,27,5,21
100,60,ASD Mathematical Cognition: A Cognitive and Systems Neuroscience Approach,https://nda.nih.gov/edit_collection.html?id=1889,"Investigation of math abilities in children with ASD via behavioral tests and brain imaging. Study will investigate cognitive and brain processes as well as brain networks involved in mathematical cognition in ASD populations. First submission will include behavioral (WASI) as well as diagnostic assessments (ADI, ADOS, SCQ).",1/11/12,Stanford Universtity,R01MH084164,Stanford University,6/1/11,2/28/17,3150031,"Vinod Menon, Stanford University",86,74,12,lab,1/11/12,6/1/11,2/28/17,0.860465116,0.139534884,2011,6,1,6,1
101,66,Cellular Density and Morphology in the Autistic Temporal Human Cerebral Cortex,https://nda.nih.gov/edit_collection.html?id=1898,"This project will analyze the temporal lobe of 21 autistic postmortem human brains (diagnosed as autistic, not as other autism spectrum disorders) and the temporal lobe of 18 control postmortem human brains. The data obtained from this project will also serve as the basis for future studies focusing on the neuropathology and the imbalance excitation / inhibition of the autistic brain.",1/27/12,"University of California, Davis",R01MH094681,University Of California At Davis,6/2/11,9/8/16,1794150,Veronica Martinez Cerdeno,60,59,1,lab,1/27/12,6/2/11,9/8/16,0.983333333,0.016666667,2011,6,2,6,2
102,693,Role of the Hippocampus and its Projections in Episodic Memory Development,https://nda.nih.gov/edit_collection.html?id=2764,"Episodic memory, or the ability to consciously remember past events, is central to the human experience. In a number of mental health disorders, this form of memory is among the most severely impaired cognitive functions. In the case of schizophrenia, episodic memory dysfunction precedes the onset of the full-blown disorder and predicts long-term functional outcomes. In typically developing children, episodic memory improves rapidly during childhood, and then improves more slowly during adolescence. ... more",8/22/17,"University of California, Davis",R01MH091109,University Of California At Davis,6/7/11,2/28/17,2681949,Simona Ghetti,212,106,106,lab,8/22/17,6/7/11,2/28/17,0.5,0.5,2011,6,7,6,3
103,458,D-Cycloserine Augmentation of CBT for Pediatric OCD,https://nda.nih.gov/edit_collection.html?id=2496,"Obsessive-compulsive disorder (OCD) affects 1-2 percent of children, runs a chronic course without treatment, and is associated with considerable functional impairment and poor quality of life. Although most patients with OCD respond to cognitive-behavioral therapy CBT or pharmacotherapy with a serotonin reuptake inhibitor SRI, a substantial number of youth remain symptomatic after receiving these therapies. Pharmacological interventions with SRIs are only moderately efficacious, rarely produce remission, ... more",9/19/16,University of South Florida,R01MH093381,University Of South Florida,6/8/11,2/28/17,1147831,Eric Storch and Daniel Geller,307,155,152,lab,9/19/16,6/8/11,2/28/17,0.504885993,0.495114007,2011,6,8,6,4
104,79,"Autism Risk, Prenatal Environmental Exposures, and Pathophysiologic Markers",https://nda.nih.gov/edit_collection.html?id=1946,"An extension of the epidemiology project MARBLES (Markers of Autism Risk in Babies Learning Early Signs) to collect 1) extensive behavioral, medical, and exposure data, 2) biologic specimens from the mother and child, and 3) detailed psychometric assessments from birth to 3 years, Exposures of interest are 2 classes of compounds common in household products with known neuro- or neurodevelopmental toxicity: pyrethroid pesticides diphenyl ethers (flame retardants). We assessed associations of self-reported ... more",5/14/12,"University of California, Davis",R01ES020392,University Of California At Davis,8/24/11,2/28/17,3656464,Irva Hertz-Picciotto,294,163,131,lab,5/14/12,8/24/11,2/28/17,0.554421769,0.445578231,2011,8,24,6,5
680,57,PDN Screening Data,https://nda.nih.gov/edit_collection.html?id=1886,Data from PDN Screening study,8/29/11,NIH,,,8/29/11,,,Audrey Thurm,249,197,52,lab,8/29/11,8/29/11,,0.791164659,0.208835341,2011,8,29,6,6
105,68,Functional Neuroimaging of Attention in Autism,https://nda.nih.gov/edit_collection.html?id=1904,"The proposed study will use functional MRI and rest state MRI along with novel, data-driven methods to examine brain networks disrupted in children with ASD and ADHD symptoms. This approach has two distinct advantages: 1) a basal ganglia-thalamocortical loop tapped by response inhibition is well- defined and known to be disrupted in children with prototypical ADHD; and 2) our data-driven methods make no a priori assumptions about potential sub-groups identified or connectivity among brain regions. ... more",1/27/12,Children's Hospital of Philadelphia,R21MH092615,Childrens Hosp Of Philadelphia,9/1/11,8/31/14,426605,Benjamin Yerys,95,76,19,lab,1/27/12,9/1/11,8/31/14,0.8,0.2,2011,9,1,6,7
106,90,Rapid Phenotyping for Rare Variant Discovery in Autism,https://nda.nih.gov/edit_collection.html?id=1971,"The project proposed here is to use the combined power of web based recruiting, web-implemented and validated phenotypic measurements, and distributed blood collection to establish a cost-effective recruitment of affected children with ASD. Based on our preliminary analysis where we assessed the accuracy of a web-based approach to autism phenotyping implemented within the Interactive Autism Network (IAN), we have set up a protocol in IAN to recruit from already registered and newly registered families, ... more",8/9/12,"University of California, Los Angeles",R01NS073871,University Of California Los Angeles,9/1/11,8/31/17,1099047,Stanley Nelson,4897,2423,2474,lab,8/9/12,9/1/11,8/31/17,0.49479273,0.50520727,2011,9,1,6,8
107,130,Autism Brain Imaging Data Exchange,https://nda.nih.gov/edit_collection.html?id=2039,"Autism spectrum disorders (ASD) are characterized by qualitative impairment in reciprocal social communication, as well as by repetitive, restricted, and stereotyped behaviors. Previously considered rare, ASD are now recognized to occur in more than 1% of children, causing immense suffering to individuals and their families. The complexity and heterogeneity of ASD make it necessary to obtain large-scale samples which are difficult to attain in any individual lab. In response, the Autism Brain Imaging ... more",7/17/13,Nathan Kline Institute,R03MH096321,Nathan S. Kline Institute For Psych Res,1/16/12,5/31/14,157976,"Michael Milham, MD, Ph.D.",1112,948,164,lab,7/17/13,1/16/12,5/31/14,0.852517986,0.147482014,2012,1,16,6,9
108,565,Online Treatments for Mood and Anxiety Disorders in Primary Care,https://nda.nih.gov/edit_collection.html?id=2625,"Depression and anxiety are prevalent in primary care practice, associated with substantial reductions in health-related quality of life HRQoL, and generate a significant excess of morbidity. In response, dozens of trials have demonstrated the greater effectiveness of Collaborative Care for these conditions vs. primary care physicians usual care. Yet for a variety of reasons, these models have not been widely implemented. Therefore, an urgent need remains to develop and test more scalable, powerful, ... more",5/15/17,University of Pittsburgh,R01MH093501,University Of Pittsburgh At Pittsburgh,2/9/12,6/30/17,2538704,Bruce Rollman,704,142,562,lab,5/15/17,2/9/12,6/30/17,0.201704545,0.798295455,2012,2,9,6,10
109,136,"Autism Spectrum Disorder: Birth Cohort 1976-2000, Epidemiology and Adult",https://nda.nih.gov/edit_collection.html?id=2053,"Autism Spectrum Disorders (ASDs) are lifelong neurodevelopmental conditions with mostly unknown etiology that have a huge impact on affected individuals and their families, and are a major public health concern. This proposal, Autism Spectrum Disorder: Birth Cohort 1976-2000, Epidemiology and Adult Status, in response to NIH Funding Opportunity Announcement (PA-10-158) describes an epidemiologic, population-based, large birth cohort study of ASDs. Significant gaps exist in the knowledge of ASD incidence ... more",10/3/13,Mayo Clinic,R01MH093522,Mayo Clinic Rochester,2/20/12,1/31/18,3026835,Slavica Katusic,487,307,180,lab,10/3/13,2/20/12,1/31/18,0.630390144,0.369609856,2012,2,20,6,11
681,70,Autism Genome Project,https://nda.nih.gov/edit_collection.html?id=1916,"The Autism Genome Project (AGP) Consortium represents more than 50 centers in North America and Europe. In an ongoing effort, the international AGP Consortium is collecting DNA from ASD families for ongoing genetic studies. The first phase of this initiative involved examining genetic linkage and chromosomal rearrangements in 1,168 families having at least two ASD individuals (PMID: 17322880). In this second phase of the project, we collected more families and genotyped them to examine for Copy Number ... more",2/22/12,,,,2/22/12,,,"Scherer, S. Devlin, B",8035,4989,3046,lab,2/22/12,2/22/12,,0.620908525,0.379091475,2012,2,22,6,12
110,138,Reduced NADH Production in the Presence of Tryptophan as a Biomarker of ASD,https://nda.nih.gov/edit_collection.html?id=2058,"Autism Spectrum Disorders (ASDs) affect 1/110 children in the United States, but physicians do not yethave an effective laboratory test which can confirm the clinical diagnosis. This proposal aims to develop aquick and reliable metabolic array to identify individuals with ASD.Using Phenotype Microarray plates obtained from Biolog (Hayward, CA), we have been able to showthat Nicotinamide Adenine Dinucleotide, reduced form (NADH) production in the presence of tryptophan asonly energy source in lymphoblastoid ... more",10/3/13,Greenwood Genetic Center,R21HD072473,Greenwood Genetic Center,3/9/12,2/28/14,269884,Charles Schwartz,100,80,20,lab,10/3/13,3/9/12,2/28/14,0.8,0.2,2012,3,9,6,13
111,104,Treatment of Autism Symptoms in Children (TASC): Initial RCT with Active Control,https://nda.nih.gov/edit_collection.html?id=2007,"Cognitive behavioral therapy (CBT) offers a novel approach for addressing core autism symptoms in higher functioning school-age youngsters. CBT has been successfully adapted to treat emotional problems in school-aged children with ASD (e.g., Wood et al., 2009a). Initial results suggest that CBT may also be promising for reducing core autism symptoms (Wood et al., 2009b; Drahota, Wood et al., 2011). The treatment is based on a contemporary model of memory retrieval competition, employing strategies ... more",10/19/12,"University of California, Los Angeles",R01MH094391,University Of California Los Angeles,3/15/12,2/28/18,1909600,Jeffrey Wood,143,121,22,lab,10/19/12,3/15/12,2/28/18,0.846153846,0.153846154,2012,3,15,6,14
112,663,Aging and Geriatric Experiments in Bipolar Disorder (AGE-BD),https://nda.nih.gov/edit_collection.html?id=2732,"Bipolar disorder (BD) is a serious and chronic mental illness that is associated with substantial impairment in quality of life and functional outcomes, high rates of suicide, and high financial costs. In spite of a proliferation of treatments for BD, nearly half of individuals with BD do not benefit from pharmacotherapy because of sub-optimal medication treatment adherence. Non-adherence with BD medication treatment dramatically worsens outcomes. Reasons for non-adherence among individuals with ... more",8/11/17,Case Western Reserve University,R01MH093321,Case Western Reserve University,3/19/12,2/28/18,2761046,Martha Sajatovic,189,63,126,lab,8/11/17,3/19/12,2/28/18,0.333333333,0.666666667,2012,3,19,6,15
113,80,Effectiveness and Implementation of a Mental Health Intervention for ASD,https://nda.nih.gov/edit_collection.html?id=1950,This collection includes clinical data on children ages 5 to 13 with ASD receiving community mental health services.,6/7/12,University of California San Diego,R01MH094317,"University Of California, San Diego",4/5/12,1/31/17,2127425,Lauren Brookman-Frazee,192,159,33,lab,6/7/12,4/5/12,1/31/17,0.828125,0.171875,2012,4,5,6,16
114,84,A Family-Genetic Study of Autism and Fragile X Syndrome,https://nda.nih.gov/edit_collection.html?id=1958,"Fragile X syndrome (FXS) is associated with an increased risk of autism, with prevalence rates ranging from 25-50%. This translates to an approximate relative risk of over 100, indicating that FMR1 (the gene causing FXS) confers considerable vulnerability to autism. While efforts to uncover the causal mechanisms in autism are often confounded by multiple unknown etiologies, genetically defined syndromes such as FXS provide the rare opportunity to examine gene-brain-behavior associations in an etiologically ... more",6/18/12,Northwestern University,R01MH091131,Northwestern University,5/1/12,4/30/17,2969503,Molly C. Losh,263,100,163,lab,6/18/12,5/1/12,4/30/17,0.380228137,0.619771863,2012,5,1,6,17
115,101,"1/3, 2/3, and 3/3: Sequencing Autism Spectrum Disorder Extended Pedigrees",https://nda.nih.gov/edit_collection.html?id=2004,"We have in hand a unique resource of extended autism spectrum disorder (ASD) pedigrees. We will sequence family members from the most informative pedigrees to study genetic variation contributing to ASD and related phenotypes. We will work to discover new variation, and also use the resource to characterize variants in conjunction with existing whole exome data available through our collaborations. We will test findings in up to 10 other families available from the Autism Genome Project (AGP) network ... more",10/1/12,University of Utah School of Medicine,R01MH094382,University Of Pennsylvania,6/1/12,4/30/17,793600,"Gerard Schellenberg, Hilary Coon and Ellen Wijsman",3714,2209,1505,lab,10/1/12,6/1/12,4/30/17,0.594776521,0.405223479,2012,6,1,6,18
116,94,Preschool Reading and Language Interventions for Children with Autism,https://nda.nih.gov/edit_collection.html?id=1981,"The goal of this proposed project is to determine the immediate (end of preschool) and longer term (end of kindergarten) effects of preschool interventions based on areas that have been previously shown to be important for emergent literacy and improved reading and language outcomes. To investigate these interventions, we will use three randomized control trials to test the efficacy of (a) Dialogic Reading and Phonological Awareness interventions in comparison to untutored peers and (b) compare the ... more",8/10/12,University of Washington,R01HD072143,University Of Washington,7/1/12,6/30/17,1160309,Roxanne Hudson,89,75,14,lab,8/10/12,7/1/12,6/30/17,0.842696629,0.157303371,2012,7,1,6,19
117,124,Electrophysiological Response to Executive Control Training in Autism,https://nda.nih.gov/edit_collection.html?id=2030,"Fifty to 96% of children with ASD demonstrate impaired executive control the ability to manage complex or conflicting information in the service of a goal. Development of appropriate executive control is relevant to public health because these skills are critical for success in school, the workplace, and social relationships. Executive impairments in ASD have been well documented, but have received virtually no intervention research attention. Further, development of neural systems underlying executive ... more",1/15/13,Boston Children's Hospital,K99HD071966,Boston Childrens Hospital,7/1/12,6/30/18,896997,Susan Faja,150,127,23,lab,1/15/13,7/1/12,6/30/18,0.846666667,0.153333333,2012,7,1,6,20
118,191,Longitudinal Study of Genetic Influences on Cognition (LOGIC),https://nda.nih.gov/edit_collection.html?id=2123,"This project aims to collect DNA and cognitive and psychiatric phenotypes on 3,000 clinically-referred youth enriched for neurocognitive dysfunction. Its goal is to reveal complex trajectories to adult psychiatric illness and provide an evidence base by which to improve early identification and intervention efforts in youth at risk for adult mental illness.",9/24/14,Massachusetts General Hospital,R00MH095867,Massachusetts General Hospital,7/1/12,6/30/17,932831,"Alysa E. Doyle, Ellen B. Braaten, Steven McCarroll, Michael Talkowski",32,22,10,lab,9/24/14,7/1/12,6/30/17,0.6875,0.3125,2012,7,1,6,21
119,116,The Social Brain in Schizophrenia and Autism Spectrum Disorders,https://nda.nih.gov/edit_collection.html?id=2022,"Autism measures, diagnostic measures, EEG and fMRI data",12/5/12,Hartford Hospital,R01MH095888,Hartford Hospital,7/5/12,6/30/18,2555439,Michal Assaf,160,105,55,lab,12/5/12,7/5/12,6/30/18,0.65625,0.34375,2012,7,5,7,1
120,99,Influence of Attention and Arousal on Sensory Abnormalities in ASD,https://nda.nih.gov/edit_collection.html?id=2001,"Based upon our own work and existing evidence, we suggest a model in which basic sensory function is intact in ASD and abnormalities in sensory behavior result instead from the influence of poorly modulated arousal and attention on sensory responsiveness. We propose to address this important issue using electroencephalography (EEG) and physiological measures of arousal (skin conductance and heart rate) in young adults and children with ASD. We will assess auditory and visual sensory functions including ... more",9/24/12,University of California San Diego,R21MH096582,"University Of California, San Diego",7/15/12,5/31/14,418500,Jeanne Townsend,59,46,13,lab,9/24/12,7/15/12,5/31/14,0.779661017,0.220338983,2012,7,15,7,2
121,387,The Neurobiology of Social Decision-Making,https://nda.nih.gov/edit_collection.html?id=2417,"This collection houses regularly updated human subjects data of two sorts: (1) behavioral/psychological assessment data, and (2) MRI data. The two types of data, and all sub-fields within them, are fully linked. All data comes from the Caltech Conte Center for the Neurobiology of Social Decision Making, and is collected from community-dwelling adults. The data collection focuses on decision and social neuroscience, encompassing basic background psychological assessment, personality, mood, resting-state ... more",7/25/16,California Institute of Technology,P50MH094258,California Institute Of Technology,7/26/12,2/28/22,11285395,Ralph Adolphs,67,40,27,lab,7/25/16,7/26/12,2/28/22,0.597014925,0.402985075,2012,7,26,7,3
122,96,Testing the hyperspecificity hypothesis: a neural theory of autism,https://nda.nih.gov/edit_collection.html?id=1986,"The current proposal represents the first ever neural test of the ""hyperspecificity"" hypothesis of ASD. Testing involves application of new methods that our labs developed for implementation with fMRI and ERPs. We predict that fMRI based probe will reveal sparser neural encoding in ASD, and that indices of encoding sparseness will correlate with deficits on face recognition tests. This pursuit is one of the first to link a viable network hypothesis of ASD to an experimentally testable neural instantiation. ... more",8/10/12,Children's Hospital of Philadelphia,R21MH098153,Childrens Hosp Of Philadelphia,8/1/12,5/31/15,436854,Robert Schultz,84,62,22,lab,8/10/12,8/1/12,5/31/15,0.738095238,0.261904762,2012,8,1,7,4
123,161,Early Quantitative Characterization of Reciprocal Social Behavior,https://nda.nih.gov/edit_collection.html?id=2089,"This project is focused on the development, validation, and standardization of quantitative methods to measure core components of variation in the social development of young children.This is critical for understanding autism and will inform the development and evaluation of early interventions for children with autism and related conditions. The proposed application covers the 18 to 48 month age range; i.e. the period when autism is actually first diagnosed. Currently, there exist few options for ... more",5/29/14,Saint Louis University,R01HD068479,Washington University,8/1/12,4/30/18,2727277,John Constantino,2063,1002,1061,lab,5/29/14,8/1/12,4/30/18,0.485700436,0.514299564,2012,8,1,7,5
124,102,Pivotal Response Treatment for Infants at Risk for ASD: A Pilot Intervention,https://nda.nih.gov/edit_collection.html?id=2005,"The proposed project aims to evaluate the feasibility and acceptability of a novel behavioral intervention, Infant-Toddler Years Pivotal Response Treatment (ITY-PRT), designed to enhance the frequency of communication and social engagement in infant siblings of children with Autism Spectrum Disorders (ASD; SIBSASD). In synergy with the ongoing prospective studies for infant SIBSASD at the Yale Child Study Center (PI: Katarzyna Chawarska), we will pilot ITY-PRT, a downward extension of Pivotal Response ... more",10/5/12,Yale University,R03MH092617,Yale University,8/3/12,5/31/14,162900,Katarzyna Chawarska,10,5,5,lab,10/5/12,8/3/12,5/31/14,0.5,0.5,2012,8,3,7,6
125,83,Characterizing mechanistic heterogeneity across ADHD and Autism,https://nda.nih.gov/edit_collection.html?id=1955,"Progress in establishing the etiology of psychiatric illness is limited by the absence of objective biological measures able to detect and discriminate between disorders. This problem is particularly important in developmental disorders, where early identification could eventually assist in prevention of life long impairments. The two earliest onset, most common, and costly developmental disorders in child psychiatry are attention deficit hyperactivity disorder (ADHD) and Autism spectrum disorders ... more",6/18/12,University of Minnesota,R01MH096773,Oregon Health & Science University,8/6/12,11/30/18,1870295,Damien Fair,348,249,99,lab,6/18/12,8/6/12,11/30/18,0.715517241,0.284482759,2012,8,6,7,7
126,95,Evaluating the Time-Dependent Unfolding of Social Interactions in Children with Autism,https://nda.nih.gov/edit_collection.html?id=1985,"Given the importance of social competence in ASD, the proposed research will evaluate whether social motor coordination can be a marker for social competence in autism across the spectrum of deficits and explore the relationship between motorically-based and cognitively-based conceptions of social competence. Given that social interactions are inherently complex and unfold over time, we propose to evaluate not only traditional cognitive measures of social competence but also the dynamical structure ... more",8/10/12,University of Cincinnati,R21MH094659,University Of Cincinnati,8/6/12,5/31/14,449609,Michael Richardson,105,85,20,lab,8/10/12,8/6/12,5/31/14,0.80952381,0.19047619,2012,8,6,7,8
127,103,Impairments of Theory of Mind disrupt patterns of brain activity,https://nda.nih.gov/edit_collection.html?id=2006,"Humans think constantly about one another's thoughts, for example, in order to communicate, to teach, to learn from, to cooperate with, to compete with, and to deceive one another. This ability to fluently infer what others are thinking is impaired in individuals with Autism Spectrum Disorders (ASD), but the neural basis of this impairment is poorly understood. In particular, brain regions involved in thinking about other peoples thoughts are not reliably smaller or less active in individuals with ... more",10/16/12,Massachusetts Institute of Technology,R01MH096914,Massachusetts Institute Of Technology,8/10/12,4/30/18,1590879,Rebecca Saxe,135,88,47,lab,10/16/12,8/10/12,4/30/18,0.651851852,0.348148148,2012,8,10,7,9
128,109,Magnetoencephalographic studies of lexical processing and abstraction in autism,https://nda.nih.gov/edit_collection.html?id=2013,Language impairment and communication difficulties are a hallmark of autism spectrum disorders. The central hypothesis underlying this proposal is that children on the autism spectrum manifest difficulties forming and accessing abstract representations and categorizing acoustic distinct but linguistically similar stimulus tokens into unitary objects. This difficulty has deep implications for their systems of word (lexical) processing and representation: attention to (irrelevant) acoustic detail ... more,11/2/12,University of Pennsylvania,R01HD073258,University Of Pennsylvania,8/13/12,5/31/18,1536649,David Embick,101,82,19,lab,11/2/12,8/13/12,5/31/18,0.811881188,0.188118812,2012,8,13,7,10
766,3,Epigenetics Marks as Peripheral Biomarkers of Autism,https://nda.nih.gov/study.html?id=287,"We are studying a potential epigenetic component to the autism spectrum disorders (ASD) by interrogating DNA methylation (DNAm) using an established high-throughput assay that interrogates DNA methylation (DNAm) at 27578 highly informative CpG dinucleotides. To date, we have determined the DNA methylation (DNAm) profiles from whole blood-extracted DNA of over four hundred male sib-pairs discordant for ASD. A close statistical examination may ultimately identify ASD peripheral biomarkers and further ... more",8/14/12,Burkhart Center for Autism Education and Research,,,8/14/12,,,"Richman DM; Barnard-Brak L, Bosch A, Thompson S, Grubb L, Abby L",463,463,0,paper,8/14/12,8/14/12,,1,0,2012,8,14,7,11
767,4,Autism Genome Project,https://nda.nih.gov/study.html?id=288,"The Autism Genome Project (AGP) Consortium represents more than 50 centers in North America and Europe. In an ongoing effort, the international AGP Consortium is collecting ASD families for ongoing genetic studies. The first phase of this initiative involved examining genetic linkage and chromosomal rearrangements in 1,168 families having at least two ASD individuals (PMID: 17322880). In this second phase of the project, we collected more families and genotyped them to examine for Copy Number Variation ... more",8/14/12,Burkhart Center for Autism Education and Research,,,8/14/12,,,"Richman DM; Barnard-Brak L, Bosch A, Thompson S, Grubb L, Abby L",3974,2442,1532,paper,8/14/12,8/14/12,,0.614494212,0.385505788,2012,8,14,7,12
129,100,Autism: Social and Communication Predictors in Siblings (Landa) AND Effects of Active Motor and Social Training on Developmental Trajectories in Infants at High-risk for Autism Spectrum Disorders (Libertus),https://nda.nih.gov/edit_collection.html?id=2003,"The purpose of the proposed study is to identify very early indicators of ASD, beginning in infancy. Specific aims are to: (1) define markers of disrupted neurobehavioral development that appear between 6 and 14 months of age, before clinical signs of ASD; (2) translate ASD clinical indicators identified in the second year of life into early ASD diagnostic criteria applicable to 1- and 2-year olds; and (3) define protective factors associated with outcomes in sibs-A to inform treatment approaches. ... more",9/28/12,Kennedy Krieger Institute,R01MH059630,Hugo W. Moser Res Inst Kennedy Krieger,9/1/12,3/31/18,3487870,"Rebecca Landa, Klaus Libertus",357,199,158,lab,9/28/12,9/1/12,3/31/18,0.557422969,0.442577031,2012,9,1,7,13
130,105,Early Biomarkers of Autism Spectrum Disorders in infants with Tuberous Sclerosis,https://nda.nih.gov/edit_collection.html?id=2008,"Autism Spectrum Disorders (ASD) has complex and varying etiologies. A lack of understanding regarding the underlying molecular and cellular mechanisms is a key barrier in finding effective treatments. Single-gene disorders that have a high prevalence of ASD provide unique opportunities to investigate the underlying biology and test treatments for autism. Tuberous Sclerosis Complex (TSC) is a genetic disorder in which approximately 50% of individuals are also affected with ASD. Importantly, TSC can ... more",10/22/12,Boston Children's Hospital,U01NS082320,Boston Childrens Hospital,9/1/12,8/31/19,13349935,Mustafa Sahin,179,93,86,lab,10/22/12,9/1/12,8/31/19,0.519553073,0.480446927,2012,9,1,7,14
131,108,Optimization of Fidelity Procedures for Pivotal Response Training in Autism,https://nda.nih.gov/edit_collection.html?id=2012,"To improve the overall quality and effectiveness of mental health intervention, it is essential to identify empirically supported behavioral treatments (ESBTs) and assure the accessibility and usability of these treatments for providers in community settings. Fidelity of implementation (FI), or the degree to which an intervention is implemented as was intended, provides necessary information for training and maintaining providers effectiveness. However, the tools and procedures used to measure ... more",10/31/12,Rady Childrens Hospital - San Diego,R21MH097033,"University Of California, San Diego",9/1/12,8/31/18,1299308,Aubyn Stahmer,20,16,4,lab,10/31/12,9/1/12,8/31/18,0.8,0.2,2012,9,1,7,15
132,113,The Role of Germline Mutation and Parental Age in Autism Spectrum Disorders,https://nda.nih.gov/edit_collection.html?id=2019,"In the new phase of our project, we will apply a whole genome sequencing-based approach to determine the role of ROHs in ASD. We will investigate the nature intrinsic hypermutability and the extrinsic forces, such as paternal age, that influence rates of germline mutation. We will accomplish these goals through the following specific aims: Specific Aim 1 will characterize germline de novo mutations (DNMs) by whole genome sequencing in families. These studies will identify and validate ~8,000 de ... more",11/20/12,University of California San Diego,R01MH076431,"University Of California, San Diego",9/1/12,8/31/17,3685804,Jonathan Sebat,1140,678,462,lab,11/20/12,9/1/12,8/31/17,0.594736842,0.405263158,2012,9,1,7,16
133,118,Divergent biases for conspecifics as early markers for Autism Spectum Disorders,https://nda.nih.gov/edit_collection.html?id=2024,"Typically developing infants have fundamental perceptual biases that direct their attention to socially relevant stimuli such as voices and faces Children diagnosed with Autism Spectrum Disorder (ASD) show apparent deficits in auditory and visual processing of the voices and faces of their own species (conspecifics). We propose a prospective, experimental, longitudinal approach examining whether infants who lack foundational perceptual biases to attend to auditory and visual characteristics of conspecifics ... more",1/2/13,New York University,R01HD072018,New York University,9/1/12,5/31/18,1245582,Athena Vouloumanos,146,79,67,lab,1/2/13,9/1/12,5/31/18,0.54109589,0.45890411,2012,9,1,7,17
134,198,A Twin Study of Negative Valence Emotional Constructs,https://nda.nih.gov/edit_collection.html?id=2131,"Internalizing disorders, consisting of syndromes of anxiety and depression, represent common, debilitating conditions, the etiology of which is not well understood. Neuroscientists have developed dimensional assessment instruments and psychological tasks that probe negative valence systems as alternative phenotypes to clinical symptoms. Such alternative phenotypes are under consideration for use in the NIMH Research Domain Criteria (RDoC) project. However, little is currently known regarding their ... more",2/27/15,Texas A&M University - Health Science Center,R01MH098055,Virginia Commonwealth University,9/1/12,6/30/16,1559449,John Hettema,421,208,213,lab,2/27/15,9/1/12,6/30/16,0.494061758,0.505938242,2012,9,1,7,18
135,419,The Neuroimmunology of Anhedonia,https://nda.nih.gov/edit_collection.html?id=2453,"Adolescent major depressive disorder MDD is a major public health concern associated with significant morbidity and mortality. The identification of neurobiological correlates of adolescent MDD has been hampered by the disorders heterogeneity. To address this challenge, the proposed project adapts a dimensional investigative approach focusing on anhedonia - the loss of pleasure - a core symptom of MDD. Anhedonia can be easily quantified and is tied to specific neural reward circuitry. Among adolescents ... more",8/5/16,Albert Einstein College of Medicine,R01MH095807,Icahn School Of Medicine At Mount Sinai,9/1/12,6/30/17,2380481,Vilma Gabbay,30,8,22,lab,8/5/16,9/1/12,6/30/17,0.266666667,0.733333333,2012,9,1,7,19
136,106,Study of Oxytocin in Autism to Improve Reciprocal Social Behaviors (SOARS-B),https://nda.nih.gov/edit_collection.html?id=2009,"This application proposes creation of the ACE SOARS Network and a pivotal clinical trial of sustained oxytocin treatment in children with ASD known as SOARS-B (Study of Oxytocin in ASD to improve Reciprocal Social Behaviors). The ACE SOARS Network consists of five Treatment Sites across the country headed by Chris McDougle (MA), Alex Kolevzon (NY), Bryan King (WA), Lin Sikich (NC) and Jeremy Veenstra-Vander Weele (TN), a Genetic Center run by Simon Gregory (Duke); a Data Center directed by Robert ... more",10/23/12,University of North Carolina at Chapel Hill,U01HD073984,Duke University,9/4/12,5/31/18,11764242,Linmarie Sikich,15,13,2,lab,10/23/12,9/4/12,5/31/18,0.866666667,0.133333333,2012,9,4,7,20
137,114,Adaptive Interventions for Minimally Verbal Children with ASD in the Community,https://nda.nih.gov/edit_collection.html?id=2020,"An estimated 30-40% of school-aged children with an autism spectrum disorder (ASD) remain minimally verbal even after receiving years of interventions. These children require an intervention approach that simultaneously (a) consolidates early success in treatment and (b) intensifies treatment given signs of early non-response in order to place all children on a positive, long-term course. The overarching aim of this Network study is to construct an adaptive intervention that utilizes two efficacious ... more",11/23/12,"University of California, Los Angeles",R01HD073975,University Of California Los Angeles,9/4/12,5/31/19,12950672,Connie Kasari,164,133,31,lab,11/23/12,9/4/12,5/31/19,0.81097561,0.18902439,2012,9,4,7,21
138,115,Multimodal Developmental Neurogenetics of Females with ASD,https://nda.nih.gov/edit_collection.html?id=2021,"The term autism-spectrum disorders (ASD) exemplifies the tremendous heterogeneity in this developmental disorder at both the phenotypic and underlying genetic levels. It has repeatedly been observed that ASD disproportionately affects males relative to females. Although many hypotheses attempt to explain this bias, no clear answers have emerged because of inconsistent and incomplete phenotyping and small sample sizes. We propose to leverage the interdisciplinary strengths and recruiting power of ... more",11/23/12,Yale Child Study Center,R01MH100028,George Washington University,9/4/12,7/31/22,16203823,Kevin Pelphrey,1119,518,601,lab,11/23/12,9/4/12,7/31/22,0.462913315,0.537086685,2012,9,4,8,1
139,119,Minimally Verbal ASD: From Basic Mechanisms to Innovative Interventions,https://nda.nih.gov/edit_collection.html?id=2025,"Our ACE, located at Boston University, brings together researchers from across the university and collaborators from Harvard Medical School, Northeastern University and Albert Einstein College of Medicine. The interconnected projects in the ACE include: a novel intervention to promote spoken language in school-aged children with ASD (Project I); investigation of biological markers of treatment response and outcome (Projects I, II, and III); investigation of mechanisms that might underlie the failure ... more",1/2/13,Boston University,P50DC013027,Boston University (Charles River Campus),9/4/12,8/31/19,9415528,Helen Tager-Flusberg,183,134,49,lab,1/2/13,9/4/12,8/31/19,0.732240437,0.267759563,2012,9,4,8,2
140,120,Biomarkers of Developmental Trajectories and Treatment in ASD,https://nda.nih.gov/edit_collection.html?id=2026,"This is a renewal for the UCLA Autism Center of Excellence. The primary focus of the UCLA ACE renewal is to understand the relationship between aberrant brain development and core deficits in autism by identifying mechanisms relating genes to brain structure/function and brain to behavior, and to develop effective interventions based on basic experimental and clinical research findings that will change outcomes in autism. In five interdependent projects and cores, our center builds on our expertise ... more",1/2/13,"University of California, Los Angeles",P50HD055784,University Of California Los Angeles,9/4/12,7/31/22,12075743,Susan Bookheimer,637,401,236,lab,1/2/13,9/4/12,7/31/22,0.629513344,0.370486656,2012,9,4,8,3
141,121,A Longitudinal MRI Study of Infants at Risk for Autism (ACE 2),https://nda.nih.gov/edit_collection.html?id=2027,"This application is a competing continuation of an Autism Center of Excellence (ACE) Network grant. The initial grant supported a prospective, longitudinal examination of brain and behavior at 6, 12 and 24 months in infants at high familial risk (HR) for autism. By the completion of this initial study 400 HR and 150 low risk infants will have entered this study. Results reveal that HR infants who go on to have autism at 24 months have impairments in visual orienting and motor behavior at 6 months ... more",1/2/13,University of North Carolina at Chapel Hill,R01HD055741,Univ Of North Carolina Chapel Hill,9/4/12,5/31/17,3184705,Joseph Piven,1037,728,309,lab,1/2/13,9/4/12,5/31/17,0.702025072,0.297974928,2012,9,4,8,4
142,122,"Mechanisms of Risk and Resilience in ASD: Ontogeny, Phylogeny and Gene Disruption",https://nda.nih.gov/edit_collection.html?id=2028,"The Emory ACE joins 8 laboratories in 3 institutions, creating a center for clinical and translational science built-from its outset--on the expectation of transformative impact on the community. Laboratories from the Marcus Autism Center, Emory University School of Medicine, and Yerkes National Primate Research Center combine methodological and conceptual expertise in child development, behavioral neuroscience, speech science, molecular genetics, and treatment research; all against the backdrop ... more",1/4/13,Emory University,P50MH100029,Emory University,9/4/12,5/31/17,8941187,Ami Klin,266,167,99,lab,1/4/13,9/4/12,5/31/17,0.627819549,0.372180451,2012,9,4,8,5
682,97,NIMH Genetics,https://nda.nih.gov/edit_collection.html?id=1999,NIMH Genetics Summary Information,9/11/12,,,,9/11/12,,,NIMH Genetics,13876,8363,5513,lab,9/11/12,9/11/12,,0.602695301,0.397304699,2012,9,11,8,6
143,325,Risk and Resilience in Maltreated Children,https://nda.nih.gov/edit_collection.html?id=2345,"Over the past decade there has been growing appreciation of mental disorders as brain circuit disorders that are influenced by genetic and environmental factors. This application is being submitted in response to RFAMH-12-100, which stems from the NIMH Research Domain Criteria (RDoC) project that aims to further the long-range goal of developing a diagnostic system for mental disorders informed by genetics, neuroscience, and psychology. This application focuses on the RDoC domain Negative Valence ... more",1/27/16,University of Vermont College of Medicine,R01MH098073,Hugo W. Moser Res Inst Kennedy Krieger,9/11/12,8/31/17,3005856,Joan Kaufman and James Hudziak,126,61,65,lab,1/27/16,9/11/12,8/31/17,0.484126984,0.515873016,2012,9,11,8,7
144,170,"RDoC Constructs: Neural Substrates, Heritability, and Relation to Psychopathology",https://nda.nih.gov/edit_collection.html?id=2099,"The central hypothesis of the Research Domain Criteria (RDoC) project is that categorical mental disorders do not line up one-to-one with variations in the functioning of neural circuits. Rather, neural circuits align with narrower neurobehavioral constructs that are themselves related to psychopathology in cross-cutting fashion:Dysfunction in each construct is related to multiple forms of psychopathology and most forms of psychopathology are related to dysfunction in more than one construct. Failure ... more",7/29/14,Rutgers University,R01MH098098,Vanderbilt University,9/12/12,11/30/17,4433288,David Zald,487,229,258,lab,7/29/14,9/12/12,11/30/17,0.470225873,0.529774127,2012,9,12,8,8
768,5,Somatic copy-number mosaicism in human skin revealed by induced pluripotent stem cell,https://nda.nih.gov/study.html?id=289,"Reprogramming human somatic cells into induced pluripotent stem cells (iPSC) has been suspected of causing de novo copy number variations (CNVs). To explore this issue, we performed a whole-genome and transcriptome analysis of 20 human iPSC lines derived from primary skin fibroblasts of 7 individuals using next-generation sequencing. We find that, on average, an iPSC line manifests two CNVs not apparent in the fibroblasts from which the iPSC was derived. Using qPCR, PCR, and digital droplet PCR (ddPCR) ... more",9/13/12,Burkhart Center for Autism Education and Research,,,9/13/12,,,"Richman DM; Barnard-Brak L, Bosch A, Thompson S, Grubb L, Abby L",9,7,2,paper,9/13/12,9/13/12,,0.777777778,0.222222222,2012,9,13,8,9
145,199,Family Study of Reward and Threat Sensitivity in Internalizing Psychopathology,https://nda.nih.gov/edit_collection.html?id=2132,"The purpose of this study is to examine whether two transdiagnostic dimensions - reduced reward anticipation (RRA) and heightened sensitivity to potential threat (SPT) - represent risk factors for internalizing (i.e., depression and anxiety) psychopathology. The proposed project is significant because internalizing psychopathologies are very heterogeneous, raising questions as to the validity of the categorical diagnostic nomenclature (e.g., DSM-IV). This study therefore takes the Research Domain ... more",2/27/15,Northwestern University,R01MH098093,University Of Illinois At Chicago,9/14/12,12/31/17,2681596,Stewart Shankman,547,206,341,lab,2/27/15,9/14/12,12/31/17,0.376599634,0.623400366,2012,9,14,8,10
146,107,Toward Outcome Measurement of Anxiety in Youth with Autism Spectrum Disorders,https://nda.nih.gov/edit_collection.html?id=2011,"This four-year multisite project will advance outcome measurement of anxiety in future clinical trials in youth with autism spectrum disorders (ASDs). Program announcement (PAR-11-045) declares that the dearth of outcome measures in developmentally disabled populations is a major impediment for drug research in developmentally disabled populations. Impairing anxiety is common in youth with ASDs and a plausible treatment target, but poorly studied (White et al., 2009; van Steensel et al., 2011; King ... more",10/31/12,Emory University,R01MH099021,Emory University,9/15/12,5/31/18,2652375,Lawrence D. Scahill,144,112,32,lab,10/31/12,9/15/12,5/31/18,0.777777778,0.222222222,2012,9,15,8,11
147,110,The Neural Substrates of Higher-Level Learning in Autism,https://nda.nih.gov/edit_collection.html?id=2014,"Individuals with ASD display a unique pattern of abilities and disabilities in learning and memory. They exhibit intact lower-level learning of items, facts, details, and routines. However, they manifest impairments in higher level learning involving abstraction, problem solving, using information that must be organized with self generated conceptual schemas, and generalizing learning. This uneven and situation-focused learning profile has a profound impact on the academic, social, and adaptive ... more",11/2/12,MIND Institute,R21MH099250,University Of California At Davis,9/15/12,5/31/15,414260,Marjorie Solomon,1,1,0,lab,11/2/12,9/15/12,5/31/15,1,0,2012,9,15,8,12
148,195,Childrens Attentional Biases: A Key Component of Negative Valence Systems,https://nda.nih.gov/edit_collection.html?id=2128,"To achieve the RDoC goal of developing ""new ways of classifying disorders based on dimensions of observable behaviors and brain functions"", we need a more detailed understanding of which specific components of attention are disrupted in response to sustained threat and loss. This study will include 1,000 children aged 7-11 years and their mothers. Primary Aim 1 is to conduct a fine-grained examination of children's attentional biases using both behavioral (eyetracking) and physiological (event-related ... more",10/24/14,No Affiliation Provided,R01MH098060,"State University Of Ny,Binghamton",9/18/12,6/30/17,3113124,Brandon Gibb,1226,396,830,lab,10/24/14,9/18/12,6/30/17,0.323001631,0.676998369,2012,9,18,8,13
149,111,Wireless EEG System for Training Attention and Eye Movement in ASD,https://nda.nih.gov/edit_collection.html?id=2017,"Autism Spectrum Disorder (ASD) is a lifelong disorder that severely affects the ability to learn and function in a social environment. In typical function, higher level social, language and communication skills develop over the first few years of life and depend upon the critical building blocks of sensory-motor and attention abilities. Similarly in autism, higher level problems with social communication develop over the first two postnatal years and are preceded by subtle but abnormal visual attention ... more",11/5/12,University of California San Diego,R21MH096967,"University Of California, San Diego",9/21/12,8/31/18,1290756,Jeanne Townsend,40,30,10,lab,11/5/12,9/21/12,8/31/18,0.75,0.25,2012,9,21,8,14
769,6,Whole-Exome Sequencing and Homozygosity Analysis Implicate Depolarization-Regulated Neuronal Genes in Autism,https://nda.nih.gov/study.html?id=293,"Although autism has a clear genetic component, the high genetic heterogeneity of the disorder has been a challenge for the identification of causative genes. We used homozygosity analysis to identify probands from nonconsanguineous families that showed evidence of distant shared ancestry, suggesting potentially recessive mutations. Whole-exome sequencing of 16 probands revealed validated homozygous, potentially pathogenic recessive mutations that segregated perfectly with disease in 4/16 families. ... more",2/1/13,Burkhart Center for Autism Education and Research,,,2/1/13,,,"Richman DM; Barnard-Brak L, Bosch A, Thompson S, Grubb L, Abby L",18,15,3,paper,2/1/13,2/1/13,,0.833333333,0.166666667,2013,2,1,8,15
150,127,"Autism Genetics, Phase II: Increasing Representation of Human Diversity",https://nda.nih.gov/edit_collection.html?id=2035,"Autism Spectrum Disorder (ASD) is a common, often devastating neuropsychiatric condition with largely unknown pathophysiology. Although ASD has a multifactorial etiology, it encompasses a large genetic component. The investigators in this proposal aim to continue and enhance our collaborative effort that has produced significant advances in our understanding of ASD over the last four years and generated highly successful, open data and biomaterials resources for the research community, the NIMH Genetics ... more",5/31/13,"University of California, Los Angeles",R01MH100027,University Of California Los Angeles,3/25/13,2/28/18,3168451,Daniel Geschwind,5124,3043,2081,lab,5/31/13,3/25/13,2/28/18,0.593871975,0.406128025,2013,3,25,8,16
151,128,Intervention effects of intensity and delivery style for toddlers with ASD,https://nda.nih.gov/edit_collection.html?id=2036,"High quality, intensive early intervention is a powerful treatment for ASD, improving IQ and language markedly in randomized controlled clinical trials (RCTs), though little long term follow-up data exists. Few core characteristics that affect child change have been tested. Two potential core characteristics that invoke considerable debate among parents, professionals, and administrators are the delivery style of intervention: play-based versus discrete trial teaching, and the intensity (dosage) ... more",5/31/13,UC Davis MIND Institute,R01MH100030,University Of California At Davis,3/25/13,8/31/19,13411464,Sally Rogers,178,128,50,lab,5/31/13,3/25/13,8/31/19,0.719101124,0.280898876,2013,3,25,8,17
683,126,Genotyping and RNA-Seq in post-mortem brains from autism-affected cases and controls,https://nda.nih.gov/edit_collection.html?id=2034,"Despite significant heritability of autism spectrum disorders (ASDs), the genetic basis of autism remains elusive. We have genotyped 64 autism-affected cases and controls and carried out RNA-Sequencing (RNA-Seq) on post-mortem cortical brain samples (BA19 ) from these same individuals with our goal being to utilize these genetic data to better understand autism at the level of the transcriptome.",4/24/13,Johns Hopkins University,,,4/24/13,,,Dan E. Arking,73,55,18,lab,4/24/13,4/24/13,,0.753424658,0.246575342,2013,4,24,8,18
770,7,"Study of potential epigenetic component to the autism spectrum disorders (ASD) by interrogating DNA methylation (DNAm) using an established high-throughput assay that interrogates DNA methylation (DNAm) at over 450,000 CpG dinucleotid",https://nda.nih.gov/study.html?id=300,"We are studying a potential epigenetic component to the autism spectrum disorders (ASD) by interrogating DNA methylation (DNAm) using an established high-throughput assay that interrogates DNA methylation (DNAm) at over 450,000 highly informative CpG dinucleotides. To date, we have determined the DNA methylation (DNAm) profiles from whole blood-extracted DNA of over four hundred male sib-pairs discordant for ASD. A close statistical examination may ultimately identify ASD peripheral biomarkers and ... more",5/7/13,Burkhart Center for Autism Education and Research,,,5/7/13,,,"Richman DM; Barnard-Brak L, Bosch A, Thompson S, Grubb L, Abby L",587,581,6,paper,5/7/13,5/7/13,,0.989778535,0.010221465,2013,5,7,8,19
152,139,Family Outcomes in Autism Spectrum Disorders,https://nda.nih.gov/edit_collection.html?id=2059,It is now estimated that 1 in 88 children in the U.S. are diagnosed with an autism spectrum disorder (ASD).Few disabilities are more stressful on parents than ASD. There is theoretical and empirical evidence to suggest that chronic parenting stress affects marital adjustment. The overarching goal of this project is to examine the within-family associations between the autism symptoms and behavior problems of children with ASDs and marital adjustment as these processes unfold in naturalistic contexts ... more,10/3/13,University of Wisconsin-Madison,R01MH099190,University Of Wisconsin-Madison,6/1/13,2/29/20,2124433,Sigan L. Hartley,1061,647,414,lab,10/3/13,6/1/13,2/29/20,0.609802074,0.390197926,2013,6,1,8,20
771,8,Refinement and discovery of new hotspots of copy-number variation associated with autism spectrum disorder.,https://nda.nih.gov/study.html?id=301,"Rare copy-number variants (CNVs) have been implicated in autism and intellectual disability. These variants are large and affect many genes but lack clear specificity toward autism as opposed to developmental-delay phenotypes. We exploited the repeat architecture of the genome to target segmental duplication-mediated rearrangement hotspots (n = 120, median size 1.78 Mbp, range 240 kbp to 13 Mbp) and smaller hotspots flanked by repetitive sequence (n = 1,247, median size 79 kbp, range 3-96 kbp) in ... more",6/14/13,Burkhart Center for Autism Education and Research,,,6/14/13,,,"Richman DM; Barnard-Brak L, Bosch A, Thompson S, Grubb L, Abby L",3285,2511,774,paper,6/14/13,6/14/13,,0.764383562,0.235616438,2013,6,14,8,21
153,135,"Peers, Play and Performance to Improve Social Interaction in Autism",https://nda.nih.gov/edit_collection.html?id=2052,"Current psychosocial interventions in autism generally target only specific aspects of social knowledge or functioning. Moreover, promising initial gains often fail to maintain or generalize. Our goal is to address the need for the development of interventions for older children and adolescents with autism spectrum disorders (ASD) in an innovative community-service model. Our treatment combines several well-documented behavioral strategies grouped into three categories (peers, play and performance) ... more",9/27/13,Vanderbilt University Medical Center,R34MH097793,Vanderbilt University,7/1/13,4/30/17,706139,Blythe Corbett,84,64,20,lab,9/27/13,7/1/13,4/30/17,0.761904762,0.238095238,2013,7,1,9,1
154,137,Silvio O. Conte Center for Oxytocin and Social Cognition,https://nda.nih.gov/edit_collection.html?id=2055,"The oxytocin (OT) system is arguably the most viable target for pharmacologically enhancing social cognition in psychiatric disorders with compromised social cognition, including autism spectrum disorder (ASD). Central OT enhances key aspects of social behavior in animals, and intranasal (IN) OT modulates social cognition in humans. The mechanisms by which OT affects social cognition are not understood. We will launch a coordinated, interdisciplinary research program involving an outstanding team ... more",10/3/13,Emory University,P50MH100023,Emory University,7/1/13,6/30/18,5908165,Larry Young,38,38,0,lab,10/3/13,7/1/13,6/30/18,1,0,2013,7,1,9,2
155,140,Dysfunction of Sensory Inhibition in Autism,https://nda.nih.gov/edit_collection.html?id=2060,"Autism Spectrum Disorder (ASD) is a group of developmental disorders which affects approximately 1% of children, a prevalence rate that is increasing annually. The molecular basis of ASD is likely to be complex and heterogeneous, but given the central role of the inhibitory neurotransmitter GABA incognitive control, development and plasticity and a growing body of evidence linking GABAergicdys function to autism and autistic phenotypes, GABA system is a strong potential area for ASD research.Recently, ... more",10/3/13,Johns Hopkins University,R21MH098228,Johns Hopkins University,7/1/13,3/31/16,460279,Richard Edden,45,33,12,lab,10/3/13,7/1/13,3/31/16,0.733333333,0.266666667,2013,7,1,9,3
772,9,Convergent and Discriminant Validity and Reliability of the Pediatric Anxiety Rating Scale in Youth with Autism Spectrum Disorders,https://nda.nih.gov/study.html?id=304,"The psychometric properties of the Pediatric Anxiety Rating Scale (PARS), a clinician-administered measure for assessing severity of anxiety symptoms, were examined in 72 children and adolescents diagnosed with an autism spectrum disorder (ASD). The internal consistency of the PARS was 0.59, suggesting that the items were related but not repetitive.The PARS was strongly correlated with clinician-ratings of overall anxiety severity and parent- report anxiety measures, supporting convergent validity. ... more",7/3/13,Burkhart Center for Autism Education and Research,,,7/3/13,,,"Richman DM; Barnard-Brak L, Bosch A, Thompson S, Grubb L, Abby L",50,38,12,paper,7/3/13,7/3/13,,0.76,0.24,2013,7,3,9,4
156,143,The CCS: A Treatment Outcome Measure for Individuals with Severe ID,https://nda.nih.gov/edit_collection.html?id=2064,"This application is in response to FOA PAR-11-045, Outcome Measures for Use in Treatment trials for Individuals with Intellectual and Developmental Disabilities. We propose to further develop and validate an endpoint measure of communication for use in clinical trials research. We created a scale that reflects the developmental hierarchy of early communication, referred to as the Communication Complexity Scale (CCS).The CCS can be used with children and adults with severe disabilities including individuals ... more",10/30/13,University of Kansas,R01HD076903,University Of Kansas Lawrence,7/5/13,4/30/19,1689794,Nancy Brady,298,184,114,lab,10/30/13,7/5/13,4/30/19,0.617449664,0.382550336,2013,7,5,9,5
684,129,Gender and Cognitive Profile as Predictors of Functional Outcomes in School-Aged Children,https://nda.nih.gov/edit_collection.html?id=2038,"The vast variability of symptoms and symptom severity in autism spectrum disorders (ASD) has been one of the greatest obstacles for research on its causes and treatment. This project aims to enhance understanding of the phenotypic heterogeneity in the disorder by identifying social learning styles that predict positive outcome within more homogeneous subgroups of children with ASD. A large, heterogeneous sample of school-age children with ASD, developmentally-delayed peers, and typically-developing ... more",7/16/13,Emory University,,,7/16/13,,,Jennifer Moriuchi,29,8,21,lab,7/16/13,7/16/13,,0.275862069,0.724137931,2013,7,16,9,6
157,239,Piloting Treatment with Insulin-Like Growth Factor-1 in Phelan-McDermid Syndrome,https://nda.nih.gov/edit_collection.html?id=2192,"Autism spectrum disorders (ASD) can now be conceived of as having multiple distinct genetic risk genes and one example is SHANK3 deficiency, characterized by global developmental delay, motor skills deficits, delayed or absent speech, and ASD. According to the Interagency Autism Coordinating Committee 2011 Strategic Plan, there is a need for translational research that takes advantage of genetic findings in order to develop animal models to understand the effects on brain function and discover specific ... more",4/30/15,Icahn School of Medicine at Mount Sinai,R34MH100276,Icahn School Of Medicine At Mount Sinai,7/19/13,4/30/16,740399,Alexander Kolevzon,13,6,7,lab,4/30/15,7/19/13,4/30/16,0.461538462,0.538461538,2013,7,19,9,7
773,11,Elucidating the Genetic Architecture of Autism by Deep Genomic Sequencing,https://nda.nih.gov/study.html?id=307,"ARRA Autism Sequencing Collaboration The VCF files provided as Study Results for this study are what was provided at the time the study was created and consist of the Autism Only consent group. There is an additional General Research Use cohort, but those data are not provided here in this study. To obtain data from the General Research Use cohort please visit the dbGaP Study phs000298. It should be noted that the dbGaP study has been updated since the time this study was created, and the update ... more",7/23/13,Burkhart Center for Autism Education and Research,,,7/23/13,,,"Richman DM; Barnard-Brak L, Bosch A, Thompson S, Grubb L, Abby L",2035,1347,688,paper,7/23/13,7/23/13,,0.661916462,0.338083538,2013,7,23,9,8
158,141,Verbal/non-verbal asynchrony in adolescents with high-functioning Autism,https://nda.nih.gov/edit_collection.html?id=2062,"Adolescents with high-functioning autism (HFA) have significant deficits in non-verbal social communication, which often lead to depression and social withdrawal. These deficits are particularly apparent in their ability to process and produce qualitatively appropriate facial expressions. It has been suggested that a lack of synchrony between verbal and non-verbal speech acts may significantly contribute to this social awkwardness. And yet, very little attention has been paid to the interaction between ... more",10/28/13,Emerson College,R01DC012774,Emerson College,8/1/13,7/31/18,1540526,Ruth B. Grossman,71,49,22,lab,10/28/13,8/1/13,7/31/18,0.690140845,0.309859155,2013,8,1,9,9
159,164,Sporadic Mutations and Autism Spectrum Disorders,https://nda.nih.gov/edit_collection.html?id=2093,Sporadic Mutations and Autism Spectrum Disorders,6/29/14,University of Washington,R01MH101221,University Of Washington,8/1/13,12/31/20,3357802,Evan E Eichler,11247,8376,2871,lab,6/29/14,8/1/13,12/31/20,0.744731929,0.255268071,2013,8,1,9,10
160,171,Neural Dimensions of Threat Reactivity and Regulation for Understanding Anxiety,https://nda.nih.gov/edit_collection.html?id=2100,"The immediate goal of this project is to use functional imaging to define dimensional constructs for reactivity and regulation of potential threat, within the Negative Valence system of the Research Domain Criteria (RDoC). By using these constructs we ground the understanding of anxiety in neural mechanisms, rather than using pre-set diagnostic boundaries, which have inherent assumptions about the structure of anxiety symptoms. In our community, the experience of anxiety is prevalent, and costs 47 ... more",7/29/14,Stanford University,R01MH101496,Palo Alto Veterans Instit For Research,8/1/13,7/31/17,1133862,Leanne Williams,197,90,107,lab,7/29/14,8/1/13,7/31/17,0.456852792,0.543147208,2013,8,1,9,11
161,194,Psychosis and Affective Research Domains and Intermediate Phenotypes (PARDIP),https://nda.nih.gov/edit_collection.html?id=2126,"Psychotic symptoms are present in a significant subset of individuals with Bipolar Disorder (BD) and carry devastating personal and clinical implications. Most biomedical research on BD has ignored the variable presentation of psychosis possibly overlooking biologically significant heterogeneity in BD; such heterogeneity may cause inconsistencies in the literature by treating BD as a homogenous category 7,18. The expression of psychosis in some BD patients (BD-P) and absence in others (BD-NP) may ... more",10/24/14,UT Southwestern Medical School,R01MH096900,University Of Georgia,8/1/13,6/30/16,222750,Carol Tamminga,311,135,176,lab,10/24/14,8/1/13,6/30/16,0.434083601,0.565916399,2013,8,1,9,12
164,241,The role of vasopressin in the social deficits of autism,https://nda.nih.gov/edit_collection.html?id=2197,"Autism is characterized by core social impairments which limit patients ability to form and maintain meaningful social relationships. At present, antipsychotic medications are the only pharmacotherapeutic option approved to treat autism. However, these agents mainly target associated symptoms (e.g., irritability), have unfavorable side-effects (e.g., lethargy, weight gain), and remain ineffective intreating the social features of this disorder. Developing new medications that specifically target ... more",4/30/15,Stanford University,R21MH100387,Stanford University,8/1/13,7/31/16,431750,Karen J. Parker and Antonio Hardan,39,33,6,lab,4/30/15,8/1/13,7/31/16,0.846153846,0.153846154,2013,8,1,9,13
162,204,"Early Childhood Perception, Cognitive Control and Neural Correlates",https://nda.nih.gov/edit_collection.html?id=2137,"The application proposes to examine the domain of Perception as applied to young infants. P50 sensory gating will be utilized as the primary measure of Perception. Three approaches will be utilized: (1) Examine if infant P50 sensory gating is predictive of 4 year-old behavior; (2) Examine if infant P50 sensory gating is related to 4 year-old measures of Perception, Attention, and Cognitive Control; and (3) Identify the neural correlates of infant P50 sensory gating utilizing fMRI. This work should ... more",6/27/15,University of Colorado Denver,R01MH101295,University Of Colorado Denver,8/1/13,6/30/17,818574,Randal Ross,352,103,249,lab,6/27/15,8/1/13,6/30/17,0.292613636,0.707386364,2013,8,1,9,14
163,206,Using CBT to examine circuitry of frustrative non-reward in aggressive children,https://nda.nih.gov/edit_collection.html?id=2139,"Frustrative non-reward is defined by reactions elicited in response to withdrawal or prevention of reward, most notably reactive aggression. The neural mechanisms of reactive aggression involve heightened amygdala arousal in response to frustration coupled with hypoactivity of prefrontal regions that subserve emotion regulation. This is a proposal for a randomized controlled trial of cognitive behavioral therapy (CBT) in children with high levels of aggression aimed at explicating the brain behavior ... more",9/27/15,Yale University,R01MH101514,Yale University,8/1/13,7/31/17,936428,Denis Sukhodolsky,101,72,29,lab,9/27/15,8/1/13,7/31/17,0.712871287,0.287128713,2013,8,1,9,15
165,203,Genetic Contributions of Negative Valence Systems to Internalizing Pathways,https://nda.nih.gov/edit_collection.html?id=2136,"Internalizing disorders (ID) represent the largest domain of emotional disturbances that affect the general population. In recent years, significant effort has been put into examining and defining basic dimensions of functioning (e.g., neural or physiologic) that cut across internalizing disorders as traditionally defined by current nosology. Thus, the goal of the current study is to examine relationships between measures constructed to probe negative valence system (NVS) expression (e.g., fear, ... more",6/27/15,Virginia Commonwealth University,R01MH101518,Virginia Commonwealth University,8/16/13,7/31/17,1315999,Roxann Roberson-Nay,617,243,374,lab,6/27/15,8/16/13,7/31/17,0.393841167,0.606158833,2013,8,16,9,16
166,144,The CHARGE Study: Childhood Autism Risks From Genetics and the Environment,https://nda.nih.gov/edit_collection.html?id=2066,"Few rigorous epidemiologic studies have addressed the environmental causes and biologic underpinnings of autism spectrum disorder (ASD). The CHARGE (CHildhood Autism Risks from Genetics and Environment) Study is a large, population-based case-control investigation of environmental risk factors, broadly defined, in relation to ASD and developmental delay without ASD symptoms, with referents from the general population.Fieldwork began In 2003, and by now CHARGE has published widely on exposures such ... more",10/30/13,"University of California, Davis",R01ES015359,University Of California At Davis,8/19/13,6/30/18,2478748,Irva Hertz-Picciotto,482,364,118,lab,10/30/13,8/19/13,6/30/18,0.755186722,0.244813278,2013,8,19,9,17
167,288,Early Identification of ASD: Translating Eye Tracking into Practice (Years 6-10),https://nda.nih.gov/edit_collection.html?id=2290,"Currently, parent report screening tools (e.g., M-CHAT, CSBS) are the only standardized screening options available to pediatricians for the early detection of autism. As demonstrated in our previous work (the 1-Year Well-Baby Check-Up Approach, Pierce et al., 2011), such screens have valuable strengths, but also weaknesses, including the impact of parent characteristics on how they rate their child's behavior and high false positive rates. Autism is a disorder that has its roots in abnormal early ... more",8/6/15,University of California San Diego,R01MH080134,"University Of California, San Diego",8/20/13,5/31/19,1974614,Karen Pierce,474,337,137,lab,8/6/15,8/20/13,5/31/19,0.710970464,0.289029536,2013,8,20,9,18
685,131,SSC total recall project,https://nda.nih.gov/edit_collection.html?id=2042,"This collection consists of sequencing and variation data resulting from the reanalysis of Whole Exome Sequences from 9047 individual subjects belonging to the Simons Simplex Collection (SSC). Original data were contributed by a collaboration between NDAR Collections 1878 (Eichler Lab, University of Washington), 1936 (Wigler Lab, Cold Spring Harbor Laboratories), and 1985 (State Lab, UCSF). Reanalysis of this data was done by members of the Eichler Lab, sequences were realigned to a common reference ... more",8/22/13,University of Washington,,,8/22/13,,,"Eichler, Evan",9054,5345,3709,lab,8/22/13,8/22/13,,0.590346808,0.409653192,2013,8,22,9,19
168,201,Negative Valence Brain Targets and Predictors of Anxiety and Depression Treatment,https://nda.nih.gov/edit_collection.html?id=2134,"Internalizing psychopathologies (IPs) involving depression and anxiety are among the most prevalent, costly and disabling illnesses. Treatments for IPs are available but the extent to which individual patients respond is quite heterogeneous. Little information exists, particularly in the biological domain, which helps to explain individual differences in treatment response. The NIMH Research Domain Criteria (RDoC) project may solve this problem by encouraging innovative research beyond certain categorical ... more",2/27/15,University of Illinois at Chicago,R01MH101497,University Of Illinois At Chicago,8/23/13,5/31/17,1291760,Kinh Luan Phan,151,54,97,lab,2/27/15,8/23/13,5/31/17,0.357615894,0.642384106,2013,8,23,9,20
686,132,Autism Spectrum Disorder - Inflammatory Subtype: Molecular Characterization,https://nda.nih.gov/edit_collection.html?id=2043,"Previously, we have reported that some of those 'poor responders' are characterized by fluctuating behavioral symptoms following immune insults (typically microbial infection), and persistent gastrointestinal (GI) symptoms. We have also found that peripheral blood (PB) monocytes (Mo) from those children have altered innate immune responses, as compared to normal/ASD case controls. This study categorized those subjects as the ASD-inflammatory subtype (ASD-IS). ASD-IS ... more",8/29/13,Saint Peter's University Hospital,,,8/29/13,,,Harumi Jyonouchi,110,89,21,lab,8/29/13,8/29/13,,0.809090909,0.190909091,2013,8,29,9,21
169,196,Biological Determinants of Brain Variation in Autism,https://nda.nih.gov/edit_collection.html?id=2129,"The goal of this research is to generate a genetic architecture of brain development. We aim to achieve this goal in two solid steps. We first utilize our existing brain MR imaging measurements (traditional MRI volumetry, brain connectivity, resting state activity) of 235 individuals, 125 with autism and 110 typically developing subjects, to build a data structure of brain regions of interest that have at least 50% estimated heritability for typical brains, sorted first by size and then by components ... more",11/24/14,University of Wisconsin-Madison,R01MH097464,University Of Wisconsin-Madison,8/29/13,7/31/19,2902976,Janet Lainhart,701,488,213,lab,11/24/14,8/29/13,7/31/19,0.696148359,0.303851641,2013,8,29,10,1
170,232,Neural markers of shared gaze during simulated social interactions in ASD \-Modal Automated Assessment of Behavior during Social Interactions in Children with ASD,https://nda.nih.gov/edit_collection.html?id=2179,"(1) Individuals with autism spectrum disorder (ASD) experience profound difficulty in social interactions. Problems maintaining eye contact, or shared gaze, emerge early in life and persist throughout development. The social challenges experienced by people with ASD are most evident in dynamic, interactive contexts; however, most brain research in ASD has studied neural responses to social information in less realistic contexts, such as passively viewing static faces on a computer monitor. ... more",4/30/15,Yale Child Study Center,R01MH100173,Yale University,8/29/13,6/30/16,932301,James McPartland and Adam Naples,191,127,64,lab,4/30/15,8/29/13,6/30/16,0.664921466,0.335078534,2013,8,29,10,2
171,166,The neurophysiology of sensory processing and multisensory integration in ASD,https://nda.nih.gov/edit_collection.html?id=2095,"Sensory atypicalities represent a cardinal feature of Autism Spectrum Disorders (ASD) and have been established as the source of much behavioral aggression, frustration, and functional impairment over the course of the lifespan within this population[1-3]. Research in this area generally has been clinically focused, and limited to descriptions of the phenomena [4-8], although there are notable exceptions.These include a small number of psychophysics studies that report that, compared with neurotypical ... more",6/29/14,Syracuse University,R01MH101536,Syracuse University,9/1/13,8/31/20,2069336,Natalie Russo,177,103,74,lab,6/29/14,9/1/13,8/31/20,0.581920904,0.418079096,2013,9,1,10,3
172,202,The Effects of Early Life Stress on Neurodevelopment in Children and Adolescents,https://nda.nih.gov/edit_collection.html?id=2135,"Early life stress (ELS) is a significant risk factor for the development of a range of psychiatric symptoms that cut across a number of diagnostic categories. The mechanisms through which ELS confers this heightened vulnerability, however, are poorly understood. Given that there are several million referrals involving alleged child maltreatment in the US each year, it is critical that investigators focus on elucidating the neuro developmental consequences of ELS and the mechanisms by which ELS-related ... more",2/27/15,Stanford University,R01MH101495,Stanford University,9/1/13,8/31/17,1587309,Ian Gotlib,513,148,365,lab,2/27/15,9/1/13,8/31/17,0.288499025,0.711500975,2013,9,1,10,4
173,291,Components of Emotional Processing in Toddlers with ASD,https://nda.nih.gov/edit_collection.html?id=2293,"Older individuals with ASD show deficits in the pragmatic and spontaneous use of emotional information, but little is known about emotional processing in the early stages of ASD. Our preliminary work suggests that deficits in emotion processing are present as early as at 12 months in the affected infants. In typical development, infants detect and orient towards affective cues in the first months of life. These attentional biases for affectively valenced information play a critical role in the development ... more",8/17/15,Yale University,R01MH100182,Yale University,9/1/13,5/31/19,3412696,Katarzyna Chawarska,231,150,81,lab,8/17/15,9/1/13,5/31/19,0.649350649,0.350649351,2013,9,1,10,5
174,339,DCTRS Personalized and Scalable Cognitive Remediation Approaches,https://nda.nih.gov/edit_collection.html?id=2361,"The extant literature on Cognitive Remediation (CR) for schizophrenia, an empirically based intervention, indicates that across treatment methods, CR has moderate effects on neurocognition and functional outcomes. However, substantial individual differences in response to CR interventions indicate a need to refine intervention strategies to better meet the specific neurocognitive and functional needs of treatment participants. Evidence that neurocognitive and psychological factors predict a strong ... more",3/28/16,Columbia University,R34MH100317,Columbia University Health Sciences,9/1/13,2/28/18,734933,Alice Medalia,67,47,20,lab,3/28/16,9/1/13,2/28/18,0.701492537,0.298507463,2013,9,1,10,6
175,644,Functional connectivity substrates of social and non-social deficits in ASD,https://nda.nih.gov/edit_collection.html?id=2710,"Over the past decade, the hypothesis that autism spectrum disorder (ASD) is a disorder of reduced long-range and increased local functional connectivity has been gaining traction. To date, however, there is no evidence of increased local functional connectivity in ASD. If, furthermore, ASD is indeed a disorder of functional connectivity, then similar abnormalities ought to manifest in both the social communication (core/defining) and the non-social communication (non-core/non-defining) domains of ... more",7/31/17,Massachusetts General Hospital,R01HD073254,Massachusetts General Hospital,9/1/13,11/30/18,3380960,Tal Kenet,59,51,8,lab,7/31/17,9/1/13,11/30/18,0.86440678,0.13559322,2013,9,1,10,7
176,142,Epidemiological Research on Autism in Jamaica - Phase II,https://nda.nih.gov/edit_collection.html?id=2063,"Autism Spectrum Disorders (ASDs) are complex lifelong neurodevelopmental and behavioral disorders manifesting in infancy or early childhood, characterized by impairments in social interaction and communication, and by repetitive, stereotyped behavior. Although the causes of ASD are unknown, the evidence suggests that the origins are likely the result of gene environment interaction occurring in utero or very early in infancy. The long term goal of this project is to expand our capacity for conducting ... more",10/30/13,UTHealth,R01ES022165,University Of Texas Hlth Sci Ctr Houston,9/12/13,4/30/22,2841184,Mohammad Rahbar,506,415,91,lab,10/30/13,9/12/13,4/30/22,0.820158103,0.179841897,2013,9,12,10,8
177,200,Dimensional RDoC Modeling across the Range of Negative Mood Dysfunction,https://nda.nih.gov/edit_collection.html?id=2133,"Integration of dimensional parameters from brain, performance, and self and other-report measures is key towards refining intermediate phenotypes (IPs) within the Research Domain Criteria (RDoC) proposal by NIMH. Currently, IPs do not align well with the disjunctive categorical diagnostic systems. In reality, the symptoms of Major Depressive Disorder (MDD) and Bipolar Disorder (BD) NOS and subthreshold condition shave significant overlap in symptoms and impact. There are likely shared disruptions ... more",2/27/15,University of Utah,R01MH101487,University Of Illinois At Chicago,9/18/13,5/31/17,1332264,Scott Langenecker,193,66,127,lab,2/27/15,9/18/13,5/31/17,0.341968912,0.658031088,2013,9,18,10,9
178,548,Integrative Molecular and Phenotype Analysis of 22q11.2 Deletion Syndrome,https://nda.nih.gov/edit_collection.html?id=2605,"22q11.2 microdeletion syndrome Velocardiofacial Syndrome 22q11DS occurs in about 13000 live births, and is the most frequent known recurrent genetic cause of schizophrenia, accounting for 1-2 percent of schizophrenia cases in the general population The overall goal of this project is to study neural progrenitors and neurons derived from human induced pluripotent stem cells iPSCs, in order to identify the cellular and molecular mechanisms underlying the neuropsychiatric phenotype in patients with ... more",3/8/17,Stanford University,R01MH100900,Stanford University,9/19/13,7/31/18,1807937,Joachim F. Hallmayer,67,23,44,lab,3/8/17,9/19/13,7/31/18,0.343283582,0.656716418,2013,9,19,10,10
687,133,Development of a new autism screening tool for traditionally underserved families,https://nda.nih.gov/edit_collection.html?id=2046,"The goal of this study is to improve identification of young children with autism spectrum disorders (ASD) from traditionally underserved populations by refining and testing the utility of a new ASD screening tool designed for use in families with low English literacy and comprehension challenges. To address this critical issue, investigators at CSH developed a new screening tool, designed to be completed by parents with literacy and comprehension challenges and by preschool staff serving children ... more",9/20/13,Children's Specialized Hospital,,,9/20/13,,,"Yvette Janvier, MD",477,346,131,lab,9/20/13,9/20/13,,0.725366876,0.274633124,2013,9,20,10,11
688,134,Efficacy of Relationship Development Intervention and Parent-Implemented Applied Behavior,https://nda.nih.gov/edit_collection.html?id=2049,"Relationship Development Intervention (RDI) is a relationship-based intervention focusing on recreating developmental milestones through meaningful interactions with parents. The primary goal of RDI is to increase the child's response to parents bid for JA and the child's initiation of JA with the parent. By increasing JA skills, spoken language should emerge. In contrast, Applied Behavior Analysis of Verbal Behavior (ABA/VB) increases spoken language directly using a scientific approach that has ... more",9/20/13,Rowan University,,,9/20/13,,,Mary Louise Kerwin Ph.D.,56,42,14,lab,9/20/13,9/20/13,,0.75,0.25,2013,9,20,10,12
689,145,Targeting GABA-A for the Treatment of Social Disability in Young Adults with Autism Spectrum Disorders: A Phase II Proof of Mechanism Trial,https://nda.nih.gov/edit_collection.html?id=2067,"Autism Spectrum Disorders (ASD) (DSM-V, APA 2013) include the Pervasive Developmental Disorders (PDDs) previously referred to as Autistic Disorder, Asperger's disorder and PDD-Not Otherwise Specified (NOS). ASD are chronic neurodevelopmental disorders of early childhood onset that are associated with substantial disability, sharing core delays in the development of social communication and interaction skills, and impairing restricted, repetitive behaviors. These disorders occur in all racial, ethnic, ... more",10/30/13,"University of California, Los Angeles",,,10/30/13,,,James T. McCracken,156,118,38,lab,10/30/13,10/30/13,,0.756410256,0.243589744,2013,10,30,10,13
690,146,Simons Foundation Autism Research Initiative (SFARI),https://nda.nih.gov/edit_collection.html?id=2068,"Launched in 2005, the Simons Foundation Autism Research Initiative (SFARI) is a research campaign within the Simons Foundation's overall suite of programs. SFARI's mission is to improve the diagnosis and treatment of autism spectrum disorders by funding innovative research of the highest quality and relevance. Although SFARI's priority is to benefit individuals challenged by these disorders, its efforts are certain to yield insights into the neural mechanisms of fundamental human capabilities, thereby ... more",10/30/13,Simons Foundation,,,10/30/13,,,Louis F. Reichardt,10256,6023,4233,lab,10/30/13,10/30/13,,0.587265991,0.412734009,2013,10,30,10,14
774,12,Transmission disequilibrium of small CNVs in simplex autism.,https://nda.nih.gov/study.html?id=312,"Cohorts: 411 ASD Quads from Simons Simplex Collection 177 Quads from Sanders et al. (PubMed ID: 22495306) 166 Quads from I. Iossifov et al. (PubMed ID: 22542183) 71 Quads from O'Roak et al. (PubMed ID: 22495309) Publication Abstract: We searched for disruptive, genic rare copy-number variants (CNVs) among 411 families affected by sporadic autism spectrum disorder (ASD) from the Simons Simplex Collection by using available exome sequence data and CoNIFER (Copy Number Inference from ... more",12/2/13,Burkhart Center for Autism Education and Research,,,12/2/13,,,"Richman DM; Barnard-Brak L, Bosch A, Thompson S, Grubb L, Abby L",1643,936,707,paper,12/2/13,12/2/13,,0.569689592,0.430310408,2013,12,2,10,15
775,13,Sporadic autism exomes reveal a highly interconnected protein network of de novo mutations.,https://nda.nih.gov/study.html?id=316,"In addition to cohorts of Parents (N=418), Siblings (N=50), and Probands (N=209), the publication publication describes a subset of male (N=47) and female (N=26) autistic subjects, with significant impairment and intellectual disability, and with cognitive impairment, respectively. These subsets have been defined based on hi/low IQ value in Supplementary Table 1 from the publication. Publication Abstract: It is well established that autism spectrum disorders (ASD) have a strong genetic component; ... more",12/2/13,Burkhart Center for Autism Education and Research,,,12/2/13,,,"Richman DM; Barnard-Brak L, Bosch A, Thompson S, Grubb L, Abby L",674,386,288,paper,12/2/13,12/2/13,,0.572700297,0.427299703,2013,12,2,10,16
776,14,Patterns and rates of exonic de novo mutations in autism spectrum disorders.,https://nda.nih.gov/study.html?id=317,"Notes: Data submitted to NDAR did not include interview age. Publication Abstract: Autism spectrum disorders (ASD) are believed to have genetic and environmental origins, yet in only a modest fraction of individuals can specific causes be identified. To identify further genetic risk factors, here we assess the role of de novo mutations in ASD by sequencing the exomes of ASD cases and their parents (n = 175 trios). Fewer than half of the cases (46.3%) carry a missense or nonsense de novo ... more",12/2/13,Burkhart Center for Autism Education and Research,,,12/2/13,,,"Richman DM; Barnard-Brak L, Bosch A, Thompson S, Grubb L, Abby L",82,69,13,paper,12/2/13,12/2/13,,0.841463415,0.158536585,2013,12,2,10,17
777,15,Comparative RNA editing in autistic and neurotypical cerebella.,https://nda.nih.gov/study.html?id=319,"Adenosine-to-inosine (A-to-I) RNA editing is a neurodevelopmentally regulated epigenetic modification shown to modulate complex behavior in animals. Little is known about human A-to-I editing, but it is thought to constitute one of many molecular mechanisms connecting environmental stimuli and behavioral outputs. Thus, comprehensive exploration of A-to-I RNA editing in human brains may shed light on gene-environment interactions underlying complex behavior in health and disease. Synaptic function ... more",12/2/13,Burkhart Center for Autism Education and Research,,,12/2/13,,,"Richman DM; Barnard-Brak L, Bosch A, Thompson S, Grubb L, Abby L",13,9,4,paper,12/2/13,12/2/13,,0.692307692,0.307692308,2013,12,2,10,18
778,16,Multiplex Targeted Sequencing Identifies Recurrently Mutated Genes in Autism Spectrum Disorders,https://nda.nih.gov/study.html?id=320,"Abstract: Exome sequencing studies of autism spectrum disorders (ASDs) have identified many de novo mutations but few recurrently disrupted genes. We therefore developed a modified molecular inversion probe method enabling ultra-low-cost candidate gene resequencing in very large cohorts. To demonstrate the power of this approach, we captured and sequenced 44 candidate genes in 2446 ASD probands. We discovered 27 de novo events in 16 genes, 59% of which are predicted to truncate proteins or disrupt ... more",12/2/13,Burkhart Center for Autism Education and Research,,,12/2/13,,,"Richman DM; Barnard-Brak L, Bosch A, Thompson S, Grubb L, Abby L",3108,2429,679,paper,12/2/13,12/2/13,,0.781531532,0.218468468,2013,12,2,10,19
779,17,Whole-genome sequencing in autism identifies hot spots for de novo germline mutation.,https://nda.nih.gov/study.html?id=322,"De novo mutation plays an important role in autism spectrum disorders (ASDs). Notably, pathogenic copy number variants (CNVs) are characterized by high mutation rates. We hypothesize that hypermutability is a property of ASD genes and may also include nucleotide-substitution hot spots. We investigated global patterns of germline mutation by whole-genome sequencing of monozygotic twins concordant for ASD and their parents. Mutation rates varied widely throughout the genome (by 100-fold) and could ... more",12/2/13,Burkhart Center for Autism Education and Research,,,12/2/13,,,"Richman DM; Barnard-Brak L, Bosch A, Thompson S, Grubb L, Abby L",41,22,19,paper,12/2/13,12/2/13,,0.536585366,0.463414634,2013,12,2,10,20
780,18,Exome sequencing in sporadic autism spectrum disorders identifies severe de novo mutations,https://nda.nih.gov/study.html?id=323,"Evidence for the etiology of autism spectrum disorders (ASDs) has consistently pointed to a strong genetic component complicated by substantial locus heterogeneity. We sequenced the exomes of 20 individuals with sporadic ASD (cases) and their parents, reasoning that these families would be enriched for de novo mutations of major effect. We identified 21 de novo mutations, 11 of which were protein altering. Protein-altering mutations were significantly enriched for changes at highly conserved residues. ... more",12/2/13,Burkhart Center for Autism Education and Research,,,12/2/13,,,"Richman DM; Barnard-Brak L, Bosch A, Thompson S, Grubb L, Abby L",60,38,22,paper,12/2/13,12/2/13,,0.633333333,0.366666667,2013,12,2,10,21
179,152,Modifiable Behavior & Dietary Predictors of Overweight in Children with ASD,https://nda.nih.gov/edit_collection.html?id=2079,"Pediatric overweight has reached epidemic levels and, at 36%, children with autism spectrum disorder (ASD)have a higher rate of overweight than typically developing children. Pediatric overweight is a major health problem because it is linked to childhood onset of dyslipidemia, hypertension, high blood sugar, and Type 2 Diabetes. Also youths who grow up overweight, will as adults, face higher rates of hypertension, heart disease,atherosclerosis, colorectal cancer, arthritis, and chronic overweight. ... more",3/14/14,University of Kansas,R21HD076116,University Of Kansas Medical Center,1/1/14,12/31/16,423694,Susana Patton,80,62,18,lab,3/14/14,1/1/14,12/31/16,0.775,0.225,2014,1,1,11,1
180,153,Smart Early Screening for Autism and Communication Disorders in Primary Care,https://nda.nih.gov/edit_collection.html?id=2080,"There is a pressing need to build the capacity of communities to follow the guidelines of the American Academy of Pediatrics to screen all children for ASD at 18 and 24 months (Johnson & Myers, 2007) as research indicates that earlier intervention maximizes outcomes. In response to PA-10-158, the overarching purpose of this investigation is to validate the effectiveness of a new automated online version of the Early Screening for Autism and Communication Disorders the Smart ESAC, that uses smart ... more",3/14/14,Florida State University,R01HD078410,Florida State University,1/1/14,12/31/19,2454193,Amy Wetherby,389,274,115,lab,3/14/14,1/1/14,12/31/19,0.70437018,0.29562982,2014,1,1,11,2
181,242,Pivotal Response Treatment Package for Young Children with Autism,https://nda.nih.gov/edit_collection.html?id=2198,"Over the last decade, considerable progress has been made to increase our understanding of the pathophysiology of autism spectrum disorder (ASD), but limited progress has been made in identifying effective interventions. The goal of this investigation is to build on our preliminary findings and conduct a randomized controlled 24-week pilot trial to examine the efficacy of a pivotal response treatment package (PRT-P) in improving language expression in young children with ASD. Pivotal response treatment ... more",4/30/15,Stanford University,R21DC013689,Stanford University,1/1/14,12/31/16,439368,Antonio Hardan,52,47,5,lab,4/30/15,1/1/14,12/31/16,0.903846154,0.096153846,2014,1,1,11,3
182,313,Genomic Mosaicism in Developing Human Brain,https://nda.nih.gov/edit_collection.html?id=2330,"In this project we are testing to what extent subpopulation of cells of the brain accumulate changes in their genes during development, a phenomenon called somatic mosaicism.",12/9/15,Yale University,R01MH100914,Yale University,1/1/14,12/31/19,3515307,Flora Vaccarino,5,2,3,lab,12/9/15,1/1/14,12/31/19,0.4,0.6,2014,1,1,11,4
781,20,A genome-wide scan for common alleles affecting risk for autism.,https://nda.nih.gov/study.html?id=325,"Publication authors did not provide a list of Subject IDs used in this publication, cohorts in this study consist of all subjects with SNP genotyping data deposited with NDAR under data-set 8133. Publication Abstract: Although autism spectrum disorders (ASDs) have a substantial genetic basis, most of the known genetic risk has been traced to rare variants, principally copy number variants (CNVs). To identify common risk variation, the Autism Genome Project (AGP) Consortium genotyped 1558 rigorously ... more",1/2/14,Burkhart Center for Autism Education and Research,,,1/2/14,,,"Richman DM; Barnard-Brak L, Bosch A, Thompson S, Grubb L, Abby L",3843,2368,1475,paper,1/2/14,1/2/14,,0.616185272,0.383814728,2014,1,2,11,5
782,21,Functional impact of global rare copy number variation in autism spectrum disorders.,https://nda.nih.gov/study.html?id=327,"Data submitter did not provide a listing of specific Subject IDs used in this publication. Cohorts consist of all subjects with CNV data deposited in NDAR from the Autism Genome Project. Data was not provided for non-parental controls. Publication Abstract: The autism spectrum disorders (ASDs) are a group of conditions characterized by impairments in reciprocal social interaction and communication, and the presence of restricted and repetitive behaviours. Individuals with an ASD vary greatly ... more",1/2/14,Burkhart Center for Autism Education and Research,,,1/2/14,,,"Richman DM; Barnard-Brak L, Bosch A, Thompson S, Grubb L, Abby L",69,55,14,paper,1/2/14,1/2/14,,0.797101449,0.202898551,2014,1,2,11,6
183,147,Eyeblink conditioning in school-aged children with ASD,https://nda.nih.gov/edit_collection.html?id=2070,Our project seeks to apply an objective behavioral measure of brain function that may identify sites of neural dysfunction in autism spectrum disorder (ASD). Our paradigm will be a robust measure of associative learning- Pavlovian eyeblink conditioning (EBC) to assess how fundamental building-blocks of higher brain function may be disrupted in school-aged children with ASD. The subjects will be 99 10-year-old children that are currently participating in one of two longitudinal studies examining: ... more,1/17/14,Seattle Children's Research Institute,R01MH100887,Seattle Childrens Hospital,2/13/14,12/31/19,2587820,John Welsh,86,66,20,lab,1/17/14,2/13/14,12/31/19,0.76744186,0.23255814,2014,2,13,11,7
184,151,Gaze Modification Strategies for Toddlers with ASD,https://nda.nih.gov/edit_collection.html?id=2077,"Recent eye tracking studies have shown that 20 month old toddlers with autism spectrum disorders (ASD), as compared to typically developing (TD) and developmentally delayed (DD) toddlers, attend less to the shared activities of others 1 as well as to faces trying to engage them using direct eye contact and child directed speech 2 (i.e. bids for dyadic engagement). Since attending to others, and especially their actions, is critically linked to both social skill development and observational learning, ... more",3/14/14,Seattle Children's Research Institute,R21MH102572,Yale University,2/13/14,10/31/16,457875,Frederick Shic,81,53,28,lab,3/14/14,2/13/14,10/31/16,0.654320988,0.345679012,2014,2,13,11,8
185,1009,Brain Network Development in Normal and Autistic Children,https://nda.nih.gov/edit_collection.html?id=3111,"MRI data, neuropsychological assessment of normal and autistic children ages 5-12 years.",12/17/18,University of Utah,K08MH100609,University Of Utah,2/17/14,1/31/19,759456,Brandon A. Zielinski,1,1,0,lab,12/17/18,2/17/14,1/31/19,1,0,2014,2,17,11,9
186,150,Treatment of anxiety in autism spectrum disorder,https://nda.nih.gov/edit_collection.html?id=2076,"Comorbid anxiety disorders affect 40 to 50% of children with ASD, causing substantial distress and impairmentover and above that caused by ASD alone. High anxiety is associated with increased severity of ASDsymptoms and social maladjustment in affected youth. Further, parents of children with ASD consider anxietyrelatedproblems to be among the top two challenges facing their children. Although standard practicecognitive-behavioral therapy (CBT) has been established as an efficacious and safe treatment ... more",3/14/14,University of South Florida,R01HD080097,Temple Univ Of The Commonwealth,2/20/14,1/31/18,563453,"Jeffrey Wood, Eric Storch and Philip Kendall",154,119,35,lab,3/14/14,2/20/14,1/31/18,0.772727273,0.227272727,2014,2,20,11,10
187,148,Intrinsic Brain Architecture of Young Children with Autism While Awake and Asleep,https://nda.nih.gov/edit_collection.html?id=2072,"Functional neuroimaging is increasingly enhancing our understanding of autism spectrum disorders (ASD) as disconnection syndromes, but because of its demands, most studies have focused on adults or older children. Conducting functional neuroimaging during natural sleep permits the study of young children and infants.Given the early onset of ASD, such studies may be crucial to the identification of biomarkers. However, the assumption that findings obtained during sleep can be generalized to wakefulness ... more",3/14/14,Child Mind Institute,R21MH102660,New York University School Of Medicine,3/5/14,2/29/16,466125,Adriana DiMartino,57,48,9,lab,3/14/14,3/5/14,2/29/16,0.842105263,0.157894737,2014,3,5,11,11
188,149,Mapping Thalamocortical Networks Across Development in ASD,https://nda.nih.gov/edit_collection.html?id=2075,"Autism spectrum disorders (ASD) are a group of pervasive developmental disorders characterized by deficits in social interaction and communication, and rigid or stereotypical behaviors. These complex behavioral problems arise, in part, from deficits in more basic sensory and motor systems. The thalamus plays a central role in processing sensory information and modulating overall cortical activity.Consequently, dysfunction of the thalamus and its connections with the cortex may account for some of ... more",3/14/14,Vanderbilt University Medical Center,R21MH101321,Vanderbilt University,3/7/14,2/28/17,432034,Carissa Cascio,101,71,30,lab,3/14/14,3/7/14,2/28/17,0.702970297,0.297029703,2014,3,7,11,12
189,519,Development of a novel neurotechnology to promote emotion recognition in autism,https://nda.nih.gov/edit_collection.html?id=2572,"Difficulties in facial emotion recognition FER are thought to cause or exacerbate social disability in people with autism spectrum disorder ASD by preventing 1 accurate detection of social emotional information conveyed through the face, particularly the eye-region, and 2 the deployment of emotionally appropriate responses. Although the neural systems thought to underlie FER deficits in ASD are increasingly appreciated, their plasticity remains speculative. The goal of this project is to develop ... more",1/19/17,Virginia Polytechnic Institute and State University,R33MH100268,Virginia Polytechnic Inst And St Univ,3/12/14,12/31/19,1338059,Susan White,27,27,0,lab,1/19/17,3/12/14,12/31/19,1,0,2014,3,12,11,13
190,192,Homeostatic and Hedonic Food Motivation Underlying Eating Disorder Trajectories,https://nda.nih.gov/edit_collection.html?id=2124,"Eating disorders are heterogeneous illnesses characterized by aberrant behaviors of extreme dietary restriction, binge eating, and purging. The course often involves adolescent onset, and in more than half of individuals, transition from predominantly restrictive to binge/purse behaviors. The pathophysiology of low-weight eating disorders and mechanisms that underlie restricting vs. binge/purse phenotypes are almost entirely unknown. A critical knowledge gap is the neurobiology underlying the developmental ... more",10/24/14,Massachusetts General Hospital,R01MH103402,Massachusetts General Hospital,4/1/14,3/31/19,719806,Madhusmita Misra,122,0,122,lab,10/24/14,4/1/14,3/31/19,0,1,2014,4,1,11,14
191,205,Taste reward circuits and prediction error define eating disorder psychopathology,https://nda.nih.gov/edit_collection.html?id=2138,"The eating disorders (EDs) anorexia nervosa (AN) and bulimia nervosa (BN) are severe psychiatric disorders with high mortality. While AN is mainly characterized by severe underweight and BN individuals are at normal to high weight and regularly binge and purge, there are many overlapping symptoms across both disorders,such as food restriction, episodic binge eating, purging or excessive exercise. Little is known about the neurobiology of EDs and how specific ED behaviors are linked to particular ... more",6/27/15,University of Colorado,R01MH103436,University Of Colorado Denver,4/1/14,3/31/19,449847,Joel Stoddard,240,0,240,lab,6/27/15,4/1/14,3/31/19,0,1,2014,4,1,11,15
192,549,Effects of Amygdala Neurofeedback on Depressive Symptoms and Processing Biases,https://nda.nih.gov/edit_collection.html?id=2606,"This project is going to study novel neurobehavioral interventions for major depressive disorder MDD and their implementation, with a specific focus on emotional processing biases that serve as a biological marker and treatment target both for the onset and remission of MDD symptoms. The training she received during the K99 period of the award as well as her publication record clearly indicate that Dr. Young has expertise in cognitive neuroscience, the biological basis of depression, neurobehavioral ... more",3/16/17,University of Pittsburgh,R00MH101235,University Of Pittsburgh At Pittsburgh,4/1/14,3/31/20,906043,Kymberly Young,38,11,27,lab,3/16/17,4/1/14,3/31/20,0.289473684,0.710526316,2014,4,1,11,16
193,236,Organization of Excitatory and Inhibitory Circuits in ASD,https://nda.nih.gov/edit_collection.html?id=2189,"The goal of the proposed project is to investigate the largely unexplored issue of the integrity of neural elements that underlie excitatory and inhibitory control within prefrontal networks. Experiments will be conducted on post-mortem brain tissue from children, using the robustly interconnected anterior cingulate, orbitofrontal, and lateral prefrontal cortices as a model system. We will examine structural, neurochemical, and molecular features of excitatory myelinated axons in the gray and white ... more",4/30/15,Boston University,R01MH101209,Boston University (Charles River Campus),4/4/14,1/31/20,2018222,Vasileios Zikopoulos,21,17,4,lab,4/30/15,4/4/14,1/31/20,0.80952381,0.19047619,2014,4,4,11,17
194,264,Serotonin Receptor Subtypes as Pharmacotherapeutic Targets in Autism,https://nda.nih.gov/edit_collection.html?id=2255,"Social-emotional and social-communicative behaviors are core features of autism and two of the key affected substrates are the cingulate cortices and fusiform gyrus. There is neuropathology within cortical lamina as well as changes in GABA-A receptors and associated benzodiazepine binding sites in both the anterior (ACC) and posterior (PCC) cingulate areas and in the fusiform (FG), a key area for the perception of facial expressions, shown to be altered in adult individuals with autism. Peripheral ... more",5/6/15,Hussman Institute for Autism,R21MH099457,"Hussman Institute For Autism, Inc.",4/15/14,10/31/17,445500,Gene Blatt,62,55,7,lab,5/6/15,4/15/14,10/31/17,0.887096774,0.112903226,2014,4,15,11,18
195,167,Multi-Level Assays of Working Memory and Psychopathology,https://nda.nih.gov/edit_collection.html?id=2096,"The NIMH Research Domains Criteria (RDoC) initiative aims to advance understanding of mental health through critical re-evaluation of the traditional diagnostic system and development of alternate methods for measurement of biologically valid dimensions and categories. The proposed project focuses on the RDoC Working Memory construct using a bottom-up strategy that first determines the validity of three neural circuits (Local Cortical, Fronto-Posterior, and Cortico-Hippocampal) using convergent measures ... more",6/29/14,"University of California, Los Angeles",R01MH101478,University Of California Los Angeles,4/16/14,3/31/19,679307,Robert M. Bilder,196,71,125,lab,6/29/14,4/16/14,3/31/19,0.362244898,0.637755102,2014,4,16,11,19
691,154,Clinical Antipsychotic Trials of Intervention Effectiveness (CATIE) for Schizophrenia,https://nda.nih.gov/edit_collection.html?id=2081,"The CATIE Schizophrenia Trial is a randomized controlled trial of 1600 patients with schizophrenia involving the following medications: perphenazine, fluphenazine decanoate, clozapine, olanzapine, quetiapine, risperidone and ziprasidone (which was activated in February 2002). Patients will be followed for 18 months and rerandomized to a new treatment in the event of treatment failure.",5/1/14,,,,5/1/14,,,Jeffrey A Lieberman,1460,1080,380,lab,5/1/14,5/1/14,,0.739726027,0.260273973,2014,5,1,11,20
196,173,A Multidimensional Investigation of Cognitive Control Deficits in Psychopathology,https://nda.nih.gov/edit_collection.html?id=2102,"Psychotic spectrum disorders (PSD) are difficult to differentially diagnose and treat, typically leaving their victims with lifetime disability. It is increasingly becoming recognized that traditionally distinct disorders such as schizophrenia, schizoaffective disorder and bipolar disorder with psychotic features share overlapping symptoms. For example, in addition to positive symptoms, PSD patients also experience deficits in cognitive control/executive functioning, which likely result from dysregulation ... more",7/29/14,Mind Research Network,R01MH101512,The Mind Research Network,5/2/14,4/30/18,679291,Andrew Robert Mayer,256,158,98,lab,7/29/14,5/2/14,4/30/18,0.6171875,0.3828125,2014,5,2,11,21
692,155,DCTRS The Effects of Neurocognitive Remediation on Executive Processing in Patients With Schizophrenia,https://nda.nih.gov/edit_collection.html?id=2082,"Approaches to cognitive remediation have differed across studies. Most of the larger studies have concentrated on group treatments designed without the benefit of recent laboratory-based studies. The current study describes a randomized trial of an intensive cognitive remediation program involving individual daily sessions of 1 hour for up to 3 months. It targets executive functioning deficits (cognitive flexibility, working memory, and planning) that are known to be problematic in people with schizophrenia. ... more",5/20/14,King's College London,,,5/20/14,,,Til Wykes,35,27,8,lab,5/20/14,5/20/14,,0.771428571,0.228571429,2014,5,20,12,1
693,157,DCTRS Feasibility and pilot efficacy results from the multisite cognitive remediation in the schizophrenia trials network (CRSTN) randomized controlled trial,https://nda.nih.gov/edit_collection.html?id=2084,"Neurocognitive enhancement therapy (NET) is a remediation program for the persistent and function-limiting cognitive impairments of schizophrenia. In a previous study in veterans, NET improved work therapy outcomes as well as executive function and working memory. The present study aimed to determine whether NET could enhance functional outcomes among schizophrenia and schizoaffective patients in a community mental health center receiving community-based vocational services. Method: Patients (N = ... more",5/20/14,Duke University,,,5/20/14,,,Richard Keefe,58,43,15,lab,5/20/14,5/20/14,,0.74137931,0.25862069,2014,5,20,12,2
694,160,A Randomized Controlled Trial of Intranasal Oxytocin as an Adjunct to Behavioral Therapy for Autism Spectrum Disorder,https://nda.nih.gov/edit_collection.html?id=2087,"The primary objectives of this clinical study are threefold. First, we aim to test the hypothesis that cognitive behavioral therapy (CBT) will be efficacious at targeting core social deficits and enhancing social function in young adults with autism spectrum disorder (ASD). Second, we aim to examine whether this treatment response can be augmented by the administration of oxytocin (OT) prior to CBT sessions. Third, we propose to examine whether brain imaging can help identify individuals most ... more",5/28/14,Massachusetts General Hospital,,,5/28/14,,,John Gabrieli and Aude Henin,61,61,0,lab,5/28/14,5/28/14,,1,0,2014,5,28,12,3
197,284,FMRI and EEG approaches to the resting state in ASD,https://nda.nih.gov/edit_collection.html?id=2286,"In the context of increasing prevalence the brain bases of autism spectrum disorder (ASD) remain incompletely understood. There is growing consensus that ASD is a disorder of brain connectivity, but functional connectivity findings are inconsistent. Resting state functional MRI (rs-fMRI) data, considered ideal for the study of intrinsic functional connectivity, are being acquired by numerous groups and are now available in a large public database. However, known differences in behavioral and cognitive ... more",12/9/14,San Diego State University,R21MH102578,San Diego State University,6/1/14,5/31/17,430453,Ralph-Axel Mueller and Thomas T. Liu,14,10,4,lab,12/9/14,6/1/14,5/31/17,0.714285714,0.285714286,2014,6,1,12,4
198,177,"Effects of poverty on affective development: A multi-level, longitudinal study",https://nda.nih.gov/edit_collection.html?id=2106,"One in five children in the US grows up in poverty. These children face high risk for psychopathology, which often lasts a lifetime and perpetuates low socioeconomic status. Thus, poverty and its sequelae represent a major public health problem. Poor children often experience greater chronic stress, which may allow poverty to become biologically embedded by altering brain and hypothalamic-pituitary-adrenal (HPA) axis function. By examining teens growing up with poverty-related stressors, the study ... more",8/29/14,University of Michigan,R01MH103761,University Of Michigan At Ann Arbor,6/6/14,5/31/19,668286,Christopher Monk,975,359,616,lab,8/29/14,6/6/14,5/31/19,0.368205128,0.631794872,2014,6,6,12,5
199,172,Phenotypic Characterization of Gene Disrupting Mutations in ASD,https://nda.nih.gov/edit_collection.html?id=2101,"Autism spectrum disorder (ASD) is a genetically and phenotypically heterogeneous disorder. Efforts to identifying subtypes based on the behavioral and neural phenotypes have been unsuccessful, and the rarity of specific genetic events renders subtyping at the CNV or exonic mutation level challenging and exceedingly resource-intensive. However, exploring the impact of gene disruptions in common pathways holds promise forelucidating phenotypic subtypes and clarifying genotype-phenotype relations in ... more",7/29/14,University of Washington,R01MH100047,University Of Washington,6/7/14,7/31/19,2094080,Raphael Bernier,213,155,58,lab,7/29/14,6/7/14,7/31/19,0.727699531,0.272300469,2014,6,7,12,6
200,174,Longitudinal Family/Molecular Genetic Study to Validate Research Domain Criteria,https://nda.nih.gov/edit_collection.html?id=2103,"The NIMH Research Domain Criteria (RDoC) project is intended to further a long-range goal of contributing to diagnostic systems as informed by research on genetics, neuroscience, and behavior. The Request for Applications to which we are responding encourages applications to study RDoC Constructs that cut across traditional diagnostic categories. Because RDoC Constructs are theoretical entities instantiated by behavioral and neurobiologic assessments, their validation (in the absence of a known gold ... more",7/29/14,Upstate Medical University,R01MH101519,Upstate Medical University,6/25/14,5/31/19,729700,Stephen V Faraone,2768,1150,1618,lab,7/29/14,6/25/14,5/31/19,0.415462428,0.584537572,2014,6,25,12,7
695,162,DCTRS Database of Cognitive Training and Remediation Studies,https://nda.nih.gov/edit_collection.html?id=2091,"The NIMH Database of Cognitive Training and Remediation Studies (DCTRS) is an integrated database that includes study- and subject-level data from studies of cognitive remediation (CR) in schizophrenia. Samples sizes by study site: WYKES1 (n=35), BELL (n=77), KEEFE (n=53), KESHAVAN (n=58), WYKES3 (n=40), WYKES2 (n=85), SILVERSTEIN (n=83). The data contained in this Collection is aggregated data from all sites and includes Brief Psychiatric Rating Scale (BPRS), Cognitive Data, Demographic Data, ... more",6/29/14,King's College London,,,6/29/14,,,Til Wykes; Morris D. Bell; Richard S.E.Keefe; Matcheri S. Keshavan; Steven M. Silverstein,431,288,143,lab,6/29/14,6/29/14,,0.668213457,0.331786543,2014,6,29,12,8
201,1001,Double-Blind Randomized Clinical Trial of EEG Neurofeedback for ADHD,https://nda.nih.gov/edit_collection.html?id=3103,"Current established evidence-based treatments for attention-deficit/hyperactivity disorder (ADHD) are incompletely effective and not universally acceptable, and appear to wane in effect over time despite significant immediate benefit e.g., FDA-approved medication, which shows large acute benefit, leaves a third of children only partially treated even when combined with behavioral treatment, and has not been demonstrated effective beyond 2 years. Additional treatments are needed that are effective ... more",11/28/18,Ohios State University,R01MH100144,Ohio State University,7/1/14,4/30/19,2683347,"L Eugene Arnold, Howard Lightstone",328,249,79,lab,11/28/18,7/1/14,4/30/19,0.759146341,0.240853659,2014,7,1,12,9
202,178,Neural Phenotypes of Females with Autism Spectrum Disorder,https://nda.nih.gov/edit_collection.html?id=2108,"Autism spectrum disorder (ASD) affects 1 in 88 children in the United States, but the disorder is much more common in boys than in girls. The prevalence of ASD in boys is 5 times higher than in girls, with a rate of 1 in 54 for boys and 1 in 252 for girls. Although this disparate sex ratio is among the most highly replicated findings in studies of ASD, sex differences in ASD remain poorly understood. The neuropathology of ASD in females is understudied because ASD samples recruited for research studies ... more",8/29/14,"University of California, Davis",R01MH104438,University Of California At Davis,7/10/14,4/30/19,863290,Christine Wu Nordahl,104,0,104,lab,8/29/14,7/10/14,4/30/19,0,1,2014,7,10,12,10
203,510,"Prospective Evaluation of Air Pollution, Cognition, and Autism from Birth Onward",https://nda.nih.gov/edit_collection.html?id=2563,This project seeks to determine if prenatal air pollution exposures increase the risk of cognitive delays and autistic traits. Emerging evidence suggests that air pollutant exposure may increase risk of neurodevelopmental disorders and autism spectrum disorder (ASD). Our research demonstrates that exposure during gestation and early life to traffic related air pollution (TRP) and regional particulate matter (PM) were associated with risk of autism and neurodevelopmental delays. Other studies indicate ... more,12/8/16,Johns Hopkins Bloomberg School of Public Health,R01ES023780,Johns Hopkins University,7/10/14,4/30/18,2092632,Heather Volk,394,218,176,lab,12/8/16,7/10/14,4/30/18,0.553299492,0.446700508,2014,7,10,12,11
204,176,Validating RDoC for Children and Adolescents: A Twin Study with Neuroimaging,https://nda.nih.gov/edit_collection.html?id=2105,This application proposes a two-part approach to understanding developmental aspects of the RDoC positive and negative valence systems. The project focuses on objective behavioral assessment and multimodal neuroimaging. Study 1 takes advantage of 1404 children (702 twin pairs) previously objectively assessed as 7 year-olds on positive and negative affect with a battery of videotaped behavioral measures that map onto RDoC dimensions. These children had also been assessed as toddlers and were later ... more,8/29/14,University of Wisconsin-Madison,R01MH101504,University Of Wisconsin-Madison,7/14/14,6/30/18,670011,Harold Hill Goldsmith,975,359,616,lab,8/29/14,7/14/14,6/30/18,0.368205128,0.631794872,2014,7,14,12,12
205,175,Neuroinflammation and PVS Deficits in Adolescents,https://nda.nih.gov/edit_collection.html?id=2104,"Adolescence is a critical developmental period during which many psychiatric symptoms first emerge. It has been argued that common alterations within the reward circuitry underlie the development of adolescent-onset psychiatric conditions. Addressing a critical need for the identification of biomarkers early in the course of psychopathologies, this RDoC project examines the neuroimmunology of specific reward processes in adolescents. Specifically, we focus on the clinical phenomenology of anhedonia, ... more",8/29/14,Albert Einstein College of Medicine,R01MH101479,Icahn School Of Medicine At Mount Sinai,7/15/14,6/30/19,685089,Vilma Gabbay,141,55,86,lab,8/29/14,7/15/14,6/30/19,0.390070922,0.609929078,2014,7,15,12,13
206,169,2/3-Social Processes Initiative in Neurobiology of the Schizophrenia(s),https://nda.nih.gov/edit_collection.html?id=2098,"Among the major mental illnesses of early adulthood, people with schizophrenia spectrum disorders (SSDs) (i.e., schizophrenia, schizoaffective disorder, schizophreniform disorder) exhibit a continuum of impairment in social functioning. Treatment is minimally effective, and impairments tend to persist. Knowledge on the neurobiology of social cognitive (SCog) process impairment will foster therapeutic discovery. At each of our sites, pilot data show that people with SSDs who are among the most socially ... more",7/29/14,The Feinstein Institute for Medical Research,R01MH102318,University Of Maryland Baltimore,7/16/14,4/30/19,748813,"Anil K Malhotra, Aristotle Voineskos and Robert W. Buchanan",531,322,209,lab,7/29/14,7/16/14,4/30/19,0.606403013,0.393596987,2014,7,16,12,14
207,279,Neurobehavioral Assessments of RDoC Domains to Detect Preschool Mood Disorders,https://nda.nih.gov/edit_collection.html?id=2280,"Childhood mood disorders represent a significant public health concern, with 6 to 11% of the population suffering from symptomology. Among those affected, 70% will have a recurrence during childhood and/or adolescence, and 50% will continue to experience symptoms in adulthood. These patterns of chronicity suggest that mental health problems observed later in life often have identifiable markers during early childhood. Therefore, early identification and intervention is critical. The NIH has put forth ... more",6/11/15,University of Michigan,R03MH102648,University Of Michigan At Ann Arbor,8/1/14,9/30/16,166783,Katherine Rosenblum and Kate Fitzgerald,168,42,126,lab,6/11/15,8/1/14,9/30/16,0.25,0.75,2014,8,1,12,15
208,337,Neural networks for attention to internal and external sensory cues in ASD,https://nda.nih.gov/edit_collection.html?id=2358,"Altered responsiveness to basic sensory input is an under-studied symptom in autism spectrum disorders (ASD) that likely has far-reaching effects on development, although these effects are not well understood. While the term sensory typically connotes stimuli external to the body, there is copious sensory information within the body as well, including visceral and proprioceptive signals. Hypo-responsiveness to external sensory stimuli shows very strong association with core clinical symptoms, and ... more",3/15/16,Vanderbilt University Medical Center,R01MH102272,Vanderbilt University,8/7/14,7/31/24,2359128,Carissa Cascio,313,235,78,lab,3/15/16,8/7/14,7/31/24,0.750798722,0.249201278,2014,8,7,12,16
209,283,Integrity and Dynamic Processing Efficiency of Networks in ASD,https://nda.nih.gov/edit_collection.html?id=2285,"A growing functional connectivity MRI (fcMRI) and diffusion tensor imaging (DTI) literature suggests that cognitive, socio communicative, and sensori motor impairments in autism spectrum disorders (ASD) are associated with impaired brain network connectivity. However few ASD studies to date have combined measures of functional and anatomical connectivity. Even more importantly, there are no studies combining these with measures of dynamic processing, as provided by magnetoencephalography (MEG). We ... more",12/9/14,San Diego State University,R01MH101173,San Diego State University,8/10/14,4/30/21,3200363,Ralph-Axel Mueller,70,55,15,lab,12/9/14,8/10/14,4/30/21,0.785714286,0.214285714,2014,8,10,12,17
210,290,Molecular Mechanisms of Atypical Habituation in Autism Spectrum Disorders,https://nda.nih.gov/edit_collection.html?id=2292,"This project is designed to evaluate the efficacy of a novel imaging, biochemical, and behavioral approach for detecting autism spectrum disorder (ASD) and discovering mechanisms associated with ASD symptomology. Although considerable knowledge has been gained, the lack of reliable predictors during the first year of life remains a major impediment to implementing effective early interventions in children at-risk for ASD. The heterogeneity in ASD renders it unlikely that one specific biomarker will ... more",8/17/15,University of Washington,R01MH104313,University Of Washington,8/15/14,5/31/21,2371548,Natalia Kleinhans,146,127,19,lab,8/17/15,8/15/14,5/31/21,0.869863014,0.130136986,2014,8,15,12,18
211,180,Services to enhance social functioning in adults with autism spectrum disorder,https://nda.nih.gov/edit_collection.html?id=2112,"This application is submitted in response to RFA-MH-14-102 (Pilot Studies of Services Strategies for Adults with ASD), and seeks support to develop and test a service strategy to enhance social functioning in adults with autism spectrum disorder (ASD). Social cognition and social interaction difficulties, the hallmark deficits of ASD, usually persist into adulthood, markedly impairing the ability of individuals to function in family, educational, work, and community settings, and resulting in a host ... more",9/19/14,University of Pennsylvania,R34MH104407,University Of Pennsylvania,8/18/14,7/31/18,739418,Edward S. Brodkin,34,28,6,lab,9/19/14,8/18/14,7/31/18,0.823529412,0.176470588,2014,8,18,12,19
212,188,Adapting a Parent Advocacy Program to Improve Transition for Youth With Autism,https://nda.nih.gov/edit_collection.html?id=2120,"In the proposed research, we first adapt an existing parent advocacy training program (the Volunteer Advocacy Project, or VAP) to meet the needs of families of youth with autism spectrum disorders (ASD) who are transitioning to adulthood. In a randomly assigned, wait-list control design with 6- and 12-month follow-ups, we then investigate the efficacy of this revised Volunteer Advocacy Project-Transition (or VAP-T). Despite poor outcomes for young adults with ASD and the general inaccessibility of ... more",9/19/14,Vanderbilt University,R34MH104428,Vanderbilt University,8/20/14,7/31/19,708795,Julie L. Taylor,44,37,7,lab,9/19/14,8/20/14,7/31/19,0.840909091,0.159090909,2014,8,20,12,20
213,184,Improving Transition Outcomes in ASD using COMPASS,https://nda.nih.gov/edit_collection.html?id=2116,"This application responds to the identified need for developing and testing a model for transition to adult supports and services for individuals with autism spectrum disorders (ASD) that prevents lapses in services and enhances functional life outcomes. The proposal also addresses concerns raised by the Interagency Autism Coordinating Committee of a ""critical lack of tested interventions for adolescents and young adults"". Although federal education law mandates that public schools provide transition ... more",9/19/14,University of Kentucky,R34MH104208,University Of Kentucky,8/22/14,7/31/17,261750,Lisa A. Ruble,20,18,2,lab,9/19/14,8/22/14,7/31/17,0.9,0.1,2014,8,22,12,21
214,181,Addressing systemic health disparities in early ASD identification and treatment,https://nda.nih.gov/edit_collection.html?id=2113,"The goal of the proposed work is to implement a system-level intervention to (a) improve early detection of autism spectrum disorders (ASD) and (b) increase early access to autism specific early intervention services, especially for children who often are not given the known benefits of early intervention services. The proposed study builds on a funded multi-stage screening study that is currently being implemented in 3 Early Intervention programs serving children in the Circle of Promise, a Boston ... more",9/19/14,University of Massachusetts,R01MH104400,University Of Massachusetts Boston,8/25/14,6/30/19,3307385,Alice S. Carter,289,204,85,lab,9/19/14,8/25/14,6/30/19,0.705882353,0.294117647,2014,8,25,13,1
215,182,Early identification and service linkage for urban children with autism,https://nda.nih.gov/edit_collection.html?id=2114,"Emerging evidence demonstrates that Autism Spectrum Disorder (ASD) can be reliably diagnosed by age two, and that early identification and intervention can improve outcomes. Low-income and minority children with ASD, however, are diagnosed later and experience greater delays in service provision than their white and more financially advantaged peers. Feasible, culturally appropriate interventions with broad scale-up potential are necessary to reduce this disparity. This R01 application builds upon ... more",9/19/14,Boston University,R01MH104355,Boston University Medical Campus,8/25/14,6/30/19,1990360,Emily Feinberg,168,118,50,lab,9/19/14,8/25/14,6/30/19,0.702380952,0.297619048,2014,8,25,13,2
216,183,Detection of ASD at the 1st birthday as standard of care: The Get SET Early Model,https://nda.nih.gov/edit_collection.html?id=2115,"We previously demonstrated that our early intervention model system, which was centered on using the CSBS to screen all babies at the 1-year check-up as standard of care, resulted in a mean age of 12 months for screening, 14 months for evaluation, and 18 months for treatment participation. These are far younger ages than is common in the U.S. Our 3-stage model system, Get SET (S=Screen; E=Evaluate; T=Treat) Early, screened >10,000 1 year olds in our first trial run detecting over 100 ASD and other ... more",9/19/14,University of California San Diego,R01MH104446,"University Of California, San Diego",8/25/14,6/30/19,4540599,Karen L. Pierce,1234,776,458,lab,9/19/14,8/25/14,6/30/19,0.628849271,0.371150729,2014,8,25,13,3
217,187,A Screen-Refer-Treat (SRT) Model to Promote Earlier Access to ASD Intervention,https://nda.nih.gov/edit_collection.html?id=2119,"Although caregivers often become concerned about their child by 17-19 months of age, children do not typically receive a diagnosis of autism spectrum disorder (ASD) until they are 4.5 years old, or older for Hispanic families. It is now well documented that early participation in ASD-specialized intervention can lead to significant improvements in skills and behavior for toddlers with ASD. However, despite the availability of publicly funded Part C early intervention (EI) services, long waits for ... more",9/19/14,University of Washington,R01MH104302,University Of Washington,8/25/14,6/30/19,3450370,Wendy L. Stone,479,271,208,lab,9/19/14,8/25/14,6/30/19,0.565762004,0.434237996,2014,8,25,13,4
218,189,Mobilizing Community Systems to Engage Families in Early ASD Detection & Services,https://nda.nih.gov/edit_collection.html?id=2121,The American Academy of Pediatrics recommends screening all children for autism spectrum disorder (ASD) at 18 and 24 months because research indicates that earlier intervention maximizes children's outcomes. The earliest signs of ASD are delays in social communication milestones that appear in the first 2 years and yet most children are not diagnosed until 4-5 years of age. Underserved families are identified even later and significantly underrepresented in intervention research. It is vitally important ... more,9/19/14,Florida State University,R01MH104423,Florida State University,8/25/14,6/30/21,10439836,Amy Wetherby,189,132,57,lab,9/19/14,8/25/14,6/30/21,0.698412698,0.301587302,2014,8,25,13,5
219,168,Oscillatory Measures of Number and Precision in Working Memory,https://nda.nih.gov/edit_collection.html?id=2097,"The core goal of the proposed research is to better characterize the neural signals that underlie the capacity limits in human working memory. This memory system is a core part of most cognitive processes, and capacity in this system is correlated with fluid intelligence and scholastic achievement. Because disruptions of working memory are common in prevalent clinical disorders such as ADHD and schizophrenia, a better understanding of the neural mechanisms of this system will have a beneficial impact ... more",7/29/14,University of Chicago,R01MH087214,University Of Chicago,9/1/14,5/31/24,5252424,Edward Awh,281,151,130,lab,7/29/14,9/1/14,5/31/24,0.537366548,0.462633452,2014,9,1,13,6
220,179,"Supported Employment, Cognitive Enhancement, Social Skills Program for ASD Adult",https://nda.nih.gov/edit_collection.html?id=2111,"The increasing population of adults with ASD is described as a challenging public health issue. Longitudinal studies of intellectually able adults with autism have shown consistent and persistent deficits across cognitive, social, and vocational domains, indicating a significant need for effective treatments for these functional disabilities. The cognitive and social skill deficits that are core features of the autism diagnosis have been identified as major challenges to employment success for adults ... more",9/19/14,Rady Childrens Hospital - San Diego,R34MH104289,Rady Childrens Hospital - San Diego,9/1/14,7/31/18,795431,Mary J. Baker,48,37,11,lab,9/19/14,9/1/14,7/31/18,0.770833333,0.229166667,2014,9,1,13,7
221,185,Transition to Medication Self-Management for Youth with ASD & Co-Occurring ADHD,https://nda.nih.gov/edit_collection.html?id=2117,"Autism Spectrum Disorder (ASD) affects roughly 1 in 88 US children. Service delivery can be complicated during transition from youth to adulthood, when youth must begin to manage their own healthcare. Essential skills include making appointments, communicating with providers, and understanding and following medication regimens. Medication regimens may be especially important to the 30-50% of youth with ASD who also experience symptoms of Attention-Deficit/Hyperactivity Disorder (ADHD). These youth ... more",9/19/14,American Academy of Pediatrics,R34MH104231,American Academy Of Pediatrics,9/1/14,7/31/18,653218,Laura P. Shone,31,25,6,lab,9/19/14,9/1/14,7/31/18,0.806451613,0.193548387,2014,9,1,13,8
222,186,Multi-family Group Psychoeducation for Young Adults with ASD,https://nda.nih.gov/edit_collection.html?id=2118,"Autism spectrum disorders (ASDs) are developmental disabilities that affect approximately 1 in 88 children in the US (CDC, 2012). Although there is evidence of reduction in severity of symptoms from childhood to adulthood, ASD is a lifelong disability requiring ongoing support. Following high school exit, there is a significant loss of services for young adults with ASD, with many having no meaningful daytime activities. In our previous research, we have found that over 25% of adults with ASD who ... more",9/19/14,University of Wisconsin-Madison,R34MH104308,University Of Wisconsin-Madison,9/1/14,7/31/18,677250,Leann Smith,26,19,7,lab,9/19/14,9/1/14,7/31/18,0.730769231,0.269230769,2014,9,1,13,9
223,190,STEPS: Stepped Transition in Education Program for Students with ASD,https://nda.nih.gov/edit_collection.html?id=2122,"Young adults who have Autism Spectrum Disorder (ASD) without co-occurring intellectual impairment face a fairly unique set of challenges as they transition out of secondary school. These students are often quite capable of succeeding in higher education and many of them have interest in pursuing advanced degrees, but the nature of their disability and associated deficits (e.g., poor time management and poor self-regulation) may impede success. Individualized, appropriately timed, and developmentally ... more",9/19/14,Virginia Polytechnic Institute and State University,R34MH104337,Virginia Polytechnic Inst And St Univ,9/1/14,7/31/18,666496,Susan W. White,82,58,24,lab,9/19/14,9/1/14,7/31/18,0.707317073,0.292682927,2014,9,1,13,10
224,278,Neural Effects of Sustained Oxytocin Treatment in Children with Autism,https://nda.nih.gov/edit_collection.html?id=2279,"This project aims to investigate the impact of oxytocin treatment on the neural systems underlying social impairments in children with ASD. We are participating in an NIH ACE network grant to conduct a definitive randomized, double-blind, placebo-controlled clinical trial of sustained intranasal oxytocin treatment on reciprocal social behaviors in children with ASD. This presents a unique opportunity to take advantage of existing infrastructure that will enable us to provide important information ... more",6/9/15,Mount Sinai School of Medicine,R21HD081790,Icahn School Of Medicine At Mount Sinai,9/1/14,8/31/17,441739,Ting Wang,13,13,0,lab,6/9/15,9/1/14,8/31/17,1,0,2014,9,1,13,11
225,307,Efficacy of Parent-implemented Treatment in Infant Siblings of Children With ASD,https://nda.nih.gov/edit_collection.html?id=2321,"One way to prevent or reduce the severity of social and linguistic communication disorders in children at high risk for these disorders (e.g., younger siblings of children with autism spectrum disorders, Sibs-ASD) is to treat them at an age when the brain is still developing (i.e., infancy). Current screening methods over-identify which Sibs-ASD need expensive treatments. An ""Incremental Treatment Approach"" (1) uses a cost-effective treatment with all risk group members, (2) identifies those who ... more",8/21/15,Vanderbilt University,R01DC013767,Vanderbilt University,9/1/14,1/31/20,3244127,Paul Yoder,87,48,39,lab,8/21/15,9/1/14,1/31/20,0.551724138,0.448275862,2014,9,1,13,12
226,246,Change-sensitive Measurement of Emotion Dysregulation in ASD,https://nda.nih.gov/edit_collection.html?id=2203,Data collected in development of the Emotion Dysregulation Inventory battery of assessments.,2/27/15,University of Pittsburgh School of Medicine,R01HD079512,University Of Pittsburgh At Pittsburgh,9/10/14,2/28/25,2973862,Carla Mazefsky,2252,1381,871,lab,2/27/15,9/10/14,2/28/25,0.613232682,0.386767318,2014,9,10,13,13
227,280,Predictors of Cognitive Development in Autism Spectrum Disorder,https://nda.nih.gov/edit_collection.html?id=2281,"Existing studies of middle childhood suggest that some children with ASD show significant improvements in IQ and other aspects of cognitive functioning during this period, while others stabilize or fall further behind. With the increased availability of intensive early intervention, it is not clear that findings from these older studies are applicable to children with ASD now. Given that cognitive abilities developed through early and middle childhood provide a critical foundation for later competencies, ... more",6/15/15,MIND Institute,R01MH103284,University Of California At Davis,9/11/14,4/30/25,3358312,Marjorie Solomon,219,172,47,lab,6/15/15,9/11/14,4/30/25,0.785388128,0.214611872,2014,9,11,13,14
228,358,"Rett syndrome, MECP2 Duplications, and Rett-related Disorders Natural History",https://nda.nih.gov/edit_collection.html?id=2388,"This Collection is from a multi-institutional group of investigators with longstanding interest in Rett syndrome (RTT) and RTT-related disorders continues a Rare Disease Clinical Research Center (RDCRC) within the Rare Diseases Clinical Research Network. This RDCRC will focus on three distinct disorders: RTT, MECP2 duplication disorder, and the RTT-related disorders including CDKL5, FOXG1, and individuals with MECP2 mutations but lacking clinical criteria for RTT. The near-term potential for meaningful ... more",6/21/16,University of Alabama,U54HD061222,University Of Alabama At Birmingham,9/17/14,7/31/20,5096669,Alan Percy,875,113,762,lab,6/21/16,9/17/14,7/31/20,0.129142857,0.870857143,2014,9,17,13,15
229,308,Electrophysiologic Studies of Language Impairment in ASD (Years 6-10),https://nda.nih.gov/edit_collection.html?id=2322,"""Magnetoencephalographic (MEG) studies examining brain activity in children with autism spectrum disorders (ASD), including published studies from this R01s previous funding period, have identified functional markers",1/6/15,Children's Hospital of Philadelphia,R01DC008871,Childrens Hosp Of Philadelphia,9/18/14,2/28/21,1597494,Timothy Roberts,2,0,2,lab,1/6/15,9/18/14,2/28/21,0,1,2014,9,18,13,16
230,349,Mechanisms of neocortical and sensory hyperexcitability in Fragile X Syndrome,https://nda.nih.gov/edit_collection.html?id=2373,"Sensory hypersensitivity is commonly seen in FXS patients and the FXS mouse model - the Fmr1 knockout KO. Recent data suggests that this abnormality stems from hyperexcitability in sensory circuits. We have established that cortical microcircuits are hyperexcitable in the Fmr1 KO mouse model, and that sensory responses are enhanced in Fmrl KO mice and FXS patients. Thus, investigation of sensory sensitivities is clinically relevant, but perhaps more important is the promise of sensory system studies ... more",5/4/16,UT Southwestern Medical Center,U54HD082008,Ut Southwestern Medical Center,9/22/14,5/31/19,5311333,Kimberly Huber,306,181,125,lab,5/4/16,9/22/14,5/31/19,0.591503268,0.408496732,2014,9,22,13,17
231,350,Modifiers of FMR1-associated Disorders: Appplication of High Throughput Technologies,https://nda.nih.gov/edit_collection.html?id=2380,"The goals of our Center, ""Modifiers of FMR1-associated disorders: application of high throughput technologies"", are targeted to the RFA research area to Advance the understanding of the pathophysiology of FMR1 Related Conditions. The completion of the proposed aims from the three research projects will lead to the identification of the genetic basis of variable expressivity or incomplete penetrance of FMR1- associated conditions. Project A will focus on the variable expression of epilepsy among boys ... more",5/12/16,Emory University,U54NS091859,Emory University,9/22/14,5/31/21,9127699,Stephen T. Warren,531,306,225,lab,5/12/16,9/22/14,5/31/21,0.576271186,0.423728814,2014,9,22,13,18
232,603,Early Detection of Autism Spectrum Disorder,https://nda.nih.gov/edit_collection.html?id=2666,"Early detection and intervention for children with ASD leads to better outcomes (e.g., Dawson et al., 2010). Intervention depends on accurate identification; therefore, early screening and diagnosis are crucial (Filipek et al., 1999). The Modified Checklist for Autism in Toddlers (M-CHAT) has become the most widely used early autism screening tool for children 16-30 mos. However, though the M-CHAT and other screening instruments have been available for 10 years or more, and universal screening has ... more",6/2/17,Drexel University,R01HD039961,Drexel University,9/25/14,8/31/20,3008277,Diana L. Robins,138,85,53,lab,6/2/17,9/25/14,8/31/20,0.615942029,0.384057971,2014,9,25,13,19
233,261,"Developmental Synaptopathies Associated with TSC, PTEN and SHANK3 Mutations",https://nda.nih.gov/edit_collection.html?id=2251,Autism spectrum disorder and intellectual disability (ASD/ID) are severe neurodevelopmental conditions with early childhood onset. Advances in genetics have illustrated that ASD/ID represent a spectrum of rare disorders and that mutations in hundreds of genes may result in susceptibility to ASD/ID. This heterogeneity represents significant challenges but at the same time unique opportunities for research in the field of ASD/ID. Many of the genes implicated in ASD/ID appear to converge on a few common ... more,1/6/15,Boston Children's Hospital,U54NS092090,Boston Childrens Hospital,9/30/14,7/31/20,6290601,Mustafa Sahin,288,181,107,lab,1/6/15,9/30/14,7/31/20,0.628472222,0.371527778,2014,9,30,13,20
234,240,Activity as an endophenotype for genetic studies,https://nda.nih.gov/edit_collection.html?id=2196,"The NIMH Research Domain Criteria (RDoC) Project provides a framework for the integration of basic and translational research, by defining basic dimensions of function that cut across disorders. Circadian and sleep disturbances, observed in several highly incapacitating and debilitating mental disorders, represent the key constructs within the Arousal and Regulatory system RDoC Domain. The study of circadian and sleep disturbances in psychiatric populations is difficult and contradictory results ... more",4/30/15,University of Pennsylvania,R21MH103963,University Of Pennsylvania,11/10/14,10/31/17,440000,Maja Bucan,138,67,71,lab,4/30/15,11/10/14,10/31/17,0.485507246,0.514492754,2014,11,10,13,21
696,197,Recurrent de novo mutations implicate novel genes underlying simplex autism risk,https://nda.nih.gov/edit_collection.html?id=2130,"Autism spectrum disorder (ASD) is a common disorder with a strong and complex genetic component. Here, we resequence 64 candidate neurodevelopmental disorder risk genes in almost 6,000 samples and identify novel genes associated with ASD.",11/24/14,University of Washington,,,11/24/14,,,Evan Eichler,6409,4517,1892,lab,11/24/14,11/24/14,,0.704790139,0.295209861,2014,11,24,14,1
783,23,Derivation of Quality Measures for Structural Images by Neuroimaging Pipelines,https://nda.nih.gov/study.html?id=331,"Using the National Database for Autism Research cloud platform, MRI data were analyzed using neuroimaging pipelines that included packages available as part of the Neuroimaging Informatics Tools and Resources Clearinghouse (NITRC) Computational Environment to derive standardized measures of MR image quality. Structural QA was performed according to Haselgrove, et al (http://journal.frontiersin.org/Journal/10.3389/fninf.2014.00052/abstract) to provide values for Signal to Noise (SNR) and Contrast ... more",12/2/14,Burkhart Center for Autism Education and Research,,,12/2/14,,,"Richman DM; Barnard-Brak L, Bosch A, Thompson S, Grubb L, Abby L",423,358,65,paper,12/2/14,12/2/14,,0.846335697,0.153664303,2014,12,2,14,2
784,24,Derivation of Brain Structure Volumes from MRI Neuroimages hosted by NDAR using NITRC-CE,https://nda.nih.gov/study.html?id=332,A draft publication is in progress. GitHub repository with code for working with NDAR Data is available here: https://github.com/chaselgrove/ndar **Note this study is ongoing; additional may be added.**,12/2/14,Burkhart Center for Autism Education and Research,,,12/2/14,,,"Richman DM; Barnard-Brak L, Bosch A, Thompson S, Grubb L, Abby L",356,308,48,paper,12/2/14,12/2/14,,0.865168539,0.134831461,2014,12,2,14,3
785,25,Derivation of Brain Structure Volumes from MRI Neuroimages hosted by NDAR using LONI Workflows,https://nda.nih.gov/study.html?id=333,"LONI utilized de-identified data from NDAR's cloud and a LONI Pipeline (pipeline.loni.usc.edu) processing workflow to perform a secondary structural MRI examination. The workflow used in this study pulls data from and provided by NDAR to an instance on the LONI compute cluster, aligns data to a standard orientation using FSLreorient2stsd, and undergoes further image processing to eventually identify, extract, and analyze cortical and sub-cortical structures in different MRI brain volumes. Two methods ... more",12/2/14,Burkhart Center for Autism Education and Research,,,12/2/14,,,"Richman DM; Barnard-Brak L, Bosch A, Thompson S, Grubb L, Abby L",700,449,251,paper,12/2/14,12/2/14,,0.641428571,0.358571429,2014,12,2,14,4
786,26,Complete Realignment of Whole Exome Sequencing data from 2415 families in SSC Collection,https://nda.nih.gov/study.html?id=334,"Whole Exome Sequencing has been completed for ~ 2500 families from the Simons Simplex Collection. Sequencing was performed at three individual sequencing centers with original data submitted to NDAR Collections 1878, 1895, and 1936; subsets of these data have been analyzed by various methods and published. This study represents an effort to realign sequencing data from all three collection sin a uniform manner using the latest toolchains and algorithms available, which can be used as a resource for ... more",12/2/14,Burkhart Center for Autism Education and Research,,,12/2/14,,,"Richman DM; Barnard-Brak L, Bosch A, Thompson S, Grubb L, Abby L",9047,5341,3706,paper,12/2/14,12/2/14,,0.590361446,0.409638554,2014,12,2,14,5
787,27,De novo mutations revealed by whole exome sequencing are strongly associated with autism,https://nda.nih.gov/study.html?id=336,"Multiple studies have confirmed the contribution of rare de novo copy number variations (CNVs) to the risk for Autism Spectrum Disorders (ASD). While de novo single nucleotide variants (SNVs) have been identified in affected individuals, their contribution to risk has yet to be clarified. Specifically, the frequency and distribution of these mutations has not been well characterized in matched unaffected controls, data that are vital to the interpretation of de novo coding mutations observed in probands. ... more",12/2/14,Burkhart Center for Autism Education and Research,,,12/2/14,,,"Richman DM; Barnard-Brak L, Bosch A, Thompson S, Grubb L, Abby L",927,512,415,paper,12/2/14,12/2/14,,0.55231931,0.44768069,2014,12,2,14,6
788,28,Autism spectrum disorder: interaction of air pollution with the MET receptor tyrosine kinase gene.,https://nda.nih.gov/study.html?id=340,Background: Independent studies report association of autism spectrum disorder with air pollution exposure and a functional promoter variant (rs1858830) in the MET receptor tyrosine kinase (MET) gene. Toxicologic data find altered brain Met expression in mice after prenatal exposure to a model air pollutant. Our objective was to investigate whether air pollution exposure and MET rs1858830 genotype interact to alter ASD risk. Methods: We studied 252 cases of autism spectrum disorder and 156 ... more,12/2/14,Burkhart Center for Autism Education and Research,,,12/2/14,,,"Richman DM; Barnard-Brak L, Bosch A, Thompson S, Grubb L, Abby L",209,166,43,paper,12/2/14,12/2/14,,0.794258373,0.205741627,2014,12,2,14,7
789,29,Coexpression networks implicate human midfetal deep cortical projection neurons in the pathogenesis of autism.,https://nda.nih.gov/study.html?id=341,"NDAR Data for this study consist of Whole Exome sequencing for the additional 56 families from SSC collection. Other Whole Exome sequencing data and results used in this study were originally published elsewhere. NDAR Studies 340, 320, and 317 describe the data published in Iossifov et al., 2012; Neale et al., 2012; O'Roak et al., 2012b, respectively, as cited in this publication. The RNA-Seq data from this publication are available from NCBI at the given BioProject accession. Autism spectrum ... more",12/2/14,Burkhart Center for Autism Education and Research,,,12/2/14,,,"Richman DM; Barnard-Brak L, Bosch A, Thompson S, Grubb L, Abby L",224,136,88,paper,12/2/14,12/2/14,,0.607142857,0.392857143,2014,12,2,14,8
790,30,Derivation of Brain Structure Volumes from MRI Neuroimages hosted by NDAR using C-PAC pipeline and ANTs,https://nda.nih.gov/study.html?id=342,"An automated pipeline was developed to reference Neuroimages hosted by the National Database for Autism Research (NDAR) and derive volumes for distinct brain structures using Advanced Normalization Tools (ANTs) and the Configurable-Pipeline for the Analysis of Connectomes (C-PAC) platform. This pipeline utilized the ANTs cortical thickness methodology discuessed in ""Large-Scale Evaluation of ANTs and Freesurfer Cortical Tchickness Measurements"" [http://www.ncbi.nlm.nih.gov/pubmed/24879923] to extract ... more",12/2/14,Burkhart Center for Autism Education and Research,,,12/2/14,,,"Richman DM; Barnard-Brak L, Bosch A, Thompson S, Grubb L, Abby L",1428,1217,211,paper,12/2/14,12/2/14,,0.852240896,0.147759104,2014,12,2,14,9
791,31,Transcriptional consequences of 16p11.2 deletion and duplication in mouse cortex and multiplex autism families,https://nda.nih.gov/study.html?id=343,"Publication Abstract: Reciprocal copy number variation (CNV) of a 593 kb region of 16p11.2 is a common genetic cause of autism spectrum disorder (ASD), yet it is not completely penetrant and can manifest in a wide array of phenotypes. To explore its molecular consequences, we performed RNA-sequencing of cerebral cortex from mouse models with CNV of the syntenic 7qF3 region, and lymphoblast lines from 34 members of seven multiplex ASD families harboring the 16p11.2 CNV. Expression of all genes ... more",12/2/14,Burkhart Center for Autism Education and Research,,,12/2/14,,,"Richman DM; Barnard-Brak L, Bosch A, Thompson S, Grubb L, Abby L",50,29,21,paper,12/2/14,12/2/14,,0.58,0.42,2014,12,2,14,10
792,32,"Genotypes of Swedish subjects used in ""Most genetic risk for autism resides with common variation"" study",https://nda.nih.gov/study.html?id=346,"A key component of genetic architecture is the allelic spectrum influencing trait variability. For autism spectrum disorder (herein termed autism), the nature of the allelic spectrum is uncertain. Individual risk-associated genes have been identified from rare variation, especially de novo mutations. From this evidence, one might conclude that rare variation dominates the allelic spectrum in autism, yet recent studies show that common variation, individually of small effect, has substantial impact ... more",12/2/14,Burkhart Center for Autism Education and Research,,,12/2/14,,,"Richman DM; Barnard-Brak L, Bosch A, Thompson S, Grubb L, Abby L",548,388,160,paper,12/2/14,12/2/14,,0.708029197,0.291970803,2014,12,2,14,11
793,33,Variant Recalling (GATK) from Whole Exome Sequencing data for 2415 families in SSC Collection,https://nda.nih.gov/study.html?id=348,"Whole Exome Sequencing has been completed for ~ 2500 families from the Simons Simplex Collection. Sequencing was performed at three individual sequencing centers with original data submitted to NDAR Collections 1878, 1895, and 1936; subsets of these data have been analyzed by various methods and published. This study represents an effort to call and annotate SNPs and Indels on data from all three collections in a uniform manner using the latest toolchains and algorithms available. Variant calls ... more",12/2/14,Burkhart Center for Autism Education and Research,,,12/2/14,,,"Richman DM; Barnard-Brak L, Bosch A, Thompson S, Grubb L, Abby L",8970,5295,3675,paper,12/2/14,12/2/14,,0.590301003,0.409698997,2014,12,2,14,12
794,35,Derivation of Quality Measures for Time-Series Images by Neuroimaging Pipelines,https://nda.nih.gov/study.html?id=350,"Using the National Database for Autism Research cloud platform, MRI data were analyzed using neuroimaging pipelines that included packages available as part of the Neuroimaging Informatics Tools and Resources Clearinghouse (NITRC) Computational Environment to derive standardized measures of MR image quality. Time series QA was performed according to Friedman, et al. (http://www.ncbi.nlm.nih.gov/pubmed/16952468) providing values for Signal to Noise Ratio that can be compared to other subjects.",12/2/14,Burkhart Center for Autism Education and Research,,,12/2/14,,,"Richman DM; Barnard-Brak L, Bosch A, Thompson S, Grubb L, Abby L",357,313,44,paper,12/2/14,12/2/14,,0.8767507,0.1232493,2014,12,2,14,13
795,36,Excess of rare inherited truncating mutations in autism,https://nda.nih.gov/study.html?id=353,"In order to quantify the effect of private, inherited mutations on autism risk, we generated a callset of both inherited and de novo single nucleotide variants (SNVs) and copy number variants (CNVs) across 2,377 Simons Simplex Collection families. The publically deposited dataset includes 1,786 parents-child-unaffected sibling ""quads"" allowing us to compare burden of inherited and de novo mutations between affected and unaffected siblings in simplex autism families. We find that private, inherited ... more",12/2/14,Burkhart Center for Autism Education and Research,,,12/2/14,,,"Richman DM; Barnard-Brak L, Bosch A, Thompson S, Grubb L, Abby L",8911,5259,3652,paper,12/2/14,12/2/14,,0.590169453,0.409830547,2014,12,2,14,14
724,276,A Phase 2a Study to Evaluate the Kappa Opioid Receptor As a Target for the Treatment of Mood and Anxiety Spectrum Disorders by Evaluation of Whether LY2456302 Engages Key Neural Circuitry Related to the Hedonic Response,https://nda.nih.gov/edit_collection.html?id=2277,"The available treatment for patients with mood and anxiety disorders have significant limitations (Rush, 2007; Denys and de Geus, 2005). There is a need to develop new treatments for people with these disorders. Many research studies carried out in animals and a few preliminary studies carried out in humans suggest that medications which block kappa opioid receptors (KOR) have potential for being effective new treatments for patients with mood and anxiety spectrum disorders. These medications have ... more",12/9/14,Duke University,,,12/9/14,,,Andrew Krystal,163,60,103,lab,12/9/14,12/9/14,,0.36809816,0.63190184,2014,12,9,14,15
796,37,Cryptic and complex chromosomal aberrations in early onset neuropsychiatric disorders,https://nda.nih.gov/study.html?id=357,"Structural variation (SV) is a significant component of the genetic etiology of both neurodevelopmental and psychiatric disorders; however, routine guidelines for clinical genetic screening have been established only in the former category. Genome-wide chromosomal microarray (CMA) can detect genomic imbalances such as copy-number variants (CNVs), but balanced chromosomal abnormalities (BCAs) still require karyotyping for clinical detection. Moreover, submicroscopic BCAs and subarray threshold CNVs ... more",1/2/15,Burkhart Center for Autism Education and Research,,,1/2/15,,,"Richman DM; Barnard-Brak L, Bosch A, Thompson S, Grubb L, Abby L",32,22,10,paper,1/2/15,1/2/15,,0.6875,0.3125,2015,1,2,14,16
797,38,Psychometric Analysis of the Social Communication Questionnaire Using an Item-Response Theory Framework: Implications for the Use of the Lifetime and Current Forms,https://nda.nih.gov/study.html?id=358,"The Social Communication Questionnaire (SCQ) was developed as a screener of Autism Spectrum Disorder (ASD). To date, the majority of the SCQ utility studies focused on its external validity (e.g., ROC curve analyses), but very few have addressed the internal validity issues. With samples consisting of 2,134 individuals available from the National Database for Autism Research (NDAR), the current study examined the factor structure, item-level characteristics, and measurement equivalence of the SCQ ... more",1/2/15,Burkhart Center for Autism Education and Research,,,1/2/15,,,"Richman DM; Barnard-Brak L, Bosch A, Thompson S, Grubb L, Abby L",2054,1653,401,paper,1/2/15,1/2/15,,0.804771178,0.195228822,2015,1,2,14,17
798,39,Predicting Health Utilities for Children With Autism Spectrum Disorders,https://nda.nih.gov/study.html?id=360,Comparative effectiveness of interventions for children with autism spectrum disorders (ASDs) that incorporates costs is lacking due to the scarcity of information on health utility scores or preference-weighted outcomes typically used for calculating quality-adjusted life years (QALYs). This study created algorithms for mapping clinical and behavioral measures for children with ASDs to health utility scores. The algorithms could be useful for estimating the value of different interventions and treatments ... more,1/2/15,Burkhart Center for Autism Education and Research,,,1/2/15,,,"Richman DM; Barnard-Brak L, Bosch A, Thompson S, Grubb L, Abby L",181,155,26,paper,1/2/15,1/2/15,,0.856353591,0.143646409,2015,1,2,14,18
799,40,Copy Number Variants from SSC Collection ~ 2500 families by two Methods (XHMM and Conifer),https://nda.nih.gov/study.html?id=361,"XHMM was run on a set of realigned BAM files from the SSC collection (see NDAR Study 334 for BAM files) using the attached scripts. These scripts calculate depth of coverage using GATK, pull the GATK output from an instance on NDAR's cloud, merge the output of GATK into a single matrix, process the read depth matrix (filter, center), normalize the matrix using principal component analysis (PCA), process the normalized read depth matrix (filter, z-score), run a hidden markov model (HMM) on this ... more",1/2/15,Burkhart Center for Autism Education and Research,,,1/2/15,,,"Richman DM; Barnard-Brak L, Bosch A, Thompson S, Grubb L, Abby L",9035,5334,3701,paper,1/2/15,1/2/15,,0.59037078,0.40962922,2015,1,2,14,19
722,253,"The efficacy of adjunctive Garcinia mangostana Linn (mangosteen) pericarp for the treatment of Schizophrenia: A double-blind, randomized, placebo controlled trial.",https://nda.nih.gov/edit_collection.html?id=2230,"What arguably makes the most difference to people with mental health problems is the availability of effective treatments. In this context, there has been considerable anguish about both the limited efficacy of established therapeutic agents for schizophrenia, and the failure of industry to develop novel compounds despite massive investment. From atropine and opiates in the neurosciences, digitalis and pseudoephedrine in cardiology, quinine and artemesin in infectious diseases and taxol and vincristine ... more",1/6/15,Deakin University,,,1/6/15,,,Michael Berk,148,99,49,lab,1/6/15,1/6/15,,0.668918919,0.331081081,2015,1,6,14,20
723,258,Comparison of Antipsychotics for Metabolic Problems in Schizophrenia or Schizoaffective Disorder (CAMP),https://nda.nih.gov/edit_collection.html?id=2248,"This study is a multi-site, randomized controlled trial of 215 patients with schizophrenia or schizoaffective disorder treated with olanzapine, quetiapine, or risperidone with a body-mass index (BMI) > 27 and a non-HDL cholesterol >130 (if non-HDL is 130 to 139, then LDL cholesterol must be > 100). After baseline assessments, these patients were randomly assigned to continue treatment with current medication or switch to aripiprazole. Patients were followed for up to 24 weeks. All patients received ... more",1/6/15,,,,1/6/15,,,Scott Stroup,410,249,161,lab,1/6/15,1/6/15,,0.607317073,0.392682927,2015,1,6,14,21
235,260,A feasibility study for prevention and safety training for children with autism,https://nda.nih.gov/edit_collection.html?id=2250,"Children with autism spectrum disorder (ASD) are much more likely to wander or run away from supervision than their typically developing peers; a behavior referred to as elopement. The prevalence of elopement among children with ASD has contributed to the fact that accidents are the leading cause of premature death in this population, with twice the mortality rate of neurotypical peers. The tremendous impact elopement has on the family of a child with ASD, along with life threatening consequences ... more",3/31/15,Emory University School of Medicine,R03HD082436,Emory University,2/1/15,1/31/17,144709,Nathan Call,25,23,2,lab,3/31/15,2/1/15,1/31/17,0.92,0.08,2015,2,1,15,1
800,41,fMRI for affective psychological studies,https://nda.nih.gov/study.html?id=365,"Taking advantage a newly developed dyadic fMRI system, this project studied two brains interactions via eye contact. This is the first direct observation of the dyadic affective states mediated by reciprocal visual stimulation. The dual system activation due to in vivo reciprocity, empathy system and metallization system, are clear evidences, while such systems often are not fully activated by pictorial stimuli. This method offers a direct and quantitative approach to estimate deficiency of Autism ... more",2/12/15,Burkhart Center for Autism Education and Research,,,2/12/15,,,"Richman DM; Barnard-Brak L, Bosch A, Thompson S, Grubb L, Abby L",19,7,12,paper,2/12/15,2/12/15,,0.368421053,0.631578947,2015,2,12,15,2
801,42,Recurrent de novo mutations implicate novel genes underlying simplex autism risk.,https://nda.nih.gov/study.html?id=366,"Autism spectrum disorder (ASD) has a strong but complex genetic component. Here we report on the resequencing of 64 candidate neurodevelopmental disorder risk genes in 5,979 individuals: 3,486 probands and 2,493 unaffected siblings. We find a strong burden of de novo point mutations for these genes and specifically implicate nine genes. These include CHD2 and SYNGAP1, genes previously reported in related disorders, and novel genes TRIP12 and PAX5. We also show that mutation carriers generally have ... more",2/20/15,Burkhart Center for Autism Education and Research,,,2/20/15,,,"Richman DM; Barnard-Brak L, Bosch A, Thompson S, Grubb L, Abby L",6386,4500,1886,paper,2/20/15,2/20/15,,0.704666458,0.295333542,2015,2,20,15,3
718,245,A Double-Blind Trial of Adjunctive Valacyclovir to Improve Cognition in Early Phase Schizophrenia,https://nda.nih.gov/edit_collection.html?id=2202,Schizophrenia is a serious mental illness whose etiology is unknown. Cognitive impairments are a prominent feature of the illness and contribute to the social disability that is common in individuals with the disorder. 1 Currently there are no established treatments for the cognitive impairments associated with the disorder. A previous pilot study found that early course individuals with schizophrenia who were seropositive for the Herpes Simplex Virus 1 (HSV-1) and received adjunctive valacyclovir ... more,2/27/15,Indiana University Bloomington,,,2/27/15,,,Alan Breier,172,125,47,lab,2/27/15,2/27/15,,0.726744186,0.273255814,2015,2,27,15,4
719,247,Ondansetron for Bipolar Disorder and Alcohol Use Disorders,https://nda.nih.gov/edit_collection.html?id=2205,"Bipolar disorder is a severe, persistent, and common psychiatric illness that is associated with a staggering 46% lifetime prevalence of alcohol-related disorders. When present in patients with bipolar disorder, alcohol dependence is associated with numerous adverse consequences including increased hospitalization, poor outcome during hospitalization, violence towards self and others, cognitive impairment and treatment non adherence. Thus, the development of effective treatments for patients with ... more",2/27/15,UT Southwestern Medical Center,,,2/27/15,,,Sherwood Brown,70,42,28,lab,2/27/15,2/27/15,,0.6,0.4,2015,2,27,15,5
720,249,Treatment of Schizophrenia with ltetrahydropalmatine (l-THP): a Novel Dopamine Antagonist with Anti-Inflammatory and Antiprotozoal Activity,https://nda.nih.gov/edit_collection.html?id=2214,"Schizophrenia is a devastating and complex illness, with multiple symptom and behavioral manifestations. Antipsychotic medications are the mainstay of treatment, however, many patients only partially respond to treatment. Treatments have not progressed rapidly, in part, because the underlying etiopathophysiology of the illness is not well understood. To date, all pharmacological treatments approved for the use in schizophrenia involve primary modulation of the dopamine system, but may only be partially ... more",2/27/15,"University of Maryland, Baltimore",,,2/27/15,,,Deanna Kelly,74,50,24,lab,2/27/15,2/27/15,,0.675675676,0.324324324,2015,2,27,15,6
721,250,Targeted alterations in n-3 and n-6 fatty acids for the management of mood variability in the maintenance phase of bipolar disorder,https://nda.nih.gov/edit_collection.html?id=2219,"Bipolar disorder (BD) is a chronic, often disabling illness, and many individuals remain symptomatic despite pharmacotherapy. Significant mood variability often persists throughout the lifespan and predicts relapse, leading to functional impairment. Metabolism of dietary essential polyunsaturated fatty acids has been shown to be upstream of the neuroinflammatory processes that may lead to neurotoxicity and chronicity of illness in BD. Effective treatments for mania share a biological mechanism of ... more",2/27/15,Penn State Health Milton S. Hershey Medical Center,,,2/27/15,,,Erika Saunders,129,25,104,lab,2/27/15,2/27/15,,0.19379845,0.80620155,2015,2,27,15,7
802,43,Loss of delta-catenin function in severe autism,https://nda.nih.gov/study.html?id=367,"Autism is a multifactorial neurodevelopmental disorder affecting more males than females; consequently, under a multifactorial genetic hypothesis, females are affected only when they cross a higher biological threshold. We hypothesize that deleterious variants at conserved residues are enriched in severely affected patients arising from female-enriched multiplex families with severe disease, enhancing the detection of key autism genes in modest numbers of cases. Here we show the use of this strategy ... more",3/3/15,Burkhart Center for Autism Education and Research,,,3/3/15,,,"Richman DM; Barnard-Brak L, Bosch A, Thompson S, Grubb L, Abby L",16,2,14,paper,3/3/15,3/3/15,,0.125,0.875,2015,3,3,15,8
236,269,Inhibitory dysfunction in autism,https://nda.nih.gov/edit_collection.html?id=2266,"Autism spectrum disorder (ASD) is a complex disorder of brain development characterized by difficulties in social interaction, communication, and repetitive behaviors and is often accompanied by disruptions of sensory processing. One recent and potentially unifying neurobiological explanation posits that ASD is caused by disruptions in the excitatory/inhibitory (E/I) balance within the brain. Consistent with the E/I explanation, recent genetic and neuroscience research in animal models suggest that ... more",5/6/15,University of Washington,R01MH106520,University Of Washington,3/15/15,2/28/21,2749865,Scott Murray,85,55,30,lab,5/6/15,3/15/15,2/28/21,0.647058824,0.352941176,2015,3,15,15,9
803,44,Decreased tryptophan metabolism in patients with Autism Spectrum Disorders,https://nda.nih.gov/study.html?id=369,"Background: Autism spectrum disorders (ASDs) are relatively common neurodevelopmental conditions whose biological basis has been incompletely determined. Several biochemical markers have been associated with ASDs, but there is still no laboratory test for these conditions. Methods: We analyzed the metabolic profile of lymphoblastoid cell lines from 137 patients with neurodevelopmental disorders with or without ASDs and 78 normal individuals, using Biolog Phenotype MicroArrays. Results: Metabolic ... more",3/23/15,Burkhart Center for Autism Education and Research,,,3/23/15,,,"Richman DM; Barnard-Brak L, Bosch A, Thompson S, Grubb L, Abby L",100,80,20,paper,3/23/15,3/23/15,,0.8,0.2,2015,3,23,15,10
804,45,"No Evidence for Association of Autism with Rare Heterozygous Point Mutations in Contactin-Associated Protein-Like 2 (CNTNAP2), or in Other Contactin-Associated Proteins or Contactins",https://nda.nih.gov/study.html?id=370,"Contactins and Contactin-Associated Proteins, and Contactin-Associated Protein-Like 2 (CNTNAP2) in particular, have been widely cited as autism risk genes based on findings from homozygosity mapping, molecular cytogenetics, copy number variation analyses, and both common and rare single nucleotide association studies. However, data specifically with regard to the contribution of heterozygous single nucleotide variants (SNVs) have been inconsistent. In an effort to clarify the role of rare point mutations ... more",3/27/15,Burkhart Center for Autism Education and Research,,,3/27/15,,,"Richman DM; Barnard-Brak L, Bosch A, Thompson S, Grubb L, Abby L",4018,2670,1348,paper,3/27/15,3/27/15,,0.664509706,0.335490294,2015,3,27,15,11
805,46,Rare-Variant Extensions of the Transmission Disequilibrium Test: Application to Autism Exome Sequence Data,https://nda.nih.gov/study.html?id=371,"Many population-based rare-variant (RV) association tests, which aggregate variants across a region, have been developed to analyze sequence data. A drawback of analyzing population-based data is that it is difficult to adequately control for population substructure and admixture, and spurious associations can occur. For RVs, this problem can be substantial, because the spectrum of rare variation can differ greatly between populations. A solution is to analyze parent-child trio data, by using the ... more",3/30/15,Burkhart Center for Autism Education and Research,,,3/30/15,,,"Richman DM; Barnard-Brak L, Bosch A, Thompson S, Grubb L, Abby L",564,320,244,paper,3/30/15,3/30/15,,0.567375887,0.432624113,2015,3,30,15,12
700,215,Placebo-Controlled Study of Risperidone for the Treatment of Children and Adolescents With Autism and Negative Behavioral Symptoms,https://nda.nih.gov/edit_collection.html?id=2151,"The primary purpose of this study is to compare the relative safety and efficacy of risperidone and placebo in the treatment of children and adolescents with autistic disorder.HYPOTHESES: (1) Risperidone will be more effective than placebo in reducing impulsive aggression, agitation, self-injurious behavior, and troublesome repetitive behavior associated with autism. (2) Risperidone will result in more sedation (transient) and weight gain than placebo. (3) Patients continued on risperidone will be ... more",3/31/15,,,,3/31/15,,,Michael Aman,163,134,29,lab,3/31/15,3/31/15,,0.82208589,0.17791411,2015,3,31,15,13
701,216,Research Unit on Pediatric Psychopharmacology Anxiety Treatment Study,https://nda.nih.gov/edit_collection.html?id=2152,"To evaluate fluvoxamine in the treatment of children and adolescents with anxiety disorders. Fluvoxamine is a serotonin reuptake inhibitor that is FDA-approved for the treatment of obsessive-compulsive disorder (OCD) in adults and children. Anxiety disorders other than OCD are very common in youth and are not always responsive to psychosocial therapies. Fluvoxamine is an alternative treatment. After a 3-week period of evaluation, patients meeting study entry criteria are randomized to receive either ... more",3/31/15,,,,3/31/15,,,Laurence Greenhill,128,63,65,lab,3/31/15,3/31/15,,0.4921875,0.5078125,2015,3,31,15,14
702,219,Multimodal Treatment Study of Children With ADHD,https://nda.nih.gov/edit_collection.html?id=2155,"This trial is a continuation of the Multimodal Treatment Study of Children with Attention Deficit Hyperactivity Disorder (MTA Study). Continuation Aim 1 is to track the persistence of intervention-related effects as the MTA sample matures into mid-adolescence, including subsequent mental-health and school-related service utilization patterns as a function of MTA treatment experience (treatment assignment) and outcome (degree of treatment success at 14 mo.). Aim 2 is to test specific hypotheses about ... more",3/31/15,,,,3/31/15,,,"Howard Abikoff, Ph.D., L. Eugene Arnold, M.D., Claudia Buss, Ph.D., C. Keith Conners, Ph.D., Glen Elliott, M.D., Jeffery Epstein, Ph.D., Drew Erhardt, PhD, Karen Fleis, Psy.D., Laurence L. Greenhill, M.D., Jeffrey Halperin, Ph.D., Lily Hechtman, M.D., Stephen Hinshaw, Ph.D., Kimberly Hoagwood, Ph.D., Betsy Hoza, Ph.D., Peter Jensen, M.D., John March, MD, Daniel Mathalon, M.D., Ph.D. , Keith McBurnett, Ph.D., Brooke Molina, Ph.D., Desiree Murray, Ph.D., Jeffrey Newcorn, M.D., Elizabeth Owens, Ph.D., William Pelham, Jr., Ph.D., Bradley Peterson, M.D, Linda Pfiffner, Ph.D., Steven Potkin, M.D., Allen Song, Ph.D., James M. Swanson, Ph.D., Leanne Tamm, Ph.D., Katerina Velanova, Ph.D., Benedetto Vitiello, MD, Alan Vitolo, Ph.D., Karen Wells, Ph.D., & Timothy Wigal, PhD",898,713,185,lab,3/31/15,3/31/15,,0.793986637,0.206013363,2015,3,31,15,15
703,220,The Use of Metformin in the Treatment of Antipsychotic-Induced Weight Gain in Schizophrenia (The METS Study),https://nda.nih.gov/edit_collection.html?id=2156,"Schizophrenia is a chronic mental disorder that is characterized, in part, by psychotic symptoms. Psychotic symptoms include hallucinations and delusions, in which a person has abnormal experiences or beliefs, and are commonly treated with antipsychotic medications. Unfortunately, a side effect of many antipsychotics is unwanted weight gain, which can lead to physical illness. Use of the drug metformin has resulted in weight loss among diabetics. Metformin has also been shown to cause weight loss ... more",3/31/15,,,,3/31/15,,,L. Fredrik Jarskog,148,103,45,lab,3/31/15,3/31/15,,0.695945946,0.304054054,2015,3,31,15,16
704,221,A Placebo-Controlled Clinical Trial of a Standardized Extract of Hypericum perforatum in Major Depressive Disorder,https://nda.nih.gov/edit_collection.html?id=2157,"This trial will determine the acute antidepressant efficacy of a standardized extract of hypericum (St. John's Wort) for the treatment of major depressive disorder. For this trial, the primary efficacy analysis will be evaluated at 8 weeks. For observational purposes, a 4-month double blind continuation (6 months total treatment) in treatment responders would enable an approximation of the effectiveness of maintenance treatment with this medication. No published studies have included a selective ... more",3/31/15,,,,3/31/15,,,Jonathan Davidson,479,185,294,lab,3/31/15,3/31/15,,0.386221294,0.613778706,2015,3,31,15,17
705,222,Combining Medications to Enhance Depression Outcomes (CO-MED),https://nda.nih.gov/edit_collection.html?id=2158,"The overall aim of Combining Medications to Enhance Depression Outcomes (CO-MED) is to enhance remission rates for outpatients with chronic or recurrent nonpsychotic major depressive disorder (MDD) as defined by DSM-IV TR, treated in primary or psychiatric care settings.Current evidence indicates that remission, the goal of treatment, is found in only about one-third of representative depressed outpatients treated for up to 14 weeks with an initial SSRI. In addition, even for those who do respond ... more",3/31/15,,,,3/31/15,,,Madhukar H. Trivedi,750,244,506,lab,3/31/15,3/31/15,,0.325333333,0.674666667,2015,3,31,15,18
706,223,Comparative Effectiveness of Antipsychotic Medications in Patients With Alzheimer's Disease (CATIE Alzheimer's Disease Trial),https://nda.nih.gov/edit_collection.html?id=2159,"The CATIE Alzheimer's Disease Trial is part of the Clinical Antipsychotic Trials of Intervention Effectiveness (CATIE) Project. The study is for people with Alzheimer's disease who are having trouble with their thinking or behavior. In particular, this study is trying to find out the best treatment for people who have hallucinations (seeing or hearing things that aren't there), delusions (false beliefs), or agitation. The design of the trial helps to increase the chance that participants in the study ... more",3/31/15,,,,3/31/15,,,Lon Schneider,422,186,236,lab,3/31/15,3/31/15,,0.440758294,0.559241706,2015,3,31,15,19
707,225,Derived and Evaluated Data,https://nda.nih.gov/edit_collection.html?id=2161,The contents of this collection include NDA derived and evaluated Data. The NIMH Data Archive currently provides infrastructure to run established pipelines and processes making derived results available for querying. Those investigators using data contained here for purposes other than query should consider how the data have been derived. Please contact the NIMH Data Archive (NDA) for more information on how to use data from or contribute to this collection.,3/31/15,NIH,,,3/31/15,,,Multiple,1473,1038,435,lab,3/31/15,3/31/15,,0.704684318,0.295315682,2015,3,31,15,20
708,226,FAST-PS mGluR5 CNTNAP2 Study,https://nda.nih.gov/edit_collection.html?id=2162,"New treatments are needed to target persistent symptoms and neurocognitive deficits in psychotic disorders. A potential target for treatment development is the mTOR kinase system, which is coupled mechanistically to the type-5 metabotropic glutamate receptor (mGluR5). The present study evaluates the utility of PET mGluR5 binding as a potential target engagement measurement for future studies of mTOR kinase inhibitors in the treatment of schizophrenia and other psychotic disorders. The study takes ... more",3/31/15,Columbia University,,,3/31/15,,,Jeffrey Lieberman,20,12,8,lab,3/31/15,3/31/15,,0.6,0.4,2015,3,31,15,21
709,227,FAST-PS Biomarker Validation Study,https://nda.nih.gov/edit_collection.html?id=2163,"This initiative seeks to expeditiously test and analyze a novel intervention (i.e., compound) and their molecular and/or clinical targets for treating clinical dimensions of psychopathology (e.g., anhedonia, cognitive function, social engagement) associated with traditional psychotic spectrum disorders. The overall goal of this project shall be to evaluate the ability of an agonist to reverse alterations in healthy humans. These modalities could provide information regarding the degree of target ... more",3/31/15,Columbia University,,,3/31/15,,,Jeffrey Lieberman,201,133,68,lab,3/31/15,3/31/15,,0.661691542,0.338308458,2015,3,31,16,1
710,229,"Double-Blind, Placebo-Controlled Trial of Ketamine Therapy in Treatment-Resistant Depression (TRD)",https://nda.nih.gov/edit_collection.html?id=2166,"This study is looking at the efficacy, durability, safety, and tolerability of multiple single doses of Ketamine for treating patients with treatment resistant depression who are taking an antidepressant that is not working for them.",3/31/15,Massachusetts General Hospital,,,3/31/15,,,Maurizio Fava,86,46,40,lab,3/31/15,3/31/15,,0.534883721,0.465116279,2015,3,31,16,2
711,230,"Multi-Site, Randomized, Controlled Implementation Trial of an Evidence-Based, Adult & Peer-Mediated Social Skills Intervention for Elementary School Children with ASD",https://nda.nih.gov/edit_collection.html?id=2168,"With the rising cost of educational services for children with autism and fiscal challenges that school districts face, it is imperative that cost-effective autism-related interventions are easily implemented and sustained in schools. Social impairment represents the most challenging core deficit of autism and greatly affects children's school experiences; however, few evidence-based social skills programs have been translated into and sustained in schools because of the challenges that schools face ... more",3/31/15,Washington University in St. Louis,,,3/31/15,,,Jill Locke,32,28,4,lab,3/31/15,3/31/15,,0.875,0.125,2015,3,31,16,3
712,231,Human Clinical Trial of IGF-1 in Children with Idiopathic ASD,https://nda.nih.gov/edit_collection.html?id=2169,"A double-blind, randomized, placebo controlled, phase 2 human clinical trial of Insulin-Like Growth Factor-1 (IGF-1) in children with a genetic cause of autism (Phelan McDermid Syndrome) is currently underway at the Seaver Autism Center for Research and Treatment at Mount Sinai. That study builds on previous work in a mouse model system of Phelan McDermid Syndrome which showed that IGF-1 treatment reversed the effects of disrupted glutamate signaling associated with impaired learning and memory. ... more",3/31/15,Icahn School of Medicine at Mount Sinai,,,3/31/15,,,Alexander Kolevzon,7,5,2,lab,3/31/15,3/31/15,,0.714285714,0.285714286,2015,3,31,16,4
239,266,Effects of Social Gaze Training on Brain and Behavior in Fragile X Syndrome,https://nda.nih.gov/edit_collection.html?id=2260,"While research progress pertaining to autism spectrum disorder (ASD) has been extraordinary in some areas, many critical gaps in knowledge remain, particularly with respect to the development of treatments that address primary neurobiological abnormalities in affected individuals. For example, almost all children with fragile X syndrome (FXS), the most common known genetic cause of ASD, exhibit symptoms of severe social anxiety, manifested by high levels of social gaze avoidance and other social ... more",12/9/14,Stanford Medical School,R01HD081336,Stanford University,4/1/15,1/31/20,1093451,Scott S. Hall,65,65,0,lab,12/9/14,4/1/15,1/31/20,1,0,2015,4,1,16,5
242,273,Developing an Automated Emotion Training System,https://nda.nih.gov/edit_collection.html?id=2272,"Problems with nonverbal social interaction are characteristic of autism spectrum disorder (ASD). Such problems include impaired ability to detect as well as express emotions, termed facial emotion recognition (FER) and emotion expression (EE), respectively. Computer-based, automated training systems to target these mechanisms hold tremendous promise for moving the field of interventions for ASD forward. We propose to develop a highly transportable, low-cost, and user-friendly technotherapy system ... more",1/6/15,Virginia Polytechnic Institute and State University,R03HD081070,Virginia Polytechnic Inst And St Univ,4/1/15,3/31/18,147208,Susan Williams White,40,32,8,lab,1/6/15,4/1/15,3/31/18,0.8,0.2,2015,4,1,16,6
237,262,Neurophenotypic Trajectories and Behavioral Outcomes in Autism Spectrum Disorder,https://nda.nih.gov/edit_collection.html?id=2253,"Autism spectrum disorder (ASD) has a common set of diagnostic features that nonetheless vary substantially in severity in different individuals. There are also many co-morbid features ranging from developmental delay to epilepsy to gastrointestinal disturbances that further complicate the phenotypes of ASD. To discover and integrate multilevel phenotypic information that would allow definition of biological subtypes and potentially predict and facilitate optimal outcomes, the MIND Institute initiated ... more",5/6/15,"University of California, Davis",R01MH103371,University Of California At Davis,4/1/15,1/31/21,3402514,David G. Amaral,173,128,45,lab,5/6/15,4/1/15,1/31/21,0.739884393,0.260115607,2015,4,1,16,7
238,263,The neurobiological basis of heterogeneous social and motor deficits in ASD,https://nda.nih.gov/edit_collection.html?id=2254,"While social communication deficits are considered the hallmark of Autism Spectrum Disorders (ASD), there is increasing evidence that sensorimotor deficits are also common in individuals with ASD diagnoses. A large body of research suggests that brain systems for execution and observation of actions are involved in higher social cognitive processes, including intention understanding and empathy, yet research has not yet clarified the extent to which motor deficits, such as imitation ability and motor ... more",5/6/15,University of Southern California,R01HD079432,University Of Southern California,4/1/15,1/31/21,2151952,Lisa Aziz-Zadeh,111,79,32,lab,5/6/15,4/1/15,1/31/21,0.711711712,0.288288288,2015,4,1,16,8
240,268,Comparing Behavioral Assessments Using Telehealth for Children with Autism,https://nda.nih.gov/edit_collection.html?id=2262,"Managing challenging behavior in autism spectrum disorders (ASD) can profoundly improve quality of life for children and families. However, many families lack access to research-based treatment, such as applied behavior analysis (ABA). This study is a randomized trial comparing outcomes of treatment for ASD using either a standard Functional Analysis Plus Functional Communication Training (FA+FCT) package or a pragmatic version that offers a briefer, less time-intensive model of FA+FCT. Both types ... more",5/6/15,University of Iowa,R01MH104363,University Of Iowa,4/1/15,10/31/20,2578621,Scott David Lindgren,50,34,16,lab,5/6/15,4/1/15,10/31/20,0.68,0.32,2015,4,1,16,9
241,270,Epigenetic regulation of social impairments and treatment response in autism,https://nda.nih.gov/edit_collection.html?id=2268,"Autism spectrum disorder (ASD) is characterized by core social impairments and affects 1 in 68 US children, but remains poorly understood. ASD is currently diagnosed on the basis of behavioral criteria because no robust biomarkers have been identified, nor are there any pharmacotherapies that effectively treat the social features of ASD. Biomarkers improve our ability to make accurate diagnoses and provide biological targets for drug development and testing. Two promising biomarkers of ASD are the ... more",5/6/15,Stanford University,R21HD083629,Stanford University,4/1/15,3/31/18,439368,Karen J. Parker,152,113,39,lab,5/6/15,4/1/15,3/31/18,0.743421053,0.256578947,2015,4,1,16,10
243,865,CEREBELLUM AND AUTISM: NEURAL MECHANISMS AND MODULATION OF PREDICTIVE PROCESSING,https://nda.nih.gov/edit_collection.html?id=2956,"The goal of this project is to use neuroimaging and neuromodulation to test the hypothesis that cerebellar dysfunction contributes to predictive processing deficits in autism spectrum disorder (ASD). ASD is a neurodevelopmental disorder characterized by social and communication deficits, repetitive behaviors, and restricted interests. The rapidly rising incidence of ASD represents a considerable public health issue, and a better understanding of the neurobiological bases of ASD is necessary ... more",6/19/18,American University,R15MH106957,American University,4/1/15,3/31/20,402769,Catherine Stoodley,23,23,0,lab,6/19/18,4/1/15,3/31/20,1,0,2015,4,1,16,11
806,47,RNA-Seq studies of gene expression in micro-dissected samples from the brains of individuals with autism and controls,https://nda.nih.gov/study.html?id=372,"We seek to understand the cellular bases of autism by using a new technology, RNA-Seq, to determine differences in gene expression in autopsy brains of subjects with well described autism versus age and sex matched neurotypical individuals. We have investigated two specific cortical areas involved in self-awareness and social reciprocity which are abnormal in autism and have found increased expression in a network of genes related to inflammation in autism group A, whereas the remaining cases, autism ... more",4/17/15,Burkhart Center for Autism Education and Research,,,4/17/15,,,"Richman DM; Barnard-Brak L, Bosch A, Thompson S, Grubb L, Abby L",35,22,13,paper,4/17/15,4/17/15,,0.628571429,0.371428571,2015,4,17,16,12
244,542,A Multimedia Screening System for Early ASD Identification in Diverse Populations,https://nda.nih.gov/edit_collection.html?id=2599,"Although we now have the tools and expertise to diagnose autism spectrum disorders ASD reliably in the 2nd year of life, most children are still diagnosed after their 4th birthday and, in under-resourced, ethnically diverse communities, as late as 8 years of age. These gaps highlight our failure to translate state-of-the art screening and diagnostic practices into practical solutions for identifying the most vulnerable children across socioeconomic strata. This disconnect is highly concerning given ... more",2/8/17,Yale University,R21MH103550,Yale University,4/17/15,2/28/18,457875,Katarzyna Chawarska,306,208,98,lab,2/8/17,4/17/15,2/28/18,0.679738562,0.320261438,2015,4,17,16,13
713,233,Partners in Schools: A Program for Parents and Teachers of Children with Autism,https://nda.nih.gov/edit_collection.html?id=2180,"The goal of Partners In School is to develop and test a program that will improve parent-teacher communication about interventions for diverse children with autism attending public schools. With support from this enhancement grant, I will compensate parents and teachers for their participation, hire a student for data collection and management, and receive training from the Nebraska Center for Research on Children, Youth, Families, and Schools. Successful completion of this project will result in ... more",4/30/15,University of Pennsylvania,,,4/30/15,,,Gazi Azad,46,8,38,lab,4/30/15,4/30/15,,0.173913043,0.826086957,2015,4,30,16,14
714,234,Sex Differences in the Neural Mechanisms of Treatment Response,https://nda.nih.gov/edit_collection.html?id=2181,"Because of the skewed sex ratio in autism, prior treatment studies have not permitted inference regarding differential treatment response in boys and girls. Here we study how girls respond to an empirically supported behavioral treatment approach, Pivotal Response Training (PRT), to foster development of more effective treatments for girls and boys. We will assess treatment outcome at the behavioral and brain-based level, using functional magnetic resonance imaging (fMRI), to better understand how ... more",4/30/15,Yale Child Study Center,,,4/30/15,,,Pamela Ventola,16,9,7,lab,4/30/15,4/30/15,,0.5625,0.4375,2015,4,30,16,15
715,235,Identifying Biomarkers for Early Detection of Prosody Disorders in ASD using Electroglottography,https://nda.nih.gov/edit_collection.html?id=2183,"Atypical prosody is a characteristic feature of the communication deficit in autism spectrum disorders (ASD). Investigating disorders of prosody in autism is clinically important because disordered expressive prosody is an obstacle to social integration and communication for individuals with ASD and can be a life-long problem even when other areas of language improve. The goal of this project is to identify biomarkers for early detection of prosody disorders is autism. Using electroglottography (EGG), ... more",4/30/15,Emory University,,,4/30/15,,,Shweta Ghai and Gordon Ramsay,50,38,12,lab,4/30/15,4/30/15,,0.76,0.24,2015,4,30,16,16
716,237,Mitochondrial and Channelopathy Disorders and Dysfunction in Autism Spectrum Disorders: Genotypic and Phenotypic Correlations,https://nda.nih.gov/edit_collection.html?id=2190,"Our study enrolled individuals with moderate to severe ASDs associated with intellectual disabilities and/or epilepsy. Subjects underwent extensive clinical testing including brain wave testing, neuropsychological testing (including IQ and other testing), observations of behavior, measurements of sleep, and other tests. All testing and assessments were non-invasive and are tests and procedures that are often done as part of routine clinical care, and thus, are not ""experimental"". The unique and investigational ... more",4/30/15,THE CENTER FOR NEUROLOGICAL AND NEURODEVELOPMENTAL HEALTH,,,4/30/15,,,Mark Mintz,26,21,5,lab,4/30/15,4/30/15,,0.807692308,0.192307692,2015,4,30,16,17
717,244,fMRI for Affective Psychological Studies,https://nda.nih.gov/edit_collection.html?id=2201,The objective of this study is to use dyadic fMRI approach to study two brain interactions.,4/30/15,Princeton University,,,4/30/15,,,Ray Lee,19,7,12,lab,4/30/15,4/30/15,,0.368421053,0.631578947,2015,4,30,16,18
245,271,Effectiveness of MI Enhanced Behavior Therapy for Adolescents with ADHD,https://nda.nih.gov/edit_collection.html?id=2269,"This study evaluates the effectiveness of a family-based psychosocial treatment program for teens with ADHD (STAND; Sibley et al., 2013, 2014) developed to be delivered in community settings. STAND is BT enhanced by Motivational Interviewing (MI) that was developed (R34 MH092466) for teens with ADHD through a stakeholder informed process. A total of 300 adolescents with ADHD will be recruited from four community mental health agencies and randomly assigned to receive STAND or Usual Care (UC) in the ... more",1/6/15,Seattle Children's Hospital,R01MH106587,Seattle Childrens Hospital,5/1/15,10/31/20,1695676,Margaret Harper Sibley,291,201,90,lab,1/6/15,5/1/15,10/31/20,0.690721649,0.309278351,2015,5,1,16,19
246,272,Graduated sensory salience as an intervention for intrusive negative thinking,https://nda.nih.gov/edit_collection.html?id=2270,"Intrusive negative cognitions are key transdiagnostic features of many psychiatric disorders, are difficult to treat, and predict poor outcomes in conventional and neurobehavioral interventions. Here, we evaluate the extent to which a novel intervention capitalizing on a preserved neurocircuitry for attending to evolutionarily salient somatosensory stimuli can be used to train attentional mechanisms to override otherwise pre-potent negative cognitions. The R21 period will involve intervention refinement ... more",1/6/15,University of Pittsburgh,R21MH106591,University Of Pittsburgh At Pittsburgh,5/1/15,2/28/22,1606399,Greg Siegle,97,30,67,lab,1/6/15,5/1/15,2/28/22,0.309278351,0.690721649,2015,5,1,16,20
247,869,2/2 Somatic mosaicism and autism spectrum disorder,https://nda.nih.gov/edit_collection.html?id=2960,"Somatic mutations are de novo mutations that occur after fertilization. Once a cell has acquired a somatic mutation, all of its progenitors will also carry that mutation. Thus, if a cell acquires a mutation early in embryonic development, the mutation will be carried by many of the cells in the body. However, if the mutation occurs late in development, then only a few cells might carry it. Thus, it is possible to have mutations that only occur in the brain, or a small region of the brain. It has ... more",7/10/18,Yale University,U01MH106874,Yale University,5/1/15,1/31/20,1562413,Nenad Sestan,40,30,10,lab,7/10/18,5/1/15,1/31/20,0.75,0.25,2015,5,1,16,21
248,870,Somatic Mosaicism in the Brain of Tourette Syndrome,https://nda.nih.gov/edit_collection.html?id=2961,"Tourette Syndrome (TS) is a disorder of the developing telencephalon for which no significant causative genetic variant has yet emerged through the examination of blood samples. In this proposal we investigate whether somatic mutations might underlie in part the pathogenesis of TS. Existing evidence suggests that cells accumulate somatic mutations after the formation of the zygote, implying that cells of the human body do not have identical DNA sequence. Besides single nucleotide variation (SNV) ... more",7/10/18,Yale University,U01MH106876,Yale University,5/1/15,1/31/20,2311150,Flora M. Vaccarino,43,25,18,lab,7/10/18,5/1/15,1/31/20,0.581395349,0.418604651,2015,5,1,17,1
249,871,1/2-Somatic mosaicism and autism spectrum disorder,https://nda.nih.gov/edit_collection.html?id=2962,"Somatic mutations are de novo mutations that occur after fertilization. Once a cell has acquired a somatic mutation, all of its progenitors will also carry that mutation. Thus, if a cell acquires a mutation early in embryonic development, the mutation will be carried by many of the cells in the body. However, if the mutation occurs late in development, then only a few cells might carry it. Thus, it is possible to have mutations that only occur in the brain, or a small region of the brain. It has ... more",7/10/18,Children's Hospital Boston,U01MH106883,Boston Childrens Hospital,5/1/15,1/31/20,3497084,Christopher A. Walsh,79,64,15,lab,7/10/18,5/1/15,1/31/20,0.810126582,0.189873418,2015,5,1,17,2
250,289,"The Autistic Brain Over 45: The Anatomic, Functional, and Cognitive Phenotype",https://nda.nih.gov/edit_collection.html?id=2291,"The behavioral and neuroscientific literature on children and adolescents with autism spectrum disorder (ASD) has grown dramatically over the past decades. In contrast, almost nothing is known about ASD later in life. This is problematic in view of preliminary findings suggesting that some older people with ASD may experience accelerated cognitive and neurological decline, combined with extensive evidence of age-related complications and decline in other neurodevelopmental disorders. The present ... more",8/10/15,San Diego State University,R01MH103494,San Diego State University,5/8/15,4/30/26,4249298,Ralph-Axel Mueller,70,55,15,lab,8/10/15,5/8/15,4/30/26,0.785714286,0.214285714,2015,5,8,17,3
251,281,Cognitive Enhancement Therapy for Adult Autism Spectrum Disorder,https://nda.nih.gov/edit_collection.html?id=2282,"Autism spectrum disorder (ASD) is characterized by marked impairments in social and non-social cognitive ability that persist well into adulthood and contribute to significant functional disability. The treatment of ASD has focused almost exclusively on children, and few empirically supported interventions are available to address the core cognitive and functional challenges individuals with ASD face as they transition to adulthood. Cognitive rehabilitation has emerged as a set of systematic approaches ... more",6/17/15,University of Pittsburgh,R01MH106450,University Of Pittsburgh At Pittsburgh,6/1/15,3/31/22,3242082,Shaun Eack,73,50,23,lab,6/17/15,6/1/15,3/31/22,0.684931507,0.315068493,2015,6,1,17,4
252,294,Change in social adaptive action and brain connectivity in infants first 6 months,https://nda.nih.gov/edit_collection.html?id=2301,"The current project will identify maturational changes in the infant brain that accompany important transitions in social behavior in the first 6 months of life. This work is motivated by a surprising feature of a recent study in which we identified the earliest known indicators of social disability in autism (Jones & Klin, Nature, 2013). The data falsified a prior hypothesis by revealing that eye-looking a basic mechanism of social adaptive action in typical infants was not immediately diminished ... more",8/19/15,Emory University School of Medicine,R21MH105816,Emory University,6/15/15,2/28/17,362438,Warren Jones,38,25,13,lab,8/19/15,6/15/15,2/28/17,0.657894737,0.342105263,2015,6,15,17,5
807,48,Development and validation of a brain maturation index using longitudinal neuroanatomical scans,https://nda.nih.gov/study.html?id=374,"Background Major psychiatric disorders are increasingly being conceptualized as neurodevelopmental, because they are associated with aberrant brain maturation. Several studies have hypothesized that a brain maturation index integrating patterns of neuroanatomical measurements may reliably identify individual subjects deviating from a normative neurodevelopmental trajectory. However, while recent studies have shown great promise in developing accurate brain maturation indices using neuroimaging ... more",6/19/15,Burkhart Center for Autism Education and Research,,,6/19/15,,,"Richman DM; Barnard-Brak L, Bosch A, Thompson S, Grubb L, Abby L",303,141,162,paper,6/19/15,6/19/15,,0.465346535,0.534653465,2015,6,19,17,6
253,298,Intergenerational Effects of Maternal Childhood Trauma on the Fetal Brain,https://nda.nih.gov/edit_collection.html?id=2308,"Exposure to severe trauma in childhood such as physical or sexual abuse represents one of the most pervasive and pernicious stressors in society. Its sequelae, which may endure over the entire lifespan, include depression, PTSD, endocrine and immune function dysregulation, obesity, substance abuse, and also increased likelihood of subsequent exposure to trauma in adulthood. Moreover, emerging evidence suggests the long shadow cast by childhood trauma may not be restricted to only the lifespan of ... more",8/19/15,University of California Irvine,R01MH105538,University Of California-Irvine,6/19/15,5/31/20,1604118,Pathik Wadhwa,35,22,13,lab,8/19/15,6/19/15,5/31/20,0.628571429,0.371428571,2015,6,19,17,7
725,282,Recovery After an Initial Schizophrenia Episode - Implementation and Evaluation Study (RAISE-IES),https://nda.nih.gov/edit_collection.html?id=2284,"After the RAISE contract award, the NIMH identified a knowledge gap regarding system integration strategies. That led to the need to conduct a study of how to integrate an early intervention program into an existing service system. The RAISE Impact Evaluation Study (IES) used the RCP intervention model to identify strategies to facilitate the implementation of team-based care for first episode psychosis (FEP) within the U.S. healthcare system. The IES project had three aims: (1) To adapt a comprehensive ... more",6/22/15,,,,6/22/15,,,Lisa Dixon and Susan Essock,67,43,24,lab,6/22/15,6/22/15,,0.641791045,0.358208955,2015,6,22,17,8
254,286,The Autism Biomarkers Consortium for Clinical Trials,https://nda.nih.gov/edit_collection.html?id=2288,"The goal of this consortium is to establish tools that can be used as biomarkers and/or sensitive and reliable objective assays of social impairment in autism spectrum disorder (ASD) clinical trials. Specifically, we aim to accelerate the development of effective treatments for social impairment in ASD by validating (a) outcome measures that will be sensitive and reliable assessments of response to treatment and EEG and (b) eye-tracking (ET) biomarkers that can be used to reduce heterogeneity of ... more",7/26/15,Yale Child Study Center,U19MH108206,Yale University,7/1/15,6/30/20,29161446,James McPartland,446,331,115,lab,7/26/15,7/1/15,6/30/20,0.742152466,0.257847534,2015,7,1,17,9
255,296,Dissecting recurrent microdeletion syndromes using dual-guide genome editing,https://nda.nih.gov/edit_collection.html?id=2304,"Recurrent microdeletion syndromes (rMDS), such as those associated with 16p11.2, 1q21 and 22q11.2, represent a major component (10-15%) of the genetic etiology of neurodevelopmental disorders, including autism spectrum disorder (ASD). In each rMDS, a distinct set of genes is reproducibly reduced to haploid dosage due to non-allelic homologous recombination (NHAR) mediated by flanking segmental duplications. The neurodevelopmental phenotypes in rMDS could theoretically derive primarily from a single ... more",8/19/15,Massachusetts General Hospital,R01NS093200,Massachusetts General Hospital,7/1/15,6/30/21,1161596,James Gusella,1,1,0,lab,8/19/15,7/1/15,6/30/21,1,0,2015,7,1,17,10
256,354,Early Brain Development in Twins,https://nda.nih.gov/edit_collection.html?id=2384,"Twin studies have provided fundamental information about how genes and environment contribute to individual differences in brain structure and cognitive function in health and psychiatric disease and how these influences change during development. Previous twin studies in older children, adolescents and adults indicate that genetic and environmental influences are region/structure specific and change with age. Early childhood is period of rapid structural and functional brain development that is ... more",6/1/16,University of North Carolina at Chapel Hill,U01MH070890,Univ Of North Carolina Chapel Hill,7/1/15,6/30/20,1422158,John Gilmore,547,289,258,lab,6/1/16,7/1/15,6/30/20,0.52833638,0.47166362,2015,7,1,17,11
257,521,Biomarker and Safety Study of Clozapine in Benign Ethnic Neutropenia,https://nda.nih.gov/edit_collection.html?id=2574,"Clozapine is the most effective antipsychotic for the treatment of schizophrenia however it is underused particularly in the African American population. Low Absolute Neutrophil Counts (ANC), either baseline or during treatment (a drop in ANC below the threshold of 1500 mm3 currently mandates clozapine discontinuation) is a significant barrier to clozapine use in AA patients. Our pilot work finds that discontinuation of clozapine (particularly for neutropenia) in AA patients is over twice that in ... more",1/26/17,"University of Maryland, Baltimore",R01MH102215,University Of Maryland Baltimore,7/1/15,6/30/19,1759430,Deanna Kelly,101,63,38,lab,1/26/17,7/1/15,6/30/19,0.623762376,0.376237624,2015,7,1,17,12
258,864,1/3 Brain Function and Genetics in Pediatric Obsessive-Compulsive Behaviors,https://nda.nih.gov/edit_collection.html?id=2955,"Obsessive-compulsive behaviors (OCB) are common in children and adolescents. In addition to being the core features of obsessive-compulsive disorder (OCD), OCB are often associated in youth with tic, grooming, generalized anxiety, and autistic spectrum disorders. This competitive renewal application combines the unique clinical assessment, magnetic resonance imaging, and genetics expertise of three performance sites: Wayne State University (WSU), University of Michigan (UM), and the Hospital for ... more",6/18/18,Wayne State University,R01MH059299,Wayne State University,7/1/15,10/30/25,2707278,David Rosenberg,500,217,283,lab,6/18/18,7/1/15,10/30/25,0.434,0.566,2015,7,1,17,13
259,512,Anxiety and reward interaction and prediction of outcomes in anorexia nervosa,https://nda.nih.gov/edit_collection.html?id=2565,"The purpose of this study is to understand anxiety and reward neural circuitry and their dynamic interactions, and how they predict behavioral outcomes in adolescents with anorexia nervosa AN subsequent to intensive treatment. AN is notorious for its resistance to interventions and for the highest mortality rate of all psychiatric disorders. Various forms of intensive treatment may succeed in partially or fully restoring weight, yet overall benefits of treatment remain limited and early relapse is ... more",1/6/17,"University of California, Los Angeles",R01MH105662,University Of California Los Angeles,7/5/15,3/31/20,879775,Jamie Feusner,63,0,63,lab,1/6/17,7/5/15,3/31/20,0,1,2015,7,5,17,14
808,49,The Sensitivity and Specificity of the Social Communication Questionnaire for Autism Spectrum Disorder with Respect to Age,https://nda.nih.gov/study.html?id=375,Scientific Abstract The Social Communication Questionnaire (SCQ) assesses communication skills and social functioning in screening for symptoms of autism-spectrum disorder (ASD). The SCQ is recommended for individuals between 4 to 40 years with a cutoff score of 15 for referral. Mixed findings have been reported regarding the recommended cutoff scores ability to accurately classify an individual as at-risk for ASD (sensitivity) versus an individual as not at-risk for ASD (specificity). Based on ... more,7/8/15,Burkhart Center for Autism Education and Research,,,7/8/15,,,"Richman DM; Barnard-Brak L, Bosch A, Thompson S, Grubb L, Abby L",338,280,58,paper,7/8/15,7/8/15,,0.828402367,0.171597633,2015,7,8,17,15
809,50,Revising the Social Communication Questionnaire scoring procedures for Autism Spectrum Disorder and potential Social Communication Disorder,https://nda.nih.gov/study.html?id=376,"In analyzing data from the National Database for Autism Research, we examine revising the Social Communication Questionnaire (SCQ), a commonly used screening instrument for Autism Spectrum Disorder. A combination of Item Response Theory and Mokken scaling techniques were utilized to achieve this and abbreviated scoring of the SCQ is suggested. The psychometric sensitivity of this abbreviated SCQ was examined via bootstrapped Receiver Operator Characteristic (ROC) curve analyses. Additionally, we ... more",7/8/15,Burkhart Center for Autism Education and Research,,,7/8/15,,,"Richman DM; Barnard-Brak L, Bosch A, Thompson S, Grubb L, Abby L",888,699,189,paper,7/8/15,7/8/15,,0.787162162,0.212837838,2015,7,8,17,16
260,299,Internet Psychotherapy for Treating Bipolar Disorder in Primary Care,https://nda.nih.gov/edit_collection.html?id=2309,"Over a third of individuals with bipolar spectrum disorders (BP) are treated exclusively in primary care settings, and yet, primary care providers (PCPs) are ill-equipped to manage this complex and disabling illness. Medications, which can be prescribed by PCPs, hasten recovery from illness and improve long-term course of illness for those with BP, but relapse and residual symptoms are common when individuals are treated with pharmacotherapy alone. Best practices treatment for BP includes adjunctive, ... more",8/19/15,University of Pittsburgh,R34MH107541,University Of Pittsburgh At Pittsburgh,7/13/15,4/30/20,707095,Holly Swartz,47,12,35,lab,8/19/15,7/13/15,4/30/20,0.255319149,0.744680851,2015,7,13,17,17
261,1097,Impulsivity as Immaturity: Mapping Dysmaturation of the Brains Control Architecture in Youth Externalizing Psychopathology,https://nda.nih.gov/edit_collection.html?id=3203,"Youth with externalizing psychopathologies, including attention-deficit hyperactivity disorder, oppositional defiant disorder, and conduct disorder, present with diverse kinds of impulsivity symptoms, which in turn reflect deficits in regulatory control functioning. An emerging neurodevelopmental model, which we call the Impulsivity as Immaturity Model, could potentially transform our understanding of the brain basis of regulatory dysfunction. The brains regulatory control architecture RCA undergoes ... more",6/20/19,University of Michigan,R01MH107741,University Of Michigan At Ann Arbor,7/13/15,6/30/21,2340203,Chandra Sripada,255,129,126,lab,6/20/19,7/13/15,6/30/21,0.505882353,0.494117647,2015,7,13,17,18
810,51,Paternal sperm DNA methylation associated with early signs of autism risk in an autism-enriched cohort,https://nda.nih.gov/study.html?id=377,"Epigenetic mechanisms such as altered DNA methylation have been suggested to play a role in autism, beginning with the classical association of Prader-Willi syndrome, an imprinting disorder, with autistic features. Here we tested for the relationship of paternal sperm DNA methylation with autism risk in offspring, examining an enriched-risk cohort of fathers of autistic children. We examined genome-wide DNA methylation (DNAm) in paternal semen biosamples obtained from an autism spectrum disorder ... more",7/14/15,Burkhart Center for Autism Education and Research,,,7/14/15,,,"Richman DM; Barnard-Brak L, Bosch A, Thompson S, Grubb L, Abby L",44,44,0,paper,7/14/15,7/14/15,,1,0,2015,7,14,17,19
262,301,Multimodel Assessment of Social Process Systems across Neurodevelopmental Disorders,https://nda.nih.gov/edit_collection.html?id=2312,"Disruption of social process systems is a hallmark of multiple neurodevelopmental disorders, resulting in significant functional impairment for affected individuals and substantial public health costs. This project proposes to examine the relationship between social performance and Reception of Facial Communication (a subconstruct within the Social Communication construct of the RDoC Social Processes domain) across multiple levels of analysis, spanning self-report, behavior, and physiology. Dimensional ... more",8/19/15,Yale Child Study Center,R01MH107426,Yale University,7/15/15,5/31/18,650980,James McPartland,176,127,49,lab,8/19/15,7/15/15,5/31/18,0.721590909,0.278409091,2015,7,15,17,20
263,303,Quantitative Measurements of Cortical Excitability in Neurodevelopmental Disorder,https://nda.nih.gov/edit_collection.html?id=2316,"Neurodevelopmental disorders, such as autism spectrum disorder (ASD) and attention deficit hyperactivity disorder (ADHD), are characterized by abnormalities in baseline cortical excitability that are believed to be caused by an abnormal, system-wide balance between excitation and inhibition. Mounting evidence has linked baseline cortical excitability to abnormalities in the sensory systems. as manifested by both over- and hyporeactivity to sensory stimuli and by the high prevalence of epileptiform ... more",8/19/15,Stanford University,R21MH104774,Stanford University,7/15/15,3/31/18,434750,Antonio Hardan,92,72,20,lab,8/19/15,7/15/15,3/31/18,0.782608696,0.217391304,2015,7,15,17,21
264,760,Neuronal Correlates of Autistic Traits in ADHD and Autism,https://nda.nih.gov/edit_collection.html?id=2834,"This study aims to conduct the first investigation of the neurobiological underpinnings of social communicative impairments, i.e., autistic traits (AT), in children with ADHD and ASD. AT, a key feature of autism spectrum disorder (ASD), occurs in 20-30% of children with ADHD. These children incur relatively elevated school failure and poor global functioning, highlighting the clinical significance of AT in children with ADHD (ADHD+AT). We aim to advance our understanding of AT across ADHD and ASD, ... more",1/11/18,Child Mind Institute,R01MH105506,"Child Mind Institute, Inc.",7/20/15,3/31/22,3673842,Adriana Di Martino,101,75,26,lab,1/11/18,7/20/15,3/31/22,0.742574257,0.257425743,2015,7,20,18,1
265,300,Multilevel Biomarkers for Suicidal Behavior: From Interpersonal Stress to Gene Expression in a Longitudinal Study of Adolescent Girls,https://nda.nih.gov/edit_collection.html?id=2310,"In response to public calls from the US President, Congress, Surgeon General, and a recent NIMH-cosponsored Suicide Research Prioritization Agenda, the proposed research will examine how suicidal ideation and attempts develop within one of the most vulnerable populations at risk for suicide (i.e., adolescent girls). This work will examine how girls' atypical acute stress responses to interpersonal stress at physiological, genomic, and behavioral units of analysis moderate the association between ... more",8/19/15,University of North Carolina at Chapel Hill,R01MH107479,Univ Of North Carolina Chapel Hill,7/25/15,4/30/20,1743016,Mitchell Prinstein,229,0,229,lab,8/19/15,7/25/15,4/30/20,0,1,2015,7,25,18,2
726,285,Whole Genome Sequencing of Autistic Children and Families from Serbia and the U.S.,https://nda.nih.gov/edit_collection.html?id=2287,This project uses Complete Genomics' LFR and standard sequencing techniques to identify causal variants linked to autism,7/26/15,Complete Genomics,,,7/26/15,,,Brock Peters,14,9,5,lab,7/26/15,7/26/15,,0.642857143,0.357142857,2015,7,26,18,3
727,287,Lithium Use for Bipolar Disorder (LiTMUS): A Randomized Controlled Effectiveness Trial,https://nda.nih.gov/edit_collection.html?id=2289,"In this project, 283 bipolar disorder outpatients were randomly assigned to 6 months of open, flexible, moderate dosages of ""lithium plus OPT"" or to 6 months of ""OPT alone"". The primary outcome measures were the Clinical Global Impression Scale for Bipolar Disorder--Severity (CGI-BP-S) and ""necessary clinical adjustments"" (medication adjustments per month). Secondary outcome measures included mood symptoms and functioning. Also sustained remission was assessed (defined as a CGI-BPS score #2 for ... more",7/30/15,,,,7/30/15,,,Andrew A. Nierenberg,331,145,186,lab,7/30/15,7/30/15,,0.438066465,0.561933535,2015,7,30,18,4
266,292,Acute Neurocognitive-affective Predictors of Chronic Post-trauma Outcomes,https://nda.nih.gov/edit_collection.html?id=2297,"Trauma exposure is extremely common and increases risk for a host of negative health outcomes, most notably posttraumatic stress disorder (PTSD). Given the potential harmful sequelae of trauma exposure, it is crucial to identify acute post-trauma risk factors that predict chronic PTSD and other poor post-trauma outcomes. While some progress has been made in this effort, attempts to identify recently traumatized individuals at risk for poor long-term post-trauma adjustment have proven difficult. In ... more",8/19/15,University of Wisconsin-Milwaukee,R01MH106574,University Of Wisconsin Milwaukee,8/1/15,5/31/20,3074715,Christine Larson,261,123,138,lab,8/19/15,8/1/15,5/31/20,0.471264368,0.528735632,2015,8,1,18,5
267,295,Cognitive-Affective Psychosis Proneness Risk and protective factors in 22q11.2DS,https://nda.nih.gov/edit_collection.html?id=2303,"This project studies risk and protective factors for the very high risk of schizophrenia in chromosome 22q11.2 deletion syndrome (22q), a disorder with a clear genetic etiology but with a complex and variable phenotype. It takes advantage of the unique nature of the 22q population, which has a genetically conferred high risk for schizophrenia yet also provides the rare opportunity for long range prospective developmental studies. Recognizing that, in a population where up to 30% of those affected ... more",8/19/15,"University of California, Davis",R01MH107108,University Of California At Davis,8/1/15,7/31/20,1465153,Tony Simon,112,55,57,lab,8/19/15,8/1/15,7/31/20,0.491071429,0.508928571,2015,8,1,18,6
268,302,"Puberty, neural systems for social processes, and early adolescent mental health: A longitudinal neuroimaging study",https://nda.nih.gov/edit_collection.html?id=2315,"Adolescence is a period of dramatic developmental transitions - from puberty-related changes in hormones, bodies, and brains to a complex psychological reorientation to the social world. The concurrent and marked increase in the onset of many psychiatric syndromes has prompted the search for key developmental processes that drive changes in risk for psychopathology during this period of life. Pubertal development is a prime candidate, but the precise neurobiological mechanisms via which puberty impacts ... more",8/19/15,University of Oregon,R01MH107418,University Of Oregon,8/1/15,4/30/20,1201423,Jennifer Pfeifer,172,0,172,lab,8/19/15,8/1/15,4/30/20,0,1,2015,8,1,18,7
269,305,Stepped Care for Children after Trauma: Optimizing Treatment,https://nda.nih.gov/edit_collection.html?id=2318,"Approximately 68-80% of youth will experience at least one potentially traumatic event during their childhood with about one third experiencing more than one traumatic event. Exposure to traumatic events markedly elevates the risk of developing posttraumatic stress disorder (PTSD) and associated impairment. Despite advances in effective trauma-focused treatments for children, the lack of efficient, accessible, personalized, and cost-effective trauma treatment for children is a major public health ... more",8/19/15,University of South Florida,R01MH107522,University Of South Florida,8/1/15,4/30/21,2185618,Alison Salloum,184,82,102,lab,8/19/15,8/1/15,4/30/21,0.445652174,0.554347826,2015,8,1,18,8
270,318,The role of parent phenotype in parent-mediated language interventions for autism,https://nda.nih.gov/edit_collection.html?id=2335,"High dosage of early intervention is critical to language skill development in young children with autism spectrum disorders (ASD) (Dawson et al., 2010) and including parents is a cost-effective approach to maximize intervention dosage. However, parent-mediated interventions have inconsistent effects on parent and child outcomes (Oono, Honey, & McConachie, 2013). This variability is likely because parents do not have the same training as clinicians and little effort has been spent examining parent ... more",12/22/15,Northwestern University,R01DC014709,Northwestern University,8/1/15,7/31/20,2253794,Megan Roberts,290,168,122,lab,12/22/15,8/1/15,7/31/20,0.579310345,0.420689655,2015,8,1,18,9
271,640,Thalamic activity and structure and surface neural oscillations in autism,https://nda.nih.gov/edit_collection.html?id=2706,"Atypical neural activity at the brain surface is frequently reported in individuals with autism spectrum disorder (ASD). Many researchers hypothesize that this atypical surface neural activity is due to an incorrect balance in the brain chemicals that control the firing rate of neurons. Although there is evidence to support this hypothesis, a more important influence on surface brain rhythms may be the contribution of deeper and more central brain structures to surface brain activity. One of these ... more",7/13/17,Children's Hospital of Philadelphia,R21NS090192,Childrens Hosp Of Philadelphia,8/1/15,1/31/18,389562,James (Christopher) Edgar,38,38,0,lab,7/13/17,8/1/15,1/31/18,1,0,2015,8,1,18,10
272,297,Enhancing Social Cognitive Training with Oxytocin: Linking Target Engagement to Clinical Effects,https://nda.nih.gov/edit_collection.html?id=2305,"Intranasal oxytocin (OT) has shown promise as an agent that can effectively improve social processing in disorders that are characterized by impairments in social behaviors, including schizophrenia. However, important gaps in our understanding of OTs effects on the brain have greatly limited its development as a therapeutic agent and made it difficult to interpret mixed research findings. One very important therapeutic function of OT may be its ability to enhance learning of social information. The ... more",8/19/15,VA Greater Los Angeles Healthcare System,R21MH107564,University Of California Los Angeles,8/15/15,8/31/21,2524007,Stephen Marder,55,41,14,lab,8/19/15,8/15/15,8/31/21,0.745454545,0.254545455,2015,8,15,18,11
273,304,Social affiliation in psychosis: Mechanisms and vulnerability factors,https://nda.nih.gov/edit_collection.html?id=2317,"Human beings have a fundamental ""need to belong."" We are powerfully motivated to seek out, engage in, and maintain strong interpersonal attachments. Developing and maintaining close relationships, however, is not an easy task for many people with mental illnesses. Disturbances in social motivation are particularly debilitating, costly, and poorly understood in people with psychosis-related psychopathology (PRP). The RDoC affiliation construct provides a foundation for conceptualizing and unpacking ... more",8/19/15,"University of California, Los Angeles",R01MH107422,University Of California Los Angeles,8/17/15,4/30/21,1892640,William Horan,200,132,68,lab,8/19/15,8/17/15,4/30/21,0.66,0.34,2015,8,17,18,12
274,310,Familial Early-Onset Suicide Attempt Biomarkers,https://nda.nih.gov/edit_collection.html?id=2326,"""The suicide rate in the USA is the same as 60 years ago. Better prevention needs more data on risk and resilience biomarkers. We seek to determine both resilience and vulnerability potential endophenotypes for suicide attempts in major depressive disorder (MDD). Both endophenotypes may aid estimation of risk and provide new targets for prevention intervention. The study design compares healthy volunteers (Group 1) with medication-free adult offspring of a parent with MDD and suicidal behavior who ... more",11/19/15,New York State Psychiatric Institute,R01MH108039,University Of Pittsburgh At Pittsburgh,8/20/15,4/30/21,1431743,Joseph Mann and David Brent,144,47,97,lab,11/19/15,8/20/15,4/30/21,0.326388889,0.673611111,2015,8,20,18,13
811,52,Cortical underconnectivity coupled with preserved visuospatial cognition in autism: Evidence from an fMRI study of an embedded figures task.,https://nda.nih.gov/study.html?id=378,"Individuals with high-functioning autism sometimes exhibit intact or superior performance on visuospatial tasks, in contrast to impaired functioning in other domains such as language comprehension, executive tasks, and social functions. The goal of the current study was to investigate the neural bases of preserved visuospatial processing in high-functioning autism from the perspective of the cortical underconnectivity theory. We used a combination of behavioral, functional magnetic resonance imaging, ... more",8/21/15,Burkhart Center for Autism Education and Research,,,8/21/15,,,"Richman DM; Barnard-Brak L, Bosch A, Thompson S, Grubb L, Abby L",17,17,0,paper,8/21/15,8/21/15,,1,0,2015,8,21,18,14
812,53,Autonomy of lower-level perception from global processing in autism: evidence from brain activation and functional connectivity.,https://nda.nih.gov/study.html?id=379,"Previous behavioral studies have shown that individuals with autism are less hindered by interference from global processing during the performance of lower-level perceptual tasks, such as finding embedded figures. The primary goal of this study was to examine the brain manifestation of such atypicality in high-functioning autism using fMRI. Fifteen participants with high-functioning autism and fifteen age- and IQ-matched typical controls were asked to perform a lower-level perceptual line-counting ... more",8/21/15,Burkhart Center for Autism Education and Research,,,8/21/15,,,"Richman DM; Barnard-Brak L, Bosch A, Thompson S, Grubb L, Abby L",27,26,1,paper,8/21/15,8/21/15,,0.962962963,0.037037037,2015,8,21,18,15
813,54,The neural basis of deictic shifting in linguistic perspective-taking in high-functioning autism,https://nda.nih.gov/study.html?id=380,"Personal pronouns, such as 'I' and 'you', require a speaker/listener to continuously re-map their reciprocal relation to their referent, depending on who is saying the pronoun. This process, called 'deictic shifting', may underlie the incorrect production of these pronouns, or 'pronoun reversals', such as referring to oneself with the pronoun 'you', which has been reported in children with autism. The underlying neural basis of deictic shifting, however, is not understood, nor has the processing ... more",8/21/15,Burkhart Center for Autism Education and Research,,,8/21/15,,,"Richman DM; Barnard-Brak L, Bosch A, Thompson S, Grubb L, Abby L",29,28,1,paper,8/21/15,8/21/15,,0.965517241,0.034482759,2015,8,21,18,16
814,55,Distinctive Neural Processes during Learning in Autism,https://nda.nih.gov/study.html?id=381,"This functional magnetic resonance imaging study compared the neural activation patterns of 18 high-functioning individuals with autism and 18 IQ-matched neurotypical control participants as they learned to perform a social judgment task. Participants learned to identify liars among pairs of computer-animated avatars uttering the same sentence but with different facial and vocal expressions, namely those that have previously been associated with lying versus truth-telling. Despite showing a behavioral ... more",8/21/15,Burkhart Center for Autism Education and Research,,,8/21/15,,,"Richman DM; Barnard-Brak L, Bosch A, Thompson S, Grubb L, Abby L",32,30,2,paper,8/21/15,8/21/15,,0.9375,0.0625,2015,8,21,18,17
275,320,Multimodal Imaging of Early Neural Signature in Autism Spectrum Disorder,https://nda.nih.gov/edit_collection.html?id=2338,"The high and rapidly increasing prevalence of autism spectrum disorder (ASD) presents a major public health challenge, as costs of care and the need for more effective interventions are growing. While classified as a brain development disorder, its diagnostic criteria remain entirely behavioral because reliable biomarkers have yet to be established. Despite a growing number of findings converging on network dysfunction and abnormal brain connectivity as potential biomarkers of the disorder, the precise ... more",1/6/16,San Diego State University,R01MH107802,San Diego State University,9/1/15,8/31/21,2563564,Inna Fishman,67,47,20,lab,1/6/16,9/1/15,8/31/21,0.701492537,0.298507463,2015,9,1,18,18
276,322,Cognitive and Neural Flexibility in Autism,https://nda.nih.gov/edit_collection.html?id=2342,"Autism spectrum disorder (ASD) is a complex neurodevelopment disorder of largely unknown etiology affecting 1 in 68 children. While much progress has been made towards understanding the neurobiology of social and communication deficits associated with the disorder, very little is known regarding the neurobiological basis of restricted and repetitive behaviors central to the ASD diagnosis. The goal of the current project is to understand the relationship between cognitive flexibility and brain function ... more",1/6/16,University of Miami,R01MH107549,University Of Miami Coral Gables,9/8/15,8/31/20,1531926,Lucina Qazi Uddin,211,140,71,lab,1/6/16,9/8/15,8/31/20,0.663507109,0.336492891,2015,9,8,18,19
277,816,Amish Connectome Project on Mental Illness,https://nda.nih.gov/edit_collection.html?id=2902,The Amish Connectome Project (ACP) will extend the Human Connectome Project (HCP) to mental illnesses by characterizing brain circuitry and its relation to psychiatric behavior and symptom dimensions. We propose to collect HCP connectomics and whole exome sequencing data in Old Order Amish (OOA) adults recruited from multigenerational families with multiplex mental disorders spanning diagnostic boundaries. Large nuclear families with two or more members with major DSM-5 disorder will be recruited ... more,3/27/18,University of Maryland,U01MH108148,University Of Maryland Baltimore,9/10/15,6/30/21,4318326,Elliott Hong,344,142,202,lab,3/27/18,9/10/15,6/30/21,0.412790698,0.587209302,2015,9,10,18,20
278,385,Sensory Integration Therapy in Autism: Mechanisms and Effectiveness,https://nda.nih.gov/edit_collection.html?id=2415,"Autism Spectrum Disorders ASD are one of the most commonly occurring neurodevelopmental disorders, affecting 1 in 68 children, frequently resulting in impairments in the functional skills necessary for independent living, and presenting a significant impact on families and society. Up to 90 percent of individuals with ASD present with difficulties processing and integrating sensory information and these have been shown to be a significant factor impacting functional skills. Intervention for these ... more",7/20/16,Albert Einstein College of Medicine,R01HD082814,"Albert Einstein College Of Medicine, Inc",9/15/15,5/31/22,3177706,Sophie Molholm and Roseann Schaaf,85,74,11,lab,7/20/16,9/15/15,5/31/22,0.870588235,0.129411765,2015,9,15,18,21
279,642,"Dimensional analysis of developmental brain disorders using an online, genome-first approach",https://nda.nih.gov/edit_collection.html?id=2708,"Developmental brain disorders (DBD) describe a wide range of developmental and psychiatric disorders,), that are etiologically heterogeneous with variable impacts on neurodevelopmental functioning. While specific manifestations of DBD have historically been categorized as distinct developmental and psychiatric diagnoses (e.g., autism spectrum disorders (ASD) and schizophrenia (SCZ)), there is significant clinical overlap among the behavioral features of these disorders. In addition, genomics research ... more",7/31/17,Geisinger,R01MH107431,Geisinger Clinic,9/15/15,5/31/20,2831740,Christa Martin,842,400,442,lab,7/31/17,9/15/15,5/31/20,0.475059382,0.524940618,2015,9,15,19,1
280,643,Development of infant brain MEG responses to social stimuli: comparison to ASD,https://nda.nih.gov/edit_collection.html?id=2709,"Orienting to face stimuli is a skill that emerges in the first year of life and that continues to develop over time. Failure to detect or respond to faces i one of the earliest hallmarks and predictors of autism spectrum disorder (ASD). Disruption in the early instantiation of the social brain networks results in lifelong social communication impairments in ASD. These social impairments in ASD are due, in part, to atypical eye gaze (findings from eye tracking studies) and abnormal neural activity ... more",7/31/17,The Children's Hospital of Philadelphia,K01MH108822,Childrens Hosp Of Philadelphia,9/15/15,8/31/21,881390,Yuhan Chen,37,27,10,lab,7/31/17,9/15/15,8/31/21,0.72972973,0.27027027,2015,9,15,19,2
281,940,Connectomes Related to Anxiety and Depression in Adolescents,https://nda.nih.gov/edit_collection.html?id=3037,"This proposal is submitted in response to NIH Funding Opportunity Connectome Related to Human Disease (U01) and in response to NIMH's priority/disease area of interest mood and anxiety disorders. This is a collaborative effort among researchers at the Massachusetts General Hospital (MGH), Massachusetts Institute of Technology (MIT), McLean Hospital, Boston University, and the Human Connectome Project (HCP) at Washington University in St. Louis. We believe that the combination of (1) state-of-the ... more",9/6/18,Massachusetts Institute of Technology,U01MH108168,Massachusetts Institute Of Technology,9/16/15,6/30/19,1235145,Susan Whitfield-Gabrieli and John Gabrieli,200,69,131,lab,9/6/18,9/16/15,6/30/19,0.345,0.655,2015,9,16,19,3
282,403,Suicide risk reduction in the year following jail release: the SPIRIT Trial (Suicide Prevention Intervention for at-Risk Individuals in Transition),https://nda.nih.gov/edit_collection.html?id=2435,"There were nearly 12 million admissions to US jails in 2012. Jailed individuals face a disproportionate risk for suicide. The time of arrest and jail detention represents an acute stressor that further exacerbates this risk. The epidemic of suicide during jail detention has been recognized. However, less attention has been paid to the high suicide risk and mortality in the months following jail release, as individuals re-enter their communities, are faced with financial, legal, and social stressors, ... more",8/3/16,Brown University,U01MH106660,Michigan State University,9/22/15,6/30/21,7624996,Jennifer Johnson,798,585,213,lab,8/3/16,9/22/15,6/30/21,0.733082707,0.266917293,2015,9,22,19,4
815,56,Association between pupillary light reflex and sensory behaviors in children with autism spectrum disorders.,https://nda.nih.gov/study.html?id=382,"Atypical pupillary light reflexes (PLR) has been observed in children with autism spectrum disorders (ASD), which suggests potential autonomic nervous system (ANS) dysfunction in ASD. ANS is also involved in modulating sensory processing and sensory dysfunction has been widely reported in children with ASD. However, the potential association between physiological measurements of PLR and behavioral observations (e.g. sensory behaviors) has not been examined extensively in literature. In this study, ... more",9/25/15,Burkhart Center for Autism Education and Research,,,9/25/15,,,"Richman DM; Barnard-Brak L, Bosch A, Thompson S, Grubb L, Abby L",92,81,11,paper,9/25/15,9/25/15,,0.880434783,0.119565217,2015,9,25,19,5
283,321,Impact of Maternal Caregiving on Brain-Behavior Relationships in Infants,https://nda.nih.gov/edit_collection.html?id=2340,"The rapid development of the human brain, and its heightened sensitivity to environmental influences, in the first months of life determine critical brain-behavior relationships in childhood and across the lifespan. Despite evidence that the effects of poor caregiving on developing neurobiological systems underlying psychopathology risk may be most influential in the early years, little is known about the interface among neurobiological, affective and developmental areas of study in human infancy. ... more",1/6/16,University of Pittsburgh,R21MH106570,University Of Pittsburgh At Pittsburgh,9/25/15,3/31/18,410844,Mary Louise Phillips,88,43,45,lab,1/6/16,9/25/15,3/31/18,0.488636364,0.511363636,2015,9,25,19,6
697,211,Systematic Treatment Enhancement Program for Bipolar Disorder (STEP-BD),https://nda.nih.gov/edit_collection.html?id=2147,"STEP-BD is the largest, federally funded treatment study ever conducted for bipolar disorder (1). It was a long-term outpatient study that enrolled a total of 4,360 participants (1). STEP-BD aimed to find out which treatments, or combinations of treatments, are most effective for treating episodes of depression and mania and for preventing recurrent episodes in people with bipolar disorder. STEP-BD is different from typical clinical trials that test one potential new treatment; it was a broad research ... more",9/27/15,,,,9/27/15,,,Gary Sachs and Michael Thase,4547,1944,2603,lab,9/27/15,9/27/15,,0.427534638,0.572465362,2015,9,27,19,7
698,212,Sequenced Treatment Alternatives to Relieve Depression (STAR*D),https://nda.nih.gov/edit_collection.html?id=2148,"The STAR*D was a multicenter longitudinal NIMH sponsored study. STAR*D was to determine the short- and long-term effects of different sequences of medication and/or psychotherapy for the treatment of unipolar depressions that have not responded adequately to an initial standard antidepressant trial. In particular, STAR*D assessed and compared the effectiveness of different sets of treatment options: 1) augmenting the first antidepressant with another medication or psychotherapy, 2) Discontinuing ... more",9/27/15,,,,9/27/15,,,A. John Rush,4266,1590,2676,lab,9/27/15,9/27/15,,0.372714487,0.627285513,2015,9,27,19,8
699,213,Methylphenidate for Hyperactivity and Impulsiveness in Children and Adolescents With Pervasive Developmental Disorders (RUPP MPH PDD),https://nda.nih.gov/edit_collection.html?id=2149,"This study will evaluate the efficacy and safety of methylphenidate for treating hyperactivity, impulsiveness, and distractibility in 60 children and adolescents with Pervasive Developmental Disorders (PDD). Methylphenidate (Ritalin)is approved by the Food and Drug Administration for the treatment of children and adolescents with Attention Deficit Hyperactivity Disorder (ADHD). Data supporting its safety and effectiveness in treating ADHD symptoms in PDD are limited.Children and adolescents who do ... more",9/27/15,,,,9/27/15,,,Larry Scahill,118,105,13,lab,9/27/15,9/27/15,,0.889830508,0.110169492,2015,9,27,19,9
284,513,Direct Examination of Imitation-Based Learning in Autism,https://nda.nih.gov/edit_collection.html?id=2566,"The ability to imitate actions performed by others has long known to be deficient in autism spectrum disorders ASD. Psychologists studying typical development have shown that imitation is a critical ability for learning complex skills social skills in particular. The link between impaired imitation and abnormal development of social, communicative and complex motor behavior in ASD, however, is speculative and has not been documented directly. The research proposed in this application intends to look ... more",1/6/17,Kennedy Krieger Institute,R21NS091569,Hugo W. Moser Res Inst Kennedy Krieger,9/30/15,6/30/18,444400,Joshua Ewen,53,40,13,lab,1/6/17,9/30/15,6/30/18,0.754716981,0.245283019,2015,9,30,19,10
285,520,Adolescent Brain Cognitive Development Study (ABCD),https://nda.nih.gov/edit_collection.html?id=2573,"The ABCD Study is designed to permit the scientific community to answer important questions about the relationships among physical and mental health, cognition, substance use (SU), culture and environment, genetics, environmental exposures and brain development of adolescents. The ABCD Study is a nationwide study of more than 10,000 9-10 year-olds conducted at 21 sites (29% of the US population lives within 50 miles of our geographically spread sites), that, uniquely, can provide a representative ... more",1/25/17,University of California San Diego,U01DA041174,Yale University,9/30/15,3/31/27,9301963,Terry L. Jernigan,11924,6220,5704,lab,1/25/17,9/30/15,3/31/27,0.521637035,0.478362965,2015,9,30,19,11
816,58,Identification of Infants at High-Risk for Autism Spectrum Disorder Using Multiparameter Multiscale White Matter Connectivity Networks,https://nda.nih.gov/study.html?id=385,"Autism spectrum disorder (ASD) is a wide range of disabilities that cause life-long cognitive impairment and social, communication, and behavioral challenges. Early diagnosis and medical intervention are important for improving the life quality of autistic patients. However, in the current practice, diagnosis often has to be delayed until the behavioral symptoms become evident during childhood. In this study, we demonstrate the feasibility of using machine learning techniques for identifying high-risk ... more",10/2/15,Burkhart Center for Autism Education and Research,,,10/2/15,,,"Richman DM; Barnard-Brak L, Bosch A, Thompson S, Grubb L, Abby L",493,302,191,paper,10/2/15,10/2/15,,0.612576065,0.387423935,2015,10,2,19,12
286,641,MEG Studies of Auditory Processing in Minimally/Non-Verbal Children with ASD and Intellectual Disabilities,https://nda.nih.gov/edit_collection.html?id=2707,"Imaging studies of ASD (including our own) have focused on an intellectually higher-functioning population (high-functioning autism, or HFA). One reason for this bias is that the majority of imaging studies entail magnetic resonance imaging (MRI), which presupposes a participant's ability to remain motionless during the study, thereby disqualifying from study the equally large ASD population with language delay and intellectual disability. We seek to investigate the neural basis of autism and associated ... more",7/14/17,Children's Hospital of Philadelphia,U54HD086984,Childrens Hosp Of Philadelphia,11/1/15,5/31/21,6345615,Mark Yudkoff and Timothy Roberts,29,22,7,lab,7/14/17,11/1/15,5/31/21,0.75862069,0.24137931,2015,11,1,19,13
817,59,Germline Mutations in Predisposition Genes in Pediatric Cancer,https://nda.nih.gov/study.html?id=387,"Background The prevalence and spectrum of predisposing mutations among children and adolescents with cancer are largely unknown. Knowledge of such mutations may improve the understanding of tumorigenesis, direct patient care, and enable genetic counseling of patients and families. Methods In 1120 patients younger than 20 years of age, we sequenced the whole genomes (in 595 patients), whole exomes (in 456), or both (in 69). We analyzed the DNA sequences of 565 genes, including 60 that have been associated ... more",11/19/15,Burkhart Center for Autism Education and Research,,,11/19/15,,,"Richman DM; Barnard-Brak L, Bosch A, Thompson S, Grubb L, Abby L",646,469,177,paper,11/19/15,11/19/15,,0.726006192,0.273993808,2015,11,19,19,14
728,311,Simons Simplex Collection (SSC) Genome Studies,https://nda.nih.gov/edit_collection.html?id=2328,"This Collection contains the following projects: (1) Maternal Modifiers and parent-of-origin bias of the autism 16p11.2 CNV: We assessed the presence of additional CNVs in 126 families where at least one individual carried the 16p11.2 CNV. (2) Genome Sequencing Pilot of Simons Simplex Collection (SSC): We performed whole-genome sequencing (WGS) of 160 genomes from 40 simplex autism families, the majority of which had no copy number variant (CNV) or candidate de novo gene-disruptive single nucleotide ... more",11/20/15,University of Washington,,,11/20/15,,,Evan Eichler,505,255,250,lab,11/20/15,11/20/15,,0.504950495,0.495049505,2015,11,20,19,15
818,60,Maternal modifiers and parent-of-origin bias of the autism 16p11.2 CNV,https://nda.nih.gov/study.html?id=389,"Recurrent deletions and duplications at chromosome 16p11.2 are a major genetic contributor to autism but also associate with a wider range of pediatric diagnoses. In order to investigate the potential genetic basis for phenotype variability, we assessed the parent-of-origin of the 16p11.2 copy number variant (CNV) and the presence of additional CNVs using commercial SNP microarrays in over 100 families where detailed phenotype data were available. Additional phenotypic and genotypic data is available ... more",11/20/15,Burkhart Center for Autism Education and Research,,,11/20/15,,,"Richman DM; Barnard-Brak L, Bosch A, Thompson S, Grubb L, Abby L",344,163,181,paper,11/20/15,11/20/15,,0.473837209,0.526162791,2015,11,20,19,16
729,312,Cincinnati MR Imaging of Neurodevelopment (C-MIND),https://nda.nih.gov/edit_collection.html?id=2329,"The Pediatric Functional Neuroimaging Research Network is a joint venture led by the Pediatric Neuroimaging Research Consortium at CCHMC in collaboration with the Laboratory of Neuroimaging (LONI), at University of Southern California, the Brain Mapping Center at UCLA, the Children's Hospital of Pittsburgh, and University of Michigan. The Pediatric Functional Neuroimaging Research Network was supported by a contract with the Eunice Kennedy Shriver National Institute of Child Health and Human Development ... more",11/25/15,Cincinnati Children's Hospital Medical Center,,,11/25/15,,,Scott Holland and Jennifer Vannest,211,99,112,lab,11/25/15,11/25/15,,0.469194313,0.530805687,2015,11,25,19,17
819,61,Targeted DNA Sequencing from Autism Spectrum Disorder Brains Implicates Multiple Genetic Mechanisms,https://nda.nih.gov/study.html?id=391,"Single nucleotide variants (SNVs), particularly loss-of-function mutations, are significant contributors to autism spectrum disorder (ASD) risk. Here we report the first systematic deep sequencing study of 55 postmortem ASD brains for SNVs in 78 known ASD candidate genes. Remarkably, even without parental samples, we find more ASD brains with mutations that are protein-altering (26/55 cases versus 12/50 controls, p = 0.015), deleterious (16/55 versus 5/50, p = 0.016), or loss-of-function (6/55 versus ... more",12/2/15,Burkhart Center for Autism Education and Research,,,12/2/15,,,"Richman DM; Barnard-Brak L, Bosch A, Thompson S, Grubb L, Abby L",119,91,28,paper,12/2/15,12/2/15,,0.764705882,0.235294118,2015,12,2,19,18
287,405,Deprivation and Threat: Dimensions of Early Experience and Neural Development,https://nda.nih.gov/edit_collection.html?id=2438,"Extensive research finds robust links between mental health and childhood adversity CA , encompassing diverse exposures from child abuse to poverty. Despite the strength and consistency of these findings, the mechanisms producing such links remain poorly specified. In particular, past research has failed to identify how specific environmental experiences influence specific neural processes. Such limitations arise from the difficulty of precisely quantifying relevant CA and neural variables in children. ... more",8/4/16,Harvard University,R01MH106482,Harvard University,12/10/15,11/30/21,3083895,Katie Mclaughlin,228,116,112,lab,8/4/16,12/10/15,11/30/21,0.50877193,0.49122807,2015,12,10,19,19
288,335,Neurobehavioral Research on Infants at Risk for Language Delay and ASD,https://nda.nih.gov/edit_collection.html?id=2355,"Searching for biomarkers and behavioral signs of early risk for neurodevelopmental disorders has emerged as an important line of clinical research in an effort to improve diagnosis and develop the most effective treatments and preventive interventions. In our current award period we identified several significant differences between infants at high familial risk for ASD (defined as having an older sibling with the disorder) and low risk control infants, including alterations in EEG, atypical lateralization ... more",3/14/16,Boston University,R01DC010290,Boston University (Charles River Campus),12/11/15,11/30/20,2404130,Helen Tager-Flusberg,236,138,98,lab,3/14/16,12/11/15,11/30/20,0.584745763,0.415254237,2015,12,11,19,20
289,508,Somatosensory Inhibitory Dysfunction in Autism Spectrum Disorder,https://nda.nih.gov/edit_collection.html?id=2561,"Autism Spectrum Disorder (ASD) is a group of developmental disorders which affects approximately 1% of children, a prevalence rate that is increasing annually. ASD is characterized by social and communicative deficits, but there is increasing recognition of altered sensory processing as an extremely common feature of the disorder. In particular, responses to tactile stimuli are commonly observed, for example, a child with ASD may be unable to tolerate constant low level stimuli such as shirt tags ... more",12/7/16,Johns Hopkins University,R01MH106564,Johns Hopkins University,1/18/16,11/30/21,2508907,Richard Edden,96,83,13,lab,12/7/16,1/18/16,11/30/21,0.864583333,0.135416667,2016,1,18,19,21
820,62,Rare Inherited and De Novo CNVs Reveal Complex Contributions to ASD Risk in Multiplex families,https://nda.nih.gov/study.html?id=393,"NOTE: NOT ALL DATA HAS BEEN UPLOADED FOR THIS STUDY. Rare mutations, including copy-number variants (CNVs), contribute significantly to autism spectrum disorder (ASD) risk. Although their importance has been established in families with only one affected child (simplex families), the contribution of both de novo and inherited CNVs to ASD in families with multiple affected individuals (multiplex families) is less well understood. We analyzed 1,532 families from the Autism Genetic Resource Exchange ... more",1/20/16,Burkhart Center for Autism Education and Research,,,1/20/16,,,"Richman DM; Barnard-Brak L, Bosch A, Thompson S, Grubb L, Abby L",3828,2536,1292,paper,1/20/16,1/20/16,,0.662486938,0.337513062,2016,1,20,20,1
290,505,Influence of Prenatal Folate on Placental mtDNA and Autism Risk,https://nda.nih.gov/edit_collection.html?id=2558,"Autism spectrum disorders (ASD) are a growing concern, with more than 1 in every 68 children affected in the US by the age of eight years. Complex interactions between genes and environmental factors are thought to contribute to ASD risk. Evidence is accumulating for a potentially large role in ASD etiology and/or morbidity for the early in-utero environment, including gestational nutrition. Maternal folic acid is one of the first modifiable factors identified to date with the potential to reduce ... more",12/7/16,"University of California, Davis",R21HD086769,University Of California At Davis,2/1/16,1/31/19,431313,Cecilia Giulivi,83,58,25,lab,12/7/16,2/1/16,1/31/19,0.698795181,0.301204819,2016,2,1,20,2
730,327,DCTRS Computer-aided Neurocognitive Remediation in Schizophrenia: Rehabilitation Outcomes and Maintenance at Follow-up,https://nda.nih.gov/edit_collection.html?id=2347,"Cognitive Remediation Therapy (CRT) is a rehabilitative technique that aims at the recovery of single cognitive functions through the execution of massive exercises of impaired cognitive domains. This study aims to establish the effectiveness of an intensive deficit-specific 3 months CRT on both cognition and daily functioning, as well as durability of results. Patients are assessed on cognitive and daily functioning at baseline, after of either CRT or placebo training added to their standard ... more",2/16/16,SAN RAFFAELE HOSPITAL,,,2/16/16,,,Roberto Cavallaro,153,89,64,lab,2/16/16,2/16/16,,0.581699346,0.418300654,2016,2,16,20,3
291,562,Dopamine enhancement of fear extinction learning in PTSD,https://nda.nih.gov/edit_collection.html?id=2621,"This R21 R33 application in response to RFA-MH-15-300 seeks to demonstrate target engagement and clinical viability for a novel combination therapy for Posttraumatic Stress Disorder. PTSD is associated with poor quality of life and comorbidity with both physical and mental illness. While exposure-based psychological treatments have proven efficacious, up to 40 percent retain PTSD diagnoses following treatment. Thus, new protocols to boost treatment efficacy can have a significant public health impact. ... more",4/18/17,University of Wisconsin-Madison,R21MH108753,University Of Wisconsin-Madison,2/16/16,12/31/22,1459899,Joshua Cisler,172,0,172,lab,4/18/17,2/16/16,12/31/22,0,1,2016,2,16,20,4
731,328,Aspirin as Adjuvant Therapy in Young Psychotic Patients,https://nda.nih.gov/edit_collection.html?id=2348,"The aim of the study would be to determine the effects of adjuvant aspirin therapy on soft neurological signs, PANSS and the cytokine profile. The study would be a randomized, double-blind, placebo controlled in two parallel groups of 50 to 60 patients who are neuroleptic naive or previously minimally medicated with the duration of the illness up to seven years. The study would involve the patients of both sexes, aged 18 to 28 years, according to ICD 10 criteria to satisfy diagnosis F 20 to F 29. ... more",2/22/16,"Clinic for mental disorders ""Dr Laza Lazarevic"", Padinska Skela",,,2/22/16,,,Dragana Pavicevic,60,34,26,lab,2/22/16,2/22/16,,0.566666667,0.433333333,2016,2,22,20,5
732,330,DCTRS Computer-assisted cognitive remediation program for adolescents at high risk of psychosis or with psychotic disorders. Measure of cognitive and clinical efficacy.,https://nda.nih.gov/edit_collection.html?id=2350,"Cognitive impairments are frequent among adolescents with psychotic disorders and exist among adolescents at high risk of psychosis. Cognitive impairments precede the onset of schizophrenia spectrum disorders and may worsen in the early course of the disorders. Cognitive impairment hampers learning processes and may hinder school or academic achievements and account for functional outcome in major psychiatric disorders. Cognitive remediation programs are available in computerized versions. In psychiatry, ... more",2/26/16,UNIVERSITY OF LAUSANNE,,,2/26/16,,,"Laurent Holzer, Laure Jaugey, Michael Herzog, and Olivier Halfon",33,20,13,lab,2/26/16,2/26/16,,0.606060606,0.393939394,2016,2,26,20,6
292,502,A longitudinal study of brain development in children with autism,https://nda.nih.gov/edit_collection.html?id=2555,"Our laboratory has observed abnormalities in resting-state (RS) and auditory neural activity in children with autism spectrum disorder (ASD). There is a clinical component to these findings, with RS and auditory brain rhythms predicting symptom severity. There is a developmental/maturational component, with age cross-sectional findings indicating greater clinical impairment in the children with ASD with the most delayed maturation of RS and auditory processes. Finally, there is a structural component, ... more",12/7/16,Children's Hospital of Philadelphia,R01MH107506,Childrens Hosp Of Philadelphia,3/1/16,2/28/22,3283457,James Edgar,115,101,14,lab,12/7/16,3/1/16,2/28/22,0.87826087,0.12173913,2016,3,1,20,7
293,522,The Role of Dysmyelination in Cognitive Impairment of Psychotic Spectrum Disorders,https://nda.nih.gov/edit_collection.html?id=2575,"Psychotic spectrum disorders PSD are disabling severe mental syndromes with high prevalence. Among the PSD deficits, cognitive dysfunction represents a core characteristic shown to the best predictor of poor outcome and chronic disability. However, current therapies do not adequately address cognitive symptoms. This limitation reflects to a large degree the still incipient and incomplete understanding of the involved neural mechanisms. A significant predictor of cognitive ability in both healthy ... more",1/27/17,NYU School of Medicine,R01MH108962,New York University School Of Medicine,3/1/16,11/30/21,2467907,Mariana Lazar,107,57,50,lab,1/27/17,3/1/16,11/30/21,0.53271028,0.46728972,2016,3,1,20,8
294,333,Perception and central coherence in autism: A family genetic eye-tracking study,https://nda.nih.gov/edit_collection.html?id=2353,"Autism Spectrum Disorder (ASD) is a neurogenetic disorder characterized by social-communication deficits as well as restricted and repetitive interests and behaviors. Differences in perceptual coherence, including a local perceptual bias at the expense of global processing and perseverative visual attention related to circumscribed interests, are thought to underlie key features of ASD. Local and global (i.e., selective attention to parts vs. wholes, respectively) processing abilities rely on different ... more",3/14/16,Northwestern University,R03MH107834,Northwestern University,3/3/16,2/28/19,147006,Molly Losh,228,105,123,lab,3/14/16,3/3/16,2/28/19,0.460526316,0.539473684,2016,3,3,20,9
295,507,Peripersonal Space Representation as a Basis for Social Deficits in Autism and Schizophrenia Spectrum Disorders,https://nda.nih.gov/edit_collection.html?id=2560,"The objective of the proposed project is to compare and contrast multisensory representation of peripersonal space (PPS) in two clinical groups: adults with autism spectrum disorder (ASD) and schizophrenia (SZ). The NIMH has stressed the importance of investigations that cross diagnostic categories and identify neural substrates of symptoms that are both shared and divergent across clinical groups. This project will follow this directive and extend it by focusing on basic sensory processes, which ... more",12/7/16,Vanderbilt University Medical Center,R21MH109225,Vanderbilt University,3/3/16,2/28/19,434500,Carissa Cascio,117,74,43,lab,12/7/16,3/3/16,2/28/19,0.632478632,0.367521368,2016,3,3,20,10
296,516,Neurobiological and Behavioral Risk Mechanisms of Youth Avoidant/Restrictive Eating Trajectories,https://nda.nih.gov/edit_collection.html?id=2569,"Avoidant and restrictive eating is common across youth mental health disorders, and is prospectively associated with poor growth, nutritional deficiencies, psychiatric symptoms, and psychosocial impairment. The newly introduced DSM-5 Avoidant Restrictive Food Intake Disorder includes some but not all avoidant and restrictive eating presentations. Initial evidence suggests that avoidant and restrictive eating is highly heterogeneous, with poor intake characterized by choking or vomiting phobias ... more",1/12/17,Massachusetts General Hospital,R01MH108595,Massachusetts General Hospital,3/15/16,2/28/21,2690870,Jennifer Thomas,105,54,51,lab,1/12/17,3/15/16,2/28/21,0.514285714,0.485714286,2016,3,15,20,11
297,363,Fear extinction and sleep across the spectrum of severity in post-traumatic hyperarousal,https://nda.nih.gov/edit_collection.html?id=2393,"Proposed research will examine interrelationships between hyperarousal, sleep quality and extinction memory among persons who have experienced a severe traumatic event within the past 2 years (excluding the past month). In the aftermath of such an event, sleep disruption is very common and, particularly in the case of REM sleep, can predict the later development of post-traumatic psychological symptoms. Although sleep disruption is commonly classified with waking symptoms of hyperarousal, even mild ... more",7/12/16,Massachusetts General Hospital,R01MH109638,Massachusetts General Hospital,3/17/16,2/29/20,2548008,Edward Pace-Schott,150,46,104,lab,7/12/16,3/17/16,2/29/20,0.306666667,0.693333333,2016,3,17,20,12
733,338,DCTRS Predictors of Response to Cognitive Remediation in Schizophrenia,https://nda.nih.gov/edit_collection.html?id=2359,"In spite of a corpus of well over 40 randomized controlled trials, with a total of over 2000 participants, both national and international treatment guideline reports still do not consider cognitive remediation (CR) an evidence-based recommended treatment for individuals with psychosis. There is a call for additional randomized controlled trials evaluating the efficacy and durability of cognitive remediation, its impact on functional outcomes, and its mechanisms of change. The current proposal has ... more",3/24/16,VA Connecticut Healthcare System,,,3/24/16,,,Joanna Fiszdon,75,55,20,lab,3/24/16,3/24/16,,0.733333333,0.266666667,2016,3,24,20,13
298,1010,Cognitive Control in Anxiety: The Role of Ovarian Hormones,https://nda.nih.gov/edit_collection.html?id=3112,"The proposed project will address the nature and impact of anxiety in women by examining the interplay of anxiety, cognitive control dysfunction, and ovarian hormones (i.e., estradiol and progesterone). Despite sex differences in brain structure and function critical to cognitive control, limited works has been dedicated to directly examining how such differences might play a role in how anxiety manifests in and affects women. We will address this glaring gap in our understanding of anxiety in women ... more",1/9/19,Michigan State University,R01MH108511,Michigan State University,3/25/16,2/28/21,1776027,Jason Scot Moser,170,0,170,lab,1/9/19,3/25/16,2/28/21,0,1,2016,3,25,20,14
734,340,DCTRS Neurocognitive individualized training versus social skills individualized training: A randomized trial in patients with schizophrenia (DCTRS),https://nda.nih.gov/edit_collection.html?id=2362,Rehabilitation programs integrating cognitive remediation (CR) and psychosocial rehabilitation are often implemented as they seem to yield greater improvements in functional outcome than stand alone treatment approaches. Mechanisms underlying synergistic effects of combining CR with psychosocial interventions are not fully understood. Disentangling the relative contribution of each component of integrated programs might improve understanding of underlying mechanisms. In the present study we compared ... more,3/28/16,University of Campania Luigi Vanvitelli,,,3/28/16,,,Silvana Galderisi,58,47,11,lab,3/28/16,3/28/16,,0.810344828,0.189655172,2016,3,28,20,15
821,69,Variants in adjacent oxytocin/vasopressin gene region and associations with ASD diagnosis and autism related endophenotypes,https://nda.nih.gov/study.html?id=404,"Background: There has been increasing interest in oxytocin (peptide: OT, gene: OXT) as a treatment pathway for neurodevelopmental disorders such as Autism Spectrum Disorder (ASD). Neurodevelopmental disorders affect functional, social, and intellectual abilities. With advances in molecular biology, research has connected multiple gene regions to the clinical presentation of ASD. Studies have also shown that the neuropeptide hormones OT and arginine vasopressin (AVP) influence mammalian social and ... more",3/28/16,Burkhart Center for Autism Education and Research,,,3/28/16,,,"Richman DM; Barnard-Brak L, Bosch A, Thompson S, Grubb L, Abby L",568,330,238,paper,3/28/16,3/28/16,,0.580985915,0.419014085,2016,3,28,20,16
822,70,The contribution of mosaic variants to autism spectrum disorder,https://nda.nih.gov/study.html?id=405,"De novo mutation is highly implicated in autism spectrum disorder (ASD). However, the contribution of post-zygotic mutation to ASD is poorly characterized. We performed both exome sequencing of paired samples and analysis of de novo variants from whole-exome sequencing of 2,388 families. While we find little evidence for tissue-specific mosaic mutation, multi-tissue post-zygotic mutation (i.e. mosaicism) is frequent, with detectable mosaic variation comprising 5.4% of all de novo mutations. We identify ... more",3/28/16,Burkhart Center for Autism Education and Research,,,3/28/16,,,"Richman DM; Barnard-Brak L, Bosch A, Thompson S, Grubb L, Abby L",9047,5341,3706,paper,3/28/16,3/28/16,,0.590361446,0.409638554,2016,3,28,20,17
735,346,Clinical and Immunological Investigations of Subtypes of Autism,https://nda.nih.gov/edit_collection.html?id=2368,"This was a longitudinal observational study of children with autistic disorder, non-autism developmental delay, or typical development.",3/31/16,NIH,,,3/31/16,,,Susan Swedo,203,150,53,lab,3/31/16,3/31/16,,0.738916256,0.261083744,2016,3,31,20,18
299,331,Arousal Tendencies and Individual Differences in Children with Autism Spectrum Disorder,https://nda.nih.gov/edit_collection.html?id=2351,Children with autism spectrum disorder (ASD) demonstrate significant variation in the degree and patterning of core symptomatology as well as high rates of comorbid externalizing behavior problems that can exacerbate impairment in functioning and impede learning. Few factors have been identified as predictive of individual differences in the behavioral phenotype of children with ASD. Innovation: The proposed study builds upon methods that have been successful in understanding individual differences ... more,3/14/16,"California State University, Fullerton",R15HD087877,California State University Fullerton,4/1/16,3/31/19,412667,Jason Baker,73,58,15,lab,3/14/16,4/1/16,3/31/19,0.794520548,0.205479452,2016,4,1,20,19
300,409,Emergence and Stability of Autism in Fragile X Syndrome,https://nda.nih.gov/edit_collection.html?id=2442,"Autism spectrum disorder (ASD) is a devastating and common neurodevelopmental disorder and a major public health concern. Fragile X syndrome is the leading known genetic cause of autism, and both fragile X syndrome and the FMR1 premutation are highly associated with autism with ~70% and ~20% meeting DSM- criteria respectively. This proposal extends our initial study, Emergence and Stability of Autism in Fragile X, focused on behavioral symptoms and biomarkers of ASD risk in infants with fragile X ... more",8/5/16,University of South Carolina,R01MH090194,University Of South Carolina At Columbia,4/1/16,2/28/21,2243379,Jane Roberts,29,20,9,lab,8/5/16,4/1/16,2/28/21,0.689655172,0.310344828,2016,4,1,20,20
301,413,Prospective Determination of Neurobehavioral Risk for the Development of Emotion Disorders,https://nda.nih.gov/edit_collection.html?id=2447,"Anxiety disorders and depression are common, costly, and often difficult to treat, underscoring the need to understand the biological mechanisms that confer elevated risk. Individuals with a neurotic-anxious NA disposition are particularly vulnerable to these debilitating emotional disorders during late adolescence and early adulthood. NA is a trait-like phenotype that is evident early in life, stable over time, heritable, and characterized by sustained levels of heightened anxiety in contexts where ... more",8/5/16,University of Maryland,R01MH107444,"Univ Of Maryland, College Park",4/1/16,1/31/22,3384218,Alexander Shackman,258,129,129,lab,8/5/16,4/1/16,1/31/22,0.5,0.5,2016,4,1,20,21
302,418,"Trauma exposure, emotion regulation and cognitive skills in early childhood: Prospective and longitudinal examination of the mechanisms of adjustment",https://nda.nih.gov/edit_collection.html?id=2452,Exposure to trauma has a significant influence on developmental and mental health in young children. The proposed project is a renewal application designed to extend the findings of R01 MH079252-03 that successfully tested and modeled the relation between potential protective factors and mental health outcomes for a sample of 302 youth in foster care over three time points. The results indicated that constructs like child appraisal of events and coping or problem-solving style mediated the relation ... more,8/5/16,University of Kansas,R01MH079252,University Of Kansas Lawrence,4/1/16,1/31/22,3446695,Yolanda Jackson,665,184,481,lab,8/5/16,4/1/16,1/31/22,0.276691729,0.723308271,2016,4,1,21,1
303,514,Novel Cross-Species Neurophysiological Assays of Reward and Cognitive Domains,https://nda.nih.gov/edit_collection.html?id=2567,"Deficits across the domains of reward and cognition are defining characteristics of virtually all neuropsychiatric disorders, and have deleterious effects on functional recovery, disease chronicity, and morbidity. Development of effective treatments is hindered by the lack of well-validated preclinical measures of target engagement that are functionally similar across species. Capitalizing on a partnership among basic and translational neuroscientists with a strong track record of collaborations, ... more",1/9/17,Harvard University,UH2MH109334,Mclean Hospital,4/1/16,8/31/21,3298156,Diego Pizzagalli,149,58,91,lab,1/9/17,4/1/16,8/31/21,0.389261745,0.610738255,2016,4,1,21,2
304,518,Neurophysiological biomarkers of behavioral dimensions from cross-species paradigms,https://nda.nih.gov/edit_collection.html?id=2571,"There has been a fundamental failure to translate preclinically-supported compounds into clinically-approved treatments. This failure generally reflects the profound differences between phenomenon assessed in the laboratory and those targeted in the clinic. Behavioral similarity is not enough to suggest translation. For novel treatments to emerge, they will require animal models with cross-species consistency. Hence, there is a critical need for i neurophysiological biomarkers of behaviors relevant ... more",1/17/17,University of California San Diego,UH2MH109168,"University Of California, San Diego",4/1/16,8/31/21,2018003,Jared Young,91,49,42,lab,1/17/17,4/1/16,8/31/21,0.538461538,0.461538462,2016,4,1,21,3
305,524,Developmental changes in reward responsivity: Associations with depression risk markers,https://nda.nih.gov/edit_collection.html?id=2578,"Major depressive disorder is a burdensome disease that is prevalent in the general population. Despite much research on risk for and etiology of depression, processes related to the development of depression are only beginning to be understood. Family history of depressive disorders and developmental status are well established risk factors for depressive disorders. Offspring of depressed parents are at increased risk for depression and depression rates increase in adolescence. However, these broad ... more",1/27/17,Temple University,R01MH107495,Temple Univ Of The Commonwealth,4/1/16,1/31/21,799977,Thomas Olino,539,185,354,lab,1/27/17,4/1/16,1/31/21,0.3432282,0.6567718,2016,4,1,21,4
306,525,Effectiveness Trial of Treatment to Reduce Serious Antisocial Behavior in Emerging Adults with Mental Illness,https://nda.nih.gov/edit_collection.html?id=2580,"Serious antisocial behavior, including criminal offending, is extremely costly to society. Rates of such behavior are highest during emerging adulthood. Antisocial behavior is especially high among emerging adults EAs with mental illness MI findings suggest the majority of EAs with MI will be arrested by age 25, most with multiple arrests, and for serious charges. Thus, there is a clear public health need for effective treatments to reduce serious antisocial behavior in EAs with MI. Astonishingly, ... more",1/27/17,University of Massachusetts Medical School,R01MH108793,Univ Of Massachusetts Med Sch Worcester,4/1/16,1/31/22,3112067,Maryann Davis,132,80,52,lab,1/27/17,4/1/16,1/31/22,0.606060606,0.393939394,2016,4,1,21,5
307,637,The Autism MEAL Plan: A Parent Training Curriculum to Manage Eating Aversions and Limited Variety among Children with Autism,https://nda.nih.gov/edit_collection.html?id=2702,"Children with autism spectrum disorders (ASD) have a fivefold increase in the odds of developing a feeding problem compared with peers. Food selectivity (i.e., only eating a narrow variety of foods) is the most widely documented feeding issue associated with ASD, often involving strong preferences for starches and snack foods coinciding with a bias against fruits and vegetables. Estimates of food selectivity in children wit ASD reach as high as 95%, suggesting feeding problems may occur at near epidemic ... more",7/12/17,Emory University,R03HD083729,Emory University,4/7/16,3/31/18,137851,William Sharp,44,37,7,lab,7/12/17,4/7/16,3/31/18,0.840909091,0.159090909,2016,4,7,21,6
308,408,Structural and Functional Characteristics of XYY - Relationship to ASD,https://nda.nih.gov/edit_collection.html?id=2441,"This proposal addresses two challenges of great importance to child health defining genetic etiologies of autism spectrum disorders ASD and establishing clinical-pathophysiological mechanisms in ASD. Autism is common in the US, affecting 1 percent of the population, and is heterogeneous with regard to etiology, pathogenesis, and clinical presentation. A known, genetic risk factor for ASD is the male sex chromosome disorder, 47, XYY syndrome XYY. Approximately one third of males with XYY satisfy diagnostic ... more",8/5/16,Children's Hospital of Philadelphia,R21MH109158,Childrens Hosp Of Philadelphia,4/11/16,6/30/19,398777,Timothy Roberts,56,56,0,lab,8/5/16,4/11/16,6/30/19,1,0,2016,4,11,21,7
309,511,Preventing Internalizing Psychopathology in Preadolescents Exposed to Chronic Stress,https://nda.nih.gov/edit_collection.html?id=2564,"Racial and socioeconomic disparities in physical and mental health problems are large, persistent, and severe; begin during childhood; and stem from in part damage to physiologic stress response systems caused by chronic stress. Discovery of ways to prevent and/or halt this progression of damage to a child's stress response system may offer new directions for combatting health disparities. This project will evaluate the efficacy of a new prevention program designed to teach preadolescent children ... more",12/12/16,Penn State University,R33MH107631,Pennsylvania State University-Univ Park,4/11/16,3/31/19,1143781,Martha Wadsworth,176,54,122,lab,12/12/16,4/11/16,3/31/19,0.306818182,0.693181818,2016,4,11,21,8
736,347,DCTRS Efficacy of Social Cognition Training in Schizophrenia,https://nda.nih.gov/edit_collection.html?id=2370,"The term social cognition refers to how social information is processed. Individuals with schizophrenia and schizoaffective disorder have been shown to have significant deficits in social cognition. Moreover, it has been speculated that these deficits may in turn have a negative impact on their overall functioning. Behavioral interventions targeting social cognition are just beginning to emerge, and there is a need to evaluate their efficacy. This is a small RCT evaluating the efficacy of social ... more",4/12/16,VA Connecticut Healthcare System,,,4/12/16,,,Joanna Fiszdon,52,32,20,lab,4/12/16,4/12/16,,0.615384615,0.384615385,2016,4,12,21,9
310,407,Development of Behavioral and Neural Biomarkers for Autism Spectrum Disorder Using a Genetically Defined Subtype,https://nda.nih.gov/edit_collection.html?id=2440,"Autism spectrum disorder ASD affects 1 in 68 children CDC, 2014 with known genetic causes accounting for 10-15 percent of cases Devlin and Scherer, 2012 Gaugler et al., 2014. Approximately 2 percent of severely affected children with ASD have deletions or point mutations in the SHANK3 gene, which results in Phelan- McDermid syndrome PMS Betancur and Buxbaum, 2013 Leblond et al, 2014. SHANK3 is a scaffolding protein in glutamate synapses Bodzdagi et al., 2013 Yang et al., 2012. Over 80 percent of ... more",8/5/16,Icahn School of Medicine at Mount Sinai,R21MH107839,Icahn School Of Medicine At Mount Sinai,4/19/16,3/31/18,444059,Joseph Buxbaum,1,1,0,lab,8/5/16,4/19/16,3/31/18,1,0,2016,4,19,21,10
311,503,Behavioral Economic Measures of Sensitivity to Social Reward in Children with ASD,https://nda.nih.gov/edit_collection.html?id=2556,"There is an emerging supposition that autism spectrum disorder (ASD) originates from a failure to. According to this model, diminished sensitivity to social reward produces negative downstream consequences that coalesce into ASD symptomatology. That is, a child's failure to derive value from social interactions causes them to attend less to people and social events in their environment from which typically-developing (TD) children learn important skills. This failure to adequately engage with, and ... more",12/7/16,Emory University School of Medicine,R21MH108873,Emory University,4/21/16,3/31/19,404283,Nathan Call,88,62,26,lab,12/7/16,4/21/16,3/31/19,0.704545455,0.295454545,2016,4,21,21,11
312,344,Neuroimaging Studies of Reward Processing in Depression,https://nda.nih.gov/edit_collection.html?id=2366,"Depression is a major public health problem. However, the heterogeneity of DSM-defined major depressive disorder (MDD) has prevented elucidating the etiology and the pathophysiology of this prevalent disorder. A core feature of MDD is impairment in reward processing, in the form of decreased reward motivation and anhedonia. The prior project periods for this grant established several key neural underpinnings of these symptoms including abnormalities in the structure and function of the medial prefrontal ... more",3/31/16,Harvard University,R37MH068376,Mclean Hospital,4/28/16,2/28/22,3686528,Diego Pizzagalli,121,32,89,lab,3/31/16,4/28/16,2/28/22,0.26446281,0.73553719,2016,4,28,21,12
313,406,Evaluation of Neurophysiological Function in Patients with Severe Anorexia Nervosa: Before and After Medical Stabilization,https://nda.nih.gov/edit_collection.html?id=2439,"This project will examine cognitive deficits in severe, life threatening anorexia nervosa before and after medical stabilization. Medical stabilization is established when the patient is consuming 2000-3000 kcal day, the patients laboratory values show that end organ failure is resolved or resolving, and that they are through the refeeding syndrome, the patient has minimal edema, and is physically strong enough to progress to eating disorder treatment programs, the patient is deemed as medically ... more",8/4/16,Denver Health,R21MH109425,Denver Health And Hospital Authority,5/5/16,1/31/19,371725,Melanie Rylander,44,0,44,lab,8/4/16,5/5/16,1/31/19,0,1,2016,5,5,21,13
314,495,Associative Processes in Episodic Memory,https://nda.nih.gov/edit_collection.html?id=2546,"The hallmark feature of episodic memory is the ability to link events with their temporal and situational contexts. This ability allows for memories to be truly autobiographical, and failures of episodic memory are signs of normal aging and neurodegenerative disease. The proposed research aims to illuminate the neural and cognitive mechanisms underlying human episodic contextually-mediated memory through both computational modeling and the analysis of intracranial and scalp electroencephalographic ... more",11/2/16,University of Pennsylvania,R01MH055687,University Of Pennsylvania,5/5/16,1/31/21,1939883,Michael Kahana,174,71,103,lab,11/2/16,5/5/16,1/31/21,0.408045977,0.591954023,2016,5,5,21,14
823,71,De novo genic mutations among a Chinese autism spectrum disorder cohort,https://nda.nih.gov/study.html?id=406,"Recurrent de novo (DN) and likely gene-disruptive (LGD) mutations are important risk factors for autism spectrum disorders (ASD) but have been primarily investigated in cohorts of European ancestry. We sequenced 189 risk genes in 1,543 ASD probands (1,045 from trios) with Chinese ancestry. We report an 11-fold increase in the odds of DN LGD mutations compared to expectation under an exome-wide mutational rate model based on chimpanzeehuman divergence. This enrichment for DN LGD mutations remains ... more",5/6/16,Burkhart Center for Autism Education and Research,,,5/6/16,,,"Richman DM; Barnard-Brak L, Bosch A, Thompson S, Grubb L, Abby L",1647,1445,202,paper,5/6/16,5/6/16,,0.877352763,0.122647237,2016,5,6,21,15
824,72,Acetaminophen Use for Fever in Children Associated with Autism Spectrum Disorder,https://nda.nih.gov/study.html?id=407,"Autism Spectrum Disorder (ASD) is characterized by persistent deficits in social communication and restrictive behavior, interests, and activities. Our previous case-control study showed that use of acetaminophen at age 12-18 months is associated with increased likelihood for ASD (OR 8.37, 95% CI 2.08-33.7). In this study, we again show that acetaminophen use is associated with ASD (p = 0.013). Because these children are older than in our first study, the association is reversed; fewer children with ... more",5/9/16,Burkhart Center for Autism Education and Research,,,5/9/16,,,"Richman DM; Barnard-Brak L, Bosch A, Thompson S, Grubb L, Abby L",86,75,11,paper,5/9/16,5/9/16,,0.872093023,0.127906977,2016,5,9,21,16
825,73,Cross-trial prediction of treatment outcome in depression: a machine learning approach,https://nda.nih.gov/study.html?id=408,"Background: Antidepressant treatment efficacy is low, but might be improved by matching patients to interventions. At present, clinicians have no empirically validated mechanisms to assess whether a patient with depression will respond to a specific antidepressant. We aimed to develop an algorithm to assess whether patients will achieve symptomatic remission from a 12-week course of citalopram. Methods: We used patient-reported data from patients with depression (n=4041, with 1949 completers) from ... more",5/17/16,Burkhart Center for Autism Education and Research,,,5/17/16,,,"Richman DM; Barnard-Brak L, Bosch A, Thompson S, Grubb L, Abby L",1949,694,1255,paper,5/17/16,5/17/16,,0.356080041,0.643919959,2016,5,17,21,17
315,382,Gene Dosage Imbalance in Neurodevelopmental Disorders,https://nda.nih.gov/edit_collection.html?id=2412,"Developmental brain disorders DBD comprise an etiologically-heterogeneous, behaviorally-defined group of conditions affecting a significant percentage of U.S. children and adults. Shared genomic underpinnings now directly connect seemingly unrelated DBD, including autism ASD, intellectual disability and schizophrenia. DBD have traditionally been studied using categorical criteria e.g., ASD versus no ASD that are no longer consistent with biological evidence. Here, we propose a genome-first approach ... more",7/15/16,Geisinger,R01MH074090,Geisinger Clinic,5/17/16,2/28/22,3870620,David Ledbetter,184,59,125,lab,7/15/16,5/17/16,2/28/22,0.320652174,0.679347826,2016,5,17,21,18
316,768,HCP-D Mapping the Human Connectome During Typical Development (HCP-D),https://nda.nih.gov/edit_collection.html?id=2846,The major technological and analytical advances in human brain imaging achieved as part of the Human Connectome Projects (HCP) enable examination of structural and functional brain connectivity at unprecedented levels of spatial and temporal resolution. This information is proving crucial to our understanding of normative variation in adult brain connectivity. It is now timely to use the tools and analytical approaches developed by the HCP to understand how structural and functional wiring of the ... more,1/29/18,Washington University in St. Louis,U01MH109589,Washington University,5/17/16,4/30/20,3423207,"Deanna Barch, Susan Bookheimer, Randy Buckner, Mirella Dapretto, Stephen Smith, Leah Somerville, Kathleen Thomas, David Van Essen, Essa Yacoub",652,301,351,lab,1/29/18,5/17/16,4/30/20,0.461656442,0.538343558,2016,5,17,21,19
317,827,Human Connectome Project for Early Psychosis,https://nda.nih.gov/edit_collection.html?id=2914,"The Human Connectome Project HCP was initiated to accelerate progress in understanding the organization of the human brain. To accomplish this goal, the original HCP Washington-University-Minnesota and MGH Harvard-UCLA Projects have focused on acquiring and sharing data relevant to structural and functional connectivity in 1200 healthy twins and their siblings. The main aims have been to use advanced 3T imaging to develop advanced data acquisition and scanning sequences, to develop novel algorithms ... more",5/3/18,Brigham and Women's Hospital,U01MH109977,Brigham And Womens Hospital,5/17/16,2/29/20,2954138,Martha Shenton,185,117,68,lab,5/3/18,5/17/16,2/29/20,0.632432432,0.367567568,2016,5,17,21,20
826,74,Frequency and Complexity of De Novo Structural Mutation in Autism,https://nda.nih.gov/study.html?id=410,"Genetic studies of autism spectrum disorder (ASD) have established that de novo duplications and deletions contribute to risk. However, ascertainment of structural variants (SVs) has been restricted by the coarse resolution of current approaches. By applying a custom pipeline for SV discovery, genotyping, and de novo assembly to genome sequencing of 235 subjects (71 affected individuals, 26 healthy siblings, and their parents), we compiled an atlas of 29,719 SV loci (5,213/genome), comprising 11 ... more",5/23/16,Burkhart Center for Autism Education and Research,,,5/23/16,,,"Richman DM; Barnard-Brak L, Bosch A, Thompson S, Grubb L, Abby L",235,138,97,paper,5/23/16,5/23/16,,0.587234043,0.412765957,2016,5,23,21,21
737,352,Phenotype and Genetic Factors in Autism Spectrum Disorders: Autism Consortium,https://nda.nih.gov/edit_collection.html?id=2382,"The objective of this study was to collect comprehensive behavioral and medical data on individuals with autism, their parents, and one or more unaffected siblings for inclusion in the Autism Consortium data respository maintained in the Psychiatric and Neurodevelopmental Genetics Unit at Massachusetts General Hospital.",5/25/16,Massachusetts General Hospital,,,5/25/16,,,Jordan Smoller,772,460,312,lab,5/25/16,5/25/16,,0.595854922,0.404145078,2016,5,25,22,1
738,353,Adjunctive Use of Celecoxib in the Treatment of Bipolar Postpartum Depression,https://nda.nih.gov/edit_collection.html?id=2383,"The investigators will conduct a 6-week, randomized, double-blind, placebo-controlled trial of celecoxib as an add-on treatment to the mood stabilizer among women with bipolar I or II postpartum depression. Women who are taking a mood stabilizer for treatment of bipolar disorder in the postpartum treatment will receive either a placebo or celecoxib add-on treatment. Patients will be monitored regularly to assess psychiatric symptoms and side effects. The investigators aim to evaluate the potential ... more",5/26/16,St Joseph's Health Care London,,,5/26/16,,,Verinder Sharma,1,0,1,lab,5/26/16,5/26/16,,0,1,2016,5,26,22,2
318,351,Aging Inmates Suicidal Ideation and Depression (Aging INSIDE) Study,https://nda.nih.gov/edit_collection.html?id=2381,"This study seeks to determine how changes in physical capacity and cognition, and unique demands of the prison environment may work together to impact older inmates likelihood of experiencing depression and suicidal ideation. We will recruit a sample of 250 sentenced inmates age 50 and older from 10 Connecticut state prisons, collecting data at baseline and 12 months from complementary sources (self and performance based assessments, medical chart review, offender-based data).",5/16/16,UConn Health,R01MH106529,University Of Connecticut Sch Of Med/Dnt,6/1/16,3/31/22,1993750,Lisa Barry,258,244,14,lab,5/16/16,6/1/16,3/31/22,0.945736434,0.054263566,2016,6,1,22,3
319,383,Scaling up Science-based Mental Health Interventions in Latin America,https://nda.nih.gov/edit_collection.html?id=2413,"Mental health disorders are increasingly recognized as a major cause of the global burden of disease, accounting for an estimated 7.4 percent of the disease burden worldwide and significantly contributing to disability and death. This challenge is particularly evident in low and middle-income countries LMICs where more than half of the worlds populations live. Latin America is one region of the world composed of LMICs where the burden of mental health problems is high and services for mental health ... more",7/15/16,Dartmouth College,U19MH109988,Dartmouth College,6/1/16,5/31/22,3530752,Lisa Marsch,910,212,698,lab,7/15/16,6/1/16,5/31/22,0.232967033,0.767032967,2016,6,1,22,4
739,356,Efficacy of the Direct Instruction Language for Learning Program to Promote Expressive and Receptive Language in Children with Autism Spectrum Disorder,https://nda.nih.gov/edit_collection.html?id=2386,"This study will test the efficacy of DI-LL in young school-age children with ASD and moderate language delay. 100 participants, ages 5 to 7 years, 11 months, will be randomly assigned to either DI-LL or Treatment as Usual (TAU). Children randomly assigned to DI-LL will be allowed to continue in ongoing treatments as well. This five-year study will begin enrolling subjects in mid Year 1 and ramp up with the highest recruitment in Years 2, 3 and 4. Recruitment will decline in Year 5 in order to clean ... more",6/15/16,Emory University,,,6/15/16,,,Lawrence Scahill,128,108,20,lab,6/15/16,6/15/16,,0.84375,0.15625,2016,6,15,22,5
827,75,Insights into Autism Spectrum Disorder Genomic Architecture and Biology from 71 Risk Loci,https://nda.nih.gov/study.html?id=411,"Analysis of de novo CNVs (dnCNVs) from the full Simons Simplex Collection (SSC) (N = 2,591 families) replicates prior findings of strong association with autism spectrum disorders (ASDs) and confirms six risk loci (1q21.1, 3q29, 7q11.23, 16p11.2, 15q11.2-13, and 22q11.2). The addition of published CNV data from the Autism Genome Project (AGP) and exome sequencing data from the SSC and the Autism Sequencing Consortium (ASC) shows that genes within small de novo deletions, but not within large dnCNVs, ... more",6/15/16,Burkhart Center for Autism Education and Research,,,6/15/16,,,"Richman DM; Barnard-Brak L, Bosch A, Thompson S, Grubb L, Abby L",9976,5867,4109,paper,6/15/16,6/15/16,,0.588111468,0.411888532,2016,6,15,22,6
320,506,Neural Mechanisms of CBT for Anxiety in Children with Autism Spectrum Disorder,https://nda.nih.gov/edit_collection.html?id=2559,"Anxiety is among the most common concerns in children with autism spectrum disorder (ASD) who seek mental health services, causing suffering and family stress and exacerbating social disability. Cognitive- Behavioral Therapy (CBT) is a promising treatment for anxiety in children with high-functioning ASD, but the neural mechanisms supporting response to this treatment have not been studied. We will investigate the neural-systems-level targets of CBT for anxiety in children with ASD by evaluating ... more",12/7/16,Yale University,R01HD083881,Yale University,6/17/16,3/31/22,2838889,Denis Sukhodolsky,85,61,24,lab,12/7/16,6/17/16,3/31/22,0.717647059,0.282352941,2016,6,17,22,7
321,375,Development of Memory Networks in Children,https://nda.nih.gov/edit_collection.html?id=2405,"Human memory is essential for everyday living, shows robust trajectories of improvement across childhood, and is known to be impaired in a number of neurodevelopmental disorders. There is substantial data in memory physiology in adults but a paucity of information on how this core human skill emerges in children. Further, noninvasive techniques used to probe the neural basis of human memory development are unable to measure both the spatial and temporal properties of memory at high resolution. Electrocorticography ... more",7/15/16,Wayne State University,R01MH107512,Wayne State University,6/20/16,3/31/22,1938990,Noa Ofen,107,48,59,lab,7/15/16,6/20/16,3/31/22,0.448598131,0.551401869,2016,6,20,22,8
740,357,A Double-Blind Placebo-Controlled Trial of a Sulforaphane Nutraceutical to Reduce the Symptoms of Schizophrenia,https://nda.nih.gov/edit_collection.html?id=2387,This is an add-on study of outpatients with schizophrenia,6/21/16,Sheppard Pratt Health System,,,6/21/16,,,Faith Dickerson,65,50,15,lab,6/21/16,6/21/16,,0.769230769,0.230769231,2016,6,21,22,9
322,523,Solving EPHX2 and PUFA Interactions in Anorexia Nervosa,https://nda.nih.gov/edit_collection.html?id=2577,"Anorexia nervosa AN is characterized by severely restrictive eating and emaciation, with high rates of morbidity, chronicity and mortality. Current treatments have high rates of relapse and recurrence, thus developing new and improved therapies is a high priority in mental and public health. While AN is highly heritable, identifying risk genes and associated mechanisms on AN pathophysiology has yet to be successful due to the lack of adequate knowledge on how genes interact with non-genetic risk ... more",1/27/17,University of California San Diego,R01MH106781,"University Of California, San Diego",6/21/16,3/31/21,1478831,Peian Shih,177,0,177,lab,1/27/17,6/21/16,3/31/21,0,1,2016,6,21,22,10
741,359,DCTRS Cognitive remediation for individuals with psychosis in a supported education setting: A randomized controlled trial,https://nda.nih.gov/edit_collection.html?id=2389,"Cognitive remediation (CR) has demonstrated good outcomes when paired with supported employment, however little is known about its effectiveness when integrated into a supported education program. This randomized controlled trial examined the effectiveness of integrating CR within a supported education program compared with supported education without CR. Thirty-seven students with psychosis were recruited into the study in the 2012 academic year. Academic functioning, cognition, self-esteem, and ... more",7/1/16,Centre for Addiction and Mental Health,,,7/1/16,,,Sean A. Kidd,32,17,15,lab,7/1/16,7/1/16,,0.53125,0.46875,2016,7,1,22,11
742,360,DCTRS Cognitive Remediation for Individuals with Psychosis in a Supported Education Setting: A Pilot Study,https://nda.nih.gov/edit_collection.html?id=2390,"Cognitive remediation (CR) is a treatment approach that is being increasingly examined as a means through which the cognitive impacts of schizophrenia might be ameliorated. While CR has demonstrated good outcomes when paired with supported employment, little is known regarding how it might be integrated within supported education contexts. In this study CR was examined in a supported education context with 16 individuals with psychosis. The findings indicated that CR aligned well with the academic ... more",7/1/16,Centre for Addiction and Mental Health,,,7/1/16,,,Sean A. Kidd,17,12,5,lab,7/1/16,7/1/16,,0.705882353,0.294117647,2016,7,1,22,12
323,368,A Multimodal Investigation of Inhibitory Dysfunction in Autism Spectrum Disorder,https://nda.nih.gov/edit_collection.html?id=2398,"It is thought that impairments in the main inhibitory neurotransmitter GABA underlie Autism, at least to some degree. Children with Autism often show abnormal touch processing as well as abnormal motor control, which have a large impact on social interactions and quality of life. GABA plays an important role in the regulation of both tactile and motor processing and it is possible that such symptoms are driven by impaired GABAergic function. However, it remains unclear how cortical dysfunction leads ... more",7/15/16,Johns Hopkins University,K99MH107719,Johns Hopkins University,7/1/16,6/30/21,657885,Nicolaas Puts,19,18,1,lab,7/15/16,7/1/16,6/30/21,0.947368421,0.052631579,2016,7,1,22,13
324,370,Atypical Late Neurodevelopment in Autism: A Longitudinal Clinical Phenotype and Multimodal Brain Imaging Study,https://nda.nih.gov/edit_collection.html?id=2400,"The goal of the proposed project is to determine how individual variation in brain development from childhood to adulthood is associated with variation in clinical course and outcome in autism. We will achieve this goal in three steps. We will first quantify individual whole and regional brain development from imaging data across six time points collected over 15 years using magnetic resonance imaging volume, cortical thickness, functional connectivity, white matter microstructure and concurrent ... more",7/15/16,University of Wisconsin-Madison,R01MH080826,University Of Wisconsin-Madison,7/1/16,4/30/22,3812474,Janet Lainhart,207,199,8,lab,7/15/16,7/1/16,4/30/22,0.961352657,0.038647343,2016,7,1,22,14
325,374,Numbers in the Human Brain,https://nda.nih.gov/edit_collection.html?id=2404,"Human civilizations are hallmarked by communicating magnitude, time, and space in the form of numeral symbols. Humans learn to speak a certain language and read its symbols depending on the culture they live in. All brains are known to have specialized group of neuronal populations in the visual system that, through education and culture, are pruned to recognize these visual symbols, and be able to feed them to specific networks of the brain where they are processed. The existence of neuronal populations ... more",7/15/16,Stanford University,R01MH109954,Stanford University,7/1/16,7/31/21,1975000,Josef Parvizi,38,18,20,lab,7/15/16,7/1/16,7/31/21,0.473684211,0.526315789,2016,7,1,22,15
326,379,Understanding the Interplay of Social Context and Physiology on Psychological Outcomes in Trauma-Exposed Adolescents,https://nda.nih.gov/edit_collection.html?id=2409,"Trauma-exposed adolescents are at risk for a host of deleterious outcomes, particularly stress sensitive disorders such as acute stress disorder ASD, posttraumatic stress disorder PTSD, depression, anxiety, and substance use disorders. Theory and available evidence point to two particularly important influences on the development of PTSD 1 individual stress response particularly heart rate HR, skin conductance SC and 2 social context interactions occurring in person and through online social networking ... more",7/15/16,LIFESPAN,R01MH108641,Brown University,7/1/16,3/31/22,3306466,Nicole Nugent,140,57,83,lab,7/15/16,7/1/16,3/31/22,0.407142857,0.592857143,2016,7,1,22,16
327,380,Biobehavioral inflexibility and risk for juvenile-onset depression,https://nda.nih.gov/edit_collection.html?id=2410,"This REVISED competing renewal application builds on our recent study of the joint regulation of sad, dysphoric affect mood repair and cardiac indexes of autonomic nervous system ANS functioning including respiratory sinus arrhythmia, RSA among youths at varying levels of depression risk. In response to the IRGs comments, we provide information further on about the covariates we assess and sample characteristics the effects of covariates on key outcomes explicate further the study's significance ... more",7/15/16,University of Pittsburgh School of Medicine,R01MH084938,University Of Pittsburgh At Pittsburgh,7/1/16,6/30/21,718542,Maria Kovacs,718,388,330,lab,7/15/16,7/1/16,6/30/21,0.540389972,0.459610028,2016,7,1,22,17
328,381,Predicting Suicide: A Longitudinal Analysis of Speech Patterns in a High Risk Sample,https://nda.nih.gov/edit_collection.html?id=2411,"Despite the ever-increasing number of theoretical models of suicide and treatments developed for suicidal behavior, rates of suicide attempts and death by suicide in the United States continue to climb. Research has identified multiple risk factors for suicidal behavior however, the predictive value of these risk factors is limited,and the majority of individuals with these risk factors do not attempt suicide. This inadequate understanding limits our ability to predict who will engage in suicidal ... more",7/15/16,Butler Hospital,R01MH108610,"Butler Hospital (Providence, Ri)",7/1/16,6/30/22,2905648,Heather Schatten,148,62,86,lab,7/15/16,7/1/16,6/30/22,0.418918919,0.581081081,2016,7,1,22,18
329,500,Pathways Linking Dysregulation in the Positive Valence System with Adolescent Depression,https://nda.nih.gov/edit_collection.html?id=2552,"Depression rates skyrocket in adolescence, and adolescent-onset depression is associated with increased risk for depression, substance use, suicide, and work-related disability in adulthood. Consistent with NIH objectives of identifying the biobehavioral causes and prospective trajectories of mental disorders, it is imperative that we identify mechanisms that increase individuals risk for depression. The long-term goal of this study is to identify the pathways linking early risk factors with adolescent-onset ... more",11/29/16,SEATTLE PACIFIC UNIVERSITY,R15MH098294,Seattle Pacific University,7/1/16,6/30/20,418056,Amy Mezulis,128,67,61,lab,11/29/16,7/1/16,6/30/20,0.5234375,0.4765625,2016,7,1,22,19
330,365,Personalizing Parent Training Interventions for Culturally Diverse Families,https://nda.nih.gov/edit_collection.html?id=2395,"Behavioral Parent Training BPT Interventions have proven efficacy for young children with externalizing behavior problems. However, not all families benefit, and ethnic minority families in particular are less likely to enroll, engage, and improve in BPT. The overarching goal of the proposed study is to develop and pilot test a personalization instrument, PersIn, that can be used to increase fit for culturally diverse families in Parent Child Interaction Therapy PCIT, an evidence based BPT intervention ... more",7/15/16,University of San Diego,R34MH109561,University Of San Diego,7/5/16,6/30/21,621179,Kristen McCabe,29,20,9,lab,7/15/16,7/5/16,6/30/21,0.689655172,0.310344828,2016,7,5,22,20
331,367,Texting for Relapse Prevention: Improving outcomes for people with schizophrenia,https://nda.nih.gov/edit_collection.html?id=2397,"Research suggests that people with schizophrenia or SAD have identifiable early warning signs that signal the onset of a relapse. Accordingly, the Program for Relapse Prevention PRP, which has been shown to prevent relapse and hospitalization, calls for monitoring for signs of relapse with prompt clinical intervention, when indicated, alongside maintenance pharmacotherapy. The Assertive Community Treatment ACT program incorporates the PRP approach as a part of its management of people with serious ... more",7/15/16,Center for Innovative Public Health Research,R34MH108781,Center For Innovative Public Health Research,7/5/16,11/30/19,730638,Michele Ybarra,80,35,45,lab,7/15/16,7/5/16,11/30/19,0.4375,0.5625,2016,7,5,22,21
332,364,Brain Network Dynamics Contributing to Atypical Social Interaction in Autism,https://nda.nih.gov/edit_collection.html?id=2394,"Atypical reciprocal social interaction is a core diagnostic feature of autism spectrum disorder ASD, but the brain network dynamics contributing to difficulties with social interactions remain unclear. Dominant theories suggest a role for social-motivational and social-cognitive brain networks. However, these theories have been tested in neuroimaging contexts divorced from social interaction i.e., viewing photos of strangers. Because these detached, offline measures fail to capture the real-world ... more",7/15/16,University of Maryland,R01MH107441,"Univ Of Maryland, College Park",7/11/16,4/30/22,2625215,Elizabeth Redcay,88,64,24,lab,7/15/16,7/11/16,4/30/22,0.727272727,0.272727273,2016,7,11,23,1
333,372,Whole Brain Functional Connectivity Measures of Attention,https://nda.nih.gov/edit_collection.html?id=2402,"Attention has a ubiquitous role in perception and cognition, and attention deficits are common in mental illness and as symptomatic of brain damage. Yet, despite its central importance, researchers lack a straightforward way to measure a persons overall attentional functioning. The goal of this project is to develop an attention profile index that can 1 quantify a persons attentional abilities along several dimensions, 2 predict behavior, 3 facilitate comparison across individual differences and ... more",7/15/16,Yale University,R01MH108591,Yale University,7/11/16,3/31/21,1675000,Marvin Chun,68,22,46,lab,7/15/16,7/11/16,3/31/21,0.323529412,0.676470588,2016,7,11,23,2
828,76,Engineering microdeletions and microduplications by targeting segmental duplications with CRISPR.,https://nda.nih.gov/study.html?id=414,"Recurrent, reciprocal genomic disorders resulting from non-allelic homologous recombination (NAHR) between near-identical segmental duplications (SDs) are a major cause of human disease, often producing phenotypically distinct syndromes. The genomic architecture of flanking SDs presents a challenge for modeling these syndromes; however, the capability to efficiently generate reciprocal copy number variants (CNVs) that mimic NAHR would represent a valuable modeling tool. We describe here a CRISPR/Cas9 ... more",7/15/16,Burkhart Center for Autism Education and Research,,,7/15/16,,,"Richman DM; Barnard-Brak L, Bosch A, Thompson S, Grubb L, Abby L",1,1,0,paper,7/15/16,7/15/16,,1,0,2016,7,15,23,3
334,402,In utero Assessment of the Human Neural Connectome and Later Child Behavior,https://nda.nih.gov/edit_collection.html?id=2434,"The human fetal brain is complex, highly plastic, and extremely vulnerable. Mild variation in utero can drastically impair life-long learning and neurological health. Despite growing appreciation for the relevance of this period to numerous developmental, psychiatric and neurological disorders, macroscale functional organization of the fetal brain remains a black box for neuroscience research. While there are phenomenal technologies for examining fetal brain anatomy, only very recently have we possessed ... more",8/1/16,NYU Langone Health,R01MH110793,New York University School Of Medicine,7/15/16,4/30/22,2657494,Moriah Thomason,244,89,155,lab,8/1/16,7/15/16,4/30/22,0.364754098,0.635245902,2016,7,15,23,4
335,390,Optimizing Prediction of Social Deficits in Autism Spectrum Disorders,https://nda.nih.gov/edit_collection.html?id=2421,"Autism spectrum disorders ASDs are characterized by vast neural and behavioral phenotypic heterogeneity. However, little is yet known about how variability in these processes impacts functional outcomes this, in turn, hampers development of highly effective and targeted interventions. As children encounter increasing social demands through school, these challenges become especially urgent. The current project aims to address these concerns through improved multi-level characterization of the processes ... more",8/1/16,Stony Brook University,R01MH110585,State University New York Stony Brook,7/18/16,4/30/22,2206621,Matthew Lerner,146,105,41,lab,8/1/16,7/18/16,4/30/22,0.719178082,0.280821918,2016,7,18,23,5
336,361,Characterization of executive function dimensions across pediatric psychiatric disorders,https://nda.nih.gov/edit_collection.html?id=2391,"The proposal responds to RFA-MH-16-510 by focusing on the domain of Cognitive Systems and constructs cognitive control and working memory and integrating units of analysis brain circuit and behavior. These constructs are subsumed under executive function (EF), the ability to voluntarily constrain thoughts and actions in the service of goals. Among pediatric psychiatric categories, EF deficits define Attention Deficit Hyperactivity Disorder (ADHD) and are comorbid with a variety disorders, including ... more",7/8/16,Georgetown University,R01MH110512,Georgetown University,7/19/16,4/30/22,1946674,Chandan Vaidya and Lauren Kenworthy,160,118,42,lab,7/8/16,7/19/16,4/30/22,0.7375,0.2625,2016,7,19,23,6
743,386,DCTRS Evaluation of a newly developed basis module for treating neuro and social cognition in schizophrenia patients,https://nda.nih.gov/edit_collection.html?id=2416,"A body of findings yielded by exhaustive research conducted over recent decades indicates that, apart from the disorder-specific symptoms, it is the neurocognitive deficits encountered chiefly in the domains of attention, memory and executive functioning that are vital to the understanding of the various forms of schizophrenia. Numerous experimental and clinical studies in psychology have probed the issue of how neurocognitive functional deficits may be linked to other domains of disorders and functional ... more",7/20/16,McMaster University,,,7/20/16,,,"Volker Roder, Ph.D.",43,30,13,lab,7/20/16,7/20/16,,0.697674419,0.302325581,2016,7,20,23,7
337,394,Dynamics of Inflammation and its Blockade on Motivational Circuitry in Depression,https://nda.nih.gov/edit_collection.html?id=2425,"Motivational anhedonia a subset of anhedonic symptoms involving dopamine-linked impairments in effort-based decision-making, reward anticipation and reinforcement learning are common in psychiatric disorders such as major depression, and are notoriously difficult to treat. In recent years, these symptoms have been associated with alterations in dopaminergic corticostriatal circuitry, yet the underlying causes of this circuit dysfunction remain unknown. One candidate mechanism is inflammation increased ... more",8/1/16,Emory University,R01MH108605,Emory University,7/20/16,3/31/22,2116136,Michael Treadway,72,11,61,lab,8/1/16,7/20/16,3/31/22,0.152777778,0.847222222,2016,7,20,23,8
338,398,Generalized Fear-Conditioning & Avoidance: Neurobiology & Transdiagnostic Import,https://nda.nih.gov/edit_collection.html?id=2430,"The objective of this project is to neurally, behaviorally, psychologically, and clinically characterize fundamental Pavlovian and instrumental dimensions of potential threat through which emotional and behavioral responses to threat cues generalize to resembling, safe stimuli. Such generalization is aligned with the potential threat construct due to the threat ambiguity, or uncertain threat value, inherent in these safe generalization stimuli. The Pavlovian dimension of interest is generalization ... more",8/1/16,University of Minnesota,R01MH107382,University Of Minnesota,7/20/16,5/31/21,2101882,Shmuel Lissek,181,116,65,lab,8/1/16,7/20/16,5/31/21,0.640883978,0.359116022,2016,7,20,23,9
339,395,Peer Support and Mobile Technology Targeting Cardiometabolic Risk Reduction in Young Adults with SMI,https://nda.nih.gov/edit_collection.html?id=2426,"Obesity is nearly twice as prevalent in people with serious mental illness SMI compared to the general population and is associated with cardiometabolic disorders and a reduced life expectancy of 8 to 32 years in this population. Young adulthood, ages 19-30, is a critical window for interventions to reduce this early mortality health disparity as young adults experience the greatest rate of weight gain of any age group. Effective behavior change interventions to reduce cardiometabolic risk factors ... more",8/1/16,Dartmouth College,R01MH110965,Dartmouth College,7/21/16,5/31/22,1930642,Kelly Aschbrenner,90,38,52,lab,8/1/16,7/21/16,5/31/22,0.422222222,0.577777778,2016,7,21,23,10
340,400,Modulation of ventrolateral prefrontal cortical activity during reward processing by transcranial direct current stimulation,https://nda.nih.gov/edit_collection.html?id=2432,"Bipolar disorder BD is characterized by abnormally elevated reward sensitivity and risk taking, that may predispose to hypomania. We reported abnormally elevated activation in left ventrolateral prefrontal cortex vlPFC during uncertain outcome and reward expectancy in remitted and depressed individuals with BD. The vlPFC encodes the value of different decision-making options. Thus, abnormally elevated left vlPFC activation during uncertain outcome expectancy may reflect heightened representation ... more",8/1/16,University of Pittsburgh,R21MH108421,University Of Pittsburgh At Pittsburgh,7/21/16,3/31/19,381281,Mary Phillips,79,30,49,lab,8/1/16,7/21/16,3/31/19,0.379746835,0.620253165,2016,7,21,23,11
829,77,Leveraging blood serotonin as an endophenotype to identify de novo and rare variants involved in autism.,https://nda.nih.gov/study.html?id=416,"Background: Autism spectrum disorder (ASD) is one of the most highly heritable neuropsychiatric disorders, but underlying molecular mechanisms are still unresolved due to extreme locus heterogeneity. Leveraging meaningful endophenotypes or biomarkers is an effective strategy to reduce heterogeneity to identify novel ASD genes. Numerous lines of evidence suggest a link between hyperserotonemia, i.e., elevated serotonin (5-hydroxytryptamine or 5-HT) in whole blood, and ASD. However, the genetic determinants ... more",7/22/16,Burkhart Center for Autism Education and Research,,,7/22/16,,,"Richman DM; Barnard-Brak L, Bosch A, Thompson S, Grubb L, Abby L",350,215,135,paper,7/22/16,7/22/16,,0.614285714,0.385714286,2016,7,22,23,12
341,393,Neurobiology of Autism With Macrocephaly,https://nda.nih.gov/edit_collection.html?id=2424,"Autism spectrum disorders ASDs affect 1 percent-2.5 percent of children worldwide. We suggest that etiological and genetic heterogeneity might converge in a few neurobiological downstream pathways. We have been investigating the pathobiology of ASD with large brain volume macrocephaly, a phenotype which confers poorer prognosis. Ongoing studies have shown that telencephalic organoids differentiated in vitro from induced pluripotent stem cells iPSC derived from patients with ASD and macrocephaly have ... more",8/1/16,Yale University,R01MH109648,Yale University,7/22/16,4/30/21,1349091,Flora Vaccarino,69,62,7,lab,8/1/16,7/22/16,4/30/21,0.898550725,0.101449275,2016,7,22,23,13
830,78,The clinical relevance of self-reported premenstrual worsening of depressive symptoms in the management of depressed outpatients: a STAR*D report.,https://nda.nih.gov/study.html?id=417,"OBJECTIVE: To determine the incidence, clinical and demographic correlates, and relationship to treatment outcome of self-reported premenstrual exacerbation of depressive symptoms in premenopausal women with major depressive disorder who are receiving antidepressant medication. METHOD: This post-hoc analysis used clinical trial data from treatment-seeking, premenopausal, adult female outpatients with major depression who were not using hormonal contraceptives. For this report, citalopram was used ... more",7/28/16,Burkhart Center for Autism Education and Research,,,7/28/16,,,"Richman DM; Barnard-Brak L, Bosch A, Thompson S, Grubb L, Abby L",1017,0,1017,paper,7/28/16,7/28/16,,0,1,2016,7,28,23,14
744,388,Autism Spectrum Disorder - Inflammatory Subtype: Biomarker Analysis,https://nda.nih.gov/edit_collection.html?id=2419,We hypothesize 1 Altered monocyte functions detected by changes in cytokine production and miRNA expression can be biomarkers for ASD subjects suffering from immune mediated chronic inflammation. We estimate that these changes can be detected in the newly diagnosed ASD population up to 30 percent and can serve as markers for poor responders to the 1st line treatment measures behavioral and pharmacological interventions. 2 These parameters are positively associated with mitochondrial functions of ... more,7/29/16,Saint Peter's University Hospital,,,7/29/16,,,"Harumi Jyonouchi, M.D. (CO-PIs: Richard Frye M.D., Ph.D., and James J. Dermody, Ph.D.)",120,103,17,lab,7/29/16,7/29/16,,0.858333333,0.141666667,2016,7,29,23,15
342,371,A Longitudinal Study Examining Three RDoC Constructs in Adolescents with Non-Suicidal Self-Injury,https://nda.nih.gov/edit_collection.html?id=2401,"Non-Suicidal Self Injury NSSI is a common clinical problem can lead to severe negative outcomes and has limited treatment options. Advancement of new interventions for NSSI is hindered by a lack of knowledge about its neural mechanisms. Neurobiological research on NSSI should ideally incorporate approaches promoted by the NIMH Research Domains Criteria RDoC initiative, i.e. examination of brain-behavior relationships outside of the confines of traditional psychiatric diagnoses. Since individuals ... more",7/15/16,University of Minnesota,R01MH107394,University Of Minnesota,8/1/16,5/31/21,1226532,Kathryn Cullen,100,0,100,lab,7/15/16,8/1/16,5/31/21,0,1,2016,8,1,23,16
343,389,Predicting Voice Quality in ASD from Early Markers of Vocal Development,https://nda.nih.gov/edit_collection.html?id=2420,"The goal of this project is to test the hypothesis that the emergence of atypical voice quality in children with autism is an attribute of core impairments in social interaction against the hypothesis that voice quality disorders are an early outcome of comorbid motor deficits in vocal production in autism spectrum disorders ASD. By cross-analyzing electroglottographic EGG recordings and longitudinal audio recordings of the home language environment for 80 children with and without ASD, we will be ... more",8/1/16,Emory University,R03DC015302,Emory University,8/1/16,7/31/18,131178,Shweta Ghai,61,36,25,lab,8/1/16,8/1/16,7/31/18,0.590163934,0.409836066,2016,8,1,23,17
344,392,Using Serious Game Technology to Improve Sensitivity to Eye Gaze in Autism,https://nda.nih.gov/edit_collection.html?id=2423,"Impairments in social communicative behaviors are primary in autism. Two of the most affected behaviors include visual attention to faces and the ability to understand how eye gaze provides important information about the actions and intentions of others. One theory is that the neural systems for face processing are fundamentally compromised. However, our recent brain imaging findings suggest that there are contexts in which these neural systems respond normally to animal faces, indicating that they ... more",8/1/16,Penn State University,R61MH110624,Pennsylvania State University-Univ Park,8/1/16,5/31/22,2625941,Kathryn Scherf,145,97,48,lab,8/1/16,8/1/16,5/31/22,0.668965517,0.331034483,2016,8,1,23,18
345,399,Mechanisms of nonsuicidal self-injury facilitating transitions to suicidal behavior,https://nda.nih.gov/edit_collection.html?id=2431,"Deaths from suicide continue to be a major public health concern, particularly among youth and young adults, for whom suicide ranks as the second leading cause of death. Despite growing research on suicide, knowledge about the proximal behavioral and psychosocial mechanisms that facilitate the development of suicidal thinking and or the transition to suicidal behavior. Nonsuicidal self-injury NSSI is the intentional destruction of body tissue without suicidal intent, typically cutting or burning ... more",8/1/16,University of Wisconsin-Eau Claire,R15MH110960,University Of Wisconsin Eau Claire,8/1/16,9/10/23,814911,Jennifer Muehlenkamp,422,77,345,lab,8/1/16,8/1/16,9/10/23,0.182464455,0.817535545,2016,8,1,23,19
346,401,Targeting Dopaminergic Mechanisms of Slowing to Improve Late Life Depression,https://nda.nih.gov/edit_collection.html?id=2433,"Individuals with Late Life Depression (LLD) often have cognitive deficits, particularly executive dysfunction (ED), which is associated with antidepressant non-response. Our group and others have shown that decreased processing speed is the central cause of functional impairment in patients with LLD. Similarly, decreased gait speed is associated with depression and carries additional risk for falls, hospitalization, an death. Available evidence suggests that declining functionality of the nigrostriatal ... more",8/1/16,New York State Psychiatric Institute,R61MH110029,New York State Psychiatric Institute,8/1/16,11/30/21,3461873,Bret Rutherford,49,19,30,lab,8/1/16,8/1/16,11/30/21,0.387755102,0.612244898,2016,8,1,23,20
347,415,Single-neuron mechanisms of executive control of long-term memory processes in humans,https://nda.nih.gov/edit_collection.html?id=2449,"Deficient control and monitoring of memory processes is a key feature of major psychiatric diseases, including schizophrenia, bipolar disorder, and PTSD. The long-term goal of this research is to understand how individual brain areas within the temporal-and frontal lobes interact, how these interactions are coordinated and how disruption of such coordination results in mental disease. The proposed experiments will utilize rare neurosurgical opportunities to directly record from individual neurons ... more",8/5/16,Cedars-Sinai Medical Center,R01MH110831,Cedars-Sinai Medical Center,8/1/16,6/30/22,2151103,Ueli Rutishauser,19,8,11,lab,8/5/16,8/1/16,6/30/22,0.421052632,0.578947368,2016,8,1,23,21
348,817,PRESCHOOL INTERNALIZING PSYCHOPATHOLOGY: BEHAVIORAL PHENOTYPES AND STRESS PHYSIOLOGY,https://nda.nih.gov/edit_collection.html?id=2903,"Anxiety and mood dysregulation are among the most common, often persistent, emotional difficulties in preschool-aged children that cause substantial personal, familial, and economic burden. However, these behaviors are developmentally normative in young children and the level at which such behaviors may be clinically significant is largely unknown. Without established norms identified with developmentally sensitive methods, it is difficult to distinguish mild, transient behaviors from rik for persistent, ... more",3/28/18,California State University San Marcos,R15MH106885,California State University San Marcos,8/1/16,7/31/19,444681,Sara Bufferd,1738,517,1221,lab,3/28/18,8/1/16,7/31/19,0.297468354,0.702531646,2016,8,1,24,1
349,1050,Targeting Dopaminergic Mechanisms of Slowing to Improve Late Life Depression - R33 Phase,https://nda.nih.gov/edit_collection.html?id=3153,"Individuals with Late Life Depression LLD often have cognitive deficits, particularly executive dysfunction ED, which is associated with antidepressant non-response. Our group and others have shown that decreased processing speed is the central cause of functional impairment in patients with LLD. Similarly, decreased gait speed is associated with depression and carries additional risk for falls, hospitalization, and death. Available evidence suggests that declining functionality of the nigrostriatal ... more",4/12/19,New York State Psychiatric Institute,R33MH110029,New York State Psychiatric Institute,8/1/16,11/30/21,3461873,Bret Rutherford,31,21,10,lab,4/12/19,8/1/16,11/30/21,0.677419355,0.322580645,2016,8,1,24,2
350,416,"A Community-based, family Navigator intervention to improve cardiometabolic health of Medicaid-insured youth identified through an antipsychotic medication preauthorization program",https://nda.nih.gov/edit_collection.html?id=2450,"Children and adolescents are highly vulnerable to cardiometabolic adverse effects of antipsychotic treatment, which progress rapidly after medication initiation. Antipsychotic adverse cardiometabolic effects contribute to concerning pediatric health problems, adult morbidity, and shortened life span. Given the high rates of pediatric antipsychotic prescribing, public health strategies to improve child and adolescent cardiometabolic health outcomes must be portable for widespread dissemination and ... more",8/5/16,University of Maryland,R01MH110945,University Of Maryland Baltimore,8/5/16,4/30/22,2372859,Gloria Reeves,258,72,186,lab,8/5/16,8/5/16,4/30/22,0.279069767,0.720930233,2016,8,5,24,3
351,417,Biobehavioral Prediction of Illness Trajectory in Bulimic Syndromes,https://nda.nih.gov/edit_collection.html?id=2451,"Bulimic syndromes BN-S are characterized by large out-of-control binge episodes, span the three DSM-5eating disorder categories of anorexia nervosa-binge purge subtype AN bp, bulimia nervosa BN, and binge eating disorder BED, and vary considerably in illness severity and course. Our long-term objectives are to identify biobehavioral predictors of illness trajectory in BN-S so that treatments may be developed to address key factors influencing the severity and course of binge eating. The specific ... more",8/5/16,Florida State University,R01MH111263,Florida State University,8/5/16,4/30/22,2134341,Pamela Keel,288,0,288,lab,8/5/16,8/5/16,4/30/22,0,1,2016,8,5,24,4
352,420,"Approach motivation, effortful control, and internalizing and externalizing problems",https://nda.nih.gov/edit_collection.html?id=2455,"Much attention has been focused on dysfunction associated with high or low approach motivation, or with deficits in effortful control. Recent evidence suggests, however, that it is important to consider these two dimensions jointly. We suggest that high approach motivation is related to externalizing syndromes, low approach motivation is related to internalizing syndromes, and that high effortful control dampens the effects of both of these extremes of approach motivation. We propose to take a multi-level ... more",8/10/16,"University of California, Berkeley",R01MH110477,University Of California Berkeley,8/5/16,4/30/21,2658007,Sheri Johnson,256,73,183,lab,8/10/16,8/5/16,4/30/21,0.28515625,0.71484375,2016,8,5,24,5
353,443,Understanding Social Affiliative Deficits in Psychopathology,https://nda.nih.gov/edit_collection.html?id=2480,"As defined by the RDoC Social Processes Workshop, affiliation is the engagement in positive social interactions with others. The desire to affiliate has been described as a fundamental human motivation. However, impairments in the drive to affiliate occur across multiple clinical disorders and these affiliative impairments have devastating consequences for individuals, their family members, and society. Despite the major clinical significance of impairments in social affiliation, the factors that ... more",9/19/16,University of Maryland,R01MH110462,"Univ Of Maryland, College Park",8/8/16,5/31/20,1721947,Jack Blanchard,107,66,41,lab,9/19/16,8/8/16,5/31/20,0.61682243,0.38317757,2016,8,8,24,6
354,448,"Sex, Hormones and GABA in Stress Induced Anhedonia in Depression",https://nda.nih.gov/edit_collection.html?id=2485,"Major depressive disorder MDD is the leading cause of disease burden worldwide and women have a 2-fold risk higher than men. Despite this, little is known about the neurobiological mechanisms associated with the sex-dependent emergence of MDD and in what form they persist after full remission. Preclinical studies have demonstrated dysregulated hypothalamic pituitary adrenal HPA circuitry i.e., stress circuitry and gamma-aminobutyric acid GABA in depression models. Critically, the stress circuitry ... more",9/19/16,Harvard University,R01MH108602,Mclean Hospital,8/10/16,4/30/22,3227300,Diego Pizzagalli,108,44,64,lab,9/19/16,8/10/16,4/30/22,0.407407407,0.592592593,2016,8,10,24,7
355,319,Children of Bipolar Parents: A High Risk Follow Up Study (also known as Bipolar Offspring Study - BIOS),https://nda.nih.gov/edit_collection.html?id=2336,"While bipolar disorder (BP) frequently begins in adolescence, an accurate diagnosis and appropriate treatment are frequently delayed, leading to increased morbidity and functional impairment. Thus it is imperative that we improve our ability to identify youth at high risk of disorder, and develop improved preventive and early intervention strategies. While numerous risk factors have been identified to predict the onset of bipolar spectrum disorder (BPSD) in at-risk youth, including depressive episodes ... more",1/6/16,University of Pittsburgh,R01MH060952,University Of Pittsburgh At Pittsburgh,8/11/16,5/31/22,6426410,Boris Birmaher,534,256,278,lab,1/6/16,8/11/16,5/31/22,0.479400749,0.520599251,2016,8,11,24,8
831,79,Exploiting aberrant mRNA expression in autism for gene discovery and diagnosis.,https://nda.nih.gov/study.html?id=418,"Autism spectrum disorder (ASD) is characterized by substantial phenotypic and genetic heterogeneity, which greatly complicates the identification of genetic factors that contribute to the disease. Study designs have mainly focused on group differences between cases and controls. The problem is that, by their nature, group difference-based methods (e.g., differential expression analysis) blur or collapse the heterogeneity within groups. By ignoring genes with variable within-group expression, an important ... more",8/12/16,Burkhart Center for Autism Education and Research,,,8/12/16,,,"Richman DM; Barnard-Brak L, Bosch A, Thompson S, Grubb L, Abby L",72,54,18,paper,8/12/16,8/12/16,,0.75,0.25,2016,8,12,24,9
356,435,Mobile-Assisted Cognitive Behavior Therapy for Negative Symptoms in Schizophrenia,https://nda.nih.gov/edit_collection.html?id=2472,Schizophrenia is one of the most devastating diseases known to humankind and is one of the top 10 causes globally of profound functional disability. Negative symptoms of schizophrenia account for much of the poor functional outcome in schizophrenia and are an unmet treatment need in a large proportion of patients. We propose to use an experimental therapeutics approach to test a novel psychosocial intervention that combines in-person and smartphone-based cognitive behavior therapy (CBT) for experiential ... more,9/19/16,University of California San Diego,R61MH110019,"University Of California, San Diego",8/15/16,8/31/22,3396170,Eric Granholm,115,77,38,lab,9/19/16,8/15/16,8/31/22,0.669565217,0.330434783,2016,8,15,24,10
357,438,Striatal Connectivity and Clinical Outcome in Psychosis,https://nda.nih.gov/edit_collection.html?id=2475,"Converging lines of evidence suggest a key role for striatal dysconnectivity in the pathophysiology of psychosis. In the proposed study, we will utilize resting state functional magnetic resonance imaging rs-fMRI, as well as fMRI tasks derived from the Research Domain Criteria RDoC framework, to 1 develop and validate a prognostic biomarker to predict antipsychotic treatment response and 2 to model the underlying neural circuitry changes associated with state changes in psychotic symptomatology. ... more",9/19/16,The Feinstein Institute for Medical Research,R01MH108654,Feinstein Institute For Medical Research,8/15/16,4/30/22,2781376,Anil Malhotra,141,77,64,lab,9/19/16,8/15/16,4/30/22,0.546099291,0.453900709,2016,8,15,24,11
358,449,Thought disorder and social cognition in clinical risk states for schizophrenia,https://nda.nih.gov/edit_collection.html?id=2486,"In an effort to intervene before psychosis onset and prevent morbidity, a major recent focus in schizophrenia research has been the identification of young people during a putative prodromal period, so as to develop safe and effective interventions to modify disease course. Over the past decade, studies at Columbia and elsewhere have evaluated clinical high-risk CHR individuals across a wide range of cognitive processes to try to identify core deficits of schizophrenia evident before psychosis onset. ... more",9/19/16,Columbia University,R01MH107558,Icahn School Of Medicine At Mount Sinai,8/15/16,4/30/21,2592715,Cheryl Corcoran,116,65,51,lab,9/19/16,8/15/16,4/30/21,0.560344828,0.439655172,2016,8,15,24,12
832,80,Preliminary findings suggest the number and volume of supragranular and infragranular pyramidal neurons are similar in the anterior superior temporal area of control subjects and subjects with autism.,https://nda.nih.gov/study.html?id=420,We investigated the cytoarchitecture of the anterior superior temporal area (TA2) of the postmortem cerebral cortex in 9 subjects with autism and 9 age-matched typically developing subjects between the ages of 13 and 56 years. The superior temporal gyrus is involved in auditory processing and social cognition and its pathology has been correlated with autism. We quantified the number and soma volume of pyramidal neurons in the supragranular layers and pyramidal neurons in the infragranular layers ... more,8/17/16,Burkhart Center for Autism Education and Research,,,8/17/16,,,"Richman DM; Barnard-Brak L, Bosch A, Thompson S, Grubb L, Abby L",17,17,0,paper,8/17/16,8/17/16,,1,0,2016,8,17,24,13
833,81,The Number of Parvalbumin-Expressing Interneurons Is Decreased in the Medial Prefrontal Cortex in Autism.,https://nda.nih.gov/study.html?id=421,"UNASSIGNED: The cognitive phenotype of autism has been correlated with an altered balance of excitation to inhibition in the cerebral cortex, which could result from a change in the number, function, or morphology of GABA-expressing interneurons. The number of GABAergic interneuron subtypes has not been quantified in the autistic cerebral cortex. We classified interneurons into 3 subpopulations based on expression of the calcium-binding proteins parvalbumin, calbindin, or calretinin. We quantified ... more",8/17/16,Burkhart Center for Autism Education and Research,,,8/17/16,,,"Richman DM; Barnard-Brak L, Bosch A, Thompson S, Grubb L, Abby L",20,19,1,paper,8/17/16,8/17/16,,0.95,0.05,2016,8,17,24,14
745,421,Brain Somatic Mosaicism Network Reference Tissue Project,https://nda.nih.gov/edit_collection.html?id=2458,This is a collaborative project where BSMN teams generated DNA sequencing data from tissue originating from a single donor. The goal of the project was to use a variety of experimental protocols to evaluate the rate of false positive somatic variant calls. Materials were provided by the Lieber Institute for Brain Development and consisted of bulk tissue and sorted neuronal and non-neuronal nuclei from the cerebral cortex and dural fibroblasts from a single neuropsychiatric control brain donation,8/19/16,Sage Bionetworks,,,8/19/16,,,"Alexej Abyzov, Schahram Akbarian, Andrew Chess, Fred Gage, Joseph Gleeson, John Moran, Peter Park, Jonathan Pevsner, Nenad Sestan, Alexander Urban, Flora M. Vaccarino, Christopher Walsh, Daniel Weinberger",13,2,11,lab,8/19/16,8/19/16,,0.153846154,0.846153846,2016,8,19,24,15
359,439,Prefrontal Cortical Engagement and Clinical Effects of non-invasive Direct Current Stimulation for Cognitive Control Impairments in Schizophrenia,https://nda.nih.gov/edit_collection.html?id=2476,"Cognitive deficits are a strong predictor of functional outcome in schizophrenia, yet poorly remediated by current treatments. Disturbances in dorsolateral prefrontal cortex (DLPFC) function underlie core impairments such as in cognitive control and thus represent a critical target for novel therapeutics. Initial studies indicate transcranial direct-current stimulation (tDCS) may be effective in reducing symptoms due to DLPFC dysfunction. While tDCS potentially represents an exciting, novel therapeutic ... more",9/19/16,Baylor College of Medicine,R61MH110044,Baylor College Of Medicine,8/19/16,10/31/19,850860,Raymond Cho,16,8,8,lab,9/19/16,8/19/16,10/31/19,0.5,0.5,2016,8,19,24,16
360,440,Trajectories of Aging in Psychotic Disorders Over 27 Years,https://nda.nih.gov/edit_collection.html?id=2477,"Life expectancy is approximately 20 years shorter in schizophrenia and 10 years shorter in mood disorder with psychosis than in the general population, which is almost entirely due to natural-cause mortality. One proposed explanation is that psychotic disorders are associated with accelerated aging. Substantial evidence indicates that this population experiences premature declines in three functional domains internal i.e., age-related medical disorders, cognitive, and physical. However, it is unknown ... more",9/19/16,Stony Brook University,R01MH110434,State University New York Stony Brook,8/19/16,7/31/21,1529400,Roman Kotov,599,326,273,lab,9/19/16,8/19/16,7/31/21,0.544240401,0.455759599,2016,8,19,24,17
361,445,Dimensional Brain Behavior Predictors of CBT Outcomes in Pediatric Anxiety,https://nda.nih.gov/edit_collection.html?id=2482,"Impairing anxiety affects 33 percent of the population by adolescence and can become chronic, leading to depression, substance abuse, school-drop out and even suicide. To reduce anxiety and prevent its sequelae, patients must be effectively treated early yet, the first line intervention, cognitive behavioral therapy CBT, has a heterogeneous response with 40-60 percent of treated patients continuing to experience impairment from residual symptoms. The reasons for variability in CBT outcomes remain ... more",9/19/16,University of Michigan,R01MH107419,University Of Michigan At Ann Arbor,8/19/16,2/28/22,2981538,Kate Fitzgerald,145,45,100,lab,9/19/16,8/19/16,2/28/22,0.310344828,0.689655172,2016,8,19,24,18
362,452,Reward Systems and Food Avoidance in Adolescents with Low Weight Eating Disorders,https://nda.nih.gov/edit_collection.html?id=2489,"Low weight eating disorders are severe psychiatric disorders that most often develop in adolescence, have a chronic course, and evidence poor response to treatment. A core feature of these disorders is food avoidance which can be conceptualized in the research domain criteria RDoC framework as dysregulation in the dimensional expression of acute threat i.e., food aversion and reward learning i.e., pleasurable response to food absence. Emerging neuroimaging evidence suggests that deficits in insula-amygdala-ventral ... more",9/19/16,Icahn School of Medicine at Mount Sinai,R01MH109639,Icahn School Of Medicine At Mount Sinai,8/19/16,5/31/20,1899815,Thomas Hildebrandt,4,0,4,lab,9/19/16,8/19/16,5/31/20,0,1,2016,8,19,24,19
363,769,HCP-A Mapping the Human Connectome During Typical Aging,https://nda.nih.gov/edit_collection.html?id=2847,The major technological and analytical advances in human brain imaging achieved as part of the Human Connectome Projects (HCP) enable examination of structural and functional brain connectivity at unprecedented levels of spatial and temporal resolution. This information is proving invaluable for enhancing our understanding of normative variation in young adult brain connectivity. It is now timely to use the tools and analytical approaches developed by the HCP to understand how structural and functional ... more,1/29/18,Washington University in St. Louis,U01AG052564,Washington University,8/19/16,5/31/20,3760565,"Beau Ances, Susan Bookheimer, Randy Buckner, David Salat, Stephen Smith, Melissa Terpstra, Kamil Ugurbil, David Van Essen, Roger Woods",725,319,406,lab,1/29/18,8/19/16,5/31/20,0.44,0.56,2016,8,19,24,20
364,376,Attention Training to Modify ERN and Risk for Anxiety in Adolescence,https://nda.nih.gov/edit_collection.html?id=2406,"Increased error-related brain activity, as indexed by the error-related negativity ERN component of the event-related brain potential, has been proposed as an inherited risk factor for anxiety. Both the ERN and anxiety symptoms increase dramatically during adolescence-our data suggest this is especially true between the ages of 11 and 14. The current study aims to examine whether increased ERN is a mechanism of risk for the development of increased anxiety, and whether the ERN is a modifiable biomarker ... more",7/15/16,San Diego State University,R01MH106477,Florida State University,9/1/16,6/30/22,3240470,Greg Hajcak and Nader Amir,639,336,303,lab,7/15/16,9/1/16,6/30/22,0.525821596,0.474178404,2016,9,1,24,21
365,423,"Emergence, Stability and Predictors of Anxiety in Fragile X Syndrome",https://nda.nih.gov/edit_collection.html?id=2460,"Given the high prevalence and substantial impact of mental illness on individuals with intellectual disabilities ID studies that examine mental health in persons with ID are critical to direct treatment aimed at reduction and, more importantly, prevention of mental illness to improve functioning and quality of life. Fragile X syndrome FXS is the leading identified cause of ID with up to 80 percent of adolescents and adults with FXS meeting criteria for an anxiety disorder. FXS is an ideal model to ... more",9/7/16,University of South Carolina,R01MH107573,University Of South Carolina At Columbia,9/1/16,8/31/22,3207273,Jane Roberts,49,39,10,lab,9/7/16,9/1/16,8/31/22,0.795918367,0.204081633,2016,9,1,25,1
366,428,Stem cell- based studies of gene-environment interactions in PTEN- associated autism,https://nda.nih.gov/edit_collection.html?id=2465,"While autism spectrum disorders ASD are highly heritable, it is clear that there is also a strong environmental component to ASD pathogenesis. ASD is frequently associated with brain enlargement, which is often present at birth and affects multiple cell types, suggesting that dysfunction in an early stem or progenitor population contributes to ASD etiology. We hypothesize that brain enlargement is related to enhanced self-renewal of neural stem cells NSCs leading in turn to increased neurogenesis ... more",9/19/16,"University of California, Los Angeles",R21HD084204,University Of California Los Angeles,9/1/16,8/31/18,458000,Harley Kornblum and Julian A. Martinez-Agosto,7,5,2,lab,9/19/16,9/1/16,8/31/18,0.714285714,0.285714286,2016,9,1,25,2
367,431,Understanding Family Economic Impact of Chronic Child Health Conditions,https://nda.nih.gov/edit_collection.html?id=2468,"The proposed study will estimate family financial and time costs for families of children with an autism spectrum disorder ASD and will compare these family costs to those experienced by families of children with asthma ATA and families of children with no significant health conditions NSH. Families of children with ASD face financial costs, such as out-of-pocket expenses for medical and other services, as well as time costs from demands related to managing the child's ASD e.g., coordinating health ... more",9/19/16,Kaiser Permanente Center for Health Research,R01MH106680,Kaiser Foundation Research Institute,9/1/16,6/30/21,2676034,Frances Lynch,1461,1152,309,lab,9/19/16,9/1/16,6/30/21,0.788501027,0.211498973,2016,9,1,25,3
368,446,Sensory-learning deficits and conversion to psychosis among individuals at clinical high-risk: a longitudinal model-based fMRI study,https://nda.nih.gov/edit_collection.html?id=2483,"Schizophrenia SCZ is among the most severe and burdensome of medical conditions worldwide. SCZ research to date has succeeded in describing brain abnormalities in patients but has failed to clarify the mechanisms underlying hallucinations and other core psychotic symptoms of this disorder. A fundamental function of the brain is to learn regularities in the environment and predict upcoming events and their contingencies e.g., anticipating hearing a voice when answering the phone. Disruptions in predictive ... more",9/19/16,New York State Psychiatric Institute,R21MH110700,New York State Psychiatric Institute,9/1/16,10/31/19,460161,Ragy Girgis,57,26,31,lab,9/19/16,9/1/16,10/31/19,0.456140351,0.543859649,2016,9,1,25,4
369,451,Advancing innovative brain imaging to detect altered glutamate modulation and network dynamics in schizophrenia,https://nda.nih.gov/edit_collection.html?id=2488,"30 lines limit Schizophrenia SZ is one of the most debilitating, life-long mental illnesses with profound societal costs. Current treatment has a limited impact in restoring real-life functions. Biological research in the SZ diathesis has provided evidence of deficits in human brain morphology, function and in vivo biochemistry with altered glutamate Glu transmission with the medial temporal lobe being the primary implicated area emerging as one leading pathophysiologic hypothesis. Glutamatergic ... more",9/19/16,Wayne State University,R01MH111177,Wayne State University,9/1/16,5/31/22,2897271,Jeffrey Stanley,106,73,33,lab,9/19/16,9/1/16,5/31/22,0.688679245,0.311320755,2016,9,1,25,5
370,695,Human Trial of Allosteric Modulator Alpha7 Nicotinic Receptors in Schizophrenia,https://nda.nih.gov/edit_collection.html?id=2766,"Schizophrenia SZ is a highly debilitating neuropsychiatric disorder of young adulthood onset and a leading cause of disability worldwide. While treatments delivered at early stages of the disorder may be effective at reducing psychosis or altering the course of the disease, there are currently no biomarkers capable of identifying subjects at ultra-high risk UHR for psychosis who are likely to convert to the full clinical syndrome or those in early stages of SZ who are likely to respond to treatment ... more",9/18/17,Columbia University,U01MH094247,New York State Psychiatric Institute,9/1/16,12/31/18,1118298,Jeffrey Lieberman,74,53,21,lab,9/18/17,9/1/16,12/31/18,0.716216216,0.283783784,2016,9,1,25,6
371,770,UNC/UMN Baby Connectome Project,https://nda.nih.gov/edit_collection.html?id=2848,"This application is in response to the RFA-MH-16-160, entitled Lifespan Human Connectome Project (HCP): Baby Connectome. Investigators at The University of North Carolina at Chapel Hill (UNC) and The University of Minnesota (UMN) will join forces to accomplish the goals outlined by this RFA. The team at UNC has over 10 years of experience in recruiting and imaging typically developing and at-risk children, scanning over 1000 children from birth to five years1-40. Well established infrastructure ... more",1/31/18,University of North Carolina at Chapel Hill,U01MH110274,Univ Of North Carolina Chapel Hill,9/1/16,5/31/20,3374422,"Jed Elison, Weili Lin",408,201,207,lab,1/31/18,9/1/16,5/31/20,0.492647059,0.507352941,2016,9,1,25,7
372,457,Functions and Development of the Mirror Neuron System,https://nda.nih.gov/edit_collection.html?id=2495,"Function and Development of the Mirror Neuron System Two fundamental abilities are central to adaptive human functioning the ability to deploy actions strategically in the service of goals, and the ability to apprehend the goals of social partners in order to produce adaptive social responses. These abilities emerge in infancy and undergo foundational developments across childhood. Evidence from diverse scientific approaches indicates that these capacities may be supported by a common underlying ... more",9/19/16,University of Maryland,P01HD064653,"Univ Of Maryland, College Park",9/5/16,8/31/22,5992509,Nathan Fox,58,40,18,lab,9/19/16,9/5/16,8/31/22,0.689655172,0.310344828,2016,9,5,25,8
373,384,Neurodevelopment and Psychosis in the 22q11.2 Deletion Syndrome,https://nda.nih.gov/edit_collection.html?id=2414,"Schizophrenia and other psychotic disorders are highly disabling conditions with poorly understood pathophysiology. One of the central challenges in elucidating mechanisms of psychosis is its remarkable genetic and phenotypic heterogeneity. Taking a genetics first approach (i.e., ascertaining patients based on a known, homogeneous genetic etiology) may allow us to overcome the barriers posed by this complexity. 22q11.2 deletion syndrome (Velocardiofacial/DiGeorge syndrome; 22q11DS) is a particularly ... more",7/19/16,"University of California, Los Angeles",R01MH085953,University Of California Los Angeles,9/6/16,5/31/21,1575475,Carrie Bearden,98,45,53,lab,7/19/16,9/6/16,5/31/21,0.459183673,0.540816327,2016,9,6,25,9
374,434,A Simultaneous PET-MR Study of Striatal Dopamine Binding in Autism,https://nda.nih.gov/edit_collection.html?id=2471,"This grant seeks to evaluate striatal dopaminergic functioning during reward processing in autism spectrum disorder ASD through the use of simultaneous positron emission tomography PET and functional magnetic resonance imaging fMRI. Preclinical research strongly implicates impaired mesolimbic dopamine functioning in the etiology of ASD. Additionally, fMRI evidence suggests that ASD is characterized by striatal hypoactivation during reward processing. However, since fMRI is sensitive only to blood ... more",9/19/16,University of North Carolina at Chapel Hill,R21MH110933,Univ Of North Carolina Chapel Hill,9/6/16,10/31/18,447893,Gabriel Dichter,60,47,13,lab,9/19/16,9/6/16,10/31/18,0.783333333,0.216666667,2016,9,6,25,10
375,455,Advancing the science and technology of prenatal programming research,https://nda.nih.gov/edit_collection.html?id=2493,"The developmental origins of childhood physical, emotional, and behavioral problems begin in utero. Prenatal experiences program the infant for the context she will encounter upon birth, laying a foundation for health outcomes and disease. However, the biological mechanisms linking the prenatal environment to early infant outcomes remain understudied. The application of epigenetic methods to human behavior is a relatively new and innovative endeavor devoted to understanding how environmental influences ... more",9/19/16,University of Utah,R21MH109777,University Of Utah,9/6/16,7/31/19,384233,Sheila Crowell,325,78,247,lab,9/19/16,9/6/16,7/31/19,0.24,0.76,2016,9,6,25,11
376,453,Emerging relations between attention and negative affect in the first two years of life,https://nda.nih.gov/edit_collection.html?id=2490,"The adult and child clinical literature suggests that individuals who are clinically anxious or have high levels of trait anxiety show attention biases to threat. In addition, when these attention biases are experimentally manipulated in the lab, researchers can exacerbate or ameliorate levels of anxious thought and behavior. This has led researchers to argue that attention biases to threat may cause anxiety. However, the degree to which threat-related attention bias represents a down-stream result ... more",9/19/16,Penn State University,R01MH109692,Pennsylvania State University-Univ Park,9/7/16,5/31/21,1554636,Koraly Perez Edgar,394,141,253,lab,9/19/16,9/7/16,5/31/21,0.35786802,0.64213198,2016,9,7,25,12
377,450,"The Menopause Transition: Estrogen Variability, HPA axis and Affective Symptoms",https://nda.nih.gov/edit_collection.html?id=2487,Vulnerability to the deleterious mood effects of normal changes in reproductive hormones is a likely underpinning to reproductive mood disorders. The menopause transition MT is associated with pronounced hormonal variability within the context of relative E2 deprivation and substantially increased risk for clinically impairing anxiety and anhedonia. Anxiety is characterized by cognitive bias to interpret ambiguous stimuli in a threat-related manner. Anhedonia can be defined by decreased motivation ... more,9/19/16,University of North Carolina at Chapel Hill,R01MH108690,Univ Of North Carolina Chapel Hill,9/8/16,6/30/22,3193282,Susan Girdler,137,0,137,lab,9/19/16,9/8/16,6/30/22,0,1,2016,9,8,25,13
378,432,Chandelier interneurons and the excitation/inhibition balance in the human prefrontal cortex in autism,https://nda.nih.gov/edit_collection.html?id=2469,"Little is known about the pathology of the cerebral cortex in autism. The goal of our previously funded R01 grant was to unravel the pathology of the cerebral cortex in patients with autism. Specifically, we proposed to discover which cell type(s), if any, are altered in the cerebral cortex of human autistic cases. We quantified the number of pyramidal neurons, specific subtypes of interneurons, and glial cells, within each layer of the human temporal and prefrontal cortex in autism. We determined ... more",9/19/16,"University of California, Davis",R01MH094681,University Of California At Davis,9/9/16,6/30/22,1916586,Veronica Martinez Cerdeno,40,38,2,lab,9/19/16,9/9/16,6/30/22,0.95,0.05,2016,9,9,25,14
379,433,Longitudinal Investigation of Social-Communication and Attention Processes in School-Aged Children at Genetic Risk for Autism,https://nda.nih.gov/edit_collection.html?id=2470,"Autism spectrum disorder ASD affects 1 in 68 children in the United States. Rising along with the prevalence of ASD is the rate of being a sibling of a child with ASD. Multiple previous studies have demonstrated that many first-degree relatives of individuals with ASD experience their own challenges, including not only higher rates of ASD, but also milder social and communication difficulties, attention problems, and mood and anxiety symptoms. In the past decade, multiple investigations, including ... more",9/19/16,"University of California, Davis",R01MH109541,University Of California At Davis,9/9/16,6/30/22,3153056,Sally Ozonoff,211,106,105,lab,9/19/16,9/9/16,6/30/22,0.502369668,0.497630332,2016,9,9,25,15
380,422,High Performance Imaging for Assessment of Small Vessel Disease in Older Adults with Depression,https://nda.nih.gov/edit_collection.html?id=2459,"Depression target disease of this proposal affects 34 million Americans including 2 million seniors per year. It is a leading cause of morbidity and mortality in older adults target population of this proposal. The vascular depression hypothesis proposed in 1998 remains the most salient theory explaining the onset and perpetuation of depression in older adults. This model is based on the observation that in older adults, white matter hyper intensities a hallmark of small vessel disease, SVD are associated ... more",8/29/16,University of Pittsburgh,R01MH111265,University Of Pittsburgh At Pittsburgh,9/13/16,6/30/21,1356714,Tamer Ibrahim and Howard J. Aizenstein,61,24,37,lab,8/29/16,9/13/16,6/30/21,0.393442623,0.606557377,2016,9,13,25,16
746,424,Autism Clinical and Genetic Resources in China (ACGC),https://nda.nih.gov/edit_collection.html?id=2461,"Recurrent sporadic mutations are important risk factors for autism spectrum disorders (ASD) but have been primarily investigated in European cohorts. Here, we sequenced 189 risk genes in 1,543 Chinese ASD probands (1,045 from trios) and find novel recurrences of potential pathogenic significance.",9/14/16,University of Washington,,,9/14/16,,,Evan Eichler and Kun Xia,1647,1445,202,lab,9/14/16,9/14/16,,0.877352763,0.122647237,2016,9,14,25,17
381,442,Effectiveness of Task Shifting to Peer Delivery of Behavioral Activation for Depression among Pregnant Women,https://nda.nih.gov/edit_collection.html?id=2479,"Depression is a prevalent problem during pregnancy, 1,2 with adverse and potentially enduring correlates and consequences for mothers and infants 3 however, there is a persistent failure to provide intervention for the majority of depressed pregnant women,4 despite the fact that efficacious behavioral interventions exist. A widely recognized barrier to treatment engagement is the lack of effective, available care that is well aligned with women's preferences. 5 Pregnant women prefer care that is ... more",9/19/16,University of Colorado Boulder,R34MH110478,University Of Colorado,9/14/16,7/31/20,716405,Sona Dimidjian,37,0,37,lab,9/19/16,9/14/16,7/31/20,0,1,2016,9,14,25,18
382,441,Harm avoidance and incompleteness as dimensional endophenotypes in anxiety and OC spectrum disorders,https://nda.nih.gov/edit_collection.html?id=2478,"Obsessive Compulsive OC spectrum and anxiety disorders are the most prevalent psychiatric conditions in the United States. The economic costs of these disorders to society are enormous, accounting for 31 percent of total mental health costs. In spite of the development of effective cognitive behavioral and pharmacologic treatments, a substantial portion of patients remain ill. The limitations of symptom and diagnosis based approaches in understanding the underlying pathobiology of anxiety and OC ... more",9/19/16,Brown University,R01MH110449,Brown University,9/15/16,5/31/22,3502774,Steven Rasmussen,186,46,140,lab,9/19/16,9/15/16,5/31/22,0.247311828,0.752688172,2016,9,15,25,19
383,456,Functional Anatomic Studies of Self-Affect: A Multimodal Approach,https://nda.nih.gov/edit_collection.html?id=2494,"How the self is experienced is central to healthy emotional functioning as well as many disturbances in psychological functioning. This competing renewal uses structural, functional, and resting-state neuroimaging, coupled with passive smartphone sensing technology and ecological momentary assessments, to examine the affective components of self. Understanding the factors that contribute to changes in the affective aspects of self that result from environmental stressors has the potential to provide ... more",9/19/16,Dartmouth College,R01MH059282,Dartmouth College,9/15/16,6/30/22,3283673,James V. Haxby,298,92,206,lab,9/19/16,9/15/16,6/30/22,0.308724832,0.691275168,2016,9,15,25,20
747,461,A new treatment for minimally verbal girls with ASD,https://nda.nih.gov/edit_collection.html?id=2503,"Fewer females than males are diagnosed with autism spectrum disorder, and fewer females have been enrolled in treatment studies. As a result, it is not clear if commonly used interventions are equally effective for females. This study will examine the feasibility and preliminary efficacy of Social Engagement Therapy SET in a sample of minimally verbal girls with ASD. SET is a brief, structured behavioral intervention, based on applied behavior analysis, and is designed to increase social communication ... more",9/19/16,Children's Healthcare of Atlanta,,,9/19/16,,,Tom Cariveau,9,0,9,lab,9/19/16,9/19/16,,0,1,2016,9,19,25,21
834,82,Targeted sequencing identifies 91 neurodevelopmental disorder risk genes with autism and developmental disability biases,https://nda.nih.gov/study.html?id=425,"Gene-disruptive mutations contribute to the biology of neurodevelopmental disorders (NDDs), but most pathogenic genes are not known. We sequenced 208 candidate genes from >11,730 patients and >2,867 controls. We report 91 genes with an excess of de novo mutations or private disruptive mutations in 5.7% of patients, including 38 novel NDD genes. Drosophila functional assays of a subset bolster their involvement in NDDs. We identify 25 genes that show a bias for autism versus intellectual disability ... more",9/19/16,Burkhart Center for Autism Education and Research,,,9/19/16,,,"Richman DM; Barnard-Brak L, Bosch A, Thompson S, Grubb L, Abby L",15561,10890,4671,paper,9/19/16,9/19/16,,0.699826489,0.300173511,2016,9,19,26,1
384,471,"Computational, Neural, and Behavioral Studies of Competition-Dependent Learning",https://nda.nih.gov/edit_collection.html?id=2521,"Our overarching goal is to understanding how stored memories change as a function of experience. The pro-posed work builds on prior research showing a U-shaped relationship between memory activation and learn-ing, whereby strong activation leads to synaptic strengthening, moderate activation leads to synaptic weaken-ing, and no activation leads to no change in synaptic strength. The present grant focuses on the implications of this U-shaped relationship for representational change Learning is not ... more",9/29/16,Princeton University,R01MH069456,Princeton University,9/19/16,6/30/21,1919481,Kenneth Norman,239,91,148,lab,9/29/16,9/19/16,6/30/21,0.380753138,0.619246862,2016,9,19,26,2
385,472,A Computerized Intervention Targeting Cognitive Control Network Deficits in Depression,https://nda.nih.gov/edit_collection.html?id=2522,"Project EVO or EVO is a mobile 3D video game that has been shown to reduce older adults susceptibility to interference by augmenting sustained attention and working memory abilities e.g. cognitive control through targeted adaptive algorithms. The combination of peer-reviewed validity, adaptivity, and fun video game mechanics elevates the EVO platform beyond other at-home training tools while reducing burden associated with tedious task replication. We propose to study EVO as a potential intervention ... more",9/29/16,University of Washington,R61MH110509,University Of Washington,9/19/16,8/31/18,1253106,Patricia Arean,48,19,29,lab,9/29/16,9/19/16,8/31/18,0.395833333,0.604166667,2016,9,19,26,3
386,466,Functional Neuroanatomy Correlates of Worry in Older Adults,https://nda.nih.gov/edit_collection.html?id=2514,"Severe worry, a transdiagnostic symptom particularly pernicious for the health of older adults, is associated with increased risk of conversion from mild cognitive impairment to Alzheimer's disease, and with increased risk of stroke and other cardiovascular events. Severe worry, defined as intense, uncontrollable worry associated with interruption in functioning and reduced quality of life, is surprisingly prevalent in the community, with 20 percent of older adults reporting severe worry. While there ... more",9/29/16,University of Pittsburgh,R01MH108509,University Of Pittsburgh At Pittsburgh,9/20/16,6/30/21,1499967,Carmen Andreescu,165,58,107,lab,9/29/16,9/20/16,6/30/21,0.351515152,0.648484848,2016,9,20,26,4
387,468,Mobile Eye-Tracking as a Tool for Studying Socioemotional Development: Threat-related Attention in a Social Context,https://nda.nih.gov/edit_collection.html?id=2516,"The adult and child clinical literature suggests that individuals who are clinically anxious or have high levels of trait anxiety show attention biases to threat. In addition, researchers can exacerbate or ameliorate levels of anxious thought and behavior by experimentally manipulating attention biases in the lab. This has led researchers to argue that attention biases to threat may cause anxiety. These studies are an important and useful proof of concept for the role of attention in the emergence ... more",9/29/16,Penn State University,R21MH111980,Pennsylvania State University-Univ Park,9/20/16,8/31/19,432300,Koraly Perez Edgar,161,88,73,lab,9/29/16,9/20/16,8/31/19,0.546583851,0.453416149,2016,9,20,26,5
388,469,Neural mechanisms of social distance in psychosis,https://nda.nih.gov/edit_collection.html?id=2519,"One of the most debilitating features of psychotic disorders is the impairment in social functioning that can begin very early in the illness. Unfortunately, there are no effective treatments available for these impairments. This is in part because their neurobiological basis is not understood. However, recent advances in social neuroscience and neuroimaging have provided novel avenues for understanding the neural circuitry involved in generating social behavior. One general approach often used in ... more",9/29/16,Massachusetts General Hospital,R01MH109562,Massachusetts General Hospital,9/21/16,6/30/21,3241832,Daphne Holt,133,80,53,lab,9/29/16,9/21/16,6/30/21,0.601503759,0.398496241,2016,9,21,26,6
389,464,Kansas Intellectual and Developmental Disabilities Research Center,https://nda.nih.gov/edit_collection.html?id=2510,"The Kansas Intellectual and Developmental Disabilities Center KIDDRC supports rigorous and high-impact basic and applied research within themes that are relevant to the etiology, identification, prevention, and treatment of intellectual and developmental disabilities IDD. The Center is organized around projects that fall into four basic themes 1 Language, Communication Disorders, and Cognition, 2 Risk, Intervention, and Prevention, 3 The Neurobiology of IDD, and 4 Cellular and Molecular Biology of ... more",9/29/16,University of Kansas,U54HD090216,University Of Kansas Lawrence,9/22/16,5/31/21,5096186,John Colombo,34,26,8,lab,9/29/16,9/22/16,5/31/21,0.764705882,0.235294118,2016,9,22,26,7
390,463,A Novel Cognitive Reappraisal Intervention for Suicide Prevention,https://nda.nih.gov/edit_collection.html?id=2509,"The goal of this project is to refine and test a novel emotion-regulation based psychosocial intervention designed to reduce suicide risk in middle-aged and older adults 50-90 years old who have been discharged after a suicide-related hospitalization i.e. for suicidal ideation or suicide attempt. Suicide rates in this group are alarmingly high, and reducing suicide rates in at-risk populations is a major NIMH priority. We developed a novel psychosocial intervention called Cognitive Reappraisal Intervention ... more",9/22/16,Weill Medical College of Cornell University,R61MH110542,Weill Medical Coll Of Cornell Univ,9/23/16,8/31/21,2951430,Dimitris Kiosses,51,15,36,lab,9/22/16,9/23/16,8/31/21,0.294117647,0.705882353,2016,9,23,26,8
391,470,Regulating Emotional Responses to Spoken Comments and Visual Images Across the Affective Instability Spectrum: An fMRI Study,https://nda.nih.gov/edit_collection.html?id=2520,"Project Emotionally distressing, aversive or painful experiences are a part of everyday life experience. Crucial to emotional resilience is the capacity to voluntarily regulate ones emotional reaction to such experiences. Some people, however, have difficulty modulating their emotional reactions and are subject to sudden, extreme emotional states, especially in response to interpersonal events. This vulnerability, referred to as affective instability AI, is prototypic of borderline personality disorder ... more",9/29/16,Icahn School of Medicine at Mount Sinai,R01MH109730,Icahn School Of Medicine At Mount Sinai,9/23/16,5/31/22,3096757,Harold Koenigsberg,56,23,33,lab,9/29/16,9/23/16,5/31/22,0.410714286,0.589285714,2016,9,23,26,9
392,476,Longitudinal Assessment of Post-traumatic Syndromes. AURORA Project,https://nda.nih.gov/edit_collection.html?id=2526,"Each year, more than 40 million Americans present to US emergency departments EDs for evaluation after trauma exposure TE. While the majority of these individuals recover, an important subset develops adverse posttraumatic neuropsychiatric sequel ae APNS. These APNS include traditionally categorized outcomes such as posttraumatic stress disorder PTSD, depression, minor traumatic brain injury MTBI, and regional or widespread pain. However, these previous definitions of outcome have limited progress, ... more",9/30/16,University of North Carolina at Chapel Hill,U01MH110925,Univ Of North Carolina Chapel Hill,9/23/16,7/31/21,16378753,Samuel Mclean,2101,795,1306,lab,9/30/16,9/23/16,7/31/21,0.378391242,0.621608758,2016,9,23,26,10
393,477,Impact of Trauma Exposure on Critical Periods in Brain Development and Fear Processing in Children,https://nda.nih.gov/edit_collection.html?id=2527,"Childhood trauma exposure constitutes a major risk factor for subsequent psychopathology, including depression, posttraumatic stress disorder, substance abuse, personality disorders, and schizophrenia. Violence exposure in low-income, urban populations can occur early in life, increasing risk for trauma exposure in children living in inner-city areas. While it is shown that early adverse experiences affect brain activation and connectivity as well as fear physiology during development in children, ... more",9/30/16,Wayne State University,R01MH111682,Emory University,9/23/16,6/30/21,1649554,Tanja Jovanovic,73,41,32,lab,9/30/16,9/23/16,6/30/21,0.561643836,0.438356164,2016,9,23,26,11
394,478,Optimized dosing of repetitive transcranial magnetic stimulation for enhancement of hippocampal-cortical networks,https://nda.nih.gov/edit_collection.html?id=2528,"Memory impairment occurs in a variety of neuropsychiatric conditions e.g., depression and schizophrenia and in many neurologic disorders e.g., neurodegenerative disease and brain injury, often with devastating consequences for life quality. The goal of this project is to determine optimal dosing parameters for a new procedure involving the noninvasive enhancement of human hippocampal-cortical brain networks that critically support memory. This noninvasive brain-stimulation procedure, HFN-Stim, can ... more",9/30/16,Northwestern University,R01MH111790,Northwestern University At Chicago,9/23/16,6/30/20,1575625,Joel Voss,123,45,78,lab,9/30/16,9/23/16,6/30/20,0.365853659,0.634146341,2016,9,23,26,12
395,482,Dose Dependent Response of Cerebellar Transcranial Magnetic Stimulation,https://nda.nih.gov/edit_collection.html?id=2532,"Repetitive transcranial magnetic stimulation rTMS is an emerging technology for the treatment of neurological and psychiatric illnesses. Recent interest has shifted to the cerebellum, where initial promising therapeutic investigations have been made disease such as schizophrenia and ataxia. Despite these developments, the understanding of which parameters are best suited to stimulate the cerebellum remains a mystery. Our proposal seeks to understand the relevant dose parameters of repetitive cerebellar ... more",9/30/16,Beth Israel Deaconess Medical Center (BIDMC),R01MH111868,Mclean Hospital,9/23/16,6/30/21,1719881,Mark Halko,44,17,27,lab,9/30/16,9/23/16,6/30/21,0.386363636,0.613636364,2016,9,23,26,13
396,483,Optimizing peripheral stimulation parameters to modulate the sensorimotor cortex for post-stroke motor recovery,https://nda.nih.gov/edit_collection.html?id=2533,"Stroke is the leading cause of disability in the United States, with approximately 700,000 new cases per year. Disability from upper limb impairment depends primarily on loss of hand function and finger dexterity. Despite advances in task-specific training for the upper limb, a large number of stroke patients do not regain full function of their hand. Somatosensory peripheral nerve stimulation PNS is a promising approach to target recovery of hand motor function in stroke patients. Both short-term ... more",9/30/16,"University of California, San Francisco",R01MH111871,"University Of California, San Francisco",9/23/16,6/30/21,2025908,Karunesh Ganguly,19,15,4,lab,9/30/16,9/23/16,6/30/21,0.789473684,0.210526316,2016,9,23,26,14
397,489,"7T MRI to reveal structural, connectomic and metabolic imaging markers for the neurobiology of depression",https://nda.nih.gov/edit_collection.html?id=2539,"Major depressive disorder MDD affects 6.7 percent of the U.S. adult population and costs an estimated 104 billion per year. Despite this tremendous impact on society, the biological mechanisms of MDD are still poorly understood and consequently treatment options are limited and often ineffective. There is a clear need to establish the abnormalities in the regions and circuits of the brain associated with MDD in order to enable the development of more effective, bio-logically targeted treatments. ... more",9/30/16,Icahn School of Medicine at Mount Sinai,R01MH109544,Icahn School Of Medicine At Mount Sinai,9/23/16,6/30/22,2103874,Priti Balchandani,64,40,24,lab,9/30/16,9/23/16,6/30/22,0.625,0.375,2016,9,23,26,15
398,491,Study of early brain alterations that predict development of chronic PTSD,https://nda.nih.gov/edit_collection.html?id=2541,"Millions of Americans survive traumatic events 1. Symptom trajectories over the initial year after trauma can lead to development of chronic post-traumatic stress disorder PTSD or to a recovery free of PTSD 2-16. Neuroimaging studies indicate chronic PTSD symptoms are associated with changes in brain function and structure 17-32 consequently, recognition of early post-trauma brain changes provides an opportunity to predict chronic PTSD 33-35. Identification of brain changes that underlie post-trauma ... more",9/30/16,The University of Toledo Health Science Campus,R01MH110483,University Of Toledo Health Sci Campus,9/23/16,6/30/21,2128851,Xin Wang,277,96,181,lab,9/30/16,9/23/16,6/30/21,0.346570397,0.653429603,2016,9,23,26,16
399,884,Objective Measurement of Challenging Behaviors in Individuals with ASD,https://nda.nih.gov/edit_collection.html?id=2975,"Aggressive, self-injurious, and disruptive behaviors are a common referral concern among individuals with Autism Spectrum Disorder ASD. These behaviors limit access to educational services and community resources, prevent the development of adaptive behavior, restrict opportunities for socialization, and drastically affect quality of life for families and long-term outcomes for the individuals. There is a critical need fr direct, continuous, and objective measures of these behaviors that are sensitive ... more",8/6/18,Emory University School of Medicine,R21HD086491,Emory University,9/23/16,8/31/19,388802,Nathan Call,37,31,6,lab,8/6/18,9/23/16,8/31/19,0.837837838,0.162162162,2016,9,23,26,17
400,462,Structural Development of Human Fetal Brain,https://nda.nih.gov/edit_collection.html?id=2508,"Despite its critical significance, little is known about the most dynamic phase of brain development in infancy 0-2 years. To change the status quo, comprehensive and quantitative infant brain atlases as reference standards for precision health are needed. In addition, diffusion MRI dMRI has entered a new era in which dynamic cortical internal microstructural complexity, indexed by e.g. cortical mean kurtosis derived from diffusion kurtosis imaging DKI, can be studied in the living infant brain noninvasively ... more",9/22/16,Children's Hospital of Philadelphia,R01MH092535,Childrens Hosp Of Philadelphia,9/26/16,8/31/22,2673477,Hao Huang,102,57,45,lab,9/22/16,9/26/16,8/31/22,0.558823529,0.441176471,2016,9,26,26,18
401,475,Neural Mechanisms for Social Interactions and Eye Contact in ASD,https://nda.nih.gov/edit_collection.html?id=2525,"Social interaction and communication begin in early infancy, and, although these are fundamental human functions, little is known about the underlying neural mechanisms that regulate them particularly in Autism Spectrum Disorder ASD. ASD is a neurodevelopmental disorder characterized by significant disabilities in language and social skills, and the specific neural mechanisms that lead to these disabilities remain active topics for investigation. Emerging theoretical directions converge on problems ... more",9/30/16,Yale University School of Medicine,R01MH111629,Yale University,9/26/16,6/30/22,3197009,Joy Hirsch,12,10,2,lab,9/30/16,9/26/16,6/30/22,0.833333333,0.166666667,2016,9,26,26,19
402,484,Imaging the Neural Effects of Transcranial Direct Current Stimulation,https://nda.nih.gov/edit_collection.html?id=2534,"Research investigating the use of noninvasive electrical stimulation e.g., transcranial direct current stimulation tDCS, for neurologic and psychiatric disorders has provided compelling evidence that such stimulation can modulate behavior and cognition, and even facilitate recovery of function after focal brain injury, with effects typically outlasting the stimulation period. It is known that these effects are achieved by altering excitability in targeted brain regions, but our understanding of the ... more",9/30/16,Beth Israel Deaconess Medical Center (BIDMC),R01MH111874,University Of Massachusetts Amherst,9/26/16,6/30/22,2244540,Gottfried Schlaug,18,11,7,lab,9/30/16,9/26/16,6/30/22,0.611111111,0.388888889,2016,9,26,26,20
403,486,Non-invasive neuromodulation mechanisms and dose/response metrics,https://nda.nih.gov/edit_collection.html?id=2536,"In an exciting era of growth in the use of non-invasive brain stimulation, new methods and applications are being disseminated widely with an increasing number of FDA approvals and equipment designed to probe or modulate the brain in fascinating new ways. The problem with this growing enthusiasm is that there are too few studies that have evaluated how tools such as transcranial magnetic stimulation TMS induce functional activation throughout a human brain, especially outside of the motor system. ... more",9/30/16,University of Pennsylvania,R01MH111886,University Of Pennsylvania,9/26/16,6/30/20,1483914,Desmond Oathes,98,42,56,lab,9/30/16,9/26/16,6/30/20,0.428571429,0.571428571,2016,9,26,26,21
404,488,Trajectories of Behavioral Inibition and Risk for Anxiety,https://nda.nih.gov/edit_collection.html?id=2538,"Childhood temperament broadly shapes psychological adjustment across the lifespan, having particular influence during critical and complex periods of development such as adolescence. While risk for psychopathology rises sharply during adolescence, temperamental differences further enhance risk. Behavioral Inhibition BI is a temperament identified early in life, marked by strong physiological, behavioral, and emotional reactions to unfamiliar contexts, and associated with a four-fold increased risk ... more",9/30/16,University of Maryland,U01MH093349,"Univ Of Maryland, College Park",9/26/16,7/31/21,2048365,Nathan Fox,447,214,233,lab,9/30/16,9/26/16,7/31/21,0.478747204,0.521252796,2016,9,26,27,1
405,604,A tool-box to control and enhance tDCS spatial precision,https://nda.nih.gov/edit_collection.html?id=2667,"Aimed at revolutionizing our understanding of the brain, the BRAIN initiative calls for improvement of existing non-invasive neuromodulation techniques. There is presently great interest in transcranial Direct Current Stimulation tDCS, which is deployable, well tolerated, and carries the promise of targeted neuromodulation. Computational models of tDCS predict individual brain current flow for a given electrode configuration montage, and predict that optimized targeting montages can achieve more ... more",6/12/17,The City College of New York,R01MH111896,City College Of New York,9/26/16,6/30/20,1726699,Marom Bikson,37,19,18,lab,6/12/17,9/26/16,6/30/20,0.513513514,0.486486486,2016,9,26,27,2
406,425,Prenatal exposure to metals and risk for Autism Spectrum Disorder in MARBLES and EARLI,https://nda.nih.gov/edit_collection.html?id=2462,"Autism Spectrum Disorder ASD is a major public health burden in the US, with current prevalence estimates of 1 in 68 children and economic costs exceed 60 billion per year. Identification of causes that can inform prevention and policy is the most efficient way to stem the tide of this rising prevalence. Most research to date has focused on identifying genetic causes of autism, however, recent twin and population-scale studies have shown that both genes and environmental exposures contribute equally ... more",9/19/16,Johns Hopkins University,R01ES025531,Johns Hopkins University,9/30/16,8/31/22,3155061,Dani Fallin,213,0,213,lab,9/19/16,9/30/16,8/31/22,0,1,2016,9,30,27,3
407,504,Environmental Influence on Infant Microbiome Development and ASD Symptoms,https://nda.nih.gov/edit_collection.html?id=2557,"We propose to characterize associations among the fecal microbiome, the fecal glycome, and measures of household environmental exposures in infants who do and do not subsequently develop autism spectrum disorder (ASD) from the MARBLES cohort. One of the most common co-morbidities in autism are gastrointestinal problems, and the presence of frequent symptoms of diarrhea or constipation is associated with more severe symptoms. However, virtually all research on GI dysfunction in ASD to date has been ... more",12/7/16,"University of California, Davis",R01ES028089,University Of California At Davis,9/30/16,7/31/21,2155307,Irva Hertz-Picciotto,666,191,475,lab,12/7/16,9/30/16,7/31/21,0.286786787,0.713213213,2016,9,30,27,4
835,83,"ASD and genetic associations with receptors for oxytocin and vasopressin  AVPR1A, AVPR1B, and OXTR",https://nda.nih.gov/study.html?id=427,"Background: There are limited treatments available for autism spectrum disorder (ASD). Studies have reported significant associations between the receptor genes of oxytocin (OT) and vasopressin (AVP) and ASD diagnosis, as well as, ASD-related phenotypes. Researchers have also found the manipulation of these systems affect social and repetitive behaviors, core characteristics of ASD. Consequently, research involving the oxytocin/vasopressin pathways as intervention targets has increased. Therefore, ... more",11/2/16,Burkhart Center for Autism Education and Research,,,11/2/16,,,"Richman DM; Barnard-Brak L, Bosch A, Thompson S, Grubb L, Abby L",490,291,199,paper,11/2/16,11/2/16,,0.593877551,0.406122449,2016,11,2,27,5
836,84,Cognitive remediation for individuals with psychosis: Efficacy and mechanisms of treatment effects,https://nda.nih.gov/study.html?id=428,"The popularity of cognitive remediation (CR) interventions for individuals with psychosis is in part based on the well-established link between cognition and functioning and the assumption that by targeting cognition, function can improve. While numerous trials have reported CR's efficacy, it is still not considered an evidencebased treatment. Importantly, little is known about the mechanisms through which it may affect functioning. Method: In this study, we evaluated CR's proximal and distal effects, ... more",11/4/16,Burkhart Center for Autism Education and Research,,,11/4/16,,,"Richman DM; Barnard-Brak L, Bosch A, Thompson S, Grubb L, Abby L",75,55,20,paper,11/4/16,11/4/16,,0.733333333,0.266666667,2016,11,4,27,6
837,85,The evolution and population diversity of human-specific segmental duplications,https://nda.nih.gov/study.html?id=431,"Segmental duplications contribute to human evolution, adaptation and genomic instability but are often poorly characterized. We investigate the evolution, genetic variation and coding potential of human-specific segmental duplications (HSDs). We identify 218 HSDs based on analysis of 322 deeply sequenced archaic and contemporary hominid genomes. We sequence 550 human and nonhuman primate genomic clones to reconstruct the evolution of the largest, most complex regions with protein-coding potential ... more",12/5/16,Burkhart Center for Autism Education and Research,,,12/5/16,,,"Richman DM; Barnard-Brak L, Bosch A, Thompson S, Grubb L, Abby L",6355,4618,1737,paper,12/5/16,12/5/16,,0.726671912,0.273328088,2016,12,5,27,7
408,531,Neurodevelopmental Trajectories of Reward Processing in Very Early Emerging Risk for Depression,https://nda.nih.gov/edit_collection.html?id=2587,"Neuroimaging studies of depression have suggested that reduced brain reactivity to gain is significantly linked to diminished hedonic tone i.e., anhedonia and future Major Depressive Disorder MDD. This work has also suggested that increased brain reactivity to loss may be a key biomarker of increased negative emotionality in MDD and risk for depression as well. Despite compelling findings suggesting that diminished hedonic tone and increased negative emotionality are significant risk factors for ... more",1/27/17,Duke University,R01MH110488,Duke University,12/19/16,11/30/21,3337251,Michael Gaffrey,251,127,124,lab,1/27/17,12/19/16,11/30/21,0.505976096,0.494023904,2016,12,19,27,8
838,87,Paternally inherited noncoding structural variants contribute to autism,https://nda.nih.gov/study.html?id=434,"The genetic architecture of autism spectrum disorder (ASD) is known to consist of contributions from gene-disrupting de novo mutations and common variants of modest effect. We hypothesize that the unexplained heritability of ASD also includes rare inherited variants with intermediate effects. We investigated the genome-wide distribution and functional impact of structural variants (SVs) through whole genome analysis (>30X coverage) of 3,169 subjects from 829 families affected by ASD. Genes that are ... more",12/20/16,Burkhart Center for Autism Education and Research,,,12/20/16,,,"Richman DM; Barnard-Brak L, Bosch A, Thompson S, Grubb L, Abby L",3170,1867,1303,paper,12/20/16,12/20/16,,0.588958991,0.411041009,2016,12,20,27,9
409,528,Neural Mechanisms of Monoaminergic Engagement in Late-Life Depression Treatment Response (NEMO),https://nda.nih.gov/edit_collection.html?id=2583,"In this competing renewal Year 11 of our R01 using fMRI to study late-life depression LLD pharmacotherapy R01MH076079, the primary aim is to characterize functional connectivity changes associated with initial medication exposure 12-hour challenge. Our preliminary data suggests that these initial fMRI changes reflect monoaminergic engagement, regardless of monoaminergic class serotonergic or noradrenergic, and predict later treatment response. In the proposed study we test a neural systems level ... more",1/27/17,University of Pittsburgh,R01MH076079,University Of Pittsburgh At Pittsburgh,1/1/17,12/31/21,2133485,Howard Aizenstein,43,18,25,lab,1/27/17,1/1/17,12/31/21,0.418604651,0.581395349,2017,1,1,27,10
410,533,Health System Integration of Tools to Improve Primary Care for Autistic Adults,https://nda.nih.gov/edit_collection.html?id=2589,"The health system is ill-equipped to meet the needs of autistic adults. Our prior work has identified significant healthcare disparities experienced by autistic adults, including greater unmet healthcare needs, lower use of preventive services, and greater use of the Emergency Department ED. A majority of primary care providers PCPs lack the skills needed to care for autistic adults, yet competing priorities make it unlikely they will attend trainings on autism. The heterogeneity of the autism spectrum ... more",1/27/17,PORTLAND STATE UNIVERSITY,R34MH111536,Portland State University,1/1/17,12/31/19,690072,Christina Nicolaidis,268,171,97,lab,1/27/17,1/1/17,12/31/19,0.638059701,0.361940299,2017,1,1,27,11
839,88,Improvement in Social Competence Using a Randomized Trial of a Theatre Intervention for Children with Autism Spectrum Disorder.,https://nda.nih.gov/study.html?id=435,"The efficacy of a peer-mediated, theatre-based intervention on social competence in participants with autism spectrum disorder (ASD) was tested. Thirty 8-to-14 year-olds with ASD were randomly assigned to the treatment (n = 17) or a wait-list control (n = 13) group. Immediately after treatment, group effects were seen on social ability, (d = .77), communication symptoms (d = -.86), group play with toys in the company of peers (d = .77), immediate memory of faces as measured by neuropsychological ... more",1/3/17,Burkhart Center for Autism Education and Research,,,1/3/17,,,"Richman DM; Barnard-Brak L, Bosch A, Thompson S, Grubb L, Abby L",31,25,6,paper,1/3/17,1/3/17,,0.806451613,0.193548387,2017,1,3,27,12
840,89,Identifying Clinical Net Benefit of Psychotropic Medication Use with Latent Variable Techniques: Evidence from Systematic Treatment Enhancement Program for Bipolar Disorder (STEP-BD),https://nda.nih.gov/study.html?id=437,"Background: Poor medication adherence is common among individuals with Bipolar Disorder (BD). Understanding the sources of heterogeneity in clinical net benefit (CNB) and how it is related to psychotropic medications can provide new insight into ways to improve adherence. Methods: Data come from the baseline assessments of the Systematic Treatment Enhancement Program for Bipolar Disorder (STEP-BD). Latent class analysis identified groups of CNB, and validity of this construct was assessed using ... more",1/6/17,Burkhart Center for Autism Education and Research,,,1/6/17,,,"Richman DM; Barnard-Brak L, Bosch A, Thompson S, Grubb L, Abby L",4449,1897,2552,paper,1/6/17,1/6/17,,0.426387952,0.573612048,2017,1,6,27,13
748,517,Cryptic Genetic Causes of Autism,https://nda.nih.gov/edit_collection.html?id=2570,This project performed whole-genome structural variation sequencing using large-insert jumping libraries in the Simons Simplex Collection.,1/13/17,Massachusetts General Hospital,,,1/13/17,,,Michael Talkowski,684,600,84,lab,1/13/17,1/13/17,,0.877192982,0.122807018,2017,1,13,27,14
411,535,Quantification of Predictive Motor Impairments in Individuals with ASD,https://nda.nih.gov/edit_collection.html?id=2591,"Autism spectrum disorder ASD is a developmental disorder associated with a heterogeneous phenotype that includes social, linguistic, cognitive, and behavioral symptoms. Anecdotal reports and selected research results suggest that individuals with ASD exhibit difficulties in motor coordination, especially when interacting with dynamic objects, like catching a ball. Yet, these challenges are not included in the diagnostic criteria. Motivated by a theory recently developed by members of this collaborative ... more",1/27/17,Northeastern University,R21HD089731,Northeastern University,1/18/17,12/31/19,450370,Dagmar Sternad,54,41,13,lab,1/27/17,1/18/17,12/31/19,0.759259259,0.240740741,2017,1,18,27,15
412,527,Developing Neuronal KCNQ Channel Modulators for Mood Disorders,https://nda.nih.gov/edit_collection.html?id=2582,"This 5-year R61R33 phased-innovation award, Developing KCNQ Channel Modulators for Mood Disorders, is designed to efficiently examine the neuronal KCNQ23 potassium K channel subtype as a novel treatment target for depression and related conditions. Depressive disorders are among the most disabling medical conditions worldwide and currently available treatments fall short of addressing this large public health burden. Dysfunction within the brain reward system is emerging as a core feature of depressive ... more",1/27/17,Icahn School of Medicine at Mount Sinai,R61MH111932,Icahn School Of Medicine At Mount Sinai,1/20/17,2/28/24,2425680,James Murrough,63,32,31,lab,1/27/17,1/20/17,2/28/24,0.507936508,0.492063492,2017,1,20,27,16
841,90,Lack of early improvement with antipsychotics is a marker for subsequent non-response in behavioral and psychological symptoms of dementia: Analysis of CATIE-AD data,https://nda.nih.gov/study.html?id=439,Objective: Prediction of response/non-response to antipsychotics is especially important in patients with behavioral and psychological symptoms of dementia (BPSD) in whom antipsychotic exposure increases risks of death. We aimed to examine whether presence/absence of early improvement of BPSD with antipsychotics is associated with subsequent response/non-response. Design: Post-hoc analysis of the Clinical Antipsychotic Trials in Intervention Effectiveness with Alzheimers Disease (CATIE-AD) study ... more,1/31/17,Burkhart Center for Autism Education and Research,,,1/31/17,,,"Richman DM; Barnard-Brak L, Bosch A, Thompson S, Grubb L, Abby L",244,108,136,paper,1/31/17,1/31/17,,0.442622951,0.557377049,2017,1,31,27,17
413,526,Virtual Reality Attention Management Program for Improving Attention in Children,https://nda.nih.gov/edit_collection.html?id=2581,"Distraction is a growing and large public health problem with estimated societal harm due to distracted driving alone at 123 billion 1. In the age of texting, social media and computer pop-ups, distractions are unavoidable. There are no known interventions specifically developed to reduce distractions from interfering with attention. This project will test a treatment that combines virtual reality VR technology with habituation learning and exposure therapy to reduce the ability of distractors to ... more",1/27/17,"University of California, Davis",R61MH110043,University Of California At Davis,2/1/17,6/30/23,2243845,Julie Schweitzer,19,17,2,lab,1/27/17,2/1/17,6/30/23,0.894736842,0.105263158,2017,2,1,27,18
414,532,Engaging Siblings of Adults with Autism in Future Planning,https://nda.nih.gov/edit_collection.html?id=2588,"In the next decade, over one half million youths with autism spectrum disorder ASD will enter adulthood. The adult service system is not adequately prepared to meet the needs of this growing population. The burden of coordinating care frequently falls on family members. Siblings are the future generation of caregivers and often become the guardians for their brother or sister with ASD when parents are no longer able to provide care due to illness or death. Yet, siblings are seldom involved in research ... more",1/27/17,Boston University,R34MH111489,Boston University (Charles River Campus),2/1/17,1/31/20,317018,Gael Orsmond,4,4,0,lab,1/27/17,2/1/17,1/31/20,1,0,2017,2,1,27,19
415,534,Using complex video stimuli to elucidate atypical brain functioning in ASD,https://nda.nih.gov/edit_collection.html?id=2590,"A major gap in our understanding of autism spectrum disorder ASD is in knowing how the brain functions during conditions that approximate the complex processing demands of the real world. Instead, almost everything we know about brain functioning in ASD comes from reductionist studies that often use highly simplified stimuli and isolated task demands, or even from studies that lack a stimulus or task altogether, as in the case of resting-state functional connectivity. Yet, successful processing in ... more",1/27/17,Indiana University,R01MH110630,Indiana University Bloomington,2/1/17,12/31/21,2535784,Daniel Kennedy,79,53,26,lab,1/27/17,2/1/17,12/31/21,0.670886076,0.329113924,2017,2,1,27,20
416,536,1/2 Effectiveness of a Multi-Level Implementation Strategy for ASD Interventions,https://nda.nih.gov/edit_collection.html?id=2592,"12. The Centers for Disease Control CDC estimates that 1 in 68 children have autism spectrum disorder CDC, 2014 and the annual cost of ASD in the U.S. is estimated to be 236 billion. Evidence-based interventions have been developed and demonstrate effectiveness in improving child outcomes. However, research on generalizable methods to scale up these practices in the multiple service systems caring for these children has been limited and is critical to meet this growing public health need. We propose ... more",2/3/17,University of California San Diego,R01MH111950,"University Of California, San Diego",2/1/17,1/31/21,830383,Lauren Brookman-Frazee,134,109,25,lab,2/3/17,2/1/17,1/31/21,0.813432836,0.186567164,2017,2,1,27,21
417,537,2/2 Effectiveness of a Multi-Level Implementation Strategy for ASD Interventions,https://nda.nih.gov/edit_collection.html?id=2593,"12. The Centers for Disease Control CDC estimates that 1 in 68 children have autism spectrum disorder CDC,2014 and the annual cost of ASD in the U.S.is estimated to be 236 billion. Evidence-based interventions have been developed and demonstrate effectiveness in improving child outcomes. However, research on generalizable methods to scale up these practices in the multiple service systems caring for these children has been limited and is critical to meet this growing public health need. We propose ... more",2/3/17,Rady Childrens Hospital - San Diego,R01MH111981,University Of California At Davis,2/1/17,1/31/21,1557805,Aubyn Stahmer,179,144,35,lab,2/3/17,2/1/17,1/31/21,0.804469274,0.195530726,2017,2,1,28,1
418,538,Development of Attention Bias Modification for Depression,https://nda.nih.gov/edit_collection.html?id=2594,"The overall goal of this project is to continue development of an attention bias modification ABM intervention that targets and reduces negative attention bias among adults with elevated symptoms of depression. Our prior work indicates that attention bias for negative information is associated with the maintenance of depression and that neural circuitry within frontal-parietal brain networks supports biased attention for negative information, thus allowing us to develop specific and targeted interventions ... more",2/3/17,The University of Texas at Austin,R33MH109600,"University Of Texas, Austin",2/1/17,1/31/21,1972968,Christopher Beevers,163,38,125,lab,2/3/17,2/1/17,1/31/21,0.233128834,0.766871166,2017,2,1,28,2
419,539,Development of A Novel Transdiagnostic Intervention for Anhedonia,https://nda.nih.gov/edit_collection.html?id=2595,"Deficits in motivation and pleasure, together referred to as anhedonia, are implicated in a number of psychiatric illnesses, including mood and anxiety disorders, substance-use disorders, schizophrenia, and attention-deficit hyperactivity disorder. As a result, constructs related to anhedonia are central to the NIMH Research Domain Criteria RDoC project. Anhedonia is often one of the most difficult psychiatric symptoms to treat and thus represents a critical endophenotype and vulnerability factor ... more",2/3/17,University of North Carolina at Chapel Hill,R61MH110027,Univ Of North Carolina Chapel Hill,2/1/17,1/31/19,949288,Gabriel Dichter,150,45,105,lab,2/3/17,2/1/17,1/31/19,0.3,0.7,2017,2,1,28,3
420,541,Transdiagnostic Processes in Emotional Aggression: Interplay of Negative Valence and Cognitive Systems,https://nda.nih.gov/edit_collection.html?id=2598,"Aggressive behavior that co-occurs with mental disorders has been associated with distinct trajectories, manifestations and severity of mental illness, suggesting a distinct etiological process relative to when the disorder is expressed without aggression. Thus, one key to cutting across diagnostic boundaries in the understanding of underlying psychopathological processes is to investigate the biobehavioral mechanisms behind transdiagnostic symptom dimensions like aggression. As such, the current ... more",2/3/17,University of South Florida,R21MH109853,University Of South Florida,2/1/17,1/31/20,411417,Edelyn Verona,535,270,265,lab,2/3/17,2/1/17,1/31/20,0.504672897,0.495327103,2017,2,1,28,4
842,91,One thousand somatic SNVs per skin fibroblast cell set baseline of mosaic mutational load with patterns that suggest proliferative origin,https://nda.nih.gov/study.html?id=440,Few studies have been conducted to understand post-zygotic accumulation of mutations in cells of the healthy human body. We reprogrammed 32 skin fibroblast cells from families of donors into human induced pluripotent stem cell (hiPSC) lines. The clonal nature of hiPSC lines allows a high-resolution analysis of the genomes of the founder fibroblast cells without being confounded by the artifacts of single cell whole genome amplification. We estimate that on average a fibroblast cell in children has ... more,2/6/17,Burkhart Center for Autism Education and Research,,,2/6/17,,,"Richman DM; Barnard-Brak L, Bosch A, Thompson S, Grubb L, Abby L",12,9,3,paper,2/6/17,2/6/17,,0.75,0.25,2017,2,6,28,5
421,561,High School SUCCESS: Vocational Soft Skills Program for Transition-Age ASD Youth,https://nda.nih.gov/edit_collection.html?id=2620,"This pilot application responds to NIMH Pilot Research on Services for Transition-Age Youth R34 by developing and testing an integrated intervention to increase neurocognitive and social cognitive skills to improve functioning and postsecondary outcomes for transition-age students with autism spectrum disorders ASD. Our innovative community-based High School SUCCESS Supported, Comprehensive Cognitive Enhancement and Social Skills intervention will be delivered within educational settings high schools ... more",4/6/17,Rady Childrens Hospital - San Diego,R34MH111491,Rady Childrens Hospital - San Diego,2/15/17,12/31/20,800925,Mary Baker,39,32,7,lab,4/6/17,2/15/17,12/31/20,0.820512821,0.179487179,2017,2,15,28,6
422,622,Neural dynamics supporting integration and recall over long timescales during natural continuous input,https://nda.nih.gov/edit_collection.html?id=2687,"Present and prior information converge often in everyday life. For example, during language comprehension, each syllable achieves its meaning in the context of a word, and each word in the context of a sentence. Despite the clear importance of such integration of past and present, most studies of memory use simple stimuli that are isolated in time. The long-term goal of this laboratory is to understand how the brain uses past information, gathered over seconds to hours, to make sense of a stream ... more",6/29/17,Princeton University,R01MH112357,Princeton University,2/15/17,11/30/21,2504876,Uri Hasson,237,99,138,lab,6/29/17,2/15/17,11/30/21,0.417721519,0.582278481,2017,2,15,28,7
423,617,Effects of THC on Retention of Memory for Fear Extinction Learning in PTSD,https://nda.nih.gov/edit_collection.html?id=2680,"The long-term objective of this R61/R33 is to employ 9-tetrahydrocannibinol THC a type 1 cannabinoid receptor CB1 agonist, as a cognitive enhancer to increase recall of extinction learning in post traumatic stress disorder PTSD. First-line psychotherapy for PTSD is Prolonged Exposure PE, which involves repeated exposure to fear-linked cues to produce extinction of fear. PE is generally effective, but many patients have incomplete extinction or fail to sustain extinction learning-related improvement ... more",6/29/17,Wayne State University,R61MH111935,Wayne State University,2/24/17,5/31/23,2891111,Christine Rabinak,60,11,49,lab,6/29/17,2/24/17,5/31/23,0.183333333,0.816666667,2017,2,24,28,8
424,547,A twin study of exogenous hormone exposure and risk for binge eating,https://nda.nih.gov/edit_collection.html?id=2604,"Extant animal and human data show that ovarian hormones are critical neurobiological risk factors for binge eating in women. Natural increases in these hormones across the menstrual cycle substantially increase risk for binge eating via hormonally induced increases in genetic risk. These data have significantly advanced etiological models and our understanding of the female predominance in eating disorder risk. However, this increased knowledge comes with an urgent public health responsibility. In ... more",2/27/17,Michigan State University,R01MH111715,Michigan State University,3/1/17,2/28/22,811652,Kelly Klump,326,0,326,lab,2/27/17,3/1/17,2/28/22,0,1,2017,3,1,28,9
425,767,"Attentional, temperamental, and physiological process underlying anxiety in preschoolers with ASD",https://nda.nih.gov/edit_collection.html?id=2845,"Anxiety disorders are highly prevalent in childhood and are associated with substantial impairment and disability. Symptoms of anxiety are widespread in preschoolers with ASD, limiting their learning and social interaction opportunities above and beyond difficulties related to core autism symptoms. Our preliminary work suggests that temperamental precursors of anxiety are already elevated in the second year of life in ASD. However, knowledge about the mechanisms underlying the emergence of anxiety ... more",1/29/18,Yale University,R01MH111652,Yale University,3/1/17,1/31/22,3904336,Katarzyna Chawarska,135,96,39,lab,1/29/18,3/1/17,1/31/22,0.711111111,0.288888889,2017,3,1,28,10
843,92,How anxious do you think I am? Relationship between state and trait anxiety in children with and without ASD during social tasks,https://nda.nih.gov/study.html?id=445,"Individuals with autism spectrum disorder (ASD) often exhibit increased anxiety, even in non-stressful situations. We investigate general anxiousness (anxiety trait) and responses to stressful situations (anxiety state) in 22 adolescents with ASD and 32 typically developing controls. We measured trait anxiety with standardized self- and parent-reported questionnaires. We used a Biopac system to capture state anxiety via skin conductance responses, mean heart rate and heart rate variability during ... more",3/7/17,Burkhart Center for Autism Education and Research,,,3/7/17,,,"Richman DM; Barnard-Brak L, Bosch A, Thompson S, Grubb L, Abby L",36,27,9,paper,3/7/17,3/7/17,,0.75,0.25,2017,3,7,28,11
426,698,Identifying Social Processes Implicated in Remitted Recurrent Depression,https://nda.nih.gov/edit_collection.html?id=2769,"Major depressive disorder MDD is a leading cause of disability worldwide, and it is characterized by vast heterogeneity. As approximately 35-50 percent of adults will experience recurrent episodes, recent research has sought to parse this heterogeneity by focusing on differences among individuals experiencing single episodes MDD versus recurrent recMDD MDD. Recurrent MDD is associated with increased rates of comorbidity, greater psychosocial dysfunction, and worse treatment response consequently, ... more",10/13/17,Northwestern University,R21MH112330,University Of Illinois At Chicago,3/7/17,2/28/19,457990,Stewart Shankman,71,25,46,lab,10/13/17,3/7/17,2/28/19,0.352112676,0.647887324,2017,3,7,28,12
844,93,Training Parents of Youth with Autism Spectrum Disorder to Advocate for Adult Disability Services: Results from a Pilot Randomized Controlled Trial.,https://nda.nih.gov/study.html?id=446,"This study presents findings from a pilot randomized controlled trial, testing a 12-week intervention to train parents of youth with autism spectrum disorder (ASD) to advocate for adult disability services-the Volunteer Advocacy Program-Transition (VAP-T). Participants included 41 parents of youth with ASD within 2 years of high school exit, randomly assigned to a treatment (N=20) or wait-list control (N=21) group. Outcomes, collected before and after the intervention, included parental knowledge ... more",3/9/17,Burkhart Center for Autism Education and Research,,,3/9/17,,,"Richman DM; Barnard-Brak L, Bosch A, Thompson S, Grubb L, Abby L",41,35,6,paper,3/9/17,3/9/17,,0.853658537,0.146341463,2017,3,9,28,13
427,554,"Development and preliminary trial of a brief, portable health intervention for rural sexual minority emerging adults",https://nda.nih.gov/edit_collection.html?id=2612,"The project seeks to adapt and test the feasibility of two brief online writing interventions capable of reducing the stress pathways underlying lesbian, gay, and bisexual LGB emerging adults ages 18-29 disproportionate experience of substance use, HIV risk behavior, suicidality, and depression. Given their low-cost and high portability, these interventions can circumvent barriers to health in geographies without LGB-affirmative resources. We will develop and pilot test these two interventions in ... more",3/31/17,Yale University,R21MH113860,Yale University,3/15/17,2/29/20,448427,John Pachankis,109,31,78,lab,3/31/17,3/15/17,2/29/20,0.28440367,0.71559633,2017,3,15,28,14
428,636,Ovarian Effects on Intrinsic Connectivity and the Affective Enhancement of Memory,https://nda.nih.gov/edit_collection.html?id=2701,"It is well established that women exhibit a significantly higher rate of affective disorders than men do. This difference is particularly strong in post-traumatic stress disorder, where women are more than twice as likely to experience PTSD than men. Recent evidence suggests that womens susceptibility to PTSD varies with their levels of ovarian hormones. During the luteal phase, when progesterone is elevated, women are more than three times as likely to develop PTSD symptoms after trauma. Similarly, ... more",6/29/17,Massachusetts General Hospital,R01MH109464,Massachusetts General Hospital,3/23/17,1/31/22,1483025,Lisa Barrett,41,0,41,lab,6/29/17,3/23/17,1/31/22,0,1,2017,3,23,28,15
429,545,Glutamate Neurotransmission in Bipolar Depression and Mania,https://nda.nih.gov/edit_collection.html?id=2602,"Bipolar disorder BD can cause a great deal of suffering for individuals with the disorder and their families due to the acute mood episodes that also include a high risk of suicide, and the cognitive difficulties that can contribute to disability and impair prognosis. Unfortunately, the mechanisms underlying the acute mood episodes and the vulnerability to the switch between mood states, as well as cognitive dysfunction in the disorder, are not known, and current medications are often ineffective ... more",2/10/17,Yale University,R21MH110850,Yale University,4/1/17,3/31/20,460625,Irina Esterlis,10,5,5,lab,2/10/17,4/1/17,3/31/20,0.5,0.5,2017,4,1,28,16
430,546,Role of neuroinflammation in the pathophysiology of bipolar depression.,https://nda.nih.gov/edit_collection.html?id=2603,"Elucidating the molecular changes that underlie depression and associated symptoms in Bipolar Disorder I (BD) is critical for diagnostic and therapeutic efficacy. BD is a devastating illness with a lifetime prevalence of 1 percent. Within BD, depression is the most common and most frequent presenting episode type, and is associated with a high risk of suicide. Unfortunately, currently available pharmacotherapies are not able to provide effective relief to a large portion of individuals with BD, and ... more",2/27/17,Yale University,R21MH112881,Yale University,4/1/17,3/31/20,460625,Irina Esterlis,11,5,6,lab,2/27/17,4/1/17,3/31/20,0.454545455,0.545454545,2017,4,1,28,17
431,552,Neonatal ABRs and Heritable Risk for ASD,https://nda.nih.gov/edit_collection.html?id=2610,"The goal of this proposal is to evaluate the feasibility of measuring click-evoked auditory brainstem responses ABRs among infants who vary in heritable risk for autism spectrum disorder ASD and to calculate preliminary estimates of effect size. Click-evoked ABRs are event-related potentials that reflect the electrophysiological processing of broadband acoustic stimuli i.e., clicks from the cochlea through the rostral brainstem. ABRs consist of 5 distinct waves I-V from which latencies and amplitudes ... more",3/31/17,Michigan State University,R21DC015550,Michigan State University,4/1/17,3/31/22,426250,Nicole Talge,55,27,28,lab,3/31/17,4/1/17,3/31/22,0.490909091,0.509090909,2017,4,1,28,18
432,553,Brain-to-brain dynamical Coupling: A New framework for the communication of social knowledge,https://nda.nih.gov/edit_collection.html?id=2611,"Social interaction in real-life contexts necessitates dynamical interactions among two or more brains as individuals listen, speak, act, and mutually adapt to one another to reach shared understanding. Elucidating how brains forge such shared understanding requires shifting from a one-brain to a multiple-brain frame of reference, as well as from artificial laboratory conditions to natural, real-life settings. Here we outline a novel framework to identify inter-brain dynamical coupling that underpins ... more",3/31/17,Princeton University,R01MH112566,Princeton University,4/1/17,3/31/22,2498878,Uri Hasson,239,92,147,lab,3/31/17,4/1/17,3/31/22,0.384937238,0.615062762,2017,4,1,28,19
433,566,Rare Mutations and Autism Spectrum Disorders,https://nda.nih.gov/edit_collection.html?id=2627,"Sporadic point mutations and large copy number variants CNVs contribute significantly to the etiology of autism but most of the genetic architecture has not yet been understood. Most CNVs associated with autism are large and the majority of pathogenic genes have not been proven. The goal of this proposal is to significantly increase the yield of high-impact autism mutations by focusing on the discovery of understudied classes of rare variants from whole-genome sequence data being generated from 35,000 ... more",5/15/17,University of Washington,R01MH101221,University Of Washington,4/1/17,10/31/25,3606363,Evan Eichler,4468,3318,1150,lab,5/15/17,4/1/17,10/31/25,0.742614145,0.257385855,2017,4,1,28,20
434,577,Neurobiology of Traumatic Dissociation in a Transdiagnostic Study of Women with Childhood Maltreatment,https://nda.nih.gov/edit_collection.html?id=2640,"Dissociative symptoms in traumatized individuals are common, debilitating, and costly. Exposure to traumatic stress is consistently and strongly associated with dissociative symptoms across clinical and community samples of traumatized individuals. Phenomenologically, traumatic dissociation broadly encompasses a range of distinct, yet clinically interrelated symptoms depersonalization, derealization, amnesia, numbing, intrusive flashbacks, passive influence phenomena, and identity disturbances. Either ... more",5/15/17,Emory University,R21MH112956,Mclean Hospital,4/1/17,1/31/19,445500,Kerry Ressler,220,0,220,lab,5/15/17,4/1/17,1/31/19,0,1,2017,4,1,28,21
749,558,DCTRS Compensatory Cognitive Training for Psychosis: Effects in a Randomized Controlled Trial,https://nda.nih.gov/edit_collection.html?id=2616,"Treatments for the cognitive impairments of schizophrenia are urgently needed. We developed and tested a 12-week, group-based, manualized, Compensatory Cognitive Training (CCT) intervention targeting prospective memory, attention, learning/memory, and executive functioning. The intervention focused on compensatory strategies such as calendar use, self-talk, note-taking, and a six-step problem-solving method, and did not require computers. Method: In a randomized controlled trial, 69 outpatients with ... more",4/3/17,University of California San Diego,,,4/3/17,,,Elizabeth Twamley,71,47,24,lab,4/3/17,4/3/17,,0.661971831,0.338028169,2017,4,3,29,1
435,579,"Threat-Related Negative Valence Systems, Child Victimization, and Anxiety",https://nda.nih.gov/edit_collection.html?id=2642,"Interpersonal violence IPV exposure affects 1 in 2 youth and levies tremendous physical and mental health burdens on victims and society. Childhood IPV exposure is a well-established risk factor for anxiety and other mental health problems across the lifespan. There is great variability among youth in the nature and timing of IPV exposure and considerable heterogeneity in mental health outcomes. Such heterogeneity in outcomes may be explained by various Research Domain Criteria RDoC constructs, including ... more",5/15/17,Medical University of South Carolina,R01MH112209,Medical University Of South Carolina,4/3/17,1/31/22,1640688,Carla Danielson,637,184,453,lab,5/15/17,4/3/17,1/31/22,0.288854003,0.711145997,2017,4,3,29,2
845,94,Upper limb motor coordination based early diagnosis in high risk subjects for Autism,https://nda.nih.gov/study.html?id=451,"Autism is a lifelong condition present from early childhood. Medical specialists' diagnosis autism based on observation is of great difficulty in communicating, difficulties for forming relationships with other people, and delayed speech. The scientists tried to discover other early signs to reach the early detection of Autism Spectrum Disorders (ASD). Early diagnosing is very important to initiate and improve treatment results. One of these signs is based on examination of upper limb motor movements. ... more",4/7/17,Burkhart Center for Autism Education and Research,,,4/7/17,,,"Richman DM; Barnard-Brak L, Bosch A, Thompson S, Grubb L, Abby L",58,31,27,paper,4/7/17,4/7/17,,0.534482759,0.465517241,2017,4,7,29,3
436,569,A Lay-Led Intervention for War and Refugee Related Trauma,https://nda.nih.gov/edit_collection.html?id=2630,"Rates of PTSD, a chronic and debilitating mental disorder, are considerably higher in war-torn regions like Somalia, known for sexual violence and other human rights violations e.g., 50.1 percent Johnson et al., 2010. In the aftermath of substantial war- and refugee-related trauma, there is a clear need for effectiveness research addressing the significant, under-addressed mental health needs of Somalis and the broader Muslim community. While efficacious treatments exist for PTSD and related difficulties, ... more",5/15/17,University of Washington,R34MH112756,University Of Washington,4/7/17,3/31/22,708588,Lori Zoellner,67,10,57,lab,5/15/17,4/7/17,3/31/22,0.149253731,0.850746269,2017,4,7,29,4
437,576,Suicidal and Nonsuicidal Self-Injurious Behavior in Sexual Minority Youth: Examining Modifiable Mechanisms for Treatment Development,https://nda.nih.gov/edit_collection.html?id=2639,"Lesbian, gay, bisexual, queer and other sexual minority youth SMY are at greater risk than their heterosexual counterparts for suicidal thoughts and behaviors STB, nonsuicidal self-injury NSSI, and myriad health problems. Specifically, SMY endorse both STB and NSSI at rates 3 times greater than heterosexual youth. NSSI, while a major public health concern in its own right, significantly exacerbates risk for suicidal behavior. Thus, examining suicidal and self-injurious behaviors among SMY is a federal ... more",5/15/17,Brown University,R21MH113183,Brown University,4/7/17,9/30/20,463824,Shirley Yen,102,27,75,lab,5/15/17,4/7/17,9/30/20,0.264705882,0.735294118,2017,4,7,29,5
438,621,Reducing Fetal Exposure to Maternal Depression to Improve Infant Risk Mechanisms,https://nda.nih.gov/edit_collection.html?id=2685,Exposure to maternal depressive symptoms is one of the most well established risk factors for the development of later child psychopathology. Accumulating evidence from naturalistic observational studies documents that fetal exposure to maternal depressive symptoms is associated with risk for later child mental health problems. Maternal depression is one of the most common prenatal complications with approximately 40 percent of women experiencing elevated levels of depressive symptoms. The majority ... more,6/29/17,University of Illinois at Chicago,R01MH109662,University Of Denver (Colorado Seminary),4/7/17,3/31/22,1632283,Elysia Davis,188,0,188,lab,6/29/17,4/7/17,3/31/22,0,1,2017,4,7,29,6
439,575,Disgust Learning as a Distinct OCD Endophenotype,https://nda.nih.gov/edit_collection.html?id=2638,"Obsessive-Compulsive Disorder OCD is a disabling condition that affects 2 to 3 percent of Americans and is associated with substantial distress, high economic costs, and poor quality of life. Research has also shown that a substantial proportion of individuals seeking treatment for OCD fail to respond. Given the negative impact of OCD, there is growing recognition for comprehensive models of the etiology and development of OCD that can better inform treatment and prevention efforts. Recent evidence ... more",5/15/17,Vanderbilt University,R21MH112866,Vanderbilt University,4/10/17,1/31/20,431750,Olubunmi Olatunji,28,9,19,lab,5/15/17,4/10/17,1/31/20,0.321428571,0.678571429,2017,4,10,29,7
440,578,Investigating a Neurobehavioral Mechanism of Paranoia,https://nda.nih.gov/edit_collection.html?id=2641,"The present application is in response to Strategies 1.3 and 2.2 of the NIMH strategic plan, which respectively call for the identification of brain circuits that contribute to various aspects of mental function and dysfunction and the identification of clinically useful biomarkers and behavioral indicators that predict change across illness trajectories. We propose to contribute to these goals by applying the Research Domain Criteria RDoC approach to the symptom of paranoia and attempting to identify ... more",5/15/17,The University of Texas at Dallas,R21MH112930,University Of Texas Dallas,4/17/17,1/31/19,420750,Amy Pinkham,170,73,97,lab,5/15/17,4/17/17,1/31/19,0.429411765,0.570588235,2017,4,17,29,8
441,583,Testing the causal role of orbitofrontal cortex in human compulsive behavior: a non-invasive brain stimulation study,https://nda.nih.gov/edit_collection.html?id=2646,".Compulsive behaviors, or unwanted, repetitive behaviors aimed at reducing distress, are a core feature of obsessive-compulsive OC spectrum disorders, but appear across a very broad spectrum of psychological conditions. Compulsions suggest a failure of goal-directed behavior to override habitual behaviors stamped in through repeated practice and short-term distress reduction. In OC patients, this habit hypothesis is supported by behavioral data suggesting OC patients struggle to override habits even ... more",5/15/17,University of Pittsburgh,R21MH112770,University Of Pittsburgh At Pittsburgh,4/20/17,1/31/21,402452,Rebecca Price,69,19,50,lab,5/15/17,4/20/17,1/31/21,0.275362319,0.724637681,2017,4,20,29,9
750,563,Using SMART Treatment Design to Evaluate Applied Behavior Analysis Interventions on Communication in Preschool Children with Autism,https://nda.nih.gov/edit_collection.html?id=2622,The long-term objective of the proposed program of research is to evaluate the response to behavioral interventions in preschool children with ASD in the context of possible sequence effects of treatment and pretreatment child characteristics. The specific objective of this proposal is to assess the feasibility of using a Sequential Multiple Assignment Randomized Trial (SMART) with two ABA interventions (Discrete Trial Instruction (DTI) and Verbal Behavior Approach (VBA)) on verbal and social communication ... more,4/21/17,Rowan University,,,4/21/17,,,MaryLou Kerwin,88,69,19,lab,4/21/17,4/21/17,,0.784090909,0.215909091,2017,4,21,29,10
442,585,Three Generations at High and Low Risk for Depression Followed Longitudinally,https://nda.nih.gov/edit_collection.html?id=2648,"This is a 4-year renewal for a multi-generation, 30-year longitudinal study of families at high- and low-risk for Major Depressive Disorder MDD. The project has yielded important findings on the familial transmission of mood disorders and has contributed to the fields understanding of the long-term temporal sequences of disorders from childhood to adulthood, as well as the neurobiological correlates of these processes. However, despite these advances, the mechanisms through which familial risk leads ... more",5/15/17,Columbia University,R01MH036197,New York State Psychiatric Institute,4/24/17,3/31/22,2862595,Myrna Weissman,168,74,94,lab,5/15/17,4/24/17,3/31/22,0.44047619,0.55952381,2017,4,24,29,11
443,572,Social Work Training to Reduce Duration of Untreated Psychosis,https://nda.nih.gov/edit_collection.html?id=2634,"Project summary Psychosis is typically identified in adolescence or early adulthood and can cause chronic impairment throughout life. Duration of untreated psychosis DUP is one modifiable factor that predicts clinical and functional outcomes. Shorter duration of untreated psychosis has been associated with a host of positive outcomes. Despite this knowledge, DUP in the United States is too long. Prior efforts to reduce DUP have met with only modest results, possibly because out reach efforts have ... more",5/15/17,University of Maryland,R34MH110506,University Of Maryland Baltimore,5/1/17,4/30/21,680934,Jordan Devylder,4,1,3,lab,5/15/17,5/1/17,4/30/21,0.25,0.75,2017,5,1,29,12
444,580,The Neurobiology of Social Decision-Making: Social Inference and Context,https://nda.nih.gov/edit_collection.html?id=2643,"OVERVIEW. . This renewal application of a basic research Conte Center aims to elucidate the neurobiological mechanisms for social decision-making in humans. While our current Conte Center investigated the basic systems for decision-making, and did so in both humans and monkeys, this renewal now focuses only on humans, and on more translationally relevant questions. In particular, we now focus on how social inference and context come into play. How do we attribute internal states, such as values, ... more",5/15/17,California Institute of Technology,P50MH094258,California Institute Of Technology,5/1/17,2/28/22,1838353,Ralph Adolphs,100,53,47,lab,5/15/17,5/1/17,2/28/22,0.53,0.47,2017,5,1,29,13
445,584,Identifying semantic themes from their fMRI-weighted EEG Signatures,https://nda.nih.gov/edit_collection.html?id=2647,The relationship between brain activation patterns in fMRI and the semantic features of concepts have been developed into bi-directional generative mappings in previous studies they can extrapolate beyond the training stimuli and either predict neural activation patterns of a new word based on semantic features or predict the semantic features of a new word from the neural activation patterns it evokes. The current project will develop an analogous mapping between the semantic features and the EEG ... more,5/15/17,Carnegie Mellon University,R21MH112931,Carnegie-Mellon University,5/1/17,4/30/19,419023,Marcel Just,16,4,12,lab,5/15/17,5/1/17,4/30/19,0.25,0.75,2017,5,1,29,14
446,591,OC-Go: Facilitating fidelity and dissemination of evidence based treatment for childhood OCD via an interactive crowd-sourced patient-provider tool,https://nda.nih.gov/edit_collection.html?id=2654,"OC-Go Facilitating fidelity and dissemination of evidence based treatment for childhood OCD via an interactive crowd-sourced patient-provider tool.The long-term objective of this project is to leverage mobile technologies and crowd-sourcing to create a new paradigm of evidence-based treatment delivery and dissemination, as current methods are often insufficient. The project seeks to refine and assess OC-Go, a HIPAA-compliant web-based clinician portal and patient-side mobile application designed ... more",5/15/17,"University of California, Los Angeles",R42MH111277,"Virtually Better, Inc.",5/1/17,6/30/21,1675972,Peter Tuerk,11,7,4,lab,5/15/17,5/1/17,6/30/21,0.636363636,0.363636364,2017,5,1,29,15
447,587,Trajectories of Brain Maturation among Youth at Risk for Anxiety,https://nda.nih.gov/edit_collection.html?id=2650,"Anxiety occurs widely among adolescents, with one in three youth meeting criteria for an anxiety disorder before the age of 18. Although evidence-based treatments exist, rates of relapse are strikingly high and treatment does little to alter the chronic, fluctuating course of symptoms. To address these concerns and to achieve the mission of curative therapeutics outlined in the current NIH strategic plan, factors linked to heterogeneity in the course of anxiety must be better understood. The goal ... more",5/15/17,"University of California, Los Angeles",R01MH110476,University Of California Los Angeles,5/3/17,2/28/23,2123790,Tara Peris,140,78,62,lab,5/15/17,5/3/17,2/28/23,0.557142857,0.442857143,2017,5,3,29,16
448,592,Neurophysiological and Metabolic Risk Markers of Childhood Anxiety,https://nda.nih.gov/edit_collection.html?id=2655,"Anxiety disorders are the most common psychiatric illnesses of childhood, affecting 10-20 percent of youth. Childhood anxiety often has a chronic course, negatively affecting academic, social, and adaptive functioning, and increases the risk for mental illness throughout life. Research has highlighted a number of risk factors that likely contribute to the development and maintenance of anxiety. However, there is limited understanding of the earliest precursors of anxiety or how multiple risk factors ... more",5/15/17,Children's Hospital Boston,R01MH078829,Boston Childrens Hospital,5/3/17,4/30/22,4015923,Charles Nelson,712,184,528,lab,5/15/17,5/3/17,4/30/22,0.258426966,0.741573034,2017,5,3,29,17
449,589,Understanding the dynamics of visual processing abnormalities in body dysmorphic disorder,https://nda.nih.gov/edit_collection.html?id=2652,"Individuals suffering from body dysmorphic disorder BDD experience peculiar misperceptions of their appearance, most often of the face or head. With convictions of disfigurement and ugliness, they typically have poor insight or even delusional beliefs, as well as obsessive thoughts and compulsive behaviors, anxiety, and depression. These combine to result in significant difficulties in functioning, as well as depression, suicide attempts 25 percent, and psychiatric hospitalization 50 percent. Despite ... more",5/15/17,"University of California, Los Angeles",R21MH110865,University Of California Los Angeles,5/5/17,4/30/19,261261,Jamie Feusner,45,9,36,lab,5/15/17,5/5/17,4/30/19,0.2,0.8,2017,5,5,29,18
450,582,Emotional Engagement Driven by Complex Visual Stimuli: Neural Dynamics Revealed by Multimodal Imaging,https://nda.nih.gov/edit_collection.html?id=2645,"Project Emotional dysfunction is at the core of many psychiatric disorders, in particular fear, anxiety, post-traumatic, and mood disorders. Describing the neural mechanisms associated with emotional processing is therefore a critical issue in mental healthcare. Previous attempts to define the neurophysiology of human emotions in the cognitive neuroscience laboratory have been hampered by the unavailability of conceptual and methodological frameworks for studying complex emotional responses in context ... more",5/15/17,University of Florida,R01MH112558,University Of Florida,5/11/17,2/28/22,1815040,Mingzhou Ding,119,48,71,lab,5/15/17,5/11/17,2/28/22,0.403361345,0.596638655,2017,5,11,29,19
846,95,Violation Differentiation,https://nda.nih.gov/study.html?id=454,"When an item is predicted in a particular context but the prediction is violated, memory for that item is weakened (Kim et al., 2014). Here, we explore what happens when such previously mispredicted items are later reencountered. According to prior neural network simulations, this sequence of events-misprediction and subsequent restudy-should lead to differentiation of the item's neural representation from the previous context (on which the misprediction was based). Specifically, misprediction weakens ... more",5/12/17,Burkhart Center for Autism Education and Research,,,5/12/17,,,"Richman DM; Barnard-Brak L, Bosch A, Thompson S, Grubb L, Abby L",32,12,20,paper,5/12/17,5/12/17,,0.375,0.625,2017,5,12,29,20
847,96,Inflexible neurobiological signatures precede atypical development in infants at high risk for autism,https://nda.nih.gov/study.html?id=455,"Variability in neurobiological signatures is ubiquitous in early life but the link to adverse developmental milestones in humans is unknown. We examined how levels of signal and noise in movement signatures during the 1st year of life constrain early development in 71 healthy typically developing infants, either at High or Low familial Risk (HR or LR, respectively) for developing Autism Spectrum Disorders (ASD). Delays in early learning developmental trajectories in HR infants (validated in an analysis ... more",5/12/17,Burkhart Center for Autism Education and Research,,,5/12/17,,,"Richman DM; Barnard-Brak L, Bosch A, Thompson S, Grubb L, Abby L",70,42,28,paper,5/12/17,5/12/17,,0.6,0.4,2017,5,12,29,21
451,597,Technology Enabled Mental Health Intervention for Individuals in the Criminal Justice System A1,https://nda.nih.gov/edit_collection.html?id=2660,"In the United States, over 2.2 million people are incarcerated. While these numbers are alarming, even more distressing is the rapid growth in the number of mentally ill individuals caught in this system. Within any given year, approximately 73 percent of females and 55 percent of males in jail will experience a mental health problem. This results in the criminal justice system serving as a de facto mental health treatment facility for hundreds of thousands of individuals, despite constrained funding ... more",5/17/17,"Jail Education Solutions, Inc.",R43MH112274,Edovo,5/15/17,4/30/19,149969,Elizabeth Pisney,57,46,11,lab,5/17/17,5/15/17,4/30/19,0.807017544,0.192982456,2017,5,15,30,1
452,598,Dynamics of Large-Scale Networks During Emotional and Social Processing,https://nda.nih.gov/edit_collection.html?id=2661,"The goal of this application is to develop a research program that, as stated in the call entitled. The Neural Mechanisms of Multi-Dimensional Emotional and Social Representation RFA-MH-17-300, incorporates innovative approaches designed to move the fields of affective and social neuroscience beyond single region-based, modular, and static models of brain function and behavior. The RFA calls for research that is multi-dimensional, that is, that investigates the role of among others complex contexts, ... more",5/19/17,University of Maryland,R01MH112517,"Univ Of Maryland, College Park",5/16/17,2/28/22,3284902,Luiz Pessoa,178,89,89,lab,5/19/17,5/16/17,2/28/22,0.5,0.5,2017,5,16,30,2
453,595,Modeling Anhedonia in Schizophrenia: A Stochastic Dynamical Systems Approach,https://nda.nih.gov/edit_collection.html?id=2658,"Anhedonia, traditionally defined as a diminished capacity to experience pleasure, has long been considered acore feature of schizophrenia. Modern studies indicate that interview-based ratings of anhedonia predict a number of important clinical outcomes, such as disease liability, subjective quality of life, community functional outcome, and recovery. Unfortunately, attempts to remediate anhedonia via pharmacological and psychosocial interventions have been ineffective. Limited progress in treating ... more",5/17/17,University of Georgia,R21MH112925,University Of Georgia,5/17/17,4/30/20,417456,Gregory Strauss,199,57,142,lab,5/17/17,5/17/17,4/30/20,0.286432161,0.713567839,2017,5,17,30,3
454,634,Investigating the Neural Basis of Flexible Emotion Perception,https://nda.nih.gov/edit_collection.html?id=2699,"Accurate perception of others emotion is critical for successful social interaction, yet it diminishes over the lifespan and is impaired across a wide range of disorders, including anxiety, depression, bipolar disorder, autism, and schizophrenia. The current proposal builds on a computational model developed by the PI, which posits that perceptions of social categories, including emotion categories, are driven not only by bottom-up cues inherent to targets e.g., facial features but also top-down ... more",6/29/17,New York University,R01MH112640,New York University,5/18/17,2/28/22,1943870,Jonathan Freeman,90,35,55,lab,6/29/17,5/18/17,2/28/22,0.388888889,0.611111111,2017,5,18,30,4
455,599,Computational and brain predictors of emotion cue integration,https://nda.nih.gov/edit_collection.html?id=2662,"The purpose of this project is to develop computational and brain-based models of emotion cue integration peoples inferences about others emotions based on dynamic, multimodal cues. Observers often decide how targets feel based on cues such as facial expressions, prosody, and language. Such inferences scaffold healthy social interaction, and abnormal inference both marks and exacerbates social deficits in numerous psychiatric disorders. Psychologists and neuroscientists have studied emotion inference ... more",5/19/17,Stanford University,R01MH112560,Stanford University,5/19/17,2/28/22,2155030,Jamil Zaki,167,66,101,lab,5/19/17,5/19/17,2/28/22,0.395209581,0.604790419,2017,5,19,30,5
751,601,How Autism Affects Speech in Multitalker Environments,https://nda.nih.gov/edit_collection.html?id=2664,This DOD-funded award examines young children recently diagnosed with ASD on their ability to understand speech when multiple people are speaking simultaneously,5/23/17,University of Maryland,,,5/23/17,,,Rochelle Newman,181,88,93,lab,5/23/17,5/23/17,,0.486187845,0.513812155,2017,5,23,30,6
456,607,Levetiracetamin in First Episode Psychosis,https://nda.nih.gov/edit_collection.html?id=2670,Increased perfusion of the hippocampal CA1 subfield is a clinical biomarker for early psychosis that also predicts hippocampal volume loss. Converging evidence suggests that CA1 hyperperfusion reflects excessive glutamatergic transmission which drives psychosis and may produce excitotoxic hippocampal injury that is associated with poor outcomes. Antipsychotics reduce hippocampal activity but may worsen hippocampalinjury via oxidative stress from increased dopamine release. We recently demonstrated ... more,6/29/17,NYU School of Medicine,R61MH112833,New York University School Of Medicine,5/24/17,1/31/23,2432166,Donald Goff,41,36,5,lab,6/29/17,5/24/17,1/31/23,0.87804878,0.12195122,2017,5,24,30,7
457,596,Quality Assessment in Exposure Therapy,https://nda.nih.gov/edit_collection.html?id=2659,"Empirically supported behavioral treatments cannot be effectively disseminated without understanding key quality components. Mechanism-informed quality measures have extraordinary potential to enhance pragmatism by eliminating unnecessary elements and targeting multiple problems and populations, and to enhance predictive value by detecting mechanism engagement early in treatment. Community Mental Health Agencies CMHAs, however, are often ill-equipped to use such measures of treatment quality due ... more",5/17/17,Emma Pendleton Bradley Hospital,R01MH112516,Emma Pendleton Bradley Hospital,6/1/17,4/30/22,1721254,Kristen Benito,81,30,51,lab,5/17/17,6/1/17,4/30/22,0.37037037,0.62962963,2017,6,1,30,8
458,600,Neurobehavioral Mechanisms of Emotion Regulation in Depression across the Adult Lifespan,https://nda.nih.gov/edit_collection.html?id=2663,"The ability to regulate ones emotional responses is critical for maintaining emotional health in the face of adverse events that cumulate over the lifespan. Although some emotion regulation abilities are thought to be maintained or even improve in healthy older adults, such beneficial maturation effects are moderated by individual differences in depression and neurocognition that contribute to disability, morbidity, and loss of quality of life into old age. Frontolimbic circuit dysfunction is a hallmark ... more",5/19/17,Duke University Medical Center,R01MH113238,Duke University,6/1/17,2/28/22,3183279,Moria Smoski,131,46,85,lab,5/19/17,6/1/17,2/28/22,0.351145038,0.648854962,2017,6,1,30,9
459,625,Integration of Neural Networks and Attachment in Human Infants,https://nda.nih.gov/edit_collection.html?id=2690,"Animal and human studies indicate that extreme forms of early life stress are implicated in structural and functional maladaptation in the brain during the early life course. At the same time, research on developmental psychopathology has indicated that early caregiving and development of insecure or disorganized attachment put children at risk for maladaptive behavioral and emotional problems. Thus, the roots of psychopathology likely take shape during this period of development in the context of ... more",6/29/17,University of Illinois at Urbana-Champaign,R21MH112578,University Of Illinois At Urbana-Champaign,6/1/17,4/30/21,441548,Nancy Mcelwain,259,122,137,lab,6/29/17,6/1/17,4/30/21,0.471042471,0.528957529,2017,6,1,30,10
460,628,Characterization of Variability in Motivation and Reward in Psychosis,https://nda.nih.gov/edit_collection.html?id=2693,"This is an NIMH Exploratory Developmental Research Grant Program R21 proposal entitled, Characterization of Variability in Motivation and Reward in Psychosis. Motivational deficits are a hallmark of schizophrenia and related disorders and are associated with poor community outcomes and reduced treatment adherence and efficacy during behavioral interventions such as cognitive remediation. Motivation and reward are not unitary constructs but are comprised of measurable and separable domains, as delineated ... more",6/29/17,McLean Hospital,R21MH110699,Mclean Hospital,6/1/17,3/31/20,445500,Kathryn Lewandowski,246,136,110,lab,6/29/17,6/1/17,3/31/20,0.552845528,0.447154472,2017,6,1,30,11
461,608,Novel neural circuit biomarkers of depression response to computer-augmented CBT,https://nda.nih.gov/edit_collection.html?id=2671,"Every year more than 20 percent 55 million of the adult American population suffers from major depression. MDD. While effective treatments are available, depression remains under-diagnosed and under-treated, in part due to cost and availability of treatment. In the current application in response to NIMH NOT-14-007 we propose a clinical trial to study potential novel biomarkers of depression treatment response rather than to test efficacy of an efficient, cost-effective form of computer-augmented ... more",6/29/17,University of Pennsylvania,R01MH110939,University Of Pennsylvania,6/5/17,3/31/22,2779444,Yvette Sheline,76,22,54,lab,6/29/17,6/5/17,3/31/22,0.289473684,0.710526316,2017,6,5,30,12
462,627,The New Tics Study: A Novel Approach to Pathophysiology and Cause of Tic Disorders,https://nda.nih.gov/edit_collection.html?id=2692,"Project At least 20 percent of all children have tics at some time in their life, making tic disorders a subject of substantial public health interest. However, only about 3 percent of all children have tics that last for a year or more. Thus chronic tic disorders, including Tourette syndrome, can be conceptualized as a two-step process tics start, and then they fail to remit. By the numbers, the second part of this process is the more unusual and perhaps more closely related to disease, yet surprisingly, ... more",6/29/17,Washington University in St. Louis,R01MH104030,Washington University,6/9/17,5/31/22,3330510,Kevin Black,96,71,25,lab,6/29/17,6/9/17,5/31/22,0.739583333,0.260416667,2017,6,9,30,13
463,626,Medial temporal lobe contributions to episodic memory,https://nda.nih.gov/edit_collection.html?id=2691,"It is well known that structures in the medial temporal lobe MTL, including the hippocampus, are necessary for the formation, consolidation and retrieval of new episodic memories. Perhaps the most common neuroscientific approach to understanding the brain systems supporting episodic memory is to examine encoding and retrieval of information presented on single trials. While this approach has yielded significant insights, it overlooks the fact that new experiences often are meaningfully related to ... more",6/29/17,New York University,R01MH074692,Columbia Univ New York Morningside,6/14/17,3/31/22,2479171,Lila Davachi,5,1,4,lab,6/29/17,6/14/17,3/31/22,0.2,0.8,2017,6,14,30,14
464,620,"Robust 1H MRSI of GABA, Glutamate, Glutamine, and Glutathione",https://nda.nih.gov/edit_collection.html?id=2684,"Project Understanding neurotransmitter activity is fundamental to elucidating normal and diseased neuronal function, with glutamate Glu and -aminobutyric acid GABA being the brains primary excitatory and inhibitory neurotransmitters. Such understanding is particularly critical in autism spectrum disorder ASD, a set of neurodevelopment disorders characterized by persistent deficits in social communication and restricted, repetitive, and stereotyped patterns of behavior. Although varying in presentation ... more",6/29/17,Stanford University,R01MH110683,Stanford University,6/15/17,4/30/22,1495988,Daniel Spielman,12,6,6,lab,6/29/17,6/15/17,4/30/22,0.5,0.5,2017,6,15,30,15
465,624,Investigating Dynamic Neural Systems Underlying Changing Social Representations of Faces During Development,https://nda.nih.gov/edit_collection.html?id=2689,"Successful navigation through the social world critically depends on how we perceive a face. Faces are the pre-eminent social signal from which we extract information related to the identity, age, sex, attractiveness, emotional state, and intentions of a person. All of these social cues help us anticipate the behavior of others and guide our decisions about how to behave towards them. Given the importance of face perception to our social functioning, one might expect to see mature abilities and neural ... more",6/29/17,Penn State University,R01MH112573,Pennsylvania State University-Univ Park,6/26/17,4/30/23,2609171,Kathryn Scherf,192,86,106,lab,6/29/17,6/26/17,4/30/23,0.447916667,0.552083333,2017,6,26,30,16
